No.     Time           Source                Destination           Protocol Length Info
     31 0.000000       host                  1.17.0                USB      36     GET DESCRIPTOR Request DEVICE

Frame 31: Packet, 36 bytes on wire (288 bits), 36 bytes captured (288 bits) on interface \\.\USBPcap1, id 0
    Section number: 1
    Interface id: 0 (\\.\USBPcap1)
    Encapsulation type: USB packets with USBPcap header (152)
    Arrival Time: Mar 31, 2026 22:42:49.786660000 W. Europe Summer Time
    UTC Arrival Time: Mar 31, 2026 20:42:49.786660000 UTC
    Epoch Arrival Time: 1774989769.786660000
    [Time shift for this packet: 0.000000000 seconds]
    [Time delta from previous captured frame: 0.000000000 seconds]
    [Time since reference or first frame: 0.000000000 seconds]
    Frame Number: 31
    Frame Length: 36 bytes (288 bits)
    Capture Length: 36 bytes (288 bits)
    [Frame is marked: False]
    [Frame is ignored: False]
    [Protocols in frame: usb]
    Character encoding: ASCII (0)
USB URB
    [Source: host]
    [Destination: 1.17.0]
    USBPcap pseudoheader length: 28
    IRP ID: 0x0000000000000000
    IRP USBD_STATUS: USBD_STATUS_SUCCESS (0x00000000)
    URB Function: URB_FUNCTION_GET_DESCRIPTOR_FROM_DEVICE (0x000b)
    IRP information: 0x00, Direction: FDO -> PDO
    URB bus id: 1
    Device address: 17
    Endpoint: 0x80, Direction: IN
    URB transfer type: URB_CONTROL (0x02)
    Packet Data Length: 8
    [Response in: 32]
    Control transfer stage: Setup (0)
Setup Data

No.     Time           Source                Destination           Protocol Length Info
     32 0.000000       1.17.0                host                  USB      46     GET DESCRIPTOR Response DEVICE

Frame 32: Packet, 46 bytes on wire (368 bits), 46 bytes captured (368 bits) on interface \\.\USBPcap1, id 0
    Section number: 1
    Interface id: 0 (\\.\USBPcap1)
    Encapsulation type: USB packets with USBPcap header (152)
    Arrival Time: Mar 31, 2026 22:42:49.786660000 W. Europe Summer Time
    UTC Arrival Time: Mar 31, 2026 20:42:49.786660000 UTC
    Epoch Arrival Time: 1774989769.786660000
    [Time shift for this packet: 0.000000000 seconds]
    [Time delta from previous captured frame: 0.000000000 seconds]
    [Time delta from previous displayed frame: 0.000000000 seconds]
    [Time since reference or first frame: 0.000000000 seconds]
    Frame Number: 32
    Frame Length: 46 bytes (368 bits)
    Capture Length: 46 bytes (368 bits)
    [Frame is marked: False]
    [Frame is ignored: False]
    [Protocols in frame: usb]
    Character encoding: ASCII (0)
USB URB
    [Source: 1.17.0]
    [Destination: host]
    USBPcap pseudoheader length: 28
    IRP ID: 0x0000000000000000
    IRP USBD_STATUS: USBD_STATUS_SUCCESS (0x00000000)
    URB Function: URB_FUNCTION_CONTROL_TRANSFER (0x0008)
    IRP information: 0x01, Direction: PDO -> FDO
    URB bus id: 1
    Device address: 17
    Endpoint: 0x80, Direction: IN
    URB transfer type: URB_CONTROL (0x02)
    Packet Data Length: 18
    [Request in: 31]
    [Time from request: 0.000000000 seconds]
    Control transfer stage: Complete (3)
DEVICE DESCRIPTOR

No.     Time           Source                Destination           Protocol Length Info
     33 0.000000       host                  1.17.0                USB      36     GET DESCRIPTOR Request CONFIGURATION

Frame 33: Packet, 36 bytes on wire (288 bits), 36 bytes captured (288 bits) on interface \\.\USBPcap1, id 0
    Section number: 1
    Interface id: 0 (\\.\USBPcap1)
    Encapsulation type: USB packets with USBPcap header (152)
    Arrival Time: Mar 31, 2026 22:42:49.786660000 W. Europe Summer Time
    UTC Arrival Time: Mar 31, 2026 20:42:49.786660000 UTC
    Epoch Arrival Time: 1774989769.786660000
    [Time shift for this packet: 0.000000000 seconds]
    [Time delta from previous captured frame: 0.000000000 seconds]
    [Time delta from previous displayed frame: 0.000000000 seconds]
    [Time since reference or first frame: 0.000000000 seconds]
    Frame Number: 33
    Frame Length: 36 bytes (288 bits)
    Capture Length: 36 bytes (288 bits)
    [Frame is marked: False]
    [Frame is ignored: False]
    [Protocols in frame: usb]
    Character encoding: ASCII (0)
USB URB
    [Source: host]
    [Destination: 1.17.0]
    USBPcap pseudoheader length: 28
    IRP ID: 0x0000000000000000
    IRP USBD_STATUS: USBD_STATUS_SUCCESS (0x00000000)
    URB Function: URB_FUNCTION_GET_DESCRIPTOR_FROM_DEVICE (0x000b)
    IRP information: 0x00, Direction: FDO -> PDO
    URB bus id: 1
    Device address: 17
    Endpoint: 0x80, Direction: IN
    URB transfer type: URB_CONTROL (0x02)
    Packet Data Length: 8
    [Response in: 34]
    Control transfer stage: Setup (0)
Setup Data

No.     Time           Source                Destination           Protocol Length Info
     34 0.000000       1.17.0                host                  USB      69     GET DESCRIPTOR Response CONFIGURATION

Frame 34: Packet, 69 bytes on wire (552 bits), 69 bytes captured (552 bits) on interface \\.\USBPcap1, id 0
    Section number: 1
    Interface id: 0 (\\.\USBPcap1)
    Encapsulation type: USB packets with USBPcap header (152)
    Arrival Time: Mar 31, 2026 22:42:49.786660000 W. Europe Summer Time
    UTC Arrival Time: Mar 31, 2026 20:42:49.786660000 UTC
    Epoch Arrival Time: 1774989769.786660000
    [Time shift for this packet: 0.000000000 seconds]
    [Time delta from previous captured frame: 0.000000000 seconds]
    [Time delta from previous displayed frame: 0.000000000 seconds]
    [Time since reference or first frame: 0.000000000 seconds]
    Frame Number: 34
    Frame Length: 69 bytes (552 bits)
    Capture Length: 69 bytes (552 bits)
    [Frame is marked: False]
    [Frame is ignored: False]
    [Protocols in frame: usb:usbhid]
    Character encoding: ASCII (0)
USB URB
    [Source: 1.17.0]
    [Destination: host]
    USBPcap pseudoheader length: 28
    IRP ID: 0x0000000000000000
    IRP USBD_STATUS: USBD_STATUS_SUCCESS (0x00000000)
    URB Function: URB_FUNCTION_CONTROL_TRANSFER (0x0008)
    IRP information: 0x01, Direction: PDO -> FDO
    URB bus id: 1
    Device address: 17
    Endpoint: 0x80, Direction: IN
    URB transfer type: URB_CONTROL (0x02)
    Packet Data Length: 41
    [Request in: 33]
    [Time from request: 0.000000000 seconds]
    Control transfer stage: Complete (3)
CONFIGURATION DESCRIPTOR
INTERFACE DESCRIPTOR (0.0): class HID
HID DESCRIPTOR
ENDPOINT DESCRIPTOR
ENDPOINT DESCRIPTOR

No.     Time           Source                Destination           Protocol Length Info
     35 0.000000       host                  1.17.0                USB      36     SET CONFIGURATION Request

Frame 35: Packet, 36 bytes on wire (288 bits), 36 bytes captured (288 bits) on interface \\.\USBPcap1, id 0
    Section number: 1
    Interface id: 0 (\\.\USBPcap1)
    Encapsulation type: USB packets with USBPcap header (152)
    Arrival Time: Mar 31, 2026 22:42:49.786660000 W. Europe Summer Time
    UTC Arrival Time: Mar 31, 2026 20:42:49.786660000 UTC
    Epoch Arrival Time: 1774989769.786660000
    [Time shift for this packet: 0.000000000 seconds]
    [Time delta from previous captured frame: 0.000000000 seconds]
    [Time delta from previous displayed frame: 0.000000000 seconds]
    [Time since reference or first frame: 0.000000000 seconds]
    Frame Number: 35
    Frame Length: 36 bytes (288 bits)
    Capture Length: 36 bytes (288 bits)
    [Frame is marked: False]
    [Frame is ignored: False]
    [Protocols in frame: usb]
    Character encoding: ASCII (0)
USB URB
    [Source: host]
    [Destination: 1.17.0]
    USBPcap pseudoheader length: 28
    IRP ID: 0x0000000000000000
    IRP USBD_STATUS: USBD_STATUS_SUCCESS (0x00000000)
    URB Function: URB_FUNCTION_SELECT_CONFIGURATION (0x0000)
    IRP information: 0x00, Direction: FDO -> PDO
    URB bus id: 1
    Device address: 17
    Endpoint: 0x00, Direction: OUT
    URB transfer type: URB_CONTROL (0x02)
    Packet Data Length: 8
    [Response in: 36]
    Control transfer stage: Setup (0)
Setup Data

No.     Time           Source                Destination           Protocol Length Info
     36 0.000000       1.17.0                host                  USB      28     SET CONFIGURATION Response

Frame 36: Packet, 28 bytes on wire (224 bits), 28 bytes captured (224 bits) on interface \\.\USBPcap1, id 0
    Section number: 1
    Interface id: 0 (\\.\USBPcap1)
    Encapsulation type: USB packets with USBPcap header (152)
    Arrival Time: Mar 31, 2026 22:42:49.786660000 W. Europe Summer Time
    UTC Arrival Time: Mar 31, 2026 20:42:49.786660000 UTC
    Epoch Arrival Time: 1774989769.786660000
    [Time shift for this packet: 0.000000000 seconds]
    [Time delta from previous captured frame: 0.000000000 seconds]
    [Time delta from previous displayed frame: 0.000000000 seconds]
    [Time since reference or first frame: 0.000000000 seconds]
    Frame Number: 36
    Frame Length: 28 bytes (224 bits)
    Capture Length: 28 bytes (224 bits)
    [Frame is marked: False]
    [Frame is ignored: False]
    [Protocols in frame: usb]
    Character encoding: ASCII (0)
USB URB
    [Source: 1.17.0]
    [Destination: host]
    USBPcap pseudoheader length: 28
    IRP ID: 0x0000000000000000
    IRP USBD_STATUS: USBD_STATUS_SUCCESS (0x00000000)
    URB Function: URB_FUNCTION_SELECT_CONFIGURATION (0x0000)
    IRP information: 0x01, Direction: PDO -> FDO
    URB bus id: 1
    Device address: 17
    Endpoint: 0x00, Direction: OUT
    URB transfer type: URB_CONTROL (0x02)
    Packet Data Length: 0
    [Request in: 35]
    [Time from request: 0.000000000 seconds]
    Control transfer stage: Complete (3)

No.     Time           Source                Destination           Protocol Length Info
   3073 11.351458      host                  1.17.2                USB      91     URB_INTERRUPT out

Frame 3073: Packet, 91 bytes on wire (728 bits), 91 bytes captured (728 bits) on interface \\.\USBPcap1, id 0
    Section number: 1
    Interface id: 0 (\\.\USBPcap1)
    Encapsulation type: USB packets with USBPcap header (152)
    Arrival Time: Mar 31, 2026 22:43:01.138118000 W. Europe Summer Time
    UTC Arrival Time: Mar 31, 2026 20:43:01.138118000 UTC
    Epoch Arrival Time: 1774989781.138118000
    [Time shift for this packet: 0.000000000 seconds]
    [Time delta from previous captured frame: 2.415508000 seconds]
    [Time delta from previous displayed frame: 11.351458000 seconds]
    [Time since reference or first frame: 11.351458000 seconds]
    Frame Number: 3073
    Frame Length: 91 bytes (728 bits)
    Capture Length: 91 bytes (728 bits)
    [Frame is marked: False]
    [Frame is ignored: False]
    [Protocols in frame: usb:usbhid]
    Character encoding: ASCII (0)
USB URB
    [Source: host]
    [Destination: 1.17.2]
    USBPcap pseudoheader length: 27
    IRP ID: 0xffffa6864b4d4010
    IRP USBD_STATUS: USBD_STATUS_SUCCESS (0x00000000)
    URB Function: URB_FUNCTION_BULK_OR_INTERRUPT_TRANSFER (0x0009)
    IRP information: 0x00, Direction: FDO -> PDO
    URB bus id: 1
    Device address: 17
    Endpoint: 0x02, Direction: OUT
    URB transfer type: URB_INTERRUPT (0x01)
    Packet Data Length: 64
    [Response in: 3074]
    [bInterfaceClass: HID (0x03)]
HID Data: 10020001011010031100000000000000000000000000000000000000000000000000000000000000000000000000000000000000000000000000000000000000

No.     Time           Source                Destination           Protocol Length Info
   3074 11.353145      1.17.2                host                  USB      27     URB_INTERRUPT out

Frame 3074: Packet, 27 bytes on wire (216 bits), 27 bytes captured (216 bits) on interface \\.\USBPcap1, id 0
    Section number: 1
    Interface id: 0 (\\.\USBPcap1)
    Encapsulation type: USB packets with USBPcap header (152)
    Arrival Time: Mar 31, 2026 22:43:01.139805000 W. Europe Summer Time
    UTC Arrival Time: Mar 31, 2026 20:43:01.139805000 UTC
    Epoch Arrival Time: 1774989781.139805000
    [Time shift for this packet: 0.000000000 seconds]
    [Time delta from previous captured frame: 1.687000 milliseconds]
    [Time delta from previous displayed frame: 1.687000 milliseconds]
    [Time since reference or first frame: 11.353145000 seconds]
    Frame Number: 3074
    Frame Length: 27 bytes (216 bits)
    Capture Length: 27 bytes (216 bits)
    [Frame is marked: False]
    [Frame is ignored: False]
    [Protocols in frame: usb]
    Character encoding: ASCII (0)
USB URB
    [Source: 1.17.2]
    [Destination: host]
    USBPcap pseudoheader length: 27
    IRP ID: 0xffffa6864b4d4010
    IRP USBD_STATUS: USBD_STATUS_SUCCESS (0x00000000)
    URB Function: URB_FUNCTION_BULK_OR_INTERRUPT_TRANSFER (0x0009)
    IRP information: 0x01, Direction: PDO -> FDO
    URB bus id: 1
    Device address: 17
    Endpoint: 0x02, Direction: OUT
    URB transfer type: URB_INTERRUPT (0x01)
    Packet Data Length: 0
    [Request in: 3073]
    [Time from request: 1.687000 milliseconds]
    [bInterfaceClass: HID (0x03)]

No.     Time           Source                Destination           Protocol Length Info
   3075 11.358798      1.17.1                host                  USB      91     URB_INTERRUPT in

Frame 3075: Packet, 91 bytes on wire (728 bits), 91 bytes captured (728 bits) on interface \\.\USBPcap1, id 0
    Section number: 1
    Interface id: 0 (\\.\USBPcap1)
    Encapsulation type: USB packets with USBPcap header (152)
    Arrival Time: Mar 31, 2026 22:43:01.145458000 W. Europe Summer Time
    UTC Arrival Time: Mar 31, 2026 20:43:01.145458000 UTC
    Epoch Arrival Time: 1774989781.145458000
    [Time shift for this packet: 0.000000000 seconds]
    [Time delta from previous captured frame: 5.653000 milliseconds]
    [Time delta from previous displayed frame: 5.653000 milliseconds]
    [Time since reference or first frame: 11.358798000 seconds]
    Frame Number: 3075
    Frame Length: 91 bytes (728 bits)
    Capture Length: 91 bytes (728 bits)
    [Frame is marked: False]
    [Frame is ignored: False]
    [Protocols in frame: usb:usbhid]
    Character encoding: ASCII (0)
USB URB
    [Source: 1.17.1]
    [Destination: host]
    USBPcap pseudoheader length: 27
    IRP ID: 0xffffa68649451010
    IRP USBD_STATUS: USBD_STATUS_SUCCESS (0x00000000)
    URB Function: URB_FUNCTION_BULK_OR_INTERRUPT_TRANSFER (0x0009)
    IRP information: 0x01, Direction: PDO -> FDO
    URB bus id: 1
    Device address: 17
    Endpoint: 0x81, Direction: IN
    URB transfer type: URB_INTERRUPT (0x01)
    Packet Data Length: 64
    [bInterfaceClass: HID (0x03)]
HID Data: 1002010002101e10030c000400000100000000002500001900001700001c00000010036c000000000000000000000000000000000000000000100331000abc8d

No.     Time           Source                Destination           Protocol Length Info
   3076 11.358829      host                  1.17.1                USB      27     URB_INTERRUPT in

Frame 3076: Packet, 27 bytes on wire (216 bits), 27 bytes captured (216 bits) on interface \\.\USBPcap1, id 0
    Section number: 1
    Interface id: 0 (\\.\USBPcap1)
    Encapsulation type: USB packets with USBPcap header (152)
    Arrival Time: Mar 31, 2026 22:43:01.145489000 W. Europe Summer Time
    UTC Arrival Time: Mar 31, 2026 20:43:01.145489000 UTC
    Epoch Arrival Time: 1774989781.145489000
    [Time shift for this packet: 0.000000000 seconds]
    [Time delta from previous captured frame: 31.000 microseconds]
    [Time delta from previous displayed frame: 31.000 microseconds]
    [Time since reference or first frame: 11.358829000 seconds]
    Frame Number: 3076
    Frame Length: 27 bytes (216 bits)
    Capture Length: 27 bytes (216 bits)
    [Frame is marked: False]
    [Frame is ignored: False]
    [Protocols in frame: usb]
    Character encoding: ASCII (0)
USB URB
    [Source: host]
    [Destination: 1.17.1]
    USBPcap pseudoheader length: 27
    IRP ID: 0xffffa68649451010
    IRP USBD_STATUS: USBD_STATUS_SUCCESS (0x00000000)
    URB Function: URB_FUNCTION_BULK_OR_INTERRUPT_TRANSFER (0x0009)
    IRP information: 0x00, Direction: FDO -> PDO
    URB bus id: 1
    Device address: 17
    Endpoint: 0x81, Direction: IN
    URB transfer type: URB_INTERRUPT (0x01)
    Packet Data Length: 0
    [Response in: 3083]
    [bInterfaceClass: HID (0x03)]

No.     Time           Source                Destination           Protocol Length Info
   3077 11.360086      host                  1.17.2                USB      91     URB_INTERRUPT out

Frame 3077: Packet, 91 bytes on wire (728 bits), 91 bytes captured (728 bits) on interface \\.\USBPcap1, id 0
    Section number: 1
    Interface id: 0 (\\.\USBPcap1)
    Encapsulation type: USB packets with USBPcap header (152)
    Arrival Time: Mar 31, 2026 22:43:01.146746000 W. Europe Summer Time
    UTC Arrival Time: Mar 31, 2026 20:43:01.146746000 UTC
    Epoch Arrival Time: 1774989781.146746000
    [Time shift for this packet: 0.000000000 seconds]
    [Time delta from previous captured frame: 1.257000 milliseconds]
    [Time delta from previous displayed frame: 1.257000 milliseconds]
    [Time since reference or first frame: 11.360086000 seconds]
    Frame Number: 3077
    Frame Length: 91 bytes (728 bits)
    Capture Length: 91 bytes (728 bits)
    [Frame is marked: False]
    [Frame is ignored: False]
    [Protocols in frame: usb:usbhid]
    Character encoding: ASCII (0)
USB URB
    [Source: host]
    [Destination: 1.17.2]
    USBPcap pseudoheader length: 27
    IRP ID: 0xffffa6864b1e2010
    IRP USBD_STATUS: USBD_STATUS_SUCCESS (0x00000000)
    URB Function: URB_FUNCTION_BULK_OR_INTERRUPT_TRANSFER (0x0009)
    IRP information: 0x00, Direction: FDO -> PDO
    URB bus id: 1
    Device address: 17
    Endpoint: 0x02, Direction: OUT
    URB transfer type: URB_INTERRUPT (0x01)
    Packet Data Length: 64
    [Response in: 3078]
    [bInterfaceClass: HID (0x03)]
HID Data: 10020001011310031240000044530a0a44530ab85f050a774d40000044530a774d40000044530ac0fdfe04154840000044530a0a44530ab85f050ad8fdfe04d8

No.     Time           Source                Destination           Protocol Length Info
   3078 11.361139      1.17.2                host                  USB      27     URB_INTERRUPT out

Frame 3078: Packet, 27 bytes on wire (216 bits), 27 bytes captured (216 bits) on interface \\.\USBPcap1, id 0
    Section number: 1
    Interface id: 0 (\\.\USBPcap1)
    Encapsulation type: USB packets with USBPcap header (152)
    Arrival Time: Mar 31, 2026 22:43:01.147799000 W. Europe Summer Time
    UTC Arrival Time: Mar 31, 2026 20:43:01.147799000 UTC
    Epoch Arrival Time: 1774989781.147799000
    [Time shift for this packet: 0.000000000 seconds]
    [Time delta from previous captured frame: 1.053000 milliseconds]
    [Time delta from previous displayed frame: 1.053000 milliseconds]
    [Time since reference or first frame: 11.361139000 seconds]
    Frame Number: 3078
    Frame Length: 27 bytes (216 bits)
    Capture Length: 27 bytes (216 bits)
    [Frame is marked: False]
    [Frame is ignored: False]
    [Protocols in frame: usb]
    Character encoding: ASCII (0)
USB URB
    [Source: 1.17.2]
    [Destination: host]
    USBPcap pseudoheader length: 27
    IRP ID: 0xffffa6864b1e2010
    IRP USBD_STATUS: USBD_STATUS_SUCCESS (0x00000000)
    URB Function: URB_FUNCTION_BULK_OR_INTERRUPT_TRANSFER (0x0009)
    IRP information: 0x01, Direction: PDO -> FDO
    URB bus id: 1
    Device address: 17
    Endpoint: 0x02, Direction: OUT
    URB transfer type: URB_INTERRUPT (0x01)
    Packet Data Length: 0
    [Request in: 3077]
    [Time from request: 1.053000 milliseconds]
    [bInterfaceClass: HID (0x03)]

No.     Time           Source                Destination           Protocol Length Info
   3079 11.368780      1.17.1                host                  USB      91     URB_INTERRUPT in

Frame 3079: Packet, 91 bytes on wire (728 bits), 91 bytes captured (728 bits) on interface \\.\USBPcap1, id 0
    Section number: 1
    Interface id: 0 (\\.\USBPcap1)
    Encapsulation type: USB packets with USBPcap header (152)
    Arrival Time: Mar 31, 2026 22:43:01.155440000 W. Europe Summer Time
    UTC Arrival Time: Mar 31, 2026 20:43:01.155440000 UTC
    Epoch Arrival Time: 1774989781.155440000
    [Time shift for this packet: 0.000000000 seconds]
    [Time delta from previous captured frame: 7.641000 milliseconds]
    [Time delta from previous displayed frame: 7.641000 milliseconds]
    [Time since reference or first frame: 11.368780000 seconds]
    Frame Number: 3079
    Frame Length: 91 bytes (728 bits)
    Capture Length: 91 bytes (728 bits)
    [Frame is marked: False]
    [Frame is ignored: False]
    [Protocols in frame: usb:usbhid]
    Character encoding: ASCII (0)
USB URB
    [Source: 1.17.1]
    [Destination: host]
    USBPcap pseudoheader length: 27
    IRP ID: 0xffffa686494500d0
    IRP USBD_STATUS: USBD_STATUS_SUCCESS (0x00000000)
    URB Function: URB_FUNCTION_BULK_OR_INTERRUPT_TRANSFER (0x0009)
    IRP information: 0x01, Direction: PDO -> FDO
    URB bus id: 1
    Device address: 17
    Endpoint: 0x81, Direction: IN
    URB transfer type: URB_INTERRUPT (0x01)
    Packet Data Length: 64
    [bInterfaceClass: HID (0x03)]
HID Data: 100201000d133478344d494e49205630313010032200001900001700001c00000010036c000000000000000000000000000000000000000000100331000abc8d

No.     Time           Source                Destination           Protocol Length Info
   3080 11.368794      host                  1.17.1                USB      27     URB_INTERRUPT in

Frame 3080: Packet, 27 bytes on wire (216 bits), 27 bytes captured (216 bits) on interface \\.\USBPcap1, id 0
    Section number: 1
    Interface id: 0 (\\.\USBPcap1)
    Encapsulation type: USB packets with USBPcap header (152)
    Arrival Time: Mar 31, 2026 22:43:01.155454000 W. Europe Summer Time
    UTC Arrival Time: Mar 31, 2026 20:43:01.155454000 UTC
    Epoch Arrival Time: 1774989781.155454000
    [Time shift for this packet: 0.000000000 seconds]
    [Time delta from previous captured frame: 14.000 microseconds]
    [Time delta from previous displayed frame: 14.000 microseconds]
    [Time since reference or first frame: 11.368794000 seconds]
    Frame Number: 3080
    Frame Length: 27 bytes (216 bits)
    Capture Length: 27 bytes (216 bits)
    [Frame is marked: False]
    [Frame is ignored: False]
    [Protocols in frame: usb]
    Character encoding: ASCII (0)
USB URB
    [Source: host]
    [Destination: 1.17.1]
    USBPcap pseudoheader length: 27
    IRP ID: 0xffffa686494500d0
    IRP USBD_STATUS: USBD_STATUS_SUCCESS (0x00000000)
    URB Function: URB_FUNCTION_BULK_OR_INTERRUPT_TRANSFER (0x0009)
    IRP information: 0x00, Direction: FDO -> PDO
    URB bus id: 1
    Device address: 17
    Endpoint: 0x81, Direction: IN
    URB transfer type: URB_INTERRUPT (0x01)
    Packet Data Length: 0
    [Response in: 3087]
    [bInterfaceClass: HID (0x03)]

No.     Time           Source                Destination           Protocol Length Info
   3081 11.369685      host                  1.17.2                USB      91     URB_INTERRUPT out

Frame 3081: Packet, 91 bytes on wire (728 bits), 91 bytes captured (728 bits) on interface \\.\USBPcap1, id 0
    Section number: 1
    Interface id: 0 (\\.\USBPcap1)
    Encapsulation type: USB packets with USBPcap header (152)
    Arrival Time: Mar 31, 2026 22:43:01.156345000 W. Europe Summer Time
    UTC Arrival Time: Mar 31, 2026 20:43:01.156345000 UTC
    Epoch Arrival Time: 1774989781.156345000
    [Time shift for this packet: 0.000000000 seconds]
    [Time delta from previous captured frame: 891.000 microseconds]
    [Time delta from previous displayed frame: 891.000 microseconds]
    [Time since reference or first frame: 11.369685000 seconds]
    Frame Number: 3081
    Frame Length: 91 bytes (728 bits)
    Capture Length: 91 bytes (728 bits)
    [Frame is marked: False]
    [Frame is ignored: False]
    [Protocols in frame: usb:usbhid]
    Character encoding: ASCII (0)
USB URB
    [Source: host]
    [Destination: 1.17.2]
    USBPcap pseudoheader length: 27
    IRP ID: 0xffffa686497ed010
    IRP USBD_STATUS: USBD_STATUS_SUCCESS (0x00000000)
    URB Function: URB_FUNCTION_BULK_OR_INTERRUPT_TRANSFER (0x0009)
    IRP information: 0x00, Direction: FDO -> PDO
    URB bus id: 1
    Device address: 17
    Endpoint: 0x02, Direction: OUT
    URB transfer type: URB_INTERRUPT (0x01)
    Packet Data Length: 64
    [Response in: 3082]
    [bInterfaceClass: HID (0x03)]
HID Data: 10020001012c10032d4000f09cef03059def03b85f050a774d4000f09cef03774d4000f09cef03c0fdfe0415484000f09cef03059def03b85f050ad8fdfe04d8

No.     Time           Source                Destination           Protocol Length Info
   3082 11.371136      1.17.2                host                  USB      27     URB_INTERRUPT out

Frame 3082: Packet, 27 bytes on wire (216 bits), 27 bytes captured (216 bits) on interface \\.\USBPcap1, id 0
    Section number: 1
    Interface id: 0 (\\.\USBPcap1)
    Encapsulation type: USB packets with USBPcap header (152)
    Arrival Time: Mar 31, 2026 22:43:01.157796000 W. Europe Summer Time
    UTC Arrival Time: Mar 31, 2026 20:43:01.157796000 UTC
    Epoch Arrival Time: 1774989781.157796000
    [Time shift for this packet: 0.000000000 seconds]
    [Time delta from previous captured frame: 1.451000 milliseconds]
    [Time delta from previous displayed frame: 1.451000 milliseconds]
    [Time since reference or first frame: 11.371136000 seconds]
    Frame Number: 3082
    Frame Length: 27 bytes (216 bits)
    Capture Length: 27 bytes (216 bits)
    [Frame is marked: False]
    [Frame is ignored: False]
    [Protocols in frame: usb]
    Character encoding: ASCII (0)
USB URB
    [Source: 1.17.2]
    [Destination: host]
    USBPcap pseudoheader length: 27
    IRP ID: 0xffffa686497ed010
    IRP USBD_STATUS: USBD_STATUS_SUCCESS (0x00000000)
    URB Function: URB_FUNCTION_BULK_OR_INTERRUPT_TRANSFER (0x0009)
    IRP information: 0x01, Direction: PDO -> FDO
    URB bus id: 1
    Device address: 17
    Endpoint: 0x02, Direction: OUT
    URB transfer type: URB_INTERRUPT (0x01)
    Packet Data Length: 0
    [Request in: 3081]
    [Time from request: 1.451000 milliseconds]
    [bInterfaceClass: HID (0x03)]

No.     Time           Source                Destination           Protocol Length Info
   3083 11.377840      1.17.1                host                  USB      91     URB_INTERRUPT in

Frame 3083: Packet, 91 bytes on wire (728 bits), 91 bytes captured (728 bits) on interface \\.\USBPcap1, id 0
    Section number: 1
    Interface id: 0 (\\.\USBPcap1)
    Encapsulation type: USB packets with USBPcap header (152)
    Arrival Time: Mar 31, 2026 22:43:01.164500000 W. Europe Summer Time
    UTC Arrival Time: Mar 31, 2026 20:43:01.164500000 UTC
    Epoch Arrival Time: 1774989781.164500000
    [Time shift for this packet: 0.000000000 seconds]
    [Time delta from previous captured frame: 6.704000 milliseconds]
    [Time delta from previous displayed frame: 6.704000 milliseconds]
    [Time since reference or first frame: 11.377840000 seconds]
    Frame Number: 3083
    Frame Length: 91 bytes (728 bits)
    Capture Length: 91 bytes (728 bits)
    [Frame is marked: False]
    [Frame is ignored: False]
    [Protocols in frame: usb:usbhid]
    Character encoding: ASCII (0)
USB URB
    [Source: 1.17.1]
    [Destination: host]
    USBPcap pseudoheader length: 27
    IRP ID: 0xffffa68649451010
    IRP USBD_STATUS: USBD_STATUS_SUCCESS (0x00000000)
    URB Function: URB_FUNCTION_BULK_OR_INTERRUPT_TRANSFER (0x0009)
    IRP information: 0x01, Direction: PDO -> FDO
    URB bus id: 1
    Device address: 17
    Endpoint: 0x81, Direction: IN
    URB transfer type: URB_INTERRUPT (0x01)
    Packet Data Length: 64
    [Request in: 3076]
    [Time from request: 19.011000 milliseconds]
    [bInterfaceClass: HID (0x03)]
HID Data: 10020100082c00270f0000000010030c313010032200001900001700001c00000010036c000000000000000000000000000000000000000000100331000abc8d

No.     Time           Source                Destination           Protocol Length Info
   3084 11.377855      host                  1.17.1                USB      27     URB_INTERRUPT in

Frame 3084: Packet, 27 bytes on wire (216 bits), 27 bytes captured (216 bits) on interface \\.\USBPcap1, id 0
    Section number: 1
    Interface id: 0 (\\.\USBPcap1)
    Encapsulation type: USB packets with USBPcap header (152)
    Arrival Time: Mar 31, 2026 22:43:01.164515000 W. Europe Summer Time
    UTC Arrival Time: Mar 31, 2026 20:43:01.164515000 UTC
    Epoch Arrival Time: 1774989781.164515000
    [Time shift for this packet: 0.000000000 seconds]
    [Time delta from previous captured frame: 15.000 microseconds]
    [Time delta from previous displayed frame: 15.000 microseconds]
    [Time since reference or first frame: 11.377855000 seconds]
    Frame Number: 3084
    Frame Length: 27 bytes (216 bits)
    Capture Length: 27 bytes (216 bits)
    [Frame is marked: False]
    [Frame is ignored: False]
    [Protocols in frame: usb]
    Character encoding: ASCII (0)
USB URB
    [Source: host]
    [Destination: 1.17.1]
    USBPcap pseudoheader length: 27
    IRP ID: 0xffffa68649451010
    IRP USBD_STATUS: USBD_STATUS_SUCCESS (0x00000000)
    URB Function: URB_FUNCTION_BULK_OR_INTERRUPT_TRANSFER (0x0009)
    IRP information: 0x00, Direction: FDO -> PDO
    URB bus id: 1
    Device address: 17
    Endpoint: 0x81, Direction: IN
    URB transfer type: URB_INTERRUPT (0x01)
    Packet Data Length: 0
    [Response in: 3091]
    [bInterfaceClass: HID (0x03)]

No.     Time           Source                Destination           Protocol Length Info
   3085 11.384757      host                  1.17.2                USB      91     URB_INTERRUPT out

Frame 3085: Packet, 91 bytes on wire (728 bits), 91 bytes captured (728 bits) on interface \\.\USBPcap1, id 0
    Section number: 1
    Interface id: 0 (\\.\USBPcap1)
    Encapsulation type: USB packets with USBPcap header (152)
    Arrival Time: Mar 31, 2026 22:43:01.171417000 W. Europe Summer Time
    UTC Arrival Time: Mar 31, 2026 20:43:01.171417000 UTC
    Epoch Arrival Time: 1774989781.171417000
    [Time shift for this packet: 0.000000000 seconds]
    [Time delta from previous captured frame: 6.902000 milliseconds]
    [Time delta from previous displayed frame: 6.902000 milliseconds]
    [Time since reference or first frame: 11.384757000 seconds]
    Frame Number: 3085
    Frame Length: 91 bytes (728 bits)
    Capture Length: 91 bytes (728 bits)
    [Frame is marked: False]
    [Frame is ignored: False]
    [Protocols in frame: usb:usbhid]
    Character encoding: ASCII (0)
USB URB
    [Source: host]
    [Destination: 1.17.2]
    USBPcap pseudoheader length: 27
    IRP ID: 0xffffa6864b1e1010
    IRP USBD_STATUS: USBD_STATUS_SUCCESS (0x00000000)
    URB Function: URB_FUNCTION_BULK_OR_INTERRUPT_TRANSFER (0x0009)
    IRP information: 0x00, Direction: FDO -> PDO
    URB bus id: 1
    Device address: 17
    Endpoint: 0x02, Direction: OUT
    URB transfer type: URB_INTERRUPT (0x01)
    Packet Data Length: 64
    [Response in: 3086]
    [bInterfaceClass: HID (0x03)]
HID Data: 1002000101221003234000f09cef03009def03b85f050a774d4000f09cef03774d4000f09cef03c0fdfe0415484000f09cef03009def03b85f050ad8fdfe04d8

No.     Time           Source                Destination           Protocol Length Info
   3086 11.386139      1.17.2                host                  USB      27     URB_INTERRUPT out

Frame 3086: Packet, 27 bytes on wire (216 bits), 27 bytes captured (216 bits) on interface \\.\USBPcap1, id 0
    Section number: 1
    Interface id: 0 (\\.\USBPcap1)
    Encapsulation type: USB packets with USBPcap header (152)
    Arrival Time: Mar 31, 2026 22:43:01.172799000 W. Europe Summer Time
    UTC Arrival Time: Mar 31, 2026 20:43:01.172799000 UTC
    Epoch Arrival Time: 1774989781.172799000
    [Time shift for this packet: 0.000000000 seconds]
    [Time delta from previous captured frame: 1.382000 milliseconds]
    [Time delta from previous displayed frame: 1.382000 milliseconds]
    [Time since reference or first frame: 11.386139000 seconds]
    Frame Number: 3086
    Frame Length: 27 bytes (216 bits)
    Capture Length: 27 bytes (216 bits)
    [Frame is marked: False]
    [Frame is ignored: False]
    [Protocols in frame: usb]
    Character encoding: ASCII (0)
USB URB
    [Source: 1.17.2]
    [Destination: host]
    USBPcap pseudoheader length: 27
    IRP ID: 0xffffa6864b1e1010
    IRP USBD_STATUS: USBD_STATUS_SUCCESS (0x00000000)
    URB Function: URB_FUNCTION_BULK_OR_INTERRUPT_TRANSFER (0x0009)
    IRP information: 0x01, Direction: PDO -> FDO
    URB bus id: 1
    Device address: 17
    Endpoint: 0x02, Direction: OUT
    URB transfer type: URB_INTERRUPT (0x01)
    Packet Data Length: 0
    [Request in: 3085]
    [Time from request: 1.382000 milliseconds]
    [bInterfaceClass: HID (0x03)]

No.     Time           Source                Destination           Protocol Length Info
   3087 11.415780      1.17.1                host                  USB      91     URB_INTERRUPT in

Frame 3087: Packet, 91 bytes on wire (728 bits), 91 bytes captured (728 bits) on interface \\.\USBPcap1, id 0
    Section number: 1
    Interface id: 0 (\\.\USBPcap1)
    Encapsulation type: USB packets with USBPcap header (152)
    Arrival Time: Mar 31, 2026 22:43:01.202440000 W. Europe Summer Time
    UTC Arrival Time: Mar 31, 2026 20:43:01.202440000 UTC
    Epoch Arrival Time: 1774989781.202440000
    [Time shift for this packet: 0.000000000 seconds]
    [Time delta from previous captured frame: 29.641000 milliseconds]
    [Time delta from previous displayed frame: 29.641000 milliseconds]
    [Time since reference or first frame: 11.415780000 seconds]
    Frame Number: 3087
    Frame Length: 91 bytes (728 bits)
    Capture Length: 91 bytes (728 bits)
    [Frame is marked: False]
    [Frame is ignored: False]
    [Protocols in frame: usb:usbhid]
    Character encoding: ASCII (0)
USB URB
    [Source: 1.17.1]
    [Destination: host]
    USBPcap pseudoheader length: 27
    IRP ID: 0xffffa686494500d0
    IRP USBD_STATUS: USBD_STATUS_SUCCESS (0x00000000)
    URB Function: URB_FUNCTION_BULK_OR_INTERRUPT_TRANSFER (0x0009)
    IRP information: 0x01, Direction: PDO -> FDO
    URB bus id: 1
    Device address: 17
    Endpoint: 0x81, Direction: IN
    URB transfer type: URB_INTERRUPT (0x01)
    Packet Data Length: 64
    [Request in: 3080]
    [Time from request: 46.986000 milliseconds]
    [bInterfaceClass: HID (0x03)]
HID Data: 100201001f22ffff0000000000000000000000000000000000000000000000000000000010033d000000000000000000000000000000000000100331000abc8d

No.     Time           Source                Destination           Protocol Length Info
   3088 11.415796      host                  1.17.1                USB      27     URB_INTERRUPT in

Frame 3088: Packet, 27 bytes on wire (216 bits), 27 bytes captured (216 bits) on interface \\.\USBPcap1, id 0
    Section number: 1
    Interface id: 0 (\\.\USBPcap1)
    Encapsulation type: USB packets with USBPcap header (152)
    Arrival Time: Mar 31, 2026 22:43:01.202456000 W. Europe Summer Time
    UTC Arrival Time: Mar 31, 2026 20:43:01.202456000 UTC
    Epoch Arrival Time: 1774989781.202456000
    [Time shift for this packet: 0.000000000 seconds]
    [Time delta from previous captured frame: 16.000 microseconds]
    [Time delta from previous displayed frame: 16.000 microseconds]
    [Time since reference or first frame: 11.415796000 seconds]
    Frame Number: 3088
    Frame Length: 27 bytes (216 bits)
    Capture Length: 27 bytes (216 bits)
    [Frame is marked: False]
    [Frame is ignored: False]
    [Protocols in frame: usb]
    Character encoding: ASCII (0)
USB URB
    [Source: host]
    [Destination: 1.17.1]
    USBPcap pseudoheader length: 27
    IRP ID: 0xffffa686494500d0
    IRP USBD_STATUS: USBD_STATUS_SUCCESS (0x00000000)
    URB Function: URB_FUNCTION_BULK_OR_INTERRUPT_TRANSFER (0x0009)
    IRP information: 0x00, Direction: FDO -> PDO
    URB bus id: 1
    Device address: 17
    Endpoint: 0x81, Direction: IN
    URB transfer type: URB_INTERRUPT (0x01)
    Packet Data Length: 0
    [Response in: 3095]
    [bInterfaceClass: HID (0x03)]

No.     Time           Source                Destination           Protocol Length Info
   3089 11.417761      host                  1.17.2                USB      91     URB_INTERRUPT out

Frame 3089: Packet, 91 bytes on wire (728 bits), 91 bytes captured (728 bits) on interface \\.\USBPcap1, id 0
    Section number: 1
    Interface id: 0 (\\.\USBPcap1)
    Encapsulation type: USB packets with USBPcap header (152)
    Arrival Time: Mar 31, 2026 22:43:01.204421000 W. Europe Summer Time
    UTC Arrival Time: Mar 31, 2026 20:43:01.204421000 UTC
    Epoch Arrival Time: 1774989781.204421000
    [Time shift for this packet: 0.000000000 seconds]
    [Time delta from previous captured frame: 1.965000 milliseconds]
    [Time delta from previous displayed frame: 1.965000 milliseconds]
    [Time since reference or first frame: 11.417761000 seconds]
    Frame Number: 3089
    Frame Length: 91 bytes (728 bits)
    Capture Length: 91 bytes (728 bits)
    [Frame is marked: False]
    [Frame is ignored: False]
    [Protocols in frame: usb:usbhid]
    Character encoding: ASCII (0)
USB URB
    [Source: host]
    [Destination: 1.17.2]
    USBPcap pseudoheader length: 27
    IRP ID: 0xffffa686080d32a0
    IRP USBD_STATUS: USBD_STATUS_SUCCESS (0x00000000)
    URB Function: URB_FUNCTION_BULK_OR_INTERRUPT_TRANSFER (0x0009)
    IRP information: 0x00, Direction: FDO -> PDO
    URB bus id: 1
    Device address: 17
    Endpoint: 0x02, Direction: OUT
    URB transfer type: URB_INTERRUPT (0x01)
    Packet Data Length: 64
    [Response in: 3090]
    [bInterfaceClass: HID (0x03)]
HID Data: 100200010114100315400080a1f303a7a1f303b85f050a774d400080a1f303774d400080a1f303c0fdfe041548400080a1f303a7a1f303b85f050ad8fdfe04d8

No.     Time           Source                Destination           Protocol Length Info
   3090 11.419135      1.17.2                host                  USB      27     URB_INTERRUPT out

Frame 3090: Packet, 27 bytes on wire (216 bits), 27 bytes captured (216 bits) on interface \\.\USBPcap1, id 0
    Section number: 1
    Interface id: 0 (\\.\USBPcap1)
    Encapsulation type: USB packets with USBPcap header (152)
    Arrival Time: Mar 31, 2026 22:43:01.205795000 W. Europe Summer Time
    UTC Arrival Time: Mar 31, 2026 20:43:01.205795000 UTC
    Epoch Arrival Time: 1774989781.205795000
    [Time shift for this packet: 0.000000000 seconds]
    [Time delta from previous captured frame: 1.374000 milliseconds]
    [Time delta from previous displayed frame: 1.374000 milliseconds]
    [Time since reference or first frame: 11.419135000 seconds]
    Frame Number: 3090
    Frame Length: 27 bytes (216 bits)
    Capture Length: 27 bytes (216 bits)
    [Frame is marked: False]
    [Frame is ignored: False]
    [Protocols in frame: usb]
    Character encoding: ASCII (0)
USB URB
    [Source: 1.17.2]
    [Destination: host]
    USBPcap pseudoheader length: 27
    IRP ID: 0xffffa686080d32a0
    IRP USBD_STATUS: USBD_STATUS_SUCCESS (0x00000000)
    URB Function: URB_FUNCTION_BULK_OR_INTERRUPT_TRANSFER (0x0009)
    IRP information: 0x01, Direction: PDO -> FDO
    URB bus id: 1
    Device address: 17
    Endpoint: 0x02, Direction: OUT
    URB transfer type: URB_INTERRUPT (0x01)
    Packet Data Length: 0
    [Request in: 3089]
    [Time from request: 1.374000 milliseconds]
    [bInterfaceClass: HID (0x03)]

No.     Time           Source                Destination           Protocol Length Info
   3091 11.420775      1.17.1                host                  USB      91     URB_INTERRUPT in

Frame 3091: Packet, 91 bytes on wire (728 bits), 91 bytes captured (728 bits) on interface \\.\USBPcap1, id 0
    Section number: 1
    Interface id: 0 (\\.\USBPcap1)
    Encapsulation type: USB packets with USBPcap header (152)
    Arrival Time: Mar 31, 2026 22:43:01.207435000 W. Europe Summer Time
    UTC Arrival Time: Mar 31, 2026 20:43:01.207435000 UTC
    Epoch Arrival Time: 1774989781.207435000
    [Time shift for this packet: 0.000000000 seconds]
    [Time delta from previous captured frame: 1.640000 milliseconds]
    [Time delta from previous displayed frame: 1.640000 milliseconds]
    [Time since reference or first frame: 11.420775000 seconds]
    Frame Number: 3091
    Frame Length: 91 bytes (728 bits)
    Capture Length: 91 bytes (728 bits)
    [Frame is marked: False]
    [Frame is ignored: False]
    [Protocols in frame: usb:usbhid]
    Character encoding: ASCII (0)
USB URB
    [Source: 1.17.1]
    [Destination: host]
    USBPcap pseudoheader length: 27
    IRP ID: 0xffffa68649451010
    IRP USBD_STATUS: USBD_STATUS_SUCCESS (0x00000000)
    URB Function: URB_FUNCTION_BULK_OR_INTERRUPT_TRANSFER (0x0009)
    IRP information: 0x01, Direction: PDO -> FDO
    URB bus id: 1
    Device address: 17
    Endpoint: 0x81, Direction: IN
    URB transfer type: URB_INTERRUPT (0x01)
    Packet Data Length: 64
    [Request in: 3084]
    [Time from request: 42.920000 milliseconds]
    [bInterfaceClass: HID (0x03)]
HID Data: 10020100021402100314000000000000000000000000000000000000000000000000000010033d000000000000000000000000000000000000100331000abc8d

No.     Time           Source                Destination           Protocol Length Info
   3092 11.420788      host                  1.17.1                USB      27     URB_INTERRUPT in

Frame 3092: Packet, 27 bytes on wire (216 bits), 27 bytes captured (216 bits) on interface \\.\USBPcap1, id 0
    Section number: 1
    Interface id: 0 (\\.\USBPcap1)
    Encapsulation type: USB packets with USBPcap header (152)
    Arrival Time: Mar 31, 2026 22:43:01.207448000 W. Europe Summer Time
    UTC Arrival Time: Mar 31, 2026 20:43:01.207448000 UTC
    Epoch Arrival Time: 1774989781.207448000
    [Time shift for this packet: 0.000000000 seconds]
    [Time delta from previous captured frame: 13.000 microseconds]
    [Time delta from previous displayed frame: 13.000 microseconds]
    [Time since reference or first frame: 11.420788000 seconds]
    Frame Number: 3092
    Frame Length: 27 bytes (216 bits)
    Capture Length: 27 bytes (216 bits)
    [Frame is marked: False]
    [Frame is ignored: False]
    [Protocols in frame: usb]
    Character encoding: ASCII (0)
USB URB
    [Source: host]
    [Destination: 1.17.1]
    USBPcap pseudoheader length: 27
    IRP ID: 0xffffa68649451010
    IRP USBD_STATUS: USBD_STATUS_SUCCESS (0x00000000)
    URB Function: URB_FUNCTION_BULK_OR_INTERRUPT_TRANSFER (0x0009)
    IRP information: 0x00, Direction: FDO -> PDO
    URB bus id: 1
    Device address: 17
    Endpoint: 0x81, Direction: IN
    URB transfer type: URB_INTERRUPT (0x01)
    Packet Data Length: 0
    [Response in: 3099]
    [bInterfaceClass: HID (0x03)]

No.     Time           Source                Destination           Protocol Length Info
   3093 11.421339      host                  1.17.2                USB      91     URB_INTERRUPT out

Frame 3093: Packet, 91 bytes on wire (728 bits), 91 bytes captured (728 bits) on interface \\.\USBPcap1, id 0
    Section number: 1
    Interface id: 0 (\\.\USBPcap1)
    Encapsulation type: USB packets with USBPcap header (152)
    Arrival Time: Mar 31, 2026 22:43:01.207999000 W. Europe Summer Time
    UTC Arrival Time: Mar 31, 2026 20:43:01.207999000 UTC
    Epoch Arrival Time: 1774989781.207999000
    [Time shift for this packet: 0.000000000 seconds]
    [Time delta from previous captured frame: 551.000 microseconds]
    [Time delta from previous displayed frame: 551.000 microseconds]
    [Time since reference or first frame: 11.421339000 seconds]
    Frame Number: 3093
    Frame Length: 91 bytes (728 bits)
    Capture Length: 91 bytes (728 bits)
    [Frame is marked: False]
    [Frame is ignored: False]
    [Protocols in frame: usb:usbhid]
    Character encoding: ASCII (0)
USB URB
    [Source: host]
    [Destination: 1.17.2]
    USBPcap pseudoheader length: 27
    IRP ID: 0xffffa68649cd92a0
    IRP USBD_STATUS: USBD_STATUS_SUCCESS (0x00000000)
    URB Function: URB_FUNCTION_BULK_OR_INTERRUPT_TRANSFER (0x0009)
    IRP information: 0x00, Direction: FDO -> PDO
    URB bus id: 1
    Device address: 17
    Endpoint: 0x02, Direction: OUT
    URB transfer type: URB_INTERRUPT (0x01)
    Packet Data Length: 64
    [Response in: 3094]
    [bInterfaceClass: HID (0x03)]
HID Data: 1002000102290010032b0080a1f3038aa1f303b85f050a774d400080a1f303774d400080a1f303c0fdfe041548400080a1f3038aa1f303b85f050ad8fdfe04d8

No.     Time           Source                Destination           Protocol Length Info
   3094 11.423137      1.17.2                host                  USB      27     URB_INTERRUPT out

Frame 3094: Packet, 27 bytes on wire (216 bits), 27 bytes captured (216 bits) on interface \\.\USBPcap1, id 0
    Section number: 1
    Interface id: 0 (\\.\USBPcap1)
    Encapsulation type: USB packets with USBPcap header (152)
    Arrival Time: Mar 31, 2026 22:43:01.209797000 W. Europe Summer Time
    UTC Arrival Time: Mar 31, 2026 20:43:01.209797000 UTC
    Epoch Arrival Time: 1774989781.209797000
    [Time shift for this packet: 0.000000000 seconds]
    [Time delta from previous captured frame: 1.798000 milliseconds]
    [Time delta from previous displayed frame: 1.798000 milliseconds]
    [Time since reference or first frame: 11.423137000 seconds]
    Frame Number: 3094
    Frame Length: 27 bytes (216 bits)
    Capture Length: 27 bytes (216 bits)
    [Frame is marked: False]
    [Frame is ignored: False]
    [Protocols in frame: usb]
    Character encoding: ASCII (0)
USB URB
    [Source: 1.17.2]
    [Destination: host]
    USBPcap pseudoheader length: 27
    IRP ID: 0xffffa68649cd92a0
    IRP USBD_STATUS: USBD_STATUS_SUCCESS (0x00000000)
    URB Function: URB_FUNCTION_BULK_OR_INTERRUPT_TRANSFER (0x0009)
    IRP information: 0x01, Direction: PDO -> FDO
    URB bus id: 1
    Device address: 17
    Endpoint: 0x02, Direction: OUT
    URB transfer type: URB_INTERRUPT (0x01)
    Packet Data Length: 0
    [Request in: 3093]
    [Time from request: 1.798000 milliseconds]
    [bInterfaceClass: HID (0x03)]

No.     Time           Source                Destination           Protocol Length Info
   3095 11.435780      1.17.1                host                  USB      91     URB_INTERRUPT in

Frame 3095: Packet, 91 bytes on wire (728 bits), 91 bytes captured (728 bits) on interface \\.\USBPcap1, id 0
    Section number: 1
    Interface id: 0 (\\.\USBPcap1)
    Encapsulation type: USB packets with USBPcap header (152)
    Arrival Time: Mar 31, 2026 22:43:01.222440000 W. Europe Summer Time
    UTC Arrival Time: Mar 31, 2026 20:43:01.222440000 UTC
    Epoch Arrival Time: 1774989781.222440000
    [Time shift for this packet: 0.000000000 seconds]
    [Time delta from previous captured frame: 12.643000 milliseconds]
    [Time delta from previous displayed frame: 12.643000 milliseconds]
    [Time since reference or first frame: 11.435780000 seconds]
    Frame Number: 3095
    Frame Length: 91 bytes (728 bits)
    Capture Length: 91 bytes (728 bits)
    [Frame is marked: False]
    [Frame is ignored: False]
    [Protocols in frame: usb:usbhid]
    Character encoding: ASCII (0)
USB URB
    [Source: 1.17.1]
    [Destination: host]
    USBPcap pseudoheader length: 27
    IRP ID: 0xffffa686494500d0
    IRP USBD_STATUS: USBD_STATUS_SUCCESS (0x00000000)
    URB Function: URB_FUNCTION_BULK_OR_INTERRUPT_TRANSFER (0x0009)
    IRP information: 0x01, Direction: PDO -> FDO
    URB bus id: 1
    Device address: 17
    Endpoint: 0x81, Direction: IN
    URB transfer type: URB_INTERRUPT (0x01)
    Packet Data Length: 64
    [Request in: 3088]
    [Time from request: 19.984000 milliseconds]
    [bInterfaceClass: HID (0x03)]
HID Data: 10020100102900444959204d6f6e2020202020202010032100000000000000000000000010033d000000000000000000000000000000000000100331000abc8d

No.     Time           Source                Destination           Protocol Length Info
   3096 11.435806      host                  1.17.1                USB      27     URB_INTERRUPT in

Frame 3096: Packet, 27 bytes on wire (216 bits), 27 bytes captured (216 bits) on interface \\.\USBPcap1, id 0
    Section number: 1
    Interface id: 0 (\\.\USBPcap1)
    Encapsulation type: USB packets with USBPcap header (152)
    Arrival Time: Mar 31, 2026 22:43:01.222466000 W. Europe Summer Time
    UTC Arrival Time: Mar 31, 2026 20:43:01.222466000 UTC
    Epoch Arrival Time: 1774989781.222466000
    [Time shift for this packet: 0.000000000 seconds]
    [Time delta from previous captured frame: 26.000 microseconds]
    [Time delta from previous displayed frame: 26.000 microseconds]
    [Time since reference or first frame: 11.435806000 seconds]
    Frame Number: 3096
    Frame Length: 27 bytes (216 bits)
    Capture Length: 27 bytes (216 bits)
    [Frame is marked: False]
    [Frame is ignored: False]
    [Protocols in frame: usb]
    Character encoding: ASCII (0)
USB URB
    [Source: host]
    [Destination: 1.17.1]
    USBPcap pseudoheader length: 27
    IRP ID: 0xffffa686494500d0
    IRP USBD_STATUS: USBD_STATUS_SUCCESS (0x00000000)
    URB Function: URB_FUNCTION_BULK_OR_INTERRUPT_TRANSFER (0x0009)
    IRP information: 0x00, Direction: FDO -> PDO
    URB bus id: 1
    Device address: 17
    Endpoint: 0x81, Direction: IN
    URB transfer type: URB_INTERRUPT (0x01)
    Packet Data Length: 0
    [Response in: 3103]
    [bInterfaceClass: HID (0x03)]

No.     Time           Source                Destination           Protocol Length Info
   3097 11.436583      host                  1.17.2                USB      91     URB_INTERRUPT out

Frame 3097: Packet, 91 bytes on wire (728 bits), 91 bytes captured (728 bits) on interface \\.\USBPcap1, id 0
    Section number: 1
    Interface id: 0 (\\.\USBPcap1)
    Encapsulation type: USB packets with USBPcap header (152)
    Arrival Time: Mar 31, 2026 22:43:01.223243000 W. Europe Summer Time
    UTC Arrival Time: Mar 31, 2026 20:43:01.223243000 UTC
    Epoch Arrival Time: 1774989781.223243000
    [Time shift for this packet: 0.000000000 seconds]
    [Time delta from previous captured frame: 777.000 microseconds]
    [Time delta from previous displayed frame: 777.000 microseconds]
    [Time since reference or first frame: 11.436583000 seconds]
    Frame Number: 3097
    Frame Length: 91 bytes (728 bits)
    Capture Length: 91 bytes (728 bits)
    [Frame is marked: False]
    [Frame is ignored: False]
    [Protocols in frame: usb:usbhid]
    Character encoding: ASCII (0)
USB URB
    [Source: host]
    [Destination: 1.17.2]
    USBPcap pseudoheader length: 27
    IRP ID: 0xffffa6864b0ce2a0
    IRP USBD_STATUS: USBD_STATUS_SUCCESS (0x00000000)
    URB Function: URB_FUNCTION_BULK_OR_INTERRUPT_TRANSFER (0x0009)
    IRP information: 0x00, Direction: FDO -> PDO
    URB bus id: 1
    Device address: 17
    Endpoint: 0x02, Direction: OUT
    URB transfer type: URB_INTERRUPT (0x01)
    Packet Data Length: 64
    [Response in: 3098]
    [bInterfaceClass: HID (0x03)]
HID Data: 1002000102290110032a0080a1f30398a1f303b85f050a774d400080a1f303774d400080a1f303c0fdfe041548400080a1f30398a1f303b85f050ad8fdfe04d8

No.     Time           Source                Destination           Protocol Length Info
   3098 11.438135      1.17.2                host                  USB      27     URB_INTERRUPT out

Frame 3098: Packet, 27 bytes on wire (216 bits), 27 bytes captured (216 bits) on interface \\.\USBPcap1, id 0
    Section number: 1
    Interface id: 0 (\\.\USBPcap1)
    Encapsulation type: USB packets with USBPcap header (152)
    Arrival Time: Mar 31, 2026 22:43:01.224795000 W. Europe Summer Time
    UTC Arrival Time: Mar 31, 2026 20:43:01.224795000 UTC
    Epoch Arrival Time: 1774989781.224795000
    [Time shift for this packet: 0.000000000 seconds]
    [Time delta from previous captured frame: 1.552000 milliseconds]
    [Time delta from previous displayed frame: 1.552000 milliseconds]
    [Time since reference or first frame: 11.438135000 seconds]
    Frame Number: 3098
    Frame Length: 27 bytes (216 bits)
    Capture Length: 27 bytes (216 bits)
    [Frame is marked: False]
    [Frame is ignored: False]
    [Protocols in frame: usb]
    Character encoding: ASCII (0)
USB URB
    [Source: 1.17.2]
    [Destination: host]
    USBPcap pseudoheader length: 27
    IRP ID: 0xffffa6864b0ce2a0
    IRP USBD_STATUS: USBD_STATUS_SUCCESS (0x00000000)
    URB Function: URB_FUNCTION_BULK_OR_INTERRUPT_TRANSFER (0x0009)
    IRP information: 0x01, Direction: PDO -> FDO
    URB bus id: 1
    Device address: 17
    Endpoint: 0x02, Direction: OUT
    URB transfer type: URB_INTERRUPT (0x01)
    Packet Data Length: 0
    [Request in: 3097]
    [Time from request: 1.552000 milliseconds]
    [bInterfaceClass: HID (0x03)]

No.     Time           Source                Destination           Protocol Length Info
   3099 11.455781      1.17.1                host                  USB      91     URB_INTERRUPT in

Frame 3099: Packet, 91 bytes on wire (728 bits), 91 bytes captured (728 bits) on interface \\.\USBPcap1, id 0
    Section number: 1
    Interface id: 0 (\\.\USBPcap1)
    Encapsulation type: USB packets with USBPcap header (152)
    Arrival Time: Mar 31, 2026 22:43:01.242441000 W. Europe Summer Time
    UTC Arrival Time: Mar 31, 2026 20:43:01.242441000 UTC
    Epoch Arrival Time: 1774989781.242441000
    [Time shift for this packet: 0.000000000 seconds]
    [Time delta from previous captured frame: 17.646000 milliseconds]
    [Time delta from previous displayed frame: 17.646000 milliseconds]
    [Time since reference or first frame: 11.455781000 seconds]
    Frame Number: 3099
    Frame Length: 91 bytes (728 bits)
    Capture Length: 91 bytes (728 bits)
    [Frame is marked: False]
    [Frame is ignored: False]
    [Protocols in frame: usb:usbhid]
    Character encoding: ASCII (0)
USB URB
    [Source: 1.17.1]
    [Destination: host]
    USBPcap pseudoheader length: 27
    IRP ID: 0xffffa68649451010
    IRP USBD_STATUS: USBD_STATUS_SUCCESS (0x00000000)
    URB Function: URB_FUNCTION_BULK_OR_INTERRUPT_TRANSFER (0x0009)
    IRP information: 0x01, Direction: PDO -> FDO
    URB bus id: 1
    Device address: 17
    Endpoint: 0x81, Direction: IN
    URB transfer type: URB_INTERRUPT (0x01)
    Packet Data Length: 64
    [Request in: 3092]
    [Time from request: 34.993000 milliseconds]
    [bInterfaceClass: HID (0x03)]
HID Data: 10020100102901444959204d6f6e206f666673657410032d00000000000000000000000010033d000000000000000000000000000000000000100331000abc8d

No.     Time           Source                Destination           Protocol Length Info
   3100 11.455809      host                  1.17.1                USB      27     URB_INTERRUPT in

Frame 3100: Packet, 27 bytes on wire (216 bits), 27 bytes captured (216 bits) on interface \\.\USBPcap1, id 0
    Section number: 1
    Interface id: 0 (\\.\USBPcap1)
    Encapsulation type: USB packets with USBPcap header (152)
    Arrival Time: Mar 31, 2026 22:43:01.242469000 W. Europe Summer Time
    UTC Arrival Time: Mar 31, 2026 20:43:01.242469000 UTC
    Epoch Arrival Time: 1774989781.242469000
    [Time shift for this packet: 0.000000000 seconds]
    [Time delta from previous captured frame: 28.000 microseconds]
    [Time delta from previous displayed frame: 28.000 microseconds]
    [Time since reference or first frame: 11.455809000 seconds]
    Frame Number: 3100
    Frame Length: 27 bytes (216 bits)
    Capture Length: 27 bytes (216 bits)
    [Frame is marked: False]
    [Frame is ignored: False]
    [Protocols in frame: usb]
    Character encoding: ASCII (0)
USB URB
    [Source: host]
    [Destination: 1.17.1]
    USBPcap pseudoheader length: 27
    IRP ID: 0xffffa68649451010
    IRP USBD_STATUS: USBD_STATUS_SUCCESS (0x00000000)
    URB Function: URB_FUNCTION_BULK_OR_INTERRUPT_TRANSFER (0x0009)
    IRP information: 0x00, Direction: FDO -> PDO
    URB bus id: 1
    Device address: 17
    Endpoint: 0x81, Direction: IN
    URB transfer type: URB_INTERRUPT (0x01)
    Packet Data Length: 0
    [Response in: 3107]
    [bInterfaceClass: HID (0x03)]

No.     Time           Source                Destination           Protocol Length Info
   3101 11.456634      host                  1.17.2                USB      91     URB_INTERRUPT out

Frame 3101: Packet, 91 bytes on wire (728 bits), 91 bytes captured (728 bits) on interface \\.\USBPcap1, id 0
    Section number: 1
    Interface id: 0 (\\.\USBPcap1)
    Encapsulation type: USB packets with USBPcap header (152)
    Arrival Time: Mar 31, 2026 22:43:01.243294000 W. Europe Summer Time
    UTC Arrival Time: Mar 31, 2026 20:43:01.243294000 UTC
    Epoch Arrival Time: 1774989781.243294000
    [Time shift for this packet: 0.000000000 seconds]
    [Time delta from previous captured frame: 825.000 microseconds]
    [Time delta from previous displayed frame: 825.000 microseconds]
    [Time since reference or first frame: 11.456634000 seconds]
    Frame Number: 3101
    Frame Length: 91 bytes (728 bits)
    Capture Length: 91 bytes (728 bits)
    [Frame is marked: False]
    [Frame is ignored: False]
    [Protocols in frame: usb:usbhid]
    Character encoding: ASCII (0)
USB URB
    [Source: host]
    [Destination: 1.17.2]
    USBPcap pseudoheader length: 27
    IRP ID: 0xffffa6864b1d8010
    IRP USBD_STATUS: USBD_STATUS_SUCCESS (0x00000000)
    URB Function: URB_FUNCTION_BULK_OR_INTERRUPT_TRANSFER (0x0009)
    IRP information: 0x00, Direction: FDO -> PDO
    URB bus id: 1
    Device address: 17
    Endpoint: 0x02, Direction: OUT
    URB transfer type: URB_INTERRUPT (0x01)
    Packet Data Length: 64
    [Response in: 3102]
    [bInterfaceClass: HID (0x03)]
HID Data: 100200010229021003290080a1f30398a1f303b85f050a774d400080a1f303774d400080a1f303c0fdfe041548400080a1f30398a1f303b85f050ad8fdfe04d8

No.     Time           Source                Destination           Protocol Length Info
   3102 11.458138      1.17.2                host                  USB      27     URB_INTERRUPT out

Frame 3102: Packet, 27 bytes on wire (216 bits), 27 bytes captured (216 bits) on interface \\.\USBPcap1, id 0
    Section number: 1
    Interface id: 0 (\\.\USBPcap1)
    Encapsulation type: USB packets with USBPcap header (152)
    Arrival Time: Mar 31, 2026 22:43:01.244798000 W. Europe Summer Time
    UTC Arrival Time: Mar 31, 2026 20:43:01.244798000 UTC
    Epoch Arrival Time: 1774989781.244798000
    [Time shift for this packet: 0.000000000 seconds]
    [Time delta from previous captured frame: 1.504000 milliseconds]
    [Time delta from previous displayed frame: 1.504000 milliseconds]
    [Time since reference or first frame: 11.458138000 seconds]
    Frame Number: 3102
    Frame Length: 27 bytes (216 bits)
    Capture Length: 27 bytes (216 bits)
    [Frame is marked: False]
    [Frame is ignored: False]
    [Protocols in frame: usb]
    Character encoding: ASCII (0)
USB URB
    [Source: 1.17.2]
    [Destination: host]
    USBPcap pseudoheader length: 27
    IRP ID: 0xffffa6864b1d8010
    IRP USBD_STATUS: USBD_STATUS_SUCCESS (0x00000000)
    URB Function: URB_FUNCTION_BULK_OR_INTERRUPT_TRANSFER (0x0009)
    IRP information: 0x01, Direction: PDO -> FDO
    URB bus id: 1
    Device address: 17
    Endpoint: 0x02, Direction: OUT
    URB transfer type: URB_INTERRUPT (0x01)
    Packet Data Length: 0
    [Request in: 3101]
    [Time from request: 1.504000 milliseconds]
    [bInterfaceClass: HID (0x03)]

No.     Time           Source                Destination           Protocol Length Info
   3103 11.467776      1.17.1                host                  USB      91     URB_INTERRUPT in

Frame 3103: Packet, 91 bytes on wire (728 bits), 91 bytes captured (728 bits) on interface \\.\USBPcap1, id 0
    Section number: 1
    Interface id: 0 (\\.\USBPcap1)
    Encapsulation type: USB packets with USBPcap header (152)
    Arrival Time: Mar 31, 2026 22:43:01.254436000 W. Europe Summer Time
    UTC Arrival Time: Mar 31, 2026 20:43:01.254436000 UTC
    Epoch Arrival Time: 1774989781.254436000
    [Time shift for this packet: 0.000000000 seconds]
    [Time delta from previous captured frame: 9.638000 milliseconds]
    [Time delta from previous displayed frame: 9.638000 milliseconds]
    [Time since reference or first frame: 11.467776000 seconds]
    Frame Number: 3103
    Frame Length: 91 bytes (728 bits)
    Capture Length: 91 bytes (728 bits)
    [Frame is marked: False]
    [Frame is ignored: False]
    [Protocols in frame: usb:usbhid]
    Character encoding: ASCII (0)
USB URB
    [Source: 1.17.1]
    [Destination: host]
    USBPcap pseudoheader length: 27
    IRP ID: 0xffffa686494500d0
    IRP USBD_STATUS: USBD_STATUS_SUCCESS (0x00000000)
    URB Function: URB_FUNCTION_BULK_OR_INTERRUPT_TRANSFER (0x0009)
    IRP information: 0x01, Direction: PDO -> FDO
    URB bus id: 1
    Device address: 17
    Endpoint: 0x81, Direction: IN
    URB transfer type: URB_INTERRUPT (0x01)
    Packet Data Length: 64
    [Request in: 3096]
    [Time from request: 31.970000 milliseconds]
    [bInterfaceClass: HID (0x03)]
HID Data: 1002010010290244656661756c742050726573657410037500000000000000000000000010033d000000000000000000000000000000000000100331000abc8d

No.     Time           Source                Destination           Protocol Length Info
   3104 11.467791      host                  1.17.1                USB      27     URB_INTERRUPT in

Frame 3104: Packet, 27 bytes on wire (216 bits), 27 bytes captured (216 bits) on interface \\.\USBPcap1, id 0
    Section number: 1
    Interface id: 0 (\\.\USBPcap1)
    Encapsulation type: USB packets with USBPcap header (152)
    Arrival Time: Mar 31, 2026 22:43:01.254451000 W. Europe Summer Time
    UTC Arrival Time: Mar 31, 2026 20:43:01.254451000 UTC
    Epoch Arrival Time: 1774989781.254451000
    [Time shift for this packet: 0.000000000 seconds]
    [Time delta from previous captured frame: 15.000 microseconds]
    [Time delta from previous displayed frame: 15.000 microseconds]
    [Time since reference or first frame: 11.467791000 seconds]
    Frame Number: 3104
    Frame Length: 27 bytes (216 bits)
    Capture Length: 27 bytes (216 bits)
    [Frame is marked: False]
    [Frame is ignored: False]
    [Protocols in frame: usb]
    Character encoding: ASCII (0)
USB URB
    [Source: host]
    [Destination: 1.17.1]
    USBPcap pseudoheader length: 27
    IRP ID: 0xffffa686494500d0
    IRP USBD_STATUS: USBD_STATUS_SUCCESS (0x00000000)
    URB Function: URB_FUNCTION_BULK_OR_INTERRUPT_TRANSFER (0x0009)
    IRP information: 0x00, Direction: FDO -> PDO
    URB bus id: 1
    Device address: 17
    Endpoint: 0x81, Direction: IN
    URB transfer type: URB_INTERRUPT (0x01)
    Packet Data Length: 0
    [Response in: 3111]
    [bInterfaceClass: HID (0x03)]

No.     Time           Source                Destination           Protocol Length Info
   3105 11.468379      host                  1.17.2                USB      91     URB_INTERRUPT out

Frame 3105: Packet, 91 bytes on wire (728 bits), 91 bytes captured (728 bits) on interface \\.\USBPcap1, id 0
    Section number: 1
    Interface id: 0 (\\.\USBPcap1)
    Encapsulation type: USB packets with USBPcap header (152)
    Arrival Time: Mar 31, 2026 22:43:01.255039000 W. Europe Summer Time
    UTC Arrival Time: Mar 31, 2026 20:43:01.255039000 UTC
    Epoch Arrival Time: 1774989781.255039000
    [Time shift for this packet: 0.000000000 seconds]
    [Time delta from previous captured frame: 588.000 microseconds]
    [Time delta from previous displayed frame: 588.000 microseconds]
    [Time since reference or first frame: 11.468379000 seconds]
    Frame Number: 3105
    Frame Length: 91 bytes (728 bits)
    Capture Length: 91 bytes (728 bits)
    [Frame is marked: False]
    [Frame is ignored: False]
    [Protocols in frame: usb:usbhid]
    Character encoding: ASCII (0)
USB URB
    [Source: host]
    [Destination: 1.17.2]
    USBPcap pseudoheader length: 27
    IRP ID: 0xffffa686087ee010
    IRP USBD_STATUS: USBD_STATUS_SUCCESS (0x00000000)
    URB Function: URB_FUNCTION_BULK_OR_INTERRUPT_TRANSFER (0x0009)
    IRP information: 0x00, Direction: FDO -> PDO
    URB bus id: 1
    Device address: 17
    Endpoint: 0x02, Direction: OUT
    URB transfer type: URB_INTERRUPT (0x01)
    Packet Data Length: 64
    [Response in: 3106]
    [bInterfaceClass: HID (0x03)]
HID Data: 100200010229031003280080a1f30398a1f303b85f050a774d400080a1f303774d400080a1f303c0fdfe041548400080a1f30398a1f303b85f050ad8fdfe04d8

No.     Time           Source                Destination           Protocol Length Info
   3106 11.470132      1.17.2                host                  USB      27     URB_INTERRUPT out

Frame 3106: Packet, 27 bytes on wire (216 bits), 27 bytes captured (216 bits) on interface \\.\USBPcap1, id 0
    Section number: 1
    Interface id: 0 (\\.\USBPcap1)
    Encapsulation type: USB packets with USBPcap header (152)
    Arrival Time: Mar 31, 2026 22:43:01.256792000 W. Europe Summer Time
    UTC Arrival Time: Mar 31, 2026 20:43:01.256792000 UTC
    Epoch Arrival Time: 1774989781.256792000
    [Time shift for this packet: 0.000000000 seconds]
    [Time delta from previous captured frame: 1.753000 milliseconds]
    [Time delta from previous displayed frame: 1.753000 milliseconds]
    [Time since reference or first frame: 11.470132000 seconds]
    Frame Number: 3106
    Frame Length: 27 bytes (216 bits)
    Capture Length: 27 bytes (216 bits)
    [Frame is marked: False]
    [Frame is ignored: False]
    [Protocols in frame: usb]
    Character encoding: ASCII (0)
USB URB
    [Source: 1.17.2]
    [Destination: host]
    USBPcap pseudoheader length: 27
    IRP ID: 0xffffa686087ee010
    IRP USBD_STATUS: USBD_STATUS_SUCCESS (0x00000000)
    URB Function: URB_FUNCTION_BULK_OR_INTERRUPT_TRANSFER (0x0009)
    IRP information: 0x01, Direction: PDO -> FDO
    URB bus id: 1
    Device address: 17
    Endpoint: 0x02, Direction: OUT
    URB transfer type: URB_INTERRUPT (0x01)
    Packet Data Length: 0
    [Request in: 3105]
    [Time from request: 1.753000 milliseconds]
    [bInterfaceClass: HID (0x03)]

No.     Time           Source                Destination           Protocol Length Info
   3107 11.477774      1.17.1                host                  USB      91     URB_INTERRUPT in

Frame 3107: Packet, 91 bytes on wire (728 bits), 91 bytes captured (728 bits) on interface \\.\USBPcap1, id 0
    Section number: 1
    Interface id: 0 (\\.\USBPcap1)
    Encapsulation type: USB packets with USBPcap header (152)
    Arrival Time: Mar 31, 2026 22:43:01.264434000 W. Europe Summer Time
    UTC Arrival Time: Mar 31, 2026 20:43:01.264434000 UTC
    Epoch Arrival Time: 1774989781.264434000
    [Time shift for this packet: 0.000000000 seconds]
    [Time delta from previous captured frame: 7.642000 milliseconds]
    [Time delta from previous displayed frame: 7.642000 milliseconds]
    [Time since reference or first frame: 11.477774000 seconds]
    Frame Number: 3107
    Frame Length: 91 bytes (728 bits)
    Capture Length: 91 bytes (728 bits)
    [Frame is marked: False]
    [Frame is ignored: False]
    [Protocols in frame: usb:usbhid]
    Character encoding: ASCII (0)
USB URB
    [Source: 1.17.1]
    [Destination: host]
    USBPcap pseudoheader length: 27
    IRP ID: 0xffffa68649451010
    IRP USBD_STATUS: USBD_STATUS_SUCCESS (0x00000000)
    URB Function: URB_FUNCTION_BULK_OR_INTERRUPT_TRANSFER (0x0009)
    IRP information: 0x01, Direction: PDO -> FDO
    URB bus id: 1
    Device address: 17
    Endpoint: 0x81, Direction: IN
    URB transfer type: URB_INTERRUPT (0x01)
    Packet Data Length: 64
    [Request in: 3100]
    [Time from request: 21.965000 milliseconds]
    [bInterfaceClass: HID (0x03)]
HID Data: 1002010010290344656661756c742050726573657410037400000000000000000000000010033d000000000000000000000000000000000000100331000abc8d

No.     Time           Source                Destination           Protocol Length Info
   3108 11.477790      host                  1.17.1                USB      27     URB_INTERRUPT in

Frame 3108: Packet, 27 bytes on wire (216 bits), 27 bytes captured (216 bits) on interface \\.\USBPcap1, id 0
    Section number: 1
    Interface id: 0 (\\.\USBPcap1)
    Encapsulation type: USB packets with USBPcap header (152)
    Arrival Time: Mar 31, 2026 22:43:01.264450000 W. Europe Summer Time
    UTC Arrival Time: Mar 31, 2026 20:43:01.264450000 UTC
    Epoch Arrival Time: 1774989781.264450000
    [Time shift for this packet: 0.000000000 seconds]
    [Time delta from previous captured frame: 16.000 microseconds]
    [Time delta from previous displayed frame: 16.000 microseconds]
    [Time since reference or first frame: 11.477790000 seconds]
    Frame Number: 3108
    Frame Length: 27 bytes (216 bits)
    Capture Length: 27 bytes (216 bits)
    [Frame is marked: False]
    [Frame is ignored: False]
    [Protocols in frame: usb]
    Character encoding: ASCII (0)
USB URB
    [Source: host]
    [Destination: 1.17.1]
    USBPcap pseudoheader length: 27
    IRP ID: 0xffffa68649451010
    IRP USBD_STATUS: USBD_STATUS_SUCCESS (0x00000000)
    URB Function: URB_FUNCTION_BULK_OR_INTERRUPT_TRANSFER (0x0009)
    IRP information: 0x00, Direction: FDO -> PDO
    URB bus id: 1
    Device address: 17
    Endpoint: 0x81, Direction: IN
    URB transfer type: URB_INTERRUPT (0x01)
    Packet Data Length: 0
    [Response in: 3115]
    [bInterfaceClass: HID (0x03)]

No.     Time           Source                Destination           Protocol Length Info
   3109 11.507541      host                  1.17.2                USB      91     URB_INTERRUPT out

Frame 3109: Packet, 91 bytes on wire (728 bits), 91 bytes captured (728 bits) on interface \\.\USBPcap1, id 0
    Section number: 1
    Interface id: 0 (\\.\USBPcap1)
    Encapsulation type: USB packets with USBPcap header (152)
    Arrival Time: Mar 31, 2026 22:43:01.294201000 W. Europe Summer Time
    UTC Arrival Time: Mar 31, 2026 20:43:01.294201000 UTC
    Epoch Arrival Time: 1774989781.294201000
    [Time shift for this packet: 0.000000000 seconds]
    [Time delta from previous captured frame: 29.751000 milliseconds]
    [Time delta from previous displayed frame: 29.751000 milliseconds]
    [Time since reference or first frame: 11.507541000 seconds]
    Frame Number: 3109
    Frame Length: 91 bytes (728 bits)
    Capture Length: 91 bytes (728 bits)
    [Frame is marked: False]
    [Frame is ignored: False]
    [Protocols in frame: usb:usbhid]
    Character encoding: ASCII (0)
USB URB
    [Source: host]
    [Destination: 1.17.2]
    USBPcap pseudoheader length: 27
    IRP ID: 0xffffa6864b1e2010
    IRP USBD_STATUS: USBD_STATUS_SUCCESS (0x00000000)
    URB Function: URB_FUNCTION_BULK_OR_INTERRUPT_TRANSFER (0x0009)
    IRP information: 0x00, Direction: FDO -> PDO
    URB bus id: 1
    Device address: 17
    Endpoint: 0x02, Direction: OUT
    URB transfer type: URB_INTERRUPT (0x01)
    Packet Data Length: 64
    [Response in: 3110]
    [bInterfaceClass: HID (0x03)]
HID Data: 1002000102290410032f0080a1f30398a1f303b85f050a774d400080a1f303774d400080a1f303c0fdfe041548400080a1f30398a1f303b85f050ad8fdfe04d8

No.     Time           Source                Destination           Protocol Length Info
   3110 11.509143      1.17.2                host                  USB      27     URB_INTERRUPT out

Frame 3110: Packet, 27 bytes on wire (216 bits), 27 bytes captured (216 bits) on interface \\.\USBPcap1, id 0
    Section number: 1
    Interface id: 0 (\\.\USBPcap1)
    Encapsulation type: USB packets with USBPcap header (152)
    Arrival Time: Mar 31, 2026 22:43:01.295803000 W. Europe Summer Time
    UTC Arrival Time: Mar 31, 2026 20:43:01.295803000 UTC
    Epoch Arrival Time: 1774989781.295803000
    [Time shift for this packet: 0.000000000 seconds]
    [Time delta from previous captured frame: 1.602000 milliseconds]
    [Time delta from previous displayed frame: 1.602000 milliseconds]
    [Time since reference or first frame: 11.509143000 seconds]
    Frame Number: 3110
    Frame Length: 27 bytes (216 bits)
    Capture Length: 27 bytes (216 bits)
    [Frame is marked: False]
    [Frame is ignored: False]
    [Protocols in frame: usb]
    Character encoding: ASCII (0)
USB URB
    [Source: 1.17.2]
    [Destination: host]
    USBPcap pseudoheader length: 27
    IRP ID: 0xffffa6864b1e2010
    IRP USBD_STATUS: USBD_STATUS_SUCCESS (0x00000000)
    URB Function: URB_FUNCTION_BULK_OR_INTERRUPT_TRANSFER (0x0009)
    IRP information: 0x01, Direction: PDO -> FDO
    URB bus id: 1
    Device address: 17
    Endpoint: 0x02, Direction: OUT
    URB transfer type: URB_INTERRUPT (0x01)
    Packet Data Length: 0
    [Request in: 3109]
    [Time from request: 1.602000 milliseconds]
    [bInterfaceClass: HID (0x03)]

No.     Time           Source                Destination           Protocol Length Info
   3111 11.516862      1.17.1                host                  USB      91     URB_INTERRUPT in

Frame 3111: Packet, 91 bytes on wire (728 bits), 91 bytes captured (728 bits) on interface \\.\USBPcap1, id 0
    Section number: 1
    Interface id: 0 (\\.\USBPcap1)
    Encapsulation type: USB packets with USBPcap header (152)
    Arrival Time: Mar 31, 2026 22:43:01.303522000 W. Europe Summer Time
    UTC Arrival Time: Mar 31, 2026 20:43:01.303522000 UTC
    Epoch Arrival Time: 1774989781.303522000
    [Time shift for this packet: 0.000000000 seconds]
    [Time delta from previous captured frame: 7.719000 milliseconds]
    [Time delta from previous displayed frame: 7.719000 milliseconds]
    [Time since reference or first frame: 11.516862000 seconds]
    Frame Number: 3111
    Frame Length: 91 bytes (728 bits)
    Capture Length: 91 bytes (728 bits)
    [Frame is marked: False]
    [Frame is ignored: False]
    [Protocols in frame: usb:usbhid]
    Character encoding: ASCII (0)
USB URB
    [Source: 1.17.1]
    [Destination: host]
    USBPcap pseudoheader length: 27
    IRP ID: 0xffffa686494500d0
    IRP USBD_STATUS: USBD_STATUS_SUCCESS (0x00000000)
    URB Function: URB_FUNCTION_BULK_OR_INTERRUPT_TRANSFER (0x0009)
    IRP information: 0x01, Direction: PDO -> FDO
    URB bus id: 1
    Device address: 17
    Endpoint: 0x81, Direction: IN
    URB transfer type: URB_INTERRUPT (0x01)
    Packet Data Length: 64
    [Request in: 3104]
    [Time from request: 49.071000 milliseconds]
    [bInterfaceClass: HID (0x03)]
HID Data: 1002010010290444656661756c742050726573657410037300000000000000000000000010033d000000000000000000000000000000000000100331000abc8d

No.     Time           Source                Destination           Protocol Length Info
   3112 11.516889      host                  1.17.1                USB      27     URB_INTERRUPT in

Frame 3112: Packet, 27 bytes on wire (216 bits), 27 bytes captured (216 bits) on interface \\.\USBPcap1, id 0
    Section number: 1
    Interface id: 0 (\\.\USBPcap1)
    Encapsulation type: USB packets with USBPcap header (152)
    Arrival Time: Mar 31, 2026 22:43:01.303549000 W. Europe Summer Time
    UTC Arrival Time: Mar 31, 2026 20:43:01.303549000 UTC
    Epoch Arrival Time: 1774989781.303549000
    [Time shift for this packet: 0.000000000 seconds]
    [Time delta from previous captured frame: 27.000 microseconds]
    [Time delta from previous displayed frame: 27.000 microseconds]
    [Time since reference or first frame: 11.516889000 seconds]
    Frame Number: 3112
    Frame Length: 27 bytes (216 bits)
    Capture Length: 27 bytes (216 bits)
    [Frame is marked: False]
    [Frame is ignored: False]
    [Protocols in frame: usb]
    Character encoding: ASCII (0)
USB URB
    [Source: host]
    [Destination: 1.17.1]
    USBPcap pseudoheader length: 27
    IRP ID: 0xffffa686494500d0
    IRP USBD_STATUS: USBD_STATUS_SUCCESS (0x00000000)
    URB Function: URB_FUNCTION_BULK_OR_INTERRUPT_TRANSFER (0x0009)
    IRP information: 0x00, Direction: FDO -> PDO
    URB bus id: 1
    Device address: 17
    Endpoint: 0x81, Direction: IN
    URB transfer type: URB_INTERRUPT (0x01)
    Packet Data Length: 0
    [Response in: 3119]
    [bInterfaceClass: HID (0x03)]

No.     Time           Source                Destination           Protocol Length Info
   3113 11.517769      host                  1.17.2                USB      91     URB_INTERRUPT out

Frame 3113: Packet, 91 bytes on wire (728 bits), 91 bytes captured (728 bits) on interface \\.\USBPcap1, id 0
    Section number: 1
    Interface id: 0 (\\.\USBPcap1)
    Encapsulation type: USB packets with USBPcap header (152)
    Arrival Time: Mar 31, 2026 22:43:01.304429000 W. Europe Summer Time
    UTC Arrival Time: Mar 31, 2026 20:43:01.304429000 UTC
    Epoch Arrival Time: 1774989781.304429000
    [Time shift for this packet: 0.000000000 seconds]
    [Time delta from previous captured frame: 880.000 microseconds]
    [Time delta from previous displayed frame: 880.000 microseconds]
    [Time since reference or first frame: 11.517769000 seconds]
    Frame Number: 3113
    Frame Length: 91 bytes (728 bits)
    Capture Length: 91 bytes (728 bits)
    [Frame is marked: False]
    [Frame is ignored: False]
    [Protocols in frame: usb:usbhid]
    Character encoding: ASCII (0)
USB URB
    [Source: host]
    [Destination: 1.17.2]
    USBPcap pseudoheader length: 27
    IRP ID: 0xffffa6864976a560
    IRP USBD_STATUS: USBD_STATUS_SUCCESS (0x00000000)
    URB Function: URB_FUNCTION_BULK_OR_INTERRUPT_TRANSFER (0x0009)
    IRP information: 0x00, Direction: FDO -> PDO
    URB bus id: 1
    Device address: 17
    Endpoint: 0x02, Direction: OUT
    URB transfer type: URB_INTERRUPT (0x01)
    Packet Data Length: 64
    [Response in: 3114]
    [bInterfaceClass: HID (0x03)]
HID Data: 1002000102290510032e0080a1f30398a1f303b85f050a774d400080a1f303774d400080a1f303c0fdfe041548400080a1f30398a1f303b85f050ad8fdfe04d8

No.     Time           Source                Destination           Protocol Length Info
   3114 11.519130      1.17.2                host                  USB      27     URB_INTERRUPT out

Frame 3114: Packet, 27 bytes on wire (216 bits), 27 bytes captured (216 bits) on interface \\.\USBPcap1, id 0
    Section number: 1
    Interface id: 0 (\\.\USBPcap1)
    Encapsulation type: USB packets with USBPcap header (152)
    Arrival Time: Mar 31, 2026 22:43:01.305790000 W. Europe Summer Time
    UTC Arrival Time: Mar 31, 2026 20:43:01.305790000 UTC
    Epoch Arrival Time: 1774989781.305790000
    [Time shift for this packet: 0.000000000 seconds]
    [Time delta from previous captured frame: 1.361000 milliseconds]
    [Time delta from previous displayed frame: 1.361000 milliseconds]
    [Time since reference or first frame: 11.519130000 seconds]
    Frame Number: 3114
    Frame Length: 27 bytes (216 bits)
    Capture Length: 27 bytes (216 bits)
    [Frame is marked: False]
    [Frame is ignored: False]
    [Protocols in frame: usb]
    Character encoding: ASCII (0)
USB URB
    [Source: 1.17.2]
    [Destination: host]
    USBPcap pseudoheader length: 27
    IRP ID: 0xffffa6864976a560
    IRP USBD_STATUS: USBD_STATUS_SUCCESS (0x00000000)
    URB Function: URB_FUNCTION_BULK_OR_INTERRUPT_TRANSFER (0x0009)
    IRP information: 0x01, Direction: PDO -> FDO
    URB bus id: 1
    Device address: 17
    Endpoint: 0x02, Direction: OUT
    URB transfer type: URB_INTERRUPT (0x01)
    Packet Data Length: 0
    [Request in: 3113]
    [Time from request: 1.361000 milliseconds]
    [bInterfaceClass: HID (0x03)]

No.     Time           Source                Destination           Protocol Length Info
   3115 11.526779      1.17.1                host                  USB      91     URB_INTERRUPT in

Frame 3115: Packet, 91 bytes on wire (728 bits), 91 bytes captured (728 bits) on interface \\.\USBPcap1, id 0
    Section number: 1
    Interface id: 0 (\\.\USBPcap1)
    Encapsulation type: USB packets with USBPcap header (152)
    Arrival Time: Mar 31, 2026 22:43:01.313439000 W. Europe Summer Time
    UTC Arrival Time: Mar 31, 2026 20:43:01.313439000 UTC
    Epoch Arrival Time: 1774989781.313439000
    [Time shift for this packet: 0.000000000 seconds]
    [Time delta from previous captured frame: 7.649000 milliseconds]
    [Time delta from previous displayed frame: 7.649000 milliseconds]
    [Time since reference or first frame: 11.526779000 seconds]
    Frame Number: 3115
    Frame Length: 91 bytes (728 bits)
    Capture Length: 91 bytes (728 bits)
    [Frame is marked: False]
    [Frame is ignored: False]
    [Protocols in frame: usb:usbhid]
    Character encoding: ASCII (0)
USB URB
    [Source: 1.17.1]
    [Destination: host]
    USBPcap pseudoheader length: 27
    IRP ID: 0xffffa68649451010
    IRP USBD_STATUS: USBD_STATUS_SUCCESS (0x00000000)
    URB Function: URB_FUNCTION_BULK_OR_INTERRUPT_TRANSFER (0x0009)
    IRP information: 0x01, Direction: PDO -> FDO
    URB bus id: 1
    Device address: 17
    Endpoint: 0x81, Direction: IN
    URB transfer type: URB_INTERRUPT (0x01)
    Packet Data Length: 64
    [Request in: 3108]
    [Time from request: 48.989000 milliseconds]
    [bInterfaceClass: HID (0x03)]
HID Data: 1002010010290544656661756c742050726573657410037200000000000000000000000010033d000000000000000000000000000000000000100331000abc8d

No.     Time           Source                Destination           Protocol Length Info
   3116 11.526807      host                  1.17.1                USB      27     URB_INTERRUPT in

Frame 3116: Packet, 27 bytes on wire (216 bits), 27 bytes captured (216 bits) on interface \\.\USBPcap1, id 0
    Section number: 1
    Interface id: 0 (\\.\USBPcap1)
    Encapsulation type: USB packets with USBPcap header (152)
    Arrival Time: Mar 31, 2026 22:43:01.313467000 W. Europe Summer Time
    UTC Arrival Time: Mar 31, 2026 20:43:01.313467000 UTC
    Epoch Arrival Time: 1774989781.313467000
    [Time shift for this packet: 0.000000000 seconds]
    [Time delta from previous captured frame: 28.000 microseconds]
    [Time delta from previous displayed frame: 28.000 microseconds]
    [Time since reference or first frame: 11.526807000 seconds]
    Frame Number: 3116
    Frame Length: 27 bytes (216 bits)
    Capture Length: 27 bytes (216 bits)
    [Frame is marked: False]
    [Frame is ignored: False]
    [Protocols in frame: usb]
    Character encoding: ASCII (0)
USB URB
    [Source: host]
    [Destination: 1.17.1]
    USBPcap pseudoheader length: 27
    IRP ID: 0xffffa68649451010
    IRP USBD_STATUS: USBD_STATUS_SUCCESS (0x00000000)
    URB Function: URB_FUNCTION_BULK_OR_INTERRUPT_TRANSFER (0x0009)
    IRP information: 0x00, Direction: FDO -> PDO
    URB bus id: 1
    Device address: 17
    Endpoint: 0x81, Direction: IN
    URB transfer type: URB_INTERRUPT (0x01)
    Packet Data Length: 0
    [Response in: 3123]
    [bInterfaceClass: HID (0x03)]

No.     Time           Source                Destination           Protocol Length Info
   3117 11.527504      host                  1.17.2                USB      91     URB_INTERRUPT out

Frame 3117: Packet, 91 bytes on wire (728 bits), 91 bytes captured (728 bits) on interface \\.\USBPcap1, id 0
    Section number: 1
    Interface id: 0 (\\.\USBPcap1)
    Encapsulation type: USB packets with USBPcap header (152)
    Arrival Time: Mar 31, 2026 22:43:01.314164000 W. Europe Summer Time
    UTC Arrival Time: Mar 31, 2026 20:43:01.314164000 UTC
    Epoch Arrival Time: 1774989781.314164000
    [Time shift for this packet: 0.000000000 seconds]
    [Time delta from previous captured frame: 697.000 microseconds]
    [Time delta from previous displayed frame: 697.000 microseconds]
    [Time since reference or first frame: 11.527504000 seconds]
    Frame Number: 3117
    Frame Length: 91 bytes (728 bits)
    Capture Length: 91 bytes (728 bits)
    [Frame is marked: False]
    [Frame is ignored: False]
    [Protocols in frame: usb:usbhid]
    Character encoding: ASCII (0)
USB URB
    [Source: host]
    [Destination: 1.17.2]
    USBPcap pseudoheader length: 27
    IRP ID: 0xffffa686497ed010
    IRP USBD_STATUS: USBD_STATUS_SUCCESS (0x00000000)
    URB Function: URB_FUNCTION_BULK_OR_INTERRUPT_TRANSFER (0x0009)
    IRP information: 0x00, Direction: FDO -> PDO
    URB bus id: 1
    Device address: 17
    Endpoint: 0x02, Direction: OUT
    URB transfer type: URB_INTERRUPT (0x01)
    Packet Data Length: 64
    [Response in: 3118]
    [bInterfaceClass: HID (0x03)]
HID Data: 1002000102290610032d0080a1f30398a1f303b85f050a774d400080a1f303774d400080a1f303c0fdfe041548400080a1f30398a1f303b85f050ad8fdfe04d8

No.     Time           Source                Destination           Protocol Length Info
   3118 11.529128      1.17.2                host                  USB      27     URB_INTERRUPT out

Frame 3118: Packet, 27 bytes on wire (216 bits), 27 bytes captured (216 bits) on interface \\.\USBPcap1, id 0
    Section number: 1
    Interface id: 0 (\\.\USBPcap1)
    Encapsulation type: USB packets with USBPcap header (152)
    Arrival Time: Mar 31, 2026 22:43:01.315788000 W. Europe Summer Time
    UTC Arrival Time: Mar 31, 2026 20:43:01.315788000 UTC
    Epoch Arrival Time: 1774989781.315788000
    [Time shift for this packet: 0.000000000 seconds]
    [Time delta from previous captured frame: 1.624000 milliseconds]
    [Time delta from previous displayed frame: 1.624000 milliseconds]
    [Time since reference or first frame: 11.529128000 seconds]
    Frame Number: 3118
    Frame Length: 27 bytes (216 bits)
    Capture Length: 27 bytes (216 bits)
    [Frame is marked: False]
    [Frame is ignored: False]
    [Protocols in frame: usb]
    Character encoding: ASCII (0)
USB URB
    [Source: 1.17.2]
    [Destination: host]
    USBPcap pseudoheader length: 27
    IRP ID: 0xffffa686497ed010
    IRP USBD_STATUS: USBD_STATUS_SUCCESS (0x00000000)
    URB Function: URB_FUNCTION_BULK_OR_INTERRUPT_TRANSFER (0x0009)
    IRP information: 0x01, Direction: PDO -> FDO
    URB bus id: 1
    Device address: 17
    Endpoint: 0x02, Direction: OUT
    URB transfer type: URB_INTERRUPT (0x01)
    Packet Data Length: 0
    [Request in: 3117]
    [Time from request: 1.624000 milliseconds]
    [bInterfaceClass: HID (0x03)]

No.     Time           Source                Destination           Protocol Length Info
   3119 11.536775      1.17.1                host                  USB      91     URB_INTERRUPT in

Frame 3119: Packet, 91 bytes on wire (728 bits), 91 bytes captured (728 bits) on interface \\.\USBPcap1, id 0
    Section number: 1
    Interface id: 0 (\\.\USBPcap1)
    Encapsulation type: USB packets with USBPcap header (152)
    Arrival Time: Mar 31, 2026 22:43:01.323435000 W. Europe Summer Time
    UTC Arrival Time: Mar 31, 2026 20:43:01.323435000 UTC
    Epoch Arrival Time: 1774989781.323435000
    [Time shift for this packet: 0.000000000 seconds]
    [Time delta from previous captured frame: 7.647000 milliseconds]
    [Time delta from previous displayed frame: 7.647000 milliseconds]
    [Time since reference or first frame: 11.536775000 seconds]
    Frame Number: 3119
    Frame Length: 91 bytes (728 bits)
    Capture Length: 91 bytes (728 bits)
    [Frame is marked: False]
    [Frame is ignored: False]
    [Protocols in frame: usb:usbhid]
    Character encoding: ASCII (0)
USB URB
    [Source: 1.17.1]
    [Destination: host]
    USBPcap pseudoheader length: 27
    IRP ID: 0xffffa686494500d0
    IRP USBD_STATUS: USBD_STATUS_SUCCESS (0x00000000)
    URB Function: URB_FUNCTION_BULK_OR_INTERRUPT_TRANSFER (0x0009)
    IRP information: 0x01, Direction: PDO -> FDO
    URB bus id: 1
    Device address: 17
    Endpoint: 0x81, Direction: IN
    URB transfer type: URB_INTERRUPT (0x01)
    Packet Data Length: 64
    [Request in: 3112]
    [Time from request: 19.886000 milliseconds]
    [bInterfaceClass: HID (0x03)]
HID Data: 1002010010290644656661756c742050726573657410037100000000000000000000000010033d000000000000000000000000000000000000100331000abc8d

No.     Time           Source                Destination           Protocol Length Info
   3120 11.536800      host                  1.17.1                USB      27     URB_INTERRUPT in

Frame 3120: Packet, 27 bytes on wire (216 bits), 27 bytes captured (216 bits) on interface \\.\USBPcap1, id 0
    Section number: 1
    Interface id: 0 (\\.\USBPcap1)
    Encapsulation type: USB packets with USBPcap header (152)
    Arrival Time: Mar 31, 2026 22:43:01.323460000 W. Europe Summer Time
    UTC Arrival Time: Mar 31, 2026 20:43:01.323460000 UTC
    Epoch Arrival Time: 1774989781.323460000
    [Time shift for this packet: 0.000000000 seconds]
    [Time delta from previous captured frame: 25.000 microseconds]
    [Time delta from previous displayed frame: 25.000 microseconds]
    [Time since reference or first frame: 11.536800000 seconds]
    Frame Number: 3120
    Frame Length: 27 bytes (216 bits)
    Capture Length: 27 bytes (216 bits)
    [Frame is marked: False]
    [Frame is ignored: False]
    [Protocols in frame: usb]
    Character encoding: ASCII (0)
USB URB
    [Source: host]
    [Destination: 1.17.1]
    USBPcap pseudoheader length: 27
    IRP ID: 0xffffa686494500d0
    IRP USBD_STATUS: USBD_STATUS_SUCCESS (0x00000000)
    URB Function: URB_FUNCTION_BULK_OR_INTERRUPT_TRANSFER (0x0009)
    IRP information: 0x00, Direction: FDO -> PDO
    URB bus id: 1
    Device address: 17
    Endpoint: 0x81, Direction: IN
    URB transfer type: URB_INTERRUPT (0x01)
    Packet Data Length: 0
    [Response in: 3127]
    [bInterfaceClass: HID (0x03)]

No.     Time           Source                Destination           Protocol Length Info
   3121 11.537928      host                  1.17.2                USB      91     URB_INTERRUPT out

Frame 3121: Packet, 91 bytes on wire (728 bits), 91 bytes captured (728 bits) on interface \\.\USBPcap1, id 0
    Section number: 1
    Interface id: 0 (\\.\USBPcap1)
    Encapsulation type: USB packets with USBPcap header (152)
    Arrival Time: Mar 31, 2026 22:43:01.324588000 W. Europe Summer Time
    UTC Arrival Time: Mar 31, 2026 20:43:01.324588000 UTC
    Epoch Arrival Time: 1774989781.324588000
    [Time shift for this packet: 0.000000000 seconds]
    [Time delta from previous captured frame: 1.128000 milliseconds]
    [Time delta from previous displayed frame: 1.128000 milliseconds]
    [Time since reference or first frame: 11.537928000 seconds]
    Frame Number: 3121
    Frame Length: 91 bytes (728 bits)
    Capture Length: 91 bytes (728 bits)
    [Frame is marked: False]
    [Frame is ignored: False]
    [Protocols in frame: usb:usbhid]
    Character encoding: ASCII (0)
USB URB
    [Source: host]
    [Destination: 1.17.2]
    USBPcap pseudoheader length: 27
    IRP ID: 0xffffa68649cd8530
    IRP USBD_STATUS: USBD_STATUS_SUCCESS (0x00000000)
    URB Function: URB_FUNCTION_BULK_OR_INTERRUPT_TRANSFER (0x0009)
    IRP information: 0x00, Direction: FDO -> PDO
    URB bus id: 1
    Device address: 17
    Endpoint: 0x02, Direction: OUT
    URB transfer type: URB_INTERRUPT (0x01)
    Packet Data Length: 64
    [Response in: 3122]
    [bInterfaceClass: HID (0x03)]
HID Data: 1002000102290710032c0080a1f30398a1f303b85f050a774d400080a1f303774d400080a1f303c0fdfe041548400080a1f30398a1f303b85f050ad8fdfe04d8

No.     Time           Source                Destination           Protocol Length Info
   3122 11.539132      1.17.2                host                  USB      27     URB_INTERRUPT out

Frame 3122: Packet, 27 bytes on wire (216 bits), 27 bytes captured (216 bits) on interface \\.\USBPcap1, id 0
    Section number: 1
    Interface id: 0 (\\.\USBPcap1)
    Encapsulation type: USB packets with USBPcap header (152)
    Arrival Time: Mar 31, 2026 22:43:01.325792000 W. Europe Summer Time
    UTC Arrival Time: Mar 31, 2026 20:43:01.325792000 UTC
    Epoch Arrival Time: 1774989781.325792000
    [Time shift for this packet: 0.000000000 seconds]
    [Time delta from previous captured frame: 1.204000 milliseconds]
    [Time delta from previous displayed frame: 1.204000 milliseconds]
    [Time since reference or first frame: 11.539132000 seconds]
    Frame Number: 3122
    Frame Length: 27 bytes (216 bits)
    Capture Length: 27 bytes (216 bits)
    [Frame is marked: False]
    [Frame is ignored: False]
    [Protocols in frame: usb]
    Character encoding: ASCII (0)
USB URB
    [Source: 1.17.2]
    [Destination: host]
    USBPcap pseudoheader length: 27
    IRP ID: 0xffffa68649cd8530
    IRP USBD_STATUS: USBD_STATUS_SUCCESS (0x00000000)
    URB Function: URB_FUNCTION_BULK_OR_INTERRUPT_TRANSFER (0x0009)
    IRP information: 0x01, Direction: PDO -> FDO
    URB bus id: 1
    Device address: 17
    Endpoint: 0x02, Direction: OUT
    URB transfer type: URB_INTERRUPT (0x01)
    Packet Data Length: 0
    [Request in: 3121]
    [Time from request: 1.204000 milliseconds]
    [bInterfaceClass: HID (0x03)]

No.     Time           Source                Destination           Protocol Length Info
   3123 11.546771      1.17.1                host                  USB      91     URB_INTERRUPT in

Frame 3123: Packet, 91 bytes on wire (728 bits), 91 bytes captured (728 bits) on interface \\.\USBPcap1, id 0
    Section number: 1
    Interface id: 0 (\\.\USBPcap1)
    Encapsulation type: USB packets with USBPcap header (152)
    Arrival Time: Mar 31, 2026 22:43:01.333431000 W. Europe Summer Time
    UTC Arrival Time: Mar 31, 2026 20:43:01.333431000 UTC
    Epoch Arrival Time: 1774989781.333431000
    [Time shift for this packet: 0.000000000 seconds]
    [Time delta from previous captured frame: 7.639000 milliseconds]
    [Time delta from previous displayed frame: 7.639000 milliseconds]
    [Time since reference or first frame: 11.546771000 seconds]
    Frame Number: 3123
    Frame Length: 91 bytes (728 bits)
    Capture Length: 91 bytes (728 bits)
    [Frame is marked: False]
    [Frame is ignored: False]
    [Protocols in frame: usb:usbhid]
    Character encoding: ASCII (0)
USB URB
    [Source: 1.17.1]
    [Destination: host]
    USBPcap pseudoheader length: 27
    IRP ID: 0xffffa68649451010
    IRP USBD_STATUS: USBD_STATUS_SUCCESS (0x00000000)
    URB Function: URB_FUNCTION_BULK_OR_INTERRUPT_TRANSFER (0x0009)
    IRP information: 0x01, Direction: PDO -> FDO
    URB bus id: 1
    Device address: 17
    Endpoint: 0x81, Direction: IN
    URB transfer type: URB_INTERRUPT (0x01)
    Packet Data Length: 64
    [Request in: 3116]
    [Time from request: 19.964000 milliseconds]
    [bInterfaceClass: HID (0x03)]
HID Data: 1002010010290744656661756c742050726573657410037000000000000000000000000010033d000000000000000000000000000000000000100331000abc8d

No.     Time           Source                Destination           Protocol Length Info
   3124 11.546785      host                  1.17.1                USB      27     URB_INTERRUPT in

Frame 3124: Packet, 27 bytes on wire (216 bits), 27 bytes captured (216 bits) on interface \\.\USBPcap1, id 0
    Section number: 1
    Interface id: 0 (\\.\USBPcap1)
    Encapsulation type: USB packets with USBPcap header (152)
    Arrival Time: Mar 31, 2026 22:43:01.333445000 W. Europe Summer Time
    UTC Arrival Time: Mar 31, 2026 20:43:01.333445000 UTC
    Epoch Arrival Time: 1774989781.333445000
    [Time shift for this packet: 0.000000000 seconds]
    [Time delta from previous captured frame: 14.000 microseconds]
    [Time delta from previous displayed frame: 14.000 microseconds]
    [Time since reference or first frame: 11.546785000 seconds]
    Frame Number: 3124
    Frame Length: 27 bytes (216 bits)
    Capture Length: 27 bytes (216 bits)
    [Frame is marked: False]
    [Frame is ignored: False]
    [Protocols in frame: usb]
    Character encoding: ASCII (0)
USB URB
    [Source: host]
    [Destination: 1.17.1]
    USBPcap pseudoheader length: 27
    IRP ID: 0xffffa68649451010
    IRP USBD_STATUS: USBD_STATUS_SUCCESS (0x00000000)
    URB Function: URB_FUNCTION_BULK_OR_INTERRUPT_TRANSFER (0x0009)
    IRP information: 0x00, Direction: FDO -> PDO
    URB bus id: 1
    Device address: 17
    Endpoint: 0x81, Direction: IN
    URB transfer type: URB_INTERRUPT (0x01)
    Packet Data Length: 0
    [Response in: 3131]
    [bInterfaceClass: HID (0x03)]

No.     Time           Source                Destination           Protocol Length Info
   3125 11.547389      host                  1.17.2                USB      91     URB_INTERRUPT out

Frame 3125: Packet, 91 bytes on wire (728 bits), 91 bytes captured (728 bits) on interface \\.\USBPcap1, id 0
    Section number: 1
    Interface id: 0 (\\.\USBPcap1)
    Encapsulation type: USB packets with USBPcap header (152)
    Arrival Time: Mar 31, 2026 22:43:01.334049000 W. Europe Summer Time
    UTC Arrival Time: Mar 31, 2026 20:43:01.334049000 UTC
    Epoch Arrival Time: 1774989781.334049000
    [Time shift for this packet: 0.000000000 seconds]
    [Time delta from previous captured frame: 604.000 microseconds]
    [Time delta from previous displayed frame: 604.000 microseconds]
    [Time since reference or first frame: 11.547389000 seconds]
    Frame Number: 3125
    Frame Length: 91 bytes (728 bits)
    Capture Length: 91 bytes (728 bits)
    [Frame is marked: False]
    [Frame is ignored: False]
    [Protocols in frame: usb:usbhid]
    Character encoding: ASCII (0)
USB URB
    [Source: host]
    [Destination: 1.17.2]
    USBPcap pseudoheader length: 27
    IRP ID: 0xffffa686083bb530
    IRP USBD_STATUS: USBD_STATUS_SUCCESS (0x00000000)
    URB Function: URB_FUNCTION_BULK_OR_INTERRUPT_TRANSFER (0x0009)
    IRP information: 0x00, Direction: FDO -> PDO
    URB bus id: 1
    Device address: 17
    Endpoint: 0x02, Direction: OUT
    URB transfer type: URB_INTERRUPT (0x01)
    Packet Data Length: 64
    [Response in: 3126]
    [bInterfaceClass: HID (0x03)]
HID Data: 100200010229081003230080a1f30398a1f303b85f050a774d400080a1f303774d400080a1f303c0fdfe041548400080a1f30398a1f303b85f050ad8fdfe04d8

No.     Time           Source                Destination           Protocol Length Info
   3126 11.549129      1.17.2                host                  USB      27     URB_INTERRUPT out

Frame 3126: Packet, 27 bytes on wire (216 bits), 27 bytes captured (216 bits) on interface \\.\USBPcap1, id 0
    Section number: 1
    Interface id: 0 (\\.\USBPcap1)
    Encapsulation type: USB packets with USBPcap header (152)
    Arrival Time: Mar 31, 2026 22:43:01.335789000 W. Europe Summer Time
    UTC Arrival Time: Mar 31, 2026 20:43:01.335789000 UTC
    Epoch Arrival Time: 1774989781.335789000
    [Time shift for this packet: 0.000000000 seconds]
    [Time delta from previous captured frame: 1.740000 milliseconds]
    [Time delta from previous displayed frame: 1.740000 milliseconds]
    [Time since reference or first frame: 11.549129000 seconds]
    Frame Number: 3126
    Frame Length: 27 bytes (216 bits)
    Capture Length: 27 bytes (216 bits)
    [Frame is marked: False]
    [Frame is ignored: False]
    [Protocols in frame: usb]
    Character encoding: ASCII (0)
USB URB
    [Source: 1.17.2]
    [Destination: host]
    USBPcap pseudoheader length: 27
    IRP ID: 0xffffa686083bb530
    IRP USBD_STATUS: USBD_STATUS_SUCCESS (0x00000000)
    URB Function: URB_FUNCTION_BULK_OR_INTERRUPT_TRANSFER (0x0009)
    IRP information: 0x01, Direction: PDO -> FDO
    URB bus id: 1
    Device address: 17
    Endpoint: 0x02, Direction: OUT
    URB transfer type: URB_INTERRUPT (0x01)
    Packet Data Length: 0
    [Request in: 3125]
    [Time from request: 1.740000 milliseconds]
    [bInterfaceClass: HID (0x03)]

No.     Time           Source                Destination           Protocol Length Info
   3127 11.555772      1.17.1                host                  USB      91     URB_INTERRUPT in

Frame 3127: Packet, 91 bytes on wire (728 bits), 91 bytes captured (728 bits) on interface \\.\USBPcap1, id 0
    Section number: 1
    Interface id: 0 (\\.\USBPcap1)
    Encapsulation type: USB packets with USBPcap header (152)
    Arrival Time: Mar 31, 2026 22:43:01.342432000 W. Europe Summer Time
    UTC Arrival Time: Mar 31, 2026 20:43:01.342432000 UTC
    Epoch Arrival Time: 1774989781.342432000
    [Time shift for this packet: 0.000000000 seconds]
    [Time delta from previous captured frame: 6.643000 milliseconds]
    [Time delta from previous displayed frame: 6.643000 milliseconds]
    [Time since reference or first frame: 11.555772000 seconds]
    Frame Number: 3127
    Frame Length: 91 bytes (728 bits)
    Capture Length: 91 bytes (728 bits)
    [Frame is marked: False]
    [Frame is ignored: False]
    [Protocols in frame: usb:usbhid]
    Character encoding: ASCII (0)
USB URB
    [Source: 1.17.1]
    [Destination: host]
    USBPcap pseudoheader length: 27
    IRP ID: 0xffffa686494500d0
    IRP USBD_STATUS: USBD_STATUS_SUCCESS (0x00000000)
    URB Function: URB_FUNCTION_BULK_OR_INTERRUPT_TRANSFER (0x0009)
    IRP information: 0x01, Direction: PDO -> FDO
    URB bus id: 1
    Device address: 17
    Endpoint: 0x81, Direction: IN
    URB transfer type: URB_INTERRUPT (0x01)
    Packet Data Length: 64
    [Request in: 3120]
    [Time from request: 18.972000 milliseconds]
    [bInterfaceClass: HID (0x03)]
HID Data: 1002010010290844656661756c742050726573657410037f00000000000000000000000010033d000000000000000000000000000000000000100331000abc8d

No.     Time           Source                Destination           Protocol Length Info
   3128 11.555786      host                  1.17.1                USB      27     URB_INTERRUPT in

Frame 3128: Packet, 27 bytes on wire (216 bits), 27 bytes captured (216 bits) on interface \\.\USBPcap1, id 0
    Section number: 1
    Interface id: 0 (\\.\USBPcap1)
    Encapsulation type: USB packets with USBPcap header (152)
    Arrival Time: Mar 31, 2026 22:43:01.342446000 W. Europe Summer Time
    UTC Arrival Time: Mar 31, 2026 20:43:01.342446000 UTC
    Epoch Arrival Time: 1774989781.342446000
    [Time shift for this packet: 0.000000000 seconds]
    [Time delta from previous captured frame: 14.000 microseconds]
    [Time delta from previous displayed frame: 14.000 microseconds]
    [Time since reference or first frame: 11.555786000 seconds]
    Frame Number: 3128
    Frame Length: 27 bytes (216 bits)
    Capture Length: 27 bytes (216 bits)
    [Frame is marked: False]
    [Frame is ignored: False]
    [Protocols in frame: usb]
    Character encoding: ASCII (0)
USB URB
    [Source: host]
    [Destination: 1.17.1]
    USBPcap pseudoheader length: 27
    IRP ID: 0xffffa686494500d0
    IRP USBD_STATUS: USBD_STATUS_SUCCESS (0x00000000)
    URB Function: URB_FUNCTION_BULK_OR_INTERRUPT_TRANSFER (0x0009)
    IRP information: 0x00, Direction: FDO -> PDO
    URB bus id: 1
    Device address: 17
    Endpoint: 0x81, Direction: IN
    URB transfer type: URB_INTERRUPT (0x01)
    Packet Data Length: 0
    [Response in: 3135]
    [bInterfaceClass: HID (0x03)]

No.     Time           Source                Destination           Protocol Length Info
   3129 11.556569      host                  1.17.2                USB      91     URB_INTERRUPT out

Frame 3129: Packet, 91 bytes on wire (728 bits), 91 bytes captured (728 bits) on interface \\.\USBPcap1, id 0
    Section number: 1
    Interface id: 0 (\\.\USBPcap1)
    Encapsulation type: USB packets with USBPcap header (152)
    Arrival Time: Mar 31, 2026 22:43:01.343229000 W. Europe Summer Time
    UTC Arrival Time: Mar 31, 2026 20:43:01.343229000 UTC
    Epoch Arrival Time: 1774989781.343229000
    [Time shift for this packet: 0.000000000 seconds]
    [Time delta from previous captured frame: 783.000 microseconds]
    [Time delta from previous displayed frame: 783.000 microseconds]
    [Time since reference or first frame: 11.556569000 seconds]
    Frame Number: 3129
    Frame Length: 91 bytes (728 bits)
    Capture Length: 91 bytes (728 bits)
    [Frame is marked: False]
    [Frame is ignored: False]
    [Protocols in frame: usb:usbhid]
    Character encoding: ASCII (0)
USB URB
    [Source: host]
    [Destination: 1.17.2]
    USBPcap pseudoheader length: 27
    IRP ID: 0xffffa6864bacd530
    IRP USBD_STATUS: USBD_STATUS_SUCCESS (0x00000000)
    URB Function: URB_FUNCTION_BULK_OR_INTERRUPT_TRANSFER (0x0009)
    IRP information: 0x00, Direction: FDO -> PDO
    URB bus id: 1
    Device address: 17
    Endpoint: 0x02, Direction: OUT
    URB transfer type: URB_INTERRUPT (0x01)
    Packet Data Length: 64
    [Response in: 3130]
    [bInterfaceClass: HID (0x03)]
HID Data: 100200010229091003220080a1f30398a1f303b85f050a774d400080a1f303774d400080a1f303c0fdfe041548400080a1f30398a1f303b85f050ad8fdfe04d8

No.     Time           Source                Destination           Protocol Length Info
   3130 11.558141      1.17.2                host                  USB      27     URB_INTERRUPT out

Frame 3130: Packet, 27 bytes on wire (216 bits), 27 bytes captured (216 bits) on interface \\.\USBPcap1, id 0
    Section number: 1
    Interface id: 0 (\\.\USBPcap1)
    Encapsulation type: USB packets with USBPcap header (152)
    Arrival Time: Mar 31, 2026 22:43:01.344801000 W. Europe Summer Time
    UTC Arrival Time: Mar 31, 2026 20:43:01.344801000 UTC
    Epoch Arrival Time: 1774989781.344801000
    [Time shift for this packet: 0.000000000 seconds]
    [Time delta from previous captured frame: 1.572000 milliseconds]
    [Time delta from previous displayed frame: 1.572000 milliseconds]
    [Time since reference or first frame: 11.558141000 seconds]
    Frame Number: 3130
    Frame Length: 27 bytes (216 bits)
    Capture Length: 27 bytes (216 bits)
    [Frame is marked: False]
    [Frame is ignored: False]
    [Protocols in frame: usb]
    Character encoding: ASCII (0)
USB URB
    [Source: 1.17.2]
    [Destination: host]
    USBPcap pseudoheader length: 27
    IRP ID: 0xffffa6864bacd530
    IRP USBD_STATUS: USBD_STATUS_SUCCESS (0x00000000)
    URB Function: URB_FUNCTION_BULK_OR_INTERRUPT_TRANSFER (0x0009)
    IRP information: 0x01, Direction: PDO -> FDO
    URB bus id: 1
    Device address: 17
    Endpoint: 0x02, Direction: OUT
    URB transfer type: URB_INTERRUPT (0x01)
    Packet Data Length: 0
    [Request in: 3129]
    [Time from request: 1.572000 milliseconds]
    [bInterfaceClass: HID (0x03)]

No.     Time           Source                Destination           Protocol Length Info
   3131 11.565776      1.17.1                host                  USB      91     URB_INTERRUPT in

Frame 3131: Packet, 91 bytes on wire (728 bits), 91 bytes captured (728 bits) on interface \\.\USBPcap1, id 0
    Section number: 1
    Interface id: 0 (\\.\USBPcap1)
    Encapsulation type: USB packets with USBPcap header (152)
    Arrival Time: Mar 31, 2026 22:43:01.352436000 W. Europe Summer Time
    UTC Arrival Time: Mar 31, 2026 20:43:01.352436000 UTC
    Epoch Arrival Time: 1774989781.352436000
    [Time shift for this packet: 0.000000000 seconds]
    [Time delta from previous captured frame: 7.635000 milliseconds]
    [Time delta from previous displayed frame: 7.635000 milliseconds]
    [Time since reference or first frame: 11.565776000 seconds]
    Frame Number: 3131
    Frame Length: 91 bytes (728 bits)
    Capture Length: 91 bytes (728 bits)
    [Frame is marked: False]
    [Frame is ignored: False]
    [Protocols in frame: usb:usbhid]
    Character encoding: ASCII (0)
USB URB
    [Source: 1.17.1]
    [Destination: host]
    USBPcap pseudoheader length: 27
    IRP ID: 0xffffa68649451010
    IRP USBD_STATUS: USBD_STATUS_SUCCESS (0x00000000)
    URB Function: URB_FUNCTION_BULK_OR_INTERRUPT_TRANSFER (0x0009)
    IRP information: 0x01, Direction: PDO -> FDO
    URB bus id: 1
    Device address: 17
    Endpoint: 0x81, Direction: IN
    URB transfer type: URB_INTERRUPT (0x01)
    Packet Data Length: 64
    [Request in: 3124]
    [Time from request: 18.991000 milliseconds]
    [bInterfaceClass: HID (0x03)]
HID Data: 1002010010290944656661756c742050726573657410037e00000000000000000000000010033d000000000000000000000000000000000000100331000abc8d

No.     Time           Source                Destination           Protocol Length Info
   3132 11.565804      host                  1.17.1                USB      27     URB_INTERRUPT in

Frame 3132: Packet, 27 bytes on wire (216 bits), 27 bytes captured (216 bits) on interface \\.\USBPcap1, id 0
    Section number: 1
    Interface id: 0 (\\.\USBPcap1)
    Encapsulation type: USB packets with USBPcap header (152)
    Arrival Time: Mar 31, 2026 22:43:01.352464000 W. Europe Summer Time
    UTC Arrival Time: Mar 31, 2026 20:43:01.352464000 UTC
    Epoch Arrival Time: 1774989781.352464000
    [Time shift for this packet: 0.000000000 seconds]
    [Time delta from previous captured frame: 28.000 microseconds]
    [Time delta from previous displayed frame: 28.000 microseconds]
    [Time since reference or first frame: 11.565804000 seconds]
    Frame Number: 3132
    Frame Length: 27 bytes (216 bits)
    Capture Length: 27 bytes (216 bits)
    [Frame is marked: False]
    [Frame is ignored: False]
    [Protocols in frame: usb]
    Character encoding: ASCII (0)
USB URB
    [Source: host]
    [Destination: 1.17.1]
    USBPcap pseudoheader length: 27
    IRP ID: 0xffffa68649451010
    IRP USBD_STATUS: USBD_STATUS_SUCCESS (0x00000000)
    URB Function: URB_FUNCTION_BULK_OR_INTERRUPT_TRANSFER (0x0009)
    IRP information: 0x00, Direction: FDO -> PDO
    URB bus id: 1
    Device address: 17
    Endpoint: 0x81, Direction: IN
    URB transfer type: URB_INTERRUPT (0x01)
    Packet Data Length: 0
    [Response in: 3139]
    [bInterfaceClass: HID (0x03)]

No.     Time           Source                Destination           Protocol Length Info
   3133 11.566751      host                  1.17.2                USB      91     URB_INTERRUPT out

Frame 3133: Packet, 91 bytes on wire (728 bits), 91 bytes captured (728 bits) on interface \\.\USBPcap1, id 0
    Section number: 1
    Interface id: 0 (\\.\USBPcap1)
    Encapsulation type: USB packets with USBPcap header (152)
    Arrival Time: Mar 31, 2026 22:43:01.353411000 W. Europe Summer Time
    UTC Arrival Time: Mar 31, 2026 20:43:01.353411000 UTC
    Epoch Arrival Time: 1774989781.353411000
    [Time shift for this packet: 0.000000000 seconds]
    [Time delta from previous captured frame: 947.000 microseconds]
    [Time delta from previous displayed frame: 947.000 microseconds]
    [Time since reference or first frame: 11.566751000 seconds]
    Frame Number: 3133
    Frame Length: 91 bytes (728 bits)
    Capture Length: 91 bytes (728 bits)
    [Frame is marked: False]
    [Frame is ignored: False]
    [Protocols in frame: usb:usbhid]
    Character encoding: ASCII (0)
USB URB
    [Source: host]
    [Destination: 1.17.2]
    USBPcap pseudoheader length: 27
    IRP ID: 0xffffa6864b1d2530
    IRP USBD_STATUS: USBD_STATUS_SUCCESS (0x00000000)
    URB Function: URB_FUNCTION_BULK_OR_INTERRUPT_TRANSFER (0x0009)
    IRP information: 0x00, Direction: FDO -> PDO
    URB bus id: 1
    Device address: 17
    Endpoint: 0x02, Direction: OUT
    URB transfer type: URB_INTERRUPT (0x01)
    Packet Data Length: 64
    [Response in: 3134]
    [bInterfaceClass: HID (0x03)]
HID Data: 1002000102290a1003210080a1f30398a1f303b85f050a774d400080a1f303774d400080a1f303c0fdfe041548400080a1f30398a1f303b85f050ad8fdfe04d8

No.     Time           Source                Destination           Protocol Length Info
   3134 11.568128      1.17.2                host                  USB      27     URB_INTERRUPT out

Frame 3134: Packet, 27 bytes on wire (216 bits), 27 bytes captured (216 bits) on interface \\.\USBPcap1, id 0
    Section number: 1
    Interface id: 0 (\\.\USBPcap1)
    Encapsulation type: USB packets with USBPcap header (152)
    Arrival Time: Mar 31, 2026 22:43:01.354788000 W. Europe Summer Time
    UTC Arrival Time: Mar 31, 2026 20:43:01.354788000 UTC
    Epoch Arrival Time: 1774989781.354788000
    [Time shift for this packet: 0.000000000 seconds]
    [Time delta from previous captured frame: 1.377000 milliseconds]
    [Time delta from previous displayed frame: 1.377000 milliseconds]
    [Time since reference or first frame: 11.568128000 seconds]
    Frame Number: 3134
    Frame Length: 27 bytes (216 bits)
    Capture Length: 27 bytes (216 bits)
    [Frame is marked: False]
    [Frame is ignored: False]
    [Protocols in frame: usb]
    Character encoding: ASCII (0)
USB URB
    [Source: 1.17.2]
    [Destination: host]
    USBPcap pseudoheader length: 27
    IRP ID: 0xffffa6864b1d2530
    IRP USBD_STATUS: USBD_STATUS_SUCCESS (0x00000000)
    URB Function: URB_FUNCTION_BULK_OR_INTERRUPT_TRANSFER (0x0009)
    IRP information: 0x01, Direction: PDO -> FDO
    URB bus id: 1
    Device address: 17
    Endpoint: 0x02, Direction: OUT
    URB transfer type: URB_INTERRUPT (0x01)
    Packet Data Length: 0
    [Request in: 3133]
    [Time from request: 1.377000 milliseconds]
    [bInterfaceClass: HID (0x03)]

No.     Time           Source                Destination           Protocol Length Info
   3135 11.575767      1.17.1                host                  USB      91     URB_INTERRUPT in

Frame 3135: Packet, 91 bytes on wire (728 bits), 91 bytes captured (728 bits) on interface \\.\USBPcap1, id 0
    Section number: 1
    Interface id: 0 (\\.\USBPcap1)
    Encapsulation type: USB packets with USBPcap header (152)
    Arrival Time: Mar 31, 2026 22:43:01.362427000 W. Europe Summer Time
    UTC Arrival Time: Mar 31, 2026 20:43:01.362427000 UTC
    Epoch Arrival Time: 1774989781.362427000
    [Time shift for this packet: 0.000000000 seconds]
    [Time delta from previous captured frame: 7.639000 milliseconds]
    [Time delta from previous displayed frame: 7.639000 milliseconds]
    [Time since reference or first frame: 11.575767000 seconds]
    Frame Number: 3135
    Frame Length: 91 bytes (728 bits)
    Capture Length: 91 bytes (728 bits)
    [Frame is marked: False]
    [Frame is ignored: False]
    [Protocols in frame: usb:usbhid]
    Character encoding: ASCII (0)
USB URB
    [Source: 1.17.1]
    [Destination: host]
    USBPcap pseudoheader length: 27
    IRP ID: 0xffffa686494500d0
    IRP USBD_STATUS: USBD_STATUS_SUCCESS (0x00000000)
    URB Function: URB_FUNCTION_BULK_OR_INTERRUPT_TRANSFER (0x0009)
    IRP information: 0x01, Direction: PDO -> FDO
    URB bus id: 1
    Device address: 17
    Endpoint: 0x81, Direction: IN
    URB transfer type: URB_INTERRUPT (0x01)
    Packet Data Length: 64
    [Request in: 3128]
    [Time from request: 19.981000 milliseconds]
    [bInterfaceClass: HID (0x03)]
HID Data: 1002010010290a44656661756c742050726573657410037d00000000000000000000000010033d000000000000000000000000000000000000100331000abc8d

No.     Time           Source                Destination           Protocol Length Info
   3136 11.575779      host                  1.17.1                USB      27     URB_INTERRUPT in

Frame 3136: Packet, 27 bytes on wire (216 bits), 27 bytes captured (216 bits) on interface \\.\USBPcap1, id 0
    Section number: 1
    Interface id: 0 (\\.\USBPcap1)
    Encapsulation type: USB packets with USBPcap header (152)
    Arrival Time: Mar 31, 2026 22:43:01.362439000 W. Europe Summer Time
    UTC Arrival Time: Mar 31, 2026 20:43:01.362439000 UTC
    Epoch Arrival Time: 1774989781.362439000
    [Time shift for this packet: 0.000000000 seconds]
    [Time delta from previous captured frame: 12.000 microseconds]
    [Time delta from previous displayed frame: 12.000 microseconds]
    [Time since reference or first frame: 11.575779000 seconds]
    Frame Number: 3136
    Frame Length: 27 bytes (216 bits)
    Capture Length: 27 bytes (216 bits)
    [Frame is marked: False]
    [Frame is ignored: False]
    [Protocols in frame: usb]
    Character encoding: ASCII (0)
USB URB
    [Source: host]
    [Destination: 1.17.1]
    USBPcap pseudoheader length: 27
    IRP ID: 0xffffa686494500d0
    IRP USBD_STATUS: USBD_STATUS_SUCCESS (0x00000000)
    URB Function: URB_FUNCTION_BULK_OR_INTERRUPT_TRANSFER (0x0009)
    IRP information: 0x00, Direction: FDO -> PDO
    URB bus id: 1
    Device address: 17
    Endpoint: 0x81, Direction: IN
    URB transfer type: URB_INTERRUPT (0x01)
    Packet Data Length: 0
    [Response in: 3143]
    [bInterfaceClass: HID (0x03)]

No.     Time           Source                Destination           Protocol Length Info
   3137 11.576306      host                  1.17.2                USB      91     URB_INTERRUPT out

Frame 3137: Packet, 91 bytes on wire (728 bits), 91 bytes captured (728 bits) on interface \\.\USBPcap1, id 0
    Section number: 1
    Interface id: 0 (\\.\USBPcap1)
    Encapsulation type: USB packets with USBPcap header (152)
    Arrival Time: Mar 31, 2026 22:43:01.362966000 W. Europe Summer Time
    UTC Arrival Time: Mar 31, 2026 20:43:01.362966000 UTC
    Epoch Arrival Time: 1774989781.362966000
    [Time shift for this packet: 0.000000000 seconds]
    [Time delta from previous captured frame: 527.000 microseconds]
    [Time delta from previous displayed frame: 527.000 microseconds]
    [Time since reference or first frame: 11.576306000 seconds]
    Frame Number: 3137
    Frame Length: 91 bytes (728 bits)
    Capture Length: 91 bytes (728 bits)
    [Frame is marked: False]
    [Frame is ignored: False]
    [Protocols in frame: usb:usbhid]
    Character encoding: ASCII (0)
USB URB
    [Source: host]
    [Destination: 1.17.2]
    USBPcap pseudoheader length: 27
    IRP ID: 0xffffa6864a310530
    IRP USBD_STATUS: USBD_STATUS_SUCCESS (0x00000000)
    URB Function: URB_FUNCTION_BULK_OR_INTERRUPT_TRANSFER (0x0009)
    IRP information: 0x00, Direction: FDO -> PDO
    URB bus id: 1
    Device address: 17
    Endpoint: 0x02, Direction: OUT
    URB transfer type: URB_INTERRUPT (0x01)
    Packet Data Length: 64
    [Response in: 3138]
    [bInterfaceClass: HID (0x03)]
HID Data: 1002000102290b1003200080a1f30398a1f303b85f050a774d400080a1f303774d400080a1f303c0fdfe041548400080a1f30398a1f303b85f050ad8fdfe04d8

No.     Time           Source                Destination           Protocol Length Info
   3138 11.578126      1.17.2                host                  USB      27     URB_INTERRUPT out

Frame 3138: Packet, 27 bytes on wire (216 bits), 27 bytes captured (216 bits) on interface \\.\USBPcap1, id 0
    Section number: 1
    Interface id: 0 (\\.\USBPcap1)
    Encapsulation type: USB packets with USBPcap header (152)
    Arrival Time: Mar 31, 2026 22:43:01.364786000 W. Europe Summer Time
    UTC Arrival Time: Mar 31, 2026 20:43:01.364786000 UTC
    Epoch Arrival Time: 1774989781.364786000
    [Time shift for this packet: 0.000000000 seconds]
    [Time delta from previous captured frame: 1.820000 milliseconds]
    [Time delta from previous displayed frame: 1.820000 milliseconds]
    [Time since reference or first frame: 11.578126000 seconds]
    Frame Number: 3138
    Frame Length: 27 bytes (216 bits)
    Capture Length: 27 bytes (216 bits)
    [Frame is marked: False]
    [Frame is ignored: False]
    [Protocols in frame: usb]
    Character encoding: ASCII (0)
USB URB
    [Source: 1.17.2]
    [Destination: host]
    USBPcap pseudoheader length: 27
    IRP ID: 0xffffa6864a310530
    IRP USBD_STATUS: USBD_STATUS_SUCCESS (0x00000000)
    URB Function: URB_FUNCTION_BULK_OR_INTERRUPT_TRANSFER (0x0009)
    IRP information: 0x01, Direction: PDO -> FDO
    URB bus id: 1
    Device address: 17
    Endpoint: 0x02, Direction: OUT
    URB transfer type: URB_INTERRUPT (0x01)
    Packet Data Length: 0
    [Request in: 3137]
    [Time from request: 1.820000 milliseconds]
    [bInterfaceClass: HID (0x03)]

No.     Time           Source                Destination           Protocol Length Info
   3139 11.597770      1.17.1                host                  USB      91     URB_INTERRUPT in

Frame 3139: Packet, 91 bytes on wire (728 bits), 91 bytes captured (728 bits) on interface \\.\USBPcap1, id 0
    Section number: 1
    Interface id: 0 (\\.\USBPcap1)
    Encapsulation type: USB packets with USBPcap header (152)
    Arrival Time: Mar 31, 2026 22:43:01.384430000 W. Europe Summer Time
    UTC Arrival Time: Mar 31, 2026 20:43:01.384430000 UTC
    Epoch Arrival Time: 1774989781.384430000
    [Time shift for this packet: 0.000000000 seconds]
    [Time delta from previous captured frame: 19.644000 milliseconds]
    [Time delta from previous displayed frame: 19.644000 milliseconds]
    [Time since reference or first frame: 11.597770000 seconds]
    Frame Number: 3139
    Frame Length: 91 bytes (728 bits)
    Capture Length: 91 bytes (728 bits)
    [Frame is marked: False]
    [Frame is ignored: False]
    [Protocols in frame: usb:usbhid]
    Character encoding: ASCII (0)
USB URB
    [Source: 1.17.1]
    [Destination: host]
    USBPcap pseudoheader length: 27
    IRP ID: 0xffffa68649451010
    IRP USBD_STATUS: USBD_STATUS_SUCCESS (0x00000000)
    URB Function: URB_FUNCTION_BULK_OR_INTERRUPT_TRANSFER (0x0009)
    IRP information: 0x01, Direction: PDO -> FDO
    URB bus id: 1
    Device address: 17
    Endpoint: 0x81, Direction: IN
    URB transfer type: URB_INTERRUPT (0x01)
    Packet Data Length: 64
    [Request in: 3132]
    [Time from request: 31.966000 milliseconds]
    [bInterfaceClass: HID (0x03)]
HID Data: 1002010010290b44656661756c742050726573657410037c00000000000000000000000010033d000000000000000000000000000000000000100331000abc8d

No.     Time           Source                Destination           Protocol Length Info
   3140 11.597790      host                  1.17.1                USB      27     URB_INTERRUPT in

Frame 3140: Packet, 27 bytes on wire (216 bits), 27 bytes captured (216 bits) on interface \\.\USBPcap1, id 0
    Section number: 1
    Interface id: 0 (\\.\USBPcap1)
    Encapsulation type: USB packets with USBPcap header (152)
    Arrival Time: Mar 31, 2026 22:43:01.384450000 W. Europe Summer Time
    UTC Arrival Time: Mar 31, 2026 20:43:01.384450000 UTC
    Epoch Arrival Time: 1774989781.384450000
    [Time shift for this packet: 0.000000000 seconds]
    [Time delta from previous captured frame: 20.000 microseconds]
    [Time delta from previous displayed frame: 20.000 microseconds]
    [Time since reference or first frame: 11.597790000 seconds]
    Frame Number: 3140
    Frame Length: 27 bytes (216 bits)
    Capture Length: 27 bytes (216 bits)
    [Frame is marked: False]
    [Frame is ignored: False]
    [Protocols in frame: usb]
    Character encoding: ASCII (0)
USB URB
    [Source: host]
    [Destination: 1.17.1]
    USBPcap pseudoheader length: 27
    IRP ID: 0xffffa68649451010
    IRP USBD_STATUS: USBD_STATUS_SUCCESS (0x00000000)
    URB Function: URB_FUNCTION_BULK_OR_INTERRUPT_TRANSFER (0x0009)
    IRP information: 0x00, Direction: FDO -> PDO
    URB bus id: 1
    Device address: 17
    Endpoint: 0x81, Direction: IN
    URB transfer type: URB_INTERRUPT (0x01)
    Packet Data Length: 0
    [Response in: 3147]
    [bInterfaceClass: HID (0x03)]

No.     Time           Source                Destination           Protocol Length Info
   3141 11.598607      host                  1.17.2                USB      91     URB_INTERRUPT out

Frame 3141: Packet, 91 bytes on wire (728 bits), 91 bytes captured (728 bits) on interface \\.\USBPcap1, id 0
    Section number: 1
    Interface id: 0 (\\.\USBPcap1)
    Encapsulation type: USB packets with USBPcap header (152)
    Arrival Time: Mar 31, 2026 22:43:01.385267000 W. Europe Summer Time
    UTC Arrival Time: Mar 31, 2026 20:43:01.385267000 UTC
    Epoch Arrival Time: 1774989781.385267000
    [Time shift for this packet: 0.000000000 seconds]
    [Time delta from previous captured frame: 817.000 microseconds]
    [Time delta from previous displayed frame: 817.000 microseconds]
    [Time since reference or first frame: 11.598607000 seconds]
    Frame Number: 3141
    Frame Length: 91 bytes (728 bits)
    Capture Length: 91 bytes (728 bits)
    [Frame is marked: False]
    [Frame is ignored: False]
    [Protocols in frame: usb:usbhid]
    Character encoding: ASCII (0)
USB URB
    [Source: host]
    [Destination: 1.17.2]
    USBPcap pseudoheader length: 27
    IRP ID: 0xffffa6864b1ca530
    IRP USBD_STATUS: USBD_STATUS_SUCCESS (0x00000000)
    URB Function: URB_FUNCTION_BULK_OR_INTERRUPT_TRANSFER (0x0009)
    IRP information: 0x00, Direction: FDO -> PDO
    URB bus id: 1
    Device address: 17
    Endpoint: 0x02, Direction: OUT
    URB transfer type: URB_INTERRUPT (0x01)
    Packet Data Length: 64
    [Response in: 3142]
    [bInterfaceClass: HID (0x03)]
HID Data: 1002000102290c1003270080a1f30398a1f303b85f050a774d400080a1f303774d400080a1f303c0fdfe041548400080a1f30398a1f303b85f050ad8fdfe04d8

No.     Time           Source                Destination           Protocol Length Info
   3142 11.600168      1.17.2                host                  USB      27     URB_INTERRUPT out

Frame 3142: Packet, 27 bytes on wire (216 bits), 27 bytes captured (216 bits) on interface \\.\USBPcap1, id 0
    Section number: 1
    Interface id: 0 (\\.\USBPcap1)
    Encapsulation type: USB packets with USBPcap header (152)
    Arrival Time: Mar 31, 2026 22:43:01.386828000 W. Europe Summer Time
    UTC Arrival Time: Mar 31, 2026 20:43:01.386828000 UTC
    Epoch Arrival Time: 1774989781.386828000
    [Time shift for this packet: 0.000000000 seconds]
    [Time delta from previous captured frame: 1.561000 milliseconds]
    [Time delta from previous displayed frame: 1.561000 milliseconds]
    [Time since reference or first frame: 11.600168000 seconds]
    Frame Number: 3142
    Frame Length: 27 bytes (216 bits)
    Capture Length: 27 bytes (216 bits)
    [Frame is marked: False]
    [Frame is ignored: False]
    [Protocols in frame: usb]
    Character encoding: ASCII (0)
USB URB
    [Source: 1.17.2]
    [Destination: host]
    USBPcap pseudoheader length: 27
    IRP ID: 0xffffa6864b1ca530
    IRP USBD_STATUS: USBD_STATUS_SUCCESS (0x00000000)
    URB Function: URB_FUNCTION_BULK_OR_INTERRUPT_TRANSFER (0x0009)
    IRP information: 0x01, Direction: PDO -> FDO
    URB bus id: 1
    Device address: 17
    Endpoint: 0x02, Direction: OUT
    URB transfer type: URB_INTERRUPT (0x01)
    Packet Data Length: 0
    [Request in: 3141]
    [Time from request: 1.561000 milliseconds]
    [bInterfaceClass: HID (0x03)]

No.     Time           Source                Destination           Protocol Length Info
   3143 11.605770      1.17.1                host                  USB      91     URB_INTERRUPT in

Frame 3143: Packet, 91 bytes on wire (728 bits), 91 bytes captured (728 bits) on interface \\.\USBPcap1, id 0
    Section number: 1
    Interface id: 0 (\\.\USBPcap1)
    Encapsulation type: USB packets with USBPcap header (152)
    Arrival Time: Mar 31, 2026 22:43:01.392430000 W. Europe Summer Time
    UTC Arrival Time: Mar 31, 2026 20:43:01.392430000 UTC
    Epoch Arrival Time: 1774989781.392430000
    [Time shift for this packet: 0.000000000 seconds]
    [Time delta from previous captured frame: 5.602000 milliseconds]
    [Time delta from previous displayed frame: 5.602000 milliseconds]
    [Time since reference or first frame: 11.605770000 seconds]
    Frame Number: 3143
    Frame Length: 91 bytes (728 bits)
    Capture Length: 91 bytes (728 bits)
    [Frame is marked: False]
    [Frame is ignored: False]
    [Protocols in frame: usb:usbhid]
    Character encoding: ASCII (0)
USB URB
    [Source: 1.17.1]
    [Destination: host]
    USBPcap pseudoheader length: 27
    IRP ID: 0xffffa686494500d0
    IRP USBD_STATUS: USBD_STATUS_SUCCESS (0x00000000)
    URB Function: URB_FUNCTION_BULK_OR_INTERRUPT_TRANSFER (0x0009)
    IRP information: 0x01, Direction: PDO -> FDO
    URB bus id: 1
    Device address: 17
    Endpoint: 0x81, Direction: IN
    URB transfer type: URB_INTERRUPT (0x01)
    Packet Data Length: 64
    [Request in: 3136]
    [Time from request: 29.991000 milliseconds]
    [bInterfaceClass: HID (0x03)]
HID Data: 1002010010290c44656661756c742050726573657410037b00000000000000000000000010033d000000000000000000000000000000000000100331000abc8d

No.     Time           Source                Destination           Protocol Length Info
   3144 11.605794      host                  1.17.1                USB      27     URB_INTERRUPT in

Frame 3144: Packet, 27 bytes on wire (216 bits), 27 bytes captured (216 bits) on interface \\.\USBPcap1, id 0
    Section number: 1
    Interface id: 0 (\\.\USBPcap1)
    Encapsulation type: USB packets with USBPcap header (152)
    Arrival Time: Mar 31, 2026 22:43:01.392454000 W. Europe Summer Time
    UTC Arrival Time: Mar 31, 2026 20:43:01.392454000 UTC
    Epoch Arrival Time: 1774989781.392454000
    [Time shift for this packet: 0.000000000 seconds]
    [Time delta from previous captured frame: 24.000 microseconds]
    [Time delta from previous displayed frame: 24.000 microseconds]
    [Time since reference or first frame: 11.605794000 seconds]
    Frame Number: 3144
    Frame Length: 27 bytes (216 bits)
    Capture Length: 27 bytes (216 bits)
    [Frame is marked: False]
    [Frame is ignored: False]
    [Protocols in frame: usb]
    Character encoding: ASCII (0)
USB URB
    [Source: host]
    [Destination: 1.17.1]
    USBPcap pseudoheader length: 27
    IRP ID: 0xffffa686494500d0
    IRP USBD_STATUS: USBD_STATUS_SUCCESS (0x00000000)
    URB Function: URB_FUNCTION_BULK_OR_INTERRUPT_TRANSFER (0x0009)
    IRP information: 0x00, Direction: FDO -> PDO
    URB bus id: 1
    Device address: 17
    Endpoint: 0x81, Direction: IN
    URB transfer type: URB_INTERRUPT (0x01)
    Packet Data Length: 0
    [Response in: 3151]
    [bInterfaceClass: HID (0x03)]

No.     Time           Source                Destination           Protocol Length Info
   3145 11.606532      host                  1.17.2                USB      91     URB_INTERRUPT out

Frame 3145: Packet, 91 bytes on wire (728 bits), 91 bytes captured (728 bits) on interface \\.\USBPcap1, id 0
    Section number: 1
    Interface id: 0 (\\.\USBPcap1)
    Encapsulation type: USB packets with USBPcap header (152)
    Arrival Time: Mar 31, 2026 22:43:01.393192000 W. Europe Summer Time
    UTC Arrival Time: Mar 31, 2026 20:43:01.393192000 UTC
    Epoch Arrival Time: 1774989781.393192000
    [Time shift for this packet: 0.000000000 seconds]
    [Time delta from previous captured frame: 738.000 microseconds]
    [Time delta from previous displayed frame: 738.000 microseconds]
    [Time since reference or first frame: 11.606532000 seconds]
    Frame Number: 3145
    Frame Length: 91 bytes (728 bits)
    Capture Length: 91 bytes (728 bits)
    [Frame is marked: False]
    [Frame is ignored: False]
    [Protocols in frame: usb:usbhid]
    Character encoding: ASCII (0)
USB URB
    [Source: host]
    [Destination: 1.17.2]
    USBPcap pseudoheader length: 27
    IRP ID: 0xffffa68649cc7530
    IRP USBD_STATUS: USBD_STATUS_SUCCESS (0x00000000)
    URB Function: URB_FUNCTION_BULK_OR_INTERRUPT_TRANSFER (0x0009)
    IRP information: 0x00, Direction: FDO -> PDO
    URB bus id: 1
    Device address: 17
    Endpoint: 0x02, Direction: OUT
    URB transfer type: URB_INTERRUPT (0x01)
    Packet Data Length: 64
    [Response in: 3146]
    [bInterfaceClass: HID (0x03)]
HID Data: 1002000102290d1003260080a1f30398a1f303b85f050a774d400080a1f303774d400080a1f303c0fdfe041548400080a1f30398a1f303b85f050ad8fdfe04d8

No.     Time           Source                Destination           Protocol Length Info
   3146 11.608138      1.17.2                host                  USB      27     URB_INTERRUPT out

Frame 3146: Packet, 27 bytes on wire (216 bits), 27 bytes captured (216 bits) on interface \\.\USBPcap1, id 0
    Section number: 1
    Interface id: 0 (\\.\USBPcap1)
    Encapsulation type: USB packets with USBPcap header (152)
    Arrival Time: Mar 31, 2026 22:43:01.394798000 W. Europe Summer Time
    UTC Arrival Time: Mar 31, 2026 20:43:01.394798000 UTC
    Epoch Arrival Time: 1774989781.394798000
    [Time shift for this packet: 0.000000000 seconds]
    [Time delta from previous captured frame: 1.606000 milliseconds]
    [Time delta from previous displayed frame: 1.606000 milliseconds]
    [Time since reference or first frame: 11.608138000 seconds]
    Frame Number: 3146
    Frame Length: 27 bytes (216 bits)
    Capture Length: 27 bytes (216 bits)
    [Frame is marked: False]
    [Frame is ignored: False]
    [Protocols in frame: usb]
    Character encoding: ASCII (0)
USB URB
    [Source: 1.17.2]
    [Destination: host]
    USBPcap pseudoheader length: 27
    IRP ID: 0xffffa68649cc7530
    IRP USBD_STATUS: USBD_STATUS_SUCCESS (0x00000000)
    URB Function: URB_FUNCTION_BULK_OR_INTERRUPT_TRANSFER (0x0009)
    IRP information: 0x01, Direction: PDO -> FDO
    URB bus id: 1
    Device address: 17
    Endpoint: 0x02, Direction: OUT
    URB transfer type: URB_INTERRUPT (0x01)
    Packet Data Length: 0
    [Request in: 3145]
    [Time from request: 1.606000 milliseconds]
    [bInterfaceClass: HID (0x03)]

No.     Time           Source                Destination           Protocol Length Info
   3147 11.615773      1.17.1                host                  USB      91     URB_INTERRUPT in

Frame 3147: Packet, 91 bytes on wire (728 bits), 91 bytes captured (728 bits) on interface \\.\USBPcap1, id 0
    Section number: 1
    Interface id: 0 (\\.\USBPcap1)
    Encapsulation type: USB packets with USBPcap header (152)
    Arrival Time: Mar 31, 2026 22:43:01.402433000 W. Europe Summer Time
    UTC Arrival Time: Mar 31, 2026 20:43:01.402433000 UTC
    Epoch Arrival Time: 1774989781.402433000
    [Time shift for this packet: 0.000000000 seconds]
    [Time delta from previous captured frame: 7.635000 milliseconds]
    [Time delta from previous displayed frame: 7.635000 milliseconds]
    [Time since reference or first frame: 11.615773000 seconds]
    Frame Number: 3147
    Frame Length: 91 bytes (728 bits)
    Capture Length: 91 bytes (728 bits)
    [Frame is marked: False]
    [Frame is ignored: False]
    [Protocols in frame: usb:usbhid]
    Character encoding: ASCII (0)
USB URB
    [Source: 1.17.1]
    [Destination: host]
    USBPcap pseudoheader length: 27
    IRP ID: 0xffffa68649451010
    IRP USBD_STATUS: USBD_STATUS_SUCCESS (0x00000000)
    URB Function: URB_FUNCTION_BULK_OR_INTERRUPT_TRANSFER (0x0009)
    IRP information: 0x01, Direction: PDO -> FDO
    URB bus id: 1
    Device address: 17
    Endpoint: 0x81, Direction: IN
    URB transfer type: URB_INTERRUPT (0x01)
    Packet Data Length: 64
    [Request in: 3140]
    [Time from request: 17.983000 milliseconds]
    [bInterfaceClass: HID (0x03)]
HID Data: 1002010010290d44656661756c742050726573657410037a00000000000000000000000010033d000000000000000000000000000000000000100331000abc8d

No.     Time           Source                Destination           Protocol Length Info
   3148 11.615801      host                  1.17.1                USB      27     URB_INTERRUPT in

Frame 3148: Packet, 27 bytes on wire (216 bits), 27 bytes captured (216 bits) on interface \\.\USBPcap1, id 0
    Section number: 1
    Interface id: 0 (\\.\USBPcap1)
    Encapsulation type: USB packets with USBPcap header (152)
    Arrival Time: Mar 31, 2026 22:43:01.402461000 W. Europe Summer Time
    UTC Arrival Time: Mar 31, 2026 20:43:01.402461000 UTC
    Epoch Arrival Time: 1774989781.402461000
    [Time shift for this packet: 0.000000000 seconds]
    [Time delta from previous captured frame: 28.000 microseconds]
    [Time delta from previous displayed frame: 28.000 microseconds]
    [Time since reference or first frame: 11.615801000 seconds]
    Frame Number: 3148
    Frame Length: 27 bytes (216 bits)
    Capture Length: 27 bytes (216 bits)
    [Frame is marked: False]
    [Frame is ignored: False]
    [Protocols in frame: usb]
    Character encoding: ASCII (0)
USB URB
    [Source: host]
    [Destination: 1.17.1]
    USBPcap pseudoheader length: 27
    IRP ID: 0xffffa68649451010
    IRP USBD_STATUS: USBD_STATUS_SUCCESS (0x00000000)
    URB Function: URB_FUNCTION_BULK_OR_INTERRUPT_TRANSFER (0x0009)
    IRP information: 0x00, Direction: FDO -> PDO
    URB bus id: 1
    Device address: 17
    Endpoint: 0x81, Direction: IN
    URB transfer type: URB_INTERRUPT (0x01)
    Packet Data Length: 0
    [Response in: 3155]
    [bInterfaceClass: HID (0x03)]

No.     Time           Source                Destination           Protocol Length Info
   3149 11.616913      host                  1.17.2                USB      91     URB_INTERRUPT out

Frame 3149: Packet, 91 bytes on wire (728 bits), 91 bytes captured (728 bits) on interface \\.\USBPcap1, id 0
    Section number: 1
    Interface id: 0 (\\.\USBPcap1)
    Encapsulation type: USB packets with USBPcap header (152)
    Arrival Time: Mar 31, 2026 22:43:01.403573000 W. Europe Summer Time
    UTC Arrival Time: Mar 31, 2026 20:43:01.403573000 UTC
    Epoch Arrival Time: 1774989781.403573000
    [Time shift for this packet: 0.000000000 seconds]
    [Time delta from previous captured frame: 1.112000 milliseconds]
    [Time delta from previous displayed frame: 1.112000 milliseconds]
    [Time since reference or first frame: 11.616913000 seconds]
    Frame Number: 3149
    Frame Length: 91 bytes (728 bits)
    Capture Length: 91 bytes (728 bits)
    [Frame is marked: False]
    [Frame is ignored: False]
    [Protocols in frame: usb:usbhid]
    Character encoding: ASCII (0)
USB URB
    [Source: host]
    [Destination: 1.17.2]
    USBPcap pseudoheader length: 27
    IRP ID: 0xffffa6864903d250
    IRP USBD_STATUS: USBD_STATUS_SUCCESS (0x00000000)
    URB Function: URB_FUNCTION_BULK_OR_INTERRUPT_TRANSFER (0x0009)
    IRP information: 0x00, Direction: FDO -> PDO
    URB bus id: 1
    Device address: 17
    Endpoint: 0x02, Direction: OUT
    URB transfer type: URB_INTERRUPT (0x01)
    Packet Data Length: 64
    [Response in: 3150]
    [bInterfaceClass: HID (0x03)]
HID Data: 1002000102290e1003250080a1f30398a1f303b85f050a774d400080a1f303774d400080a1f303c0fdfe041548400080a1f30398a1f303b85f050ad8fdfe04d8

No.     Time           Source                Destination           Protocol Length Info
   3150 11.618126      1.17.2                host                  USB      27     URB_INTERRUPT out

Frame 3150: Packet, 27 bytes on wire (216 bits), 27 bytes captured (216 bits) on interface \\.\USBPcap1, id 0
    Section number: 1
    Interface id: 0 (\\.\USBPcap1)
    Encapsulation type: USB packets with USBPcap header (152)
    Arrival Time: Mar 31, 2026 22:43:01.404786000 W. Europe Summer Time
    UTC Arrival Time: Mar 31, 2026 20:43:01.404786000 UTC
    Epoch Arrival Time: 1774989781.404786000
    [Time shift for this packet: 0.000000000 seconds]
    [Time delta from previous captured frame: 1.213000 milliseconds]
    [Time delta from previous displayed frame: 1.213000 milliseconds]
    [Time since reference or first frame: 11.618126000 seconds]
    Frame Number: 3150
    Frame Length: 27 bytes (216 bits)
    Capture Length: 27 bytes (216 bits)
    [Frame is marked: False]
    [Frame is ignored: False]
    [Protocols in frame: usb]
    Character encoding: ASCII (0)
USB URB
    [Source: 1.17.2]
    [Destination: host]
    USBPcap pseudoheader length: 27
    IRP ID: 0xffffa6864903d250
    IRP USBD_STATUS: USBD_STATUS_SUCCESS (0x00000000)
    URB Function: URB_FUNCTION_BULK_OR_INTERRUPT_TRANSFER (0x0009)
    IRP information: 0x01, Direction: PDO -> FDO
    URB bus id: 1
    Device address: 17
    Endpoint: 0x02, Direction: OUT
    URB transfer type: URB_INTERRUPT (0x01)
    Packet Data Length: 0
    [Request in: 3149]
    [Time from request: 1.213000 milliseconds]
    [bInterfaceClass: HID (0x03)]

No.     Time           Source                Destination           Protocol Length Info
   3151 11.624778      1.17.1                host                  USB      91     URB_INTERRUPT in

Frame 3151: Packet, 91 bytes on wire (728 bits), 91 bytes captured (728 bits) on interface \\.\USBPcap1, id 0
    Section number: 1
    Interface id: 0 (\\.\USBPcap1)
    Encapsulation type: USB packets with USBPcap header (152)
    Arrival Time: Mar 31, 2026 22:43:01.411438000 W. Europe Summer Time
    UTC Arrival Time: Mar 31, 2026 20:43:01.411438000 UTC
    Epoch Arrival Time: 1774989781.411438000
    [Time shift for this packet: 0.000000000 seconds]
    [Time delta from previous captured frame: 6.652000 milliseconds]
    [Time delta from previous displayed frame: 6.652000 milliseconds]
    [Time since reference or first frame: 11.624778000 seconds]
    Frame Number: 3151
    Frame Length: 91 bytes (728 bits)
    Capture Length: 91 bytes (728 bits)
    [Frame is marked: False]
    [Frame is ignored: False]
    [Protocols in frame: usb:usbhid]
    Character encoding: ASCII (0)
USB URB
    [Source: 1.17.1]
    [Destination: host]
    USBPcap pseudoheader length: 27
    IRP ID: 0xffffa686494500d0
    IRP USBD_STATUS: USBD_STATUS_SUCCESS (0x00000000)
    URB Function: URB_FUNCTION_BULK_OR_INTERRUPT_TRANSFER (0x0009)
    IRP information: 0x01, Direction: PDO -> FDO
    URB bus id: 1
    Device address: 17
    Endpoint: 0x81, Direction: IN
    URB transfer type: URB_INTERRUPT (0x01)
    Packet Data Length: 64
    [Request in: 3144]
    [Time from request: 18.984000 milliseconds]
    [bInterfaceClass: HID (0x03)]
HID Data: 1002010010290e44656661756c742050726573657410037900000000000000000000000010033d000000000000000000000000000000000000100331000abc8d

No.     Time           Source                Destination           Protocol Length Info
   3152 11.624808      host                  1.17.1                USB      27     URB_INTERRUPT in

Frame 3152: Packet, 27 bytes on wire (216 bits), 27 bytes captured (216 bits) on interface \\.\USBPcap1, id 0
    Section number: 1
    Interface id: 0 (\\.\USBPcap1)
    Encapsulation type: USB packets with USBPcap header (152)
    Arrival Time: Mar 31, 2026 22:43:01.411468000 W. Europe Summer Time
    UTC Arrival Time: Mar 31, 2026 20:43:01.411468000 UTC
    Epoch Arrival Time: 1774989781.411468000
    [Time shift for this packet: 0.000000000 seconds]
    [Time delta from previous captured frame: 30.000 microseconds]
    [Time delta from previous displayed frame: 30.000 microseconds]
    [Time since reference or first frame: 11.624808000 seconds]
    Frame Number: 3152
    Frame Length: 27 bytes (216 bits)
    Capture Length: 27 bytes (216 bits)
    [Frame is marked: False]
    [Frame is ignored: False]
    [Protocols in frame: usb]
    Character encoding: ASCII (0)
USB URB
    [Source: host]
    [Destination: 1.17.1]
    USBPcap pseudoheader length: 27
    IRP ID: 0xffffa686494500d0
    IRP USBD_STATUS: USBD_STATUS_SUCCESS (0x00000000)
    URB Function: URB_FUNCTION_BULK_OR_INTERRUPT_TRANSFER (0x0009)
    IRP information: 0x00, Direction: FDO -> PDO
    URB bus id: 1
    Device address: 17
    Endpoint: 0x81, Direction: IN
    URB transfer type: URB_INTERRUPT (0x01)
    Packet Data Length: 0
    [Response in: 3159]
    [bInterfaceClass: HID (0x03)]

No.     Time           Source                Destination           Protocol Length Info
   3153 11.625457      host                  1.17.2                USB      91     URB_INTERRUPT out

Frame 3153: Packet, 91 bytes on wire (728 bits), 91 bytes captured (728 bits) on interface \\.\USBPcap1, id 0
    Section number: 1
    Interface id: 0 (\\.\USBPcap1)
    Encapsulation type: USB packets with USBPcap header (152)
    Arrival Time: Mar 31, 2026 22:43:01.412117000 W. Europe Summer Time
    UTC Arrival Time: Mar 31, 2026 20:43:01.412117000 UTC
    Epoch Arrival Time: 1774989781.412117000
    [Time shift for this packet: 0.000000000 seconds]
    [Time delta from previous captured frame: 649.000 microseconds]
    [Time delta from previous displayed frame: 649.000 microseconds]
    [Time since reference or first frame: 11.625457000 seconds]
    Frame Number: 3153
    Frame Length: 91 bytes (728 bits)
    Capture Length: 91 bytes (728 bits)
    [Frame is marked: False]
    [Frame is ignored: False]
    [Protocols in frame: usb:usbhid]
    Character encoding: ASCII (0)
USB URB
    [Source: host]
    [Destination: 1.17.2]
    USBPcap pseudoheader length: 27
    IRP ID: 0xffffa686080d32a0
    IRP USBD_STATUS: USBD_STATUS_SUCCESS (0x00000000)
    URB Function: URB_FUNCTION_BULK_OR_INTERRUPT_TRANSFER (0x0009)
    IRP information: 0x00, Direction: FDO -> PDO
    URB bus id: 1
    Device address: 17
    Endpoint: 0x02, Direction: OUT
    URB transfer type: URB_INTERRUPT (0x01)
    Packet Data Length: 64
    [Response in: 3154]
    [bInterfaceClass: HID (0x03)]
HID Data: 1002000102290f1003240080a1f30398a1f303b85f050a774d400080a1f303774d400080a1f303c0fdfe041548400080a1f30398a1f303b85f050ad8fdfe04d8

No.     Time           Source                Destination           Protocol Length Info
   3154 11.627122      1.17.2                host                  USB      27     URB_INTERRUPT out

Frame 3154: Packet, 27 bytes on wire (216 bits), 27 bytes captured (216 bits) on interface \\.\USBPcap1, id 0
    Section number: 1
    Interface id: 0 (\\.\USBPcap1)
    Encapsulation type: USB packets with USBPcap header (152)
    Arrival Time: Mar 31, 2026 22:43:01.413782000 W. Europe Summer Time
    UTC Arrival Time: Mar 31, 2026 20:43:01.413782000 UTC
    Epoch Arrival Time: 1774989781.413782000
    [Time shift for this packet: 0.000000000 seconds]
    [Time delta from previous captured frame: 1.665000 milliseconds]
    [Time delta from previous displayed frame: 1.665000 milliseconds]
    [Time since reference or first frame: 11.627122000 seconds]
    Frame Number: 3154
    Frame Length: 27 bytes (216 bits)
    Capture Length: 27 bytes (216 bits)
    [Frame is marked: False]
    [Frame is ignored: False]
    [Protocols in frame: usb]
    Character encoding: ASCII (0)
USB URB
    [Source: 1.17.2]
    [Destination: host]
    USBPcap pseudoheader length: 27
    IRP ID: 0xffffa686080d32a0
    IRP USBD_STATUS: USBD_STATUS_SUCCESS (0x00000000)
    URB Function: URB_FUNCTION_BULK_OR_INTERRUPT_TRANSFER (0x0009)
    IRP information: 0x01, Direction: PDO -> FDO
    URB bus id: 1
    Device address: 17
    Endpoint: 0x02, Direction: OUT
    URB transfer type: URB_INTERRUPT (0x01)
    Packet Data Length: 0
    [Request in: 3153]
    [Time from request: 1.665000 milliseconds]
    [bInterfaceClass: HID (0x03)]

No.     Time           Source                Destination           Protocol Length Info
   3155 11.634768      1.17.1                host                  USB      91     URB_INTERRUPT in

Frame 3155: Packet, 91 bytes on wire (728 bits), 91 bytes captured (728 bits) on interface \\.\USBPcap1, id 0
    Section number: 1
    Interface id: 0 (\\.\USBPcap1)
    Encapsulation type: USB packets with USBPcap header (152)
    Arrival Time: Mar 31, 2026 22:43:01.421428000 W. Europe Summer Time
    UTC Arrival Time: Mar 31, 2026 20:43:01.421428000 UTC
    Epoch Arrival Time: 1774989781.421428000
    [Time shift for this packet: 0.000000000 seconds]
    [Time delta from previous captured frame: 7.646000 milliseconds]
    [Time delta from previous displayed frame: 7.646000 milliseconds]
    [Time since reference or first frame: 11.634768000 seconds]
    Frame Number: 3155
    Frame Length: 91 bytes (728 bits)
    Capture Length: 91 bytes (728 bits)
    [Frame is marked: False]
    [Frame is ignored: False]
    [Protocols in frame: usb:usbhid]
    Character encoding: ASCII (0)
USB URB
    [Source: 1.17.1]
    [Destination: host]
    USBPcap pseudoheader length: 27
    IRP ID: 0xffffa68649451010
    IRP USBD_STATUS: USBD_STATUS_SUCCESS (0x00000000)
    URB Function: URB_FUNCTION_BULK_OR_INTERRUPT_TRANSFER (0x0009)
    IRP information: 0x01, Direction: PDO -> FDO
    URB bus id: 1
    Device address: 17
    Endpoint: 0x81, Direction: IN
    URB transfer type: URB_INTERRUPT (0x01)
    Packet Data Length: 64
    [Request in: 3148]
    [Time from request: 18.967000 milliseconds]
    [bInterfaceClass: HID (0x03)]
HID Data: 1002010010290f44656661756c742050726573657410037800000000000000000000000010033d000000000000000000000000000000000000100331000abc8d

No.     Time           Source                Destination           Protocol Length Info
   3156 11.634783      host                  1.17.1                USB      27     URB_INTERRUPT in

Frame 3156: Packet, 27 bytes on wire (216 bits), 27 bytes captured (216 bits) on interface \\.\USBPcap1, id 0
    Section number: 1
    Interface id: 0 (\\.\USBPcap1)
    Encapsulation type: USB packets with USBPcap header (152)
    Arrival Time: Mar 31, 2026 22:43:01.421443000 W. Europe Summer Time
    UTC Arrival Time: Mar 31, 2026 20:43:01.421443000 UTC
    Epoch Arrival Time: 1774989781.421443000
    [Time shift for this packet: 0.000000000 seconds]
    [Time delta from previous captured frame: 15.000 microseconds]
    [Time delta from previous displayed frame: 15.000 microseconds]
    [Time since reference or first frame: 11.634783000 seconds]
    Frame Number: 3156
    Frame Length: 27 bytes (216 bits)
    Capture Length: 27 bytes (216 bits)
    [Frame is marked: False]
    [Frame is ignored: False]
    [Protocols in frame: usb]
    Character encoding: ASCII (0)
USB URB
    [Source: host]
    [Destination: 1.17.1]
    USBPcap pseudoheader length: 27
    IRP ID: 0xffffa68649451010
    IRP USBD_STATUS: USBD_STATUS_SUCCESS (0x00000000)
    URB Function: URB_FUNCTION_BULK_OR_INTERRUPT_TRANSFER (0x0009)
    IRP information: 0x00, Direction: FDO -> PDO
    URB bus id: 1
    Device address: 17
    Endpoint: 0x81, Direction: IN
    URB transfer type: URB_INTERRUPT (0x01)
    Packet Data Length: 0
    [Response in: 3163]
    [bInterfaceClass: HID (0x03)]

No.     Time           Source                Destination           Protocol Length Info
   3157 11.635376      host                  1.17.2                USB      91     URB_INTERRUPT out

Frame 3157: Packet, 91 bytes on wire (728 bits), 91 bytes captured (728 bits) on interface \\.\USBPcap1, id 0
    Section number: 1
    Interface id: 0 (\\.\USBPcap1)
    Encapsulation type: USB packets with USBPcap header (152)
    Arrival Time: Mar 31, 2026 22:43:01.422036000 W. Europe Summer Time
    UTC Arrival Time: Mar 31, 2026 20:43:01.422036000 UTC
    Epoch Arrival Time: 1774989781.422036000
    [Time shift for this packet: 0.000000000 seconds]
    [Time delta from previous captured frame: 593.000 microseconds]
    [Time delta from previous displayed frame: 593.000 microseconds]
    [Time since reference or first frame: 11.635376000 seconds]
    Frame Number: 3157
    Frame Length: 91 bytes (728 bits)
    Capture Length: 91 bytes (728 bits)
    [Frame is marked: False]
    [Frame is ignored: False]
    [Protocols in frame: usb:usbhid]
    Character encoding: ASCII (0)
USB URB
    [Source: host]
    [Destination: 1.17.2]
    USBPcap pseudoheader length: 27
    IRP ID: 0xffffa6864b0ce2a0
    IRP USBD_STATUS: USBD_STATUS_SUCCESS (0x00000000)
    URB Function: URB_FUNCTION_BULK_OR_INTERRUPT_TRANSFER (0x0009)
    IRP information: 0x00, Direction: FDO -> PDO
    URB bus id: 1
    Device address: 17
    Endpoint: 0x02, Direction: OUT
    URB transfer type: URB_INTERRUPT (0x01)
    Packet Data Length: 64
    [Response in: 3158]
    [bInterfaceClass: HID (0x03)]
HID Data: 1002000102291010033b0080a1f30398a1f303b85f050a774d400080a1f303774d400080a1f303c0fdfe041548400080a1f30398a1f303b85f050ad8fdfe04d8

No.     Time           Source                Destination           Protocol Length Info
   3158 11.637126      1.17.2                host                  USB      27     URB_INTERRUPT out

Frame 3158: Packet, 27 bytes on wire (216 bits), 27 bytes captured (216 bits) on interface \\.\USBPcap1, id 0
    Section number: 1
    Interface id: 0 (\\.\USBPcap1)
    Encapsulation type: USB packets with USBPcap header (152)
    Arrival Time: Mar 31, 2026 22:43:01.423786000 W. Europe Summer Time
    UTC Arrival Time: Mar 31, 2026 20:43:01.423786000 UTC
    Epoch Arrival Time: 1774989781.423786000
    [Time shift for this packet: 0.000000000 seconds]
    [Time delta from previous captured frame: 1.750000 milliseconds]
    [Time delta from previous displayed frame: 1.750000 milliseconds]
    [Time since reference or first frame: 11.637126000 seconds]
    Frame Number: 3158
    Frame Length: 27 bytes (216 bits)
    Capture Length: 27 bytes (216 bits)
    [Frame is marked: False]
    [Frame is ignored: False]
    [Protocols in frame: usb]
    Character encoding: ASCII (0)
USB URB
    [Source: 1.17.2]
    [Destination: host]
    USBPcap pseudoheader length: 27
    IRP ID: 0xffffa6864b0ce2a0
    IRP USBD_STATUS: USBD_STATUS_SUCCESS (0x00000000)
    URB Function: URB_FUNCTION_BULK_OR_INTERRUPT_TRANSFER (0x0009)
    IRP information: 0x01, Direction: PDO -> FDO
    URB bus id: 1
    Device address: 17
    Endpoint: 0x02, Direction: OUT
    URB transfer type: URB_INTERRUPT (0x01)
    Packet Data Length: 0
    [Request in: 3157]
    [Time from request: 1.750000 milliseconds]
    [bInterfaceClass: HID (0x03)]

No.     Time           Source                Destination           Protocol Length Info
   3159 11.644764      1.17.1                host                  USB      91     URB_INTERRUPT in

Frame 3159: Packet, 91 bytes on wire (728 bits), 91 bytes captured (728 bits) on interface \\.\USBPcap1, id 0
    Section number: 1
    Interface id: 0 (\\.\USBPcap1)
    Encapsulation type: USB packets with USBPcap header (152)
    Arrival Time: Mar 31, 2026 22:43:01.431424000 W. Europe Summer Time
    UTC Arrival Time: Mar 31, 2026 20:43:01.431424000 UTC
    Epoch Arrival Time: 1774989781.431424000
    [Time shift for this packet: 0.000000000 seconds]
    [Time delta from previous captured frame: 7.638000 milliseconds]
    [Time delta from previous displayed frame: 7.638000 milliseconds]
    [Time since reference or first frame: 11.644764000 seconds]
    Frame Number: 3159
    Frame Length: 91 bytes (728 bits)
    Capture Length: 91 bytes (728 bits)
    [Frame is marked: False]
    [Frame is ignored: False]
    [Protocols in frame: usb:usbhid]
    Character encoding: ASCII (0)
USB URB
    [Source: 1.17.1]
    [Destination: host]
    USBPcap pseudoheader length: 27
    IRP ID: 0xffffa686494500d0
    IRP USBD_STATUS: USBD_STATUS_SUCCESS (0x00000000)
    URB Function: URB_FUNCTION_BULK_OR_INTERRUPT_TRANSFER (0x0009)
    IRP information: 0x01, Direction: PDO -> FDO
    URB bus id: 1
    Device address: 17
    Endpoint: 0x81, Direction: IN
    URB transfer type: URB_INTERRUPT (0x01)
    Packet Data Length: 64
    [Request in: 3152]
    [Time from request: 19.956000 milliseconds]
    [bInterfaceClass: HID (0x03)]
HID Data: 1002010010291044656661756c742050726573657410036700000000000000000000000010033d000000000000000000000000000000000000100331000abc8d

No.     Time           Source                Destination           Protocol Length Info
   3160 11.644777      host                  1.17.1                USB      27     URB_INTERRUPT in

Frame 3160: Packet, 27 bytes on wire (216 bits), 27 bytes captured (216 bits) on interface \\.\USBPcap1, id 0
    Section number: 1
    Interface id: 0 (\\.\USBPcap1)
    Encapsulation type: USB packets with USBPcap header (152)
    Arrival Time: Mar 31, 2026 22:43:01.431437000 W. Europe Summer Time
    UTC Arrival Time: Mar 31, 2026 20:43:01.431437000 UTC
    Epoch Arrival Time: 1774989781.431437000
    [Time shift for this packet: 0.000000000 seconds]
    [Time delta from previous captured frame: 13.000 microseconds]
    [Time delta from previous displayed frame: 13.000 microseconds]
    [Time since reference or first frame: 11.644777000 seconds]
    Frame Number: 3160
    Frame Length: 27 bytes (216 bits)
    Capture Length: 27 bytes (216 bits)
    [Frame is marked: False]
    [Frame is ignored: False]
    [Protocols in frame: usb]
    Character encoding: ASCII (0)
USB URB
    [Source: host]
    [Destination: 1.17.1]
    USBPcap pseudoheader length: 27
    IRP ID: 0xffffa686494500d0
    IRP USBD_STATUS: USBD_STATUS_SUCCESS (0x00000000)
    URB Function: URB_FUNCTION_BULK_OR_INTERRUPT_TRANSFER (0x0009)
    IRP information: 0x00, Direction: FDO -> PDO
    URB bus id: 1
    Device address: 17
    Endpoint: 0x81, Direction: IN
    URB transfer type: URB_INTERRUPT (0x01)
    Packet Data Length: 0
    [Response in: 3167]
    [bInterfaceClass: HID (0x03)]

No.     Time           Source                Destination           Protocol Length Info
   3161 11.645445      host                  1.17.2                USB      91     URB_INTERRUPT out

Frame 3161: Packet, 91 bytes on wire (728 bits), 91 bytes captured (728 bits) on interface \\.\USBPcap1, id 0
    Section number: 1
    Interface id: 0 (\\.\USBPcap1)
    Encapsulation type: USB packets with USBPcap header (152)
    Arrival Time: Mar 31, 2026 22:43:01.432105000 W. Europe Summer Time
    UTC Arrival Time: Mar 31, 2026 20:43:01.432105000 UTC
    Epoch Arrival Time: 1774989781.432105000
    [Time shift for this packet: 0.000000000 seconds]
    [Time delta from previous captured frame: 668.000 microseconds]
    [Time delta from previous displayed frame: 668.000 microseconds]
    [Time since reference or first frame: 11.645445000 seconds]
    Frame Number: 3161
    Frame Length: 91 bytes (728 bits)
    Capture Length: 91 bytes (728 bits)
    [Frame is marked: False]
    [Frame is ignored: False]
    [Protocols in frame: usb:usbhid]
    Character encoding: ASCII (0)
USB URB
    [Source: host]
    [Destination: 1.17.2]
    USBPcap pseudoheader length: 27
    IRP ID: 0xffffa6864295d010
    IRP USBD_STATUS: USBD_STATUS_SUCCESS (0x00000000)
    URB Function: URB_FUNCTION_BULK_OR_INTERRUPT_TRANSFER (0x0009)
    IRP information: 0x00, Direction: FDO -> PDO
    URB bus id: 1
    Device address: 17
    Endpoint: 0x02, Direction: OUT
    URB transfer type: URB_INTERRUPT (0x01)
    Packet Data Length: 64
    [Response in: 3162]
    [bInterfaceClass: HID (0x03)]
HID Data: 1002000102291110033a0080a1f30398a1f303b85f050a774d400080a1f303774d400080a1f303c0fdfe041548400080a1f30398a1f303b85f050ad8fdfe04d8

No.     Time           Source                Destination           Protocol Length Info
   3162 11.647122      1.17.2                host                  USB      27     URB_INTERRUPT out

Frame 3162: Packet, 27 bytes on wire (216 bits), 27 bytes captured (216 bits) on interface \\.\USBPcap1, id 0
    Section number: 1
    Interface id: 0 (\\.\USBPcap1)
    Encapsulation type: USB packets with USBPcap header (152)
    Arrival Time: Mar 31, 2026 22:43:01.433782000 W. Europe Summer Time
    UTC Arrival Time: Mar 31, 2026 20:43:01.433782000 UTC
    Epoch Arrival Time: 1774989781.433782000
    [Time shift for this packet: 0.000000000 seconds]
    [Time delta from previous captured frame: 1.677000 milliseconds]
    [Time delta from previous displayed frame: 1.677000 milliseconds]
    [Time since reference or first frame: 11.647122000 seconds]
    Frame Number: 3162
    Frame Length: 27 bytes (216 bits)
    Capture Length: 27 bytes (216 bits)
    [Frame is marked: False]
    [Frame is ignored: False]
    [Protocols in frame: usb]
    Character encoding: ASCII (0)
USB URB
    [Source: 1.17.2]
    [Destination: host]
    USBPcap pseudoheader length: 27
    IRP ID: 0xffffa6864295d010
    IRP USBD_STATUS: USBD_STATUS_SUCCESS (0x00000000)
    URB Function: URB_FUNCTION_BULK_OR_INTERRUPT_TRANSFER (0x0009)
    IRP information: 0x01, Direction: PDO -> FDO
    URB bus id: 1
    Device address: 17
    Endpoint: 0x02, Direction: OUT
    URB transfer type: URB_INTERRUPT (0x01)
    Packet Data Length: 0
    [Request in: 3161]
    [Time from request: 1.677000 milliseconds]
    [bInterfaceClass: HID (0x03)]

No.     Time           Source                Destination           Protocol Length Info
   3163 11.654768      1.17.1                host                  USB      91     URB_INTERRUPT in

Frame 3163: Packet, 91 bytes on wire (728 bits), 91 bytes captured (728 bits) on interface \\.\USBPcap1, id 0
    Section number: 1
    Interface id: 0 (\\.\USBPcap1)
    Encapsulation type: USB packets with USBPcap header (152)
    Arrival Time: Mar 31, 2026 22:43:01.441428000 W. Europe Summer Time
    UTC Arrival Time: Mar 31, 2026 20:43:01.441428000 UTC
    Epoch Arrival Time: 1774989781.441428000
    [Time shift for this packet: 0.000000000 seconds]
    [Time delta from previous captured frame: 7.646000 milliseconds]
    [Time delta from previous displayed frame: 7.646000 milliseconds]
    [Time since reference or first frame: 11.654768000 seconds]
    Frame Number: 3163
    Frame Length: 91 bytes (728 bits)
    Capture Length: 91 bytes (728 bits)
    [Frame is marked: False]
    [Frame is ignored: False]
    [Protocols in frame: usb:usbhid]
    Character encoding: ASCII (0)
USB URB
    [Source: 1.17.1]
    [Destination: host]
    USBPcap pseudoheader length: 27
    IRP ID: 0xffffa68649451010
    IRP USBD_STATUS: USBD_STATUS_SUCCESS (0x00000000)
    URB Function: URB_FUNCTION_BULK_OR_INTERRUPT_TRANSFER (0x0009)
    IRP information: 0x01, Direction: PDO -> FDO
    URB bus id: 1
    Device address: 17
    Endpoint: 0x81, Direction: IN
    URB transfer type: URB_INTERRUPT (0x01)
    Packet Data Length: 64
    [Request in: 3156]
    [Time from request: 19.985000 milliseconds]
    [bInterfaceClass: HID (0x03)]
HID Data: 1002010010291144656661756c742050726573657410036600000000000000000000000010033d000000000000000000000000000000000000100331000abc8d

No.     Time           Source                Destination           Protocol Length Info
   3164 11.654792      host                  1.17.1                USB      27     URB_INTERRUPT in

Frame 3164: Packet, 27 bytes on wire (216 bits), 27 bytes captured (216 bits) on interface \\.\USBPcap1, id 0
    Section number: 1
    Interface id: 0 (\\.\USBPcap1)
    Encapsulation type: USB packets with USBPcap header (152)
    Arrival Time: Mar 31, 2026 22:43:01.441452000 W. Europe Summer Time
    UTC Arrival Time: Mar 31, 2026 20:43:01.441452000 UTC
    Epoch Arrival Time: 1774989781.441452000
    [Time shift for this packet: 0.000000000 seconds]
    [Time delta from previous captured frame: 24.000 microseconds]
    [Time delta from previous displayed frame: 24.000 microseconds]
    [Time since reference or first frame: 11.654792000 seconds]
    Frame Number: 3164
    Frame Length: 27 bytes (216 bits)
    Capture Length: 27 bytes (216 bits)
    [Frame is marked: False]
    [Frame is ignored: False]
    [Protocols in frame: usb]
    Character encoding: ASCII (0)
USB URB
    [Source: host]
    [Destination: 1.17.1]
    USBPcap pseudoheader length: 27
    IRP ID: 0xffffa68649451010
    IRP USBD_STATUS: USBD_STATUS_SUCCESS (0x00000000)
    URB Function: URB_FUNCTION_BULK_OR_INTERRUPT_TRANSFER (0x0009)
    IRP information: 0x00, Direction: FDO -> PDO
    URB bus id: 1
    Device address: 17
    Endpoint: 0x81, Direction: IN
    URB transfer type: URB_INTERRUPT (0x01)
    Packet Data Length: 0
    [Response in: 3171]
    [bInterfaceClass: HID (0x03)]

No.     Time           Source                Destination           Protocol Length Info
   3165 11.655539      host                  1.17.2                USB      91     URB_INTERRUPT out

Frame 3165: Packet, 91 bytes on wire (728 bits), 91 bytes captured (728 bits) on interface \\.\USBPcap1, id 0
    Section number: 1
    Interface id: 0 (\\.\USBPcap1)
    Encapsulation type: USB packets with USBPcap header (152)
    Arrival Time: Mar 31, 2026 22:43:01.442199000 W. Europe Summer Time
    UTC Arrival Time: Mar 31, 2026 20:43:01.442199000 UTC
    Epoch Arrival Time: 1774989781.442199000
    [Time shift for this packet: 0.000000000 seconds]
    [Time delta from previous captured frame: 747.000 microseconds]
    [Time delta from previous displayed frame: 747.000 microseconds]
    [Time since reference or first frame: 11.655539000 seconds]
    Frame Number: 3165
    Frame Length: 91 bytes (728 bits)
    Capture Length: 91 bytes (728 bits)
    [Frame is marked: False]
    [Frame is ignored: False]
    [Protocols in frame: usb:usbhid]
    Character encoding: ASCII (0)
USB URB
    [Source: host]
    [Destination: 1.17.2]
    USBPcap pseudoheader length: 27
    IRP ID: 0xffffa686087ee010
    IRP USBD_STATUS: USBD_STATUS_SUCCESS (0x00000000)
    URB Function: URB_FUNCTION_BULK_OR_INTERRUPT_TRANSFER (0x0009)
    IRP information: 0x00, Direction: FDO -> PDO
    URB bus id: 1
    Device address: 17
    Endpoint: 0x02, Direction: OUT
    URB transfer type: URB_INTERRUPT (0x01)
    Packet Data Length: 64
    [Response in: 3166]
    [bInterfaceClass: HID (0x03)]
HID Data: 100200010229121003390080a1f30398a1f303b85f050a774d400080a1f303774d400080a1f303c0fdfe041548400080a1f30398a1f303b85f050ad8fdfe04d8

No.     Time           Source                Destination           Protocol Length Info
   3166 11.657121      1.17.2                host                  USB      27     URB_INTERRUPT out

Frame 3166: Packet, 27 bytes on wire (216 bits), 27 bytes captured (216 bits) on interface \\.\USBPcap1, id 0
    Section number: 1
    Interface id: 0 (\\.\USBPcap1)
    Encapsulation type: USB packets with USBPcap header (152)
    Arrival Time: Mar 31, 2026 22:43:01.443781000 W. Europe Summer Time
    UTC Arrival Time: Mar 31, 2026 20:43:01.443781000 UTC
    Epoch Arrival Time: 1774989781.443781000
    [Time shift for this packet: 0.000000000 seconds]
    [Time delta from previous captured frame: 1.582000 milliseconds]
    [Time delta from previous displayed frame: 1.582000 milliseconds]
    [Time since reference or first frame: 11.657121000 seconds]
    Frame Number: 3166
    Frame Length: 27 bytes (216 bits)
    Capture Length: 27 bytes (216 bits)
    [Frame is marked: False]
    [Frame is ignored: False]
    [Protocols in frame: usb]
    Character encoding: ASCII (0)
USB URB
    [Source: 1.17.2]
    [Destination: host]
    USBPcap pseudoheader length: 27
    IRP ID: 0xffffa686087ee010
    IRP USBD_STATUS: USBD_STATUS_SUCCESS (0x00000000)
    URB Function: URB_FUNCTION_BULK_OR_INTERRUPT_TRANSFER (0x0009)
    IRP information: 0x01, Direction: PDO -> FDO
    URB bus id: 1
    Device address: 17
    Endpoint: 0x02, Direction: OUT
    URB transfer type: URB_INTERRUPT (0x01)
    Packet Data Length: 0
    [Request in: 3165]
    [Time from request: 1.582000 milliseconds]
    [bInterfaceClass: HID (0x03)]

No.     Time           Source                Destination           Protocol Length Info
   3167 11.664774      1.17.1                host                  USB      91     URB_INTERRUPT in

Frame 3167: Packet, 91 bytes on wire (728 bits), 91 bytes captured (728 bits) on interface \\.\USBPcap1, id 0
    Section number: 1
    Interface id: 0 (\\.\USBPcap1)
    Encapsulation type: USB packets with USBPcap header (152)
    Arrival Time: Mar 31, 2026 22:43:01.451434000 W. Europe Summer Time
    UTC Arrival Time: Mar 31, 2026 20:43:01.451434000 UTC
    Epoch Arrival Time: 1774989781.451434000
    [Time shift for this packet: 0.000000000 seconds]
    [Time delta from previous captured frame: 7.653000 milliseconds]
    [Time delta from previous displayed frame: 7.653000 milliseconds]
    [Time since reference or first frame: 11.664774000 seconds]
    Frame Number: 3167
    Frame Length: 91 bytes (728 bits)
    Capture Length: 91 bytes (728 bits)
    [Frame is marked: False]
    [Frame is ignored: False]
    [Protocols in frame: usb:usbhid]
    Character encoding: ASCII (0)
USB URB
    [Source: 1.17.1]
    [Destination: host]
    USBPcap pseudoheader length: 27
    IRP ID: 0xffffa686494500d0
    IRP USBD_STATUS: USBD_STATUS_SUCCESS (0x00000000)
    URB Function: URB_FUNCTION_BULK_OR_INTERRUPT_TRANSFER (0x0009)
    IRP information: 0x01, Direction: PDO -> FDO
    URB bus id: 1
    Device address: 17
    Endpoint: 0x81, Direction: IN
    URB transfer type: URB_INTERRUPT (0x01)
    Packet Data Length: 64
    [Request in: 3160]
    [Time from request: 19.997000 milliseconds]
    [bInterfaceClass: HID (0x03)]
HID Data: 1002010010291244656661756c742050726573657410036500000000000000000000000010033d000000000000000000000000000000000000100331000abc8d

No.     Time           Source                Destination           Protocol Length Info
   3168 11.664802      host                  1.17.1                USB      27     URB_INTERRUPT in

Frame 3168: Packet, 27 bytes on wire (216 bits), 27 bytes captured (216 bits) on interface \\.\USBPcap1, id 0
    Section number: 1
    Interface id: 0 (\\.\USBPcap1)
    Encapsulation type: USB packets with USBPcap header (152)
    Arrival Time: Mar 31, 2026 22:43:01.451462000 W. Europe Summer Time
    UTC Arrival Time: Mar 31, 2026 20:43:01.451462000 UTC
    Epoch Arrival Time: 1774989781.451462000
    [Time shift for this packet: 0.000000000 seconds]
    [Time delta from previous captured frame: 28.000 microseconds]
    [Time delta from previous displayed frame: 28.000 microseconds]
    [Time since reference or first frame: 11.664802000 seconds]
    Frame Number: 3168
    Frame Length: 27 bytes (216 bits)
    Capture Length: 27 bytes (216 bits)
    [Frame is marked: False]
    [Frame is ignored: False]
    [Protocols in frame: usb]
    Character encoding: ASCII (0)
USB URB
    [Source: host]
    [Destination: 1.17.1]
    USBPcap pseudoheader length: 27
    IRP ID: 0xffffa686494500d0
    IRP USBD_STATUS: USBD_STATUS_SUCCESS (0x00000000)
    URB Function: URB_FUNCTION_BULK_OR_INTERRUPT_TRANSFER (0x0009)
    IRP information: 0x00, Direction: FDO -> PDO
    URB bus id: 1
    Device address: 17
    Endpoint: 0x81, Direction: IN
    URB transfer type: URB_INTERRUPT (0x01)
    Packet Data Length: 0
    [Response in: 3175]
    [bInterfaceClass: HID (0x03)]

No.     Time           Source                Destination           Protocol Length Info
   3169 11.665568      host                  1.17.2                USB      91     URB_INTERRUPT out

Frame 3169: Packet, 91 bytes on wire (728 bits), 91 bytes captured (728 bits) on interface \\.\USBPcap1, id 0
    Section number: 1
    Interface id: 0 (\\.\USBPcap1)
    Encapsulation type: USB packets with USBPcap header (152)
    Arrival Time: Mar 31, 2026 22:43:01.452228000 W. Europe Summer Time
    UTC Arrival Time: Mar 31, 2026 20:43:01.452228000 UTC
    Epoch Arrival Time: 1774989781.452228000
    [Time shift for this packet: 0.000000000 seconds]
    [Time delta from previous captured frame: 766.000 microseconds]
    [Time delta from previous displayed frame: 766.000 microseconds]
    [Time since reference or first frame: 11.665568000 seconds]
    Frame Number: 3169
    Frame Length: 91 bytes (728 bits)
    Capture Length: 91 bytes (728 bits)
    [Frame is marked: False]
    [Frame is ignored: False]
    [Protocols in frame: usb:usbhid]
    Character encoding: ASCII (0)
USB URB
    [Source: host]
    [Destination: 1.17.2]
    USBPcap pseudoheader length: 27
    IRP ID: 0xffffa6864b1e2010
    IRP USBD_STATUS: USBD_STATUS_SUCCESS (0x00000000)
    URB Function: URB_FUNCTION_BULK_OR_INTERRUPT_TRANSFER (0x0009)
    IRP information: 0x00, Direction: FDO -> PDO
    URB bus id: 1
    Device address: 17
    Endpoint: 0x02, Direction: OUT
    URB transfer type: URB_INTERRUPT (0x01)
    Packet Data Length: 64
    [Response in: 3170]
    [bInterfaceClass: HID (0x03)]
HID Data: 100200010229131003380080a1f30398a1f303b85f050a774d400080a1f303774d400080a1f303c0fdfe041548400080a1f30398a1f303b85f050ad8fdfe04d8

No.     Time           Source                Destination           Protocol Length Info
   3170 11.667121      1.17.2                host                  USB      27     URB_INTERRUPT out

Frame 3170: Packet, 27 bytes on wire (216 bits), 27 bytes captured (216 bits) on interface \\.\USBPcap1, id 0
    Section number: 1
    Interface id: 0 (\\.\USBPcap1)
    Encapsulation type: USB packets with USBPcap header (152)
    Arrival Time: Mar 31, 2026 22:43:01.453781000 W. Europe Summer Time
    UTC Arrival Time: Mar 31, 2026 20:43:01.453781000 UTC
    Epoch Arrival Time: 1774989781.453781000
    [Time shift for this packet: 0.000000000 seconds]
    [Time delta from previous captured frame: 1.553000 milliseconds]
    [Time delta from previous displayed frame: 1.553000 milliseconds]
    [Time since reference or first frame: 11.667121000 seconds]
    Frame Number: 3170
    Frame Length: 27 bytes (216 bits)
    Capture Length: 27 bytes (216 bits)
    [Frame is marked: False]
    [Frame is ignored: False]
    [Protocols in frame: usb]
    Character encoding: ASCII (0)
USB URB
    [Source: 1.17.2]
    [Destination: host]
    USBPcap pseudoheader length: 27
    IRP ID: 0xffffa6864b1e2010
    IRP USBD_STATUS: USBD_STATUS_SUCCESS (0x00000000)
    URB Function: URB_FUNCTION_BULK_OR_INTERRUPT_TRANSFER (0x0009)
    IRP information: 0x01, Direction: PDO -> FDO
    URB bus id: 1
    Device address: 17
    Endpoint: 0x02, Direction: OUT
    URB transfer type: URB_INTERRUPT (0x01)
    Packet Data Length: 0
    [Request in: 3169]
    [Time from request: 1.553000 milliseconds]
    [bInterfaceClass: HID (0x03)]

No.     Time           Source                Destination           Protocol Length Info
   3171 11.674767      1.17.1                host                  USB      91     URB_INTERRUPT in

Frame 3171: Packet, 91 bytes on wire (728 bits), 91 bytes captured (728 bits) on interface \\.\USBPcap1, id 0
    Section number: 1
    Interface id: 0 (\\.\USBPcap1)
    Encapsulation type: USB packets with USBPcap header (152)
    Arrival Time: Mar 31, 2026 22:43:01.461427000 W. Europe Summer Time
    UTC Arrival Time: Mar 31, 2026 20:43:01.461427000 UTC
    Epoch Arrival Time: 1774989781.461427000
    [Time shift for this packet: 0.000000000 seconds]
    [Time delta from previous captured frame: 7.646000 milliseconds]
    [Time delta from previous displayed frame: 7.646000 milliseconds]
    [Time since reference or first frame: 11.674767000 seconds]
    Frame Number: 3171
    Frame Length: 91 bytes (728 bits)
    Capture Length: 91 bytes (728 bits)
    [Frame is marked: False]
    [Frame is ignored: False]
    [Protocols in frame: usb:usbhid]
    Character encoding: ASCII (0)
USB URB
    [Source: 1.17.1]
    [Destination: host]
    USBPcap pseudoheader length: 27
    IRP ID: 0xffffa68649451010
    IRP USBD_STATUS: USBD_STATUS_SUCCESS (0x00000000)
    URB Function: URB_FUNCTION_BULK_OR_INTERRUPT_TRANSFER (0x0009)
    IRP information: 0x01, Direction: PDO -> FDO
    URB bus id: 1
    Device address: 17
    Endpoint: 0x81, Direction: IN
    URB transfer type: URB_INTERRUPT (0x01)
    Packet Data Length: 64
    [Request in: 3164]
    [Time from request: 19.975000 milliseconds]
    [bInterfaceClass: HID (0x03)]
HID Data: 1002010010291344656661756c742050726573657410036400000000000000000000000010033d000000000000000000000000000000000000100331000abc8d

No.     Time           Source                Destination           Protocol Length Info
   3172 11.674791      host                  1.17.1                USB      27     URB_INTERRUPT in

Frame 3172: Packet, 27 bytes on wire (216 bits), 27 bytes captured (216 bits) on interface \\.\USBPcap1, id 0
    Section number: 1
    Interface id: 0 (\\.\USBPcap1)
    Encapsulation type: USB packets with USBPcap header (152)
    Arrival Time: Mar 31, 2026 22:43:01.461451000 W. Europe Summer Time
    UTC Arrival Time: Mar 31, 2026 20:43:01.461451000 UTC
    Epoch Arrival Time: 1774989781.461451000
    [Time shift for this packet: 0.000000000 seconds]
    [Time delta from previous captured frame: 24.000 microseconds]
    [Time delta from previous displayed frame: 24.000 microseconds]
    [Time since reference or first frame: 11.674791000 seconds]
    Frame Number: 3172
    Frame Length: 27 bytes (216 bits)
    Capture Length: 27 bytes (216 bits)
    [Frame is marked: False]
    [Frame is ignored: False]
    [Protocols in frame: usb]
    Character encoding: ASCII (0)
USB URB
    [Source: host]
    [Destination: 1.17.1]
    USBPcap pseudoheader length: 27
    IRP ID: 0xffffa68649451010
    IRP USBD_STATUS: USBD_STATUS_SUCCESS (0x00000000)
    URB Function: URB_FUNCTION_BULK_OR_INTERRUPT_TRANSFER (0x0009)
    IRP information: 0x00, Direction: FDO -> PDO
    URB bus id: 1
    Device address: 17
    Endpoint: 0x81, Direction: IN
    URB transfer type: URB_INTERRUPT (0x01)
    Packet Data Length: 0
    [Response in: 3179]
    [bInterfaceClass: HID (0x03)]

No.     Time           Source                Destination           Protocol Length Info
   3173 11.675512      host                  1.17.2                USB      91     URB_INTERRUPT out

Frame 3173: Packet, 91 bytes on wire (728 bits), 91 bytes captured (728 bits) on interface \\.\USBPcap1, id 0
    Section number: 1
    Interface id: 0 (\\.\USBPcap1)
    Encapsulation type: USB packets with USBPcap header (152)
    Arrival Time: Mar 31, 2026 22:43:01.462172000 W. Europe Summer Time
    UTC Arrival Time: Mar 31, 2026 20:43:01.462172000 UTC
    Epoch Arrival Time: 1774989781.462172000
    [Time shift for this packet: 0.000000000 seconds]
    [Time delta from previous captured frame: 721.000 microseconds]
    [Time delta from previous displayed frame: 721.000 microseconds]
    [Time since reference or first frame: 11.675512000 seconds]
    Frame Number: 3173
    Frame Length: 91 bytes (728 bits)
    Capture Length: 91 bytes (728 bits)
    [Frame is marked: False]
    [Frame is ignored: False]
    [Protocols in frame: usb:usbhid]
    Character encoding: ASCII (0)
USB URB
    [Source: host]
    [Destination: 1.17.2]
    USBPcap pseudoheader length: 27
    IRP ID: 0xffffa6864976a560
    IRP USBD_STATUS: USBD_STATUS_SUCCESS (0x00000000)
    URB Function: URB_FUNCTION_BULK_OR_INTERRUPT_TRANSFER (0x0009)
    IRP information: 0x00, Direction: FDO -> PDO
    URB bus id: 1
    Device address: 17
    Endpoint: 0x02, Direction: OUT
    URB transfer type: URB_INTERRUPT (0x01)
    Packet Data Length: 64
    [Response in: 3174]
    [bInterfaceClass: HID (0x03)]
HID Data: 1002000102291410033f0080a1f30398a1f303b85f050a774d400080a1f303774d400080a1f303c0fdfe041548400080a1f30398a1f303b85f050ad8fdfe04d8

No.     Time           Source                Destination           Protocol Length Info
   3174 11.677119      1.17.2                host                  USB      27     URB_INTERRUPT out

Frame 3174: Packet, 27 bytes on wire (216 bits), 27 bytes captured (216 bits) on interface \\.\USBPcap1, id 0
    Section number: 1
    Interface id: 0 (\\.\USBPcap1)
    Encapsulation type: USB packets with USBPcap header (152)
    Arrival Time: Mar 31, 2026 22:43:01.463779000 W. Europe Summer Time
    UTC Arrival Time: Mar 31, 2026 20:43:01.463779000 UTC
    Epoch Arrival Time: 1774989781.463779000
    [Time shift for this packet: 0.000000000 seconds]
    [Time delta from previous captured frame: 1.607000 milliseconds]
    [Time delta from previous displayed frame: 1.607000 milliseconds]
    [Time since reference or first frame: 11.677119000 seconds]
    Frame Number: 3174
    Frame Length: 27 bytes (216 bits)
    Capture Length: 27 bytes (216 bits)
    [Frame is marked: False]
    [Frame is ignored: False]
    [Protocols in frame: usb]
    Character encoding: ASCII (0)
USB URB
    [Source: 1.17.2]
    [Destination: host]
    USBPcap pseudoheader length: 27
    IRP ID: 0xffffa6864976a560
    IRP USBD_STATUS: USBD_STATUS_SUCCESS (0x00000000)
    URB Function: URB_FUNCTION_BULK_OR_INTERRUPT_TRANSFER (0x0009)
    IRP information: 0x01, Direction: PDO -> FDO
    URB bus id: 1
    Device address: 17
    Endpoint: 0x02, Direction: OUT
    URB transfer type: URB_INTERRUPT (0x01)
    Packet Data Length: 0
    [Request in: 3173]
    [Time from request: 1.607000 milliseconds]
    [bInterfaceClass: HID (0x03)]

No.     Time           Source                Destination           Protocol Length Info
   3175 11.697768      1.17.1                host                  USB      91     URB_INTERRUPT in

Frame 3175: Packet, 91 bytes on wire (728 bits), 91 bytes captured (728 bits) on interface \\.\USBPcap1, id 0
    Section number: 1
    Interface id: 0 (\\.\USBPcap1)
    Encapsulation type: USB packets with USBPcap header (152)
    Arrival Time: Mar 31, 2026 22:43:01.484428000 W. Europe Summer Time
    UTC Arrival Time: Mar 31, 2026 20:43:01.484428000 UTC
    Epoch Arrival Time: 1774989781.484428000
    [Time shift for this packet: 0.000000000 seconds]
    [Time delta from previous captured frame: 20.649000 milliseconds]
    [Time delta from previous displayed frame: 20.649000 milliseconds]
    [Time since reference or first frame: 11.697768000 seconds]
    Frame Number: 3175
    Frame Length: 91 bytes (728 bits)
    Capture Length: 91 bytes (728 bits)
    [Frame is marked: False]
    [Frame is ignored: False]
    [Protocols in frame: usb:usbhid]
    Character encoding: ASCII (0)
USB URB
    [Source: 1.17.1]
    [Destination: host]
    USBPcap pseudoheader length: 27
    IRP ID: 0xffffa686494500d0
    IRP USBD_STATUS: USBD_STATUS_SUCCESS (0x00000000)
    URB Function: URB_FUNCTION_BULK_OR_INTERRUPT_TRANSFER (0x0009)
    IRP information: 0x01, Direction: PDO -> FDO
    URB bus id: 1
    Device address: 17
    Endpoint: 0x81, Direction: IN
    URB transfer type: URB_INTERRUPT (0x01)
    Packet Data Length: 64
    [Request in: 3168]
    [Time from request: 32.966000 milliseconds]
    [bInterfaceClass: HID (0x03)]
HID Data: 1002010010291444656661756c742050726573657410036300000000000000000000000010033d000000000000000000000000000000000000100331000abc8d

No.     Time           Source                Destination           Protocol Length Info
   3176 11.697794      host                  1.17.1                USB      27     URB_INTERRUPT in

Frame 3176: Packet, 27 bytes on wire (216 bits), 27 bytes captured (216 bits) on interface \\.\USBPcap1, id 0
    Section number: 1
    Interface id: 0 (\\.\USBPcap1)
    Encapsulation type: USB packets with USBPcap header (152)
    Arrival Time: Mar 31, 2026 22:43:01.484454000 W. Europe Summer Time
    UTC Arrival Time: Mar 31, 2026 20:43:01.484454000 UTC
    Epoch Arrival Time: 1774989781.484454000
    [Time shift for this packet: 0.000000000 seconds]
    [Time delta from previous captured frame: 26.000 microseconds]
    [Time delta from previous displayed frame: 26.000 microseconds]
    [Time since reference or first frame: 11.697794000 seconds]
    Frame Number: 3176
    Frame Length: 27 bytes (216 bits)
    Capture Length: 27 bytes (216 bits)
    [Frame is marked: False]
    [Frame is ignored: False]
    [Protocols in frame: usb]
    Character encoding: ASCII (0)
USB URB
    [Source: host]
    [Destination: 1.17.1]
    USBPcap pseudoheader length: 27
    IRP ID: 0xffffa686494500d0
    IRP USBD_STATUS: USBD_STATUS_SUCCESS (0x00000000)
    URB Function: URB_FUNCTION_BULK_OR_INTERRUPT_TRANSFER (0x0009)
    IRP information: 0x00, Direction: FDO -> PDO
    URB bus id: 1
    Device address: 17
    Endpoint: 0x81, Direction: IN
    URB transfer type: URB_INTERRUPT (0x01)
    Packet Data Length: 0
    [Response in: 3183]
    [bInterfaceClass: HID (0x03)]

No.     Time           Source                Destination           Protocol Length Info
   3177 11.698475      host                  1.17.2                USB      91     URB_INTERRUPT out

Frame 3177: Packet, 91 bytes on wire (728 bits), 91 bytes captured (728 bits) on interface \\.\USBPcap1, id 0
    Section number: 1
    Interface id: 0 (\\.\USBPcap1)
    Encapsulation type: USB packets with USBPcap header (152)
    Arrival Time: Mar 31, 2026 22:43:01.485135000 W. Europe Summer Time
    UTC Arrival Time: Mar 31, 2026 20:43:01.485135000 UTC
    Epoch Arrival Time: 1774989781.485135000
    [Time shift for this packet: 0.000000000 seconds]
    [Time delta from previous captured frame: 681.000 microseconds]
    [Time delta from previous displayed frame: 681.000 microseconds]
    [Time since reference or first frame: 11.698475000 seconds]
    Frame Number: 3177
    Frame Length: 91 bytes (728 bits)
    Capture Length: 91 bytes (728 bits)
    [Frame is marked: False]
    [Frame is ignored: False]
    [Protocols in frame: usb:usbhid]
    Character encoding: ASCII (0)
USB URB
    [Source: host]
    [Destination: 1.17.2]
    USBPcap pseudoheader length: 27
    IRP ID: 0xffffa686497ed010
    IRP USBD_STATUS: USBD_STATUS_SUCCESS (0x00000000)
    URB Function: URB_FUNCTION_BULK_OR_INTERRUPT_TRANSFER (0x0009)
    IRP information: 0x00, Direction: FDO -> PDO
    URB bus id: 1
    Device address: 17
    Endpoint: 0x02, Direction: OUT
    URB transfer type: URB_INTERRUPT (0x01)
    Packet Data Length: 64
    [Response in: 3178]
    [bInterfaceClass: HID (0x03)]
HID Data: 1002000102291510033e0080a1f30398a1f303b85f050a774d400080a1f303774d400080a1f303c0fdfe041548400080a1f30398a1f303b85f050ad8fdfe04d8

No.     Time           Source                Destination           Protocol Length Info
   3178 11.700195      1.17.2                host                  USB      27     URB_INTERRUPT out

Frame 3178: Packet, 27 bytes on wire (216 bits), 27 bytes captured (216 bits) on interface \\.\USBPcap1, id 0
    Section number: 1
    Interface id: 0 (\\.\USBPcap1)
    Encapsulation type: USB packets with USBPcap header (152)
    Arrival Time: Mar 31, 2026 22:43:01.486855000 W. Europe Summer Time
    UTC Arrival Time: Mar 31, 2026 20:43:01.486855000 UTC
    Epoch Arrival Time: 1774989781.486855000
    [Time shift for this packet: 0.000000000 seconds]
    [Time delta from previous captured frame: 1.720000 milliseconds]
    [Time delta from previous displayed frame: 1.720000 milliseconds]
    [Time since reference or first frame: 11.700195000 seconds]
    Frame Number: 3178
    Frame Length: 27 bytes (216 bits)
    Capture Length: 27 bytes (216 bits)
    [Frame is marked: False]
    [Frame is ignored: False]
    [Protocols in frame: usb]
    Character encoding: ASCII (0)
USB URB
    [Source: 1.17.2]
    [Destination: host]
    USBPcap pseudoheader length: 27
    IRP ID: 0xffffa686497ed010
    IRP USBD_STATUS: USBD_STATUS_SUCCESS (0x00000000)
    URB Function: URB_FUNCTION_BULK_OR_INTERRUPT_TRANSFER (0x0009)
    IRP information: 0x01, Direction: PDO -> FDO
    URB bus id: 1
    Device address: 17
    Endpoint: 0x02, Direction: OUT
    URB transfer type: URB_INTERRUPT (0x01)
    Packet Data Length: 0
    [Request in: 3177]
    [Time from request: 1.720000 milliseconds]
    [bInterfaceClass: HID (0x03)]

No.     Time           Source                Destination           Protocol Length Info
   3179 11.703765      1.17.1                host                  USB      91     URB_INTERRUPT in

Frame 3179: Packet, 91 bytes on wire (728 bits), 91 bytes captured (728 bits) on interface \\.\USBPcap1, id 0
    Section number: 1
    Interface id: 0 (\\.\USBPcap1)
    Encapsulation type: USB packets with USBPcap header (152)
    Arrival Time: Mar 31, 2026 22:43:01.490425000 W. Europe Summer Time
    UTC Arrival Time: Mar 31, 2026 20:43:01.490425000 UTC
    Epoch Arrival Time: 1774989781.490425000
    [Time shift for this packet: 0.000000000 seconds]
    [Time delta from previous captured frame: 3.570000 milliseconds]
    [Time delta from previous displayed frame: 3.570000 milliseconds]
    [Time since reference or first frame: 11.703765000 seconds]
    Frame Number: 3179
    Frame Length: 91 bytes (728 bits)
    Capture Length: 91 bytes (728 bits)
    [Frame is marked: False]
    [Frame is ignored: False]
    [Protocols in frame: usb:usbhid]
    Character encoding: ASCII (0)
USB URB
    [Source: 1.17.1]
    [Destination: host]
    USBPcap pseudoheader length: 27
    IRP ID: 0xffffa68649451010
    IRP USBD_STATUS: USBD_STATUS_SUCCESS (0x00000000)
    URB Function: URB_FUNCTION_BULK_OR_INTERRUPT_TRANSFER (0x0009)
    IRP information: 0x01, Direction: PDO -> FDO
    URB bus id: 1
    Device address: 17
    Endpoint: 0x81, Direction: IN
    URB transfer type: URB_INTERRUPT (0x01)
    Packet Data Length: 64
    [Request in: 3172]
    [Time from request: 28.974000 milliseconds]
    [bInterfaceClass: HID (0x03)]
HID Data: 1002010010291544656661756c742050726573657410036200000000000000000000000010033d000000000000000000000000000000000000100331000abc8d

No.     Time           Source                Destination           Protocol Length Info
   3180 11.703788      host                  1.17.1                USB      27     URB_INTERRUPT in

Frame 3180: Packet, 27 bytes on wire (216 bits), 27 bytes captured (216 bits) on interface \\.\USBPcap1, id 0
    Section number: 1
    Interface id: 0 (\\.\USBPcap1)
    Encapsulation type: USB packets with USBPcap header (152)
    Arrival Time: Mar 31, 2026 22:43:01.490448000 W. Europe Summer Time
    UTC Arrival Time: Mar 31, 2026 20:43:01.490448000 UTC
    Epoch Arrival Time: 1774989781.490448000
    [Time shift for this packet: 0.000000000 seconds]
    [Time delta from previous captured frame: 23.000 microseconds]
    [Time delta from previous displayed frame: 23.000 microseconds]
    [Time since reference or first frame: 11.703788000 seconds]
    Frame Number: 3180
    Frame Length: 27 bytes (216 bits)
    Capture Length: 27 bytes (216 bits)
    [Frame is marked: False]
    [Frame is ignored: False]
    [Protocols in frame: usb]
    Character encoding: ASCII (0)
USB URB
    [Source: host]
    [Destination: 1.17.1]
    USBPcap pseudoheader length: 27
    IRP ID: 0xffffa68649451010
    IRP USBD_STATUS: USBD_STATUS_SUCCESS (0x00000000)
    URB Function: URB_FUNCTION_BULK_OR_INTERRUPT_TRANSFER (0x0009)
    IRP information: 0x00, Direction: FDO -> PDO
    URB bus id: 1
    Device address: 17
    Endpoint: 0x81, Direction: IN
    URB transfer type: URB_INTERRUPT (0x01)
    Packet Data Length: 0
    [Response in: 3187]
    [bInterfaceClass: HID (0x03)]

No.     Time           Source                Destination           Protocol Length Info
   3181 11.704414      host                  1.17.2                USB      91     URB_INTERRUPT out

Frame 3181: Packet, 91 bytes on wire (728 bits), 91 bytes captured (728 bits) on interface \\.\USBPcap1, id 0
    Section number: 1
    Interface id: 0 (\\.\USBPcap1)
    Encapsulation type: USB packets with USBPcap header (152)
    Arrival Time: Mar 31, 2026 22:43:01.491074000 W. Europe Summer Time
    UTC Arrival Time: Mar 31, 2026 20:43:01.491074000 UTC
    Epoch Arrival Time: 1774989781.491074000
    [Time shift for this packet: 0.000000000 seconds]
    [Time delta from previous captured frame: 626.000 microseconds]
    [Time delta from previous displayed frame: 626.000 microseconds]
    [Time since reference or first frame: 11.704414000 seconds]
    Frame Number: 3181
    Frame Length: 91 bytes (728 bits)
    Capture Length: 91 bytes (728 bits)
    [Frame is marked: False]
    [Frame is ignored: False]
    [Protocols in frame: usb:usbhid]
    Character encoding: ASCII (0)
USB URB
    [Source: host]
    [Destination: 1.17.2]
    USBPcap pseudoheader length: 27
    IRP ID: 0xffffa6864a307530
    IRP USBD_STATUS: USBD_STATUS_SUCCESS (0x00000000)
    URB Function: URB_FUNCTION_BULK_OR_INTERRUPT_TRANSFER (0x0009)
    IRP information: 0x00, Direction: FDO -> PDO
    URB bus id: 1
    Device address: 17
    Endpoint: 0x02, Direction: OUT
    URB transfer type: URB_INTERRUPT (0x01)
    Packet Data Length: 64
    [Response in: 3182]
    [bInterfaceClass: HID (0x03)]
HID Data: 1002000102291610033d0080a1f30398a1f303b85f050a774d400080a1f303774d400080a1f303c0fdfe041548400080a1f30398a1f303b85f050ad8fdfe04d8

No.     Time           Source                Destination           Protocol Length Info
   3182 11.706125      1.17.2                host                  USB      27     URB_INTERRUPT out

Frame 3182: Packet, 27 bytes on wire (216 bits), 27 bytes captured (216 bits) on interface \\.\USBPcap1, id 0
    Section number: 1
    Interface id: 0 (\\.\USBPcap1)
    Encapsulation type: USB packets with USBPcap header (152)
    Arrival Time: Mar 31, 2026 22:43:01.492785000 W. Europe Summer Time
    UTC Arrival Time: Mar 31, 2026 20:43:01.492785000 UTC
    Epoch Arrival Time: 1774989781.492785000
    [Time shift for this packet: 0.000000000 seconds]
    [Time delta from previous captured frame: 1.711000 milliseconds]
    [Time delta from previous displayed frame: 1.711000 milliseconds]
    [Time since reference or first frame: 11.706125000 seconds]
    Frame Number: 3182
    Frame Length: 27 bytes (216 bits)
    Capture Length: 27 bytes (216 bits)
    [Frame is marked: False]
    [Frame is ignored: False]
    [Protocols in frame: usb]
    Character encoding: ASCII (0)
USB URB
    [Source: 1.17.2]
    [Destination: host]
    USBPcap pseudoheader length: 27
    IRP ID: 0xffffa6864a307530
    IRP USBD_STATUS: USBD_STATUS_SUCCESS (0x00000000)
    URB Function: URB_FUNCTION_BULK_OR_INTERRUPT_TRANSFER (0x0009)
    IRP information: 0x01, Direction: PDO -> FDO
    URB bus id: 1
    Device address: 17
    Endpoint: 0x02, Direction: OUT
    URB transfer type: URB_INTERRUPT (0x01)
    Packet Data Length: 0
    [Request in: 3181]
    [Time from request: 1.711000 milliseconds]
    [bInterfaceClass: HID (0x03)]

No.     Time           Source                Destination           Protocol Length Info
   3183 11.713760      1.17.1                host                  USB      91     URB_INTERRUPT in

Frame 3183: Packet, 91 bytes on wire (728 bits), 91 bytes captured (728 bits) on interface \\.\USBPcap1, id 0
    Section number: 1
    Interface id: 0 (\\.\USBPcap1)
    Encapsulation type: USB packets with USBPcap header (152)
    Arrival Time: Mar 31, 2026 22:43:01.500420000 W. Europe Summer Time
    UTC Arrival Time: Mar 31, 2026 20:43:01.500420000 UTC
    Epoch Arrival Time: 1774989781.500420000
    [Time shift for this packet: 0.000000000 seconds]
    [Time delta from previous captured frame: 7.635000 milliseconds]
    [Time delta from previous displayed frame: 7.635000 milliseconds]
    [Time since reference or first frame: 11.713760000 seconds]
    Frame Number: 3183
    Frame Length: 91 bytes (728 bits)
    Capture Length: 91 bytes (728 bits)
    [Frame is marked: False]
    [Frame is ignored: False]
    [Protocols in frame: usb:usbhid]
    Character encoding: ASCII (0)
USB URB
    [Source: 1.17.1]
    [Destination: host]
    USBPcap pseudoheader length: 27
    IRP ID: 0xffffa686494500d0
    IRP USBD_STATUS: USBD_STATUS_SUCCESS (0x00000000)
    URB Function: URB_FUNCTION_BULK_OR_INTERRUPT_TRANSFER (0x0009)
    IRP information: 0x01, Direction: PDO -> FDO
    URB bus id: 1
    Device address: 17
    Endpoint: 0x81, Direction: IN
    URB transfer type: URB_INTERRUPT (0x01)
    Packet Data Length: 64
    [Request in: 3176]
    [Time from request: 15.966000 milliseconds]
    [bInterfaceClass: HID (0x03)]
HID Data: 1002010010291644656661756c742050726573657410036100000000000000000000000010033d000000000000000000000000000000000000100331000abc8d

No.     Time           Source                Destination           Protocol Length Info
   3184 11.713773      host                  1.17.1                USB      27     URB_INTERRUPT in

Frame 3184: Packet, 27 bytes on wire (216 bits), 27 bytes captured (216 bits) on interface \\.\USBPcap1, id 0
    Section number: 1
    Interface id: 0 (\\.\USBPcap1)
    Encapsulation type: USB packets with USBPcap header (152)
    Arrival Time: Mar 31, 2026 22:43:01.500433000 W. Europe Summer Time
    UTC Arrival Time: Mar 31, 2026 20:43:01.500433000 UTC
    Epoch Arrival Time: 1774989781.500433000
    [Time shift for this packet: 0.000000000 seconds]
    [Time delta from previous captured frame: 13.000 microseconds]
    [Time delta from previous displayed frame: 13.000 microseconds]
    [Time since reference or first frame: 11.713773000 seconds]
    Frame Number: 3184
    Frame Length: 27 bytes (216 bits)
    Capture Length: 27 bytes (216 bits)
    [Frame is marked: False]
    [Frame is ignored: False]
    [Protocols in frame: usb]
    Character encoding: ASCII (0)
USB URB
    [Source: host]
    [Destination: 1.17.1]
    USBPcap pseudoheader length: 27
    IRP ID: 0xffffa686494500d0
    IRP USBD_STATUS: USBD_STATUS_SUCCESS (0x00000000)
    URB Function: URB_FUNCTION_BULK_OR_INTERRUPT_TRANSFER (0x0009)
    IRP information: 0x00, Direction: FDO -> PDO
    URB bus id: 1
    Device address: 17
    Endpoint: 0x81, Direction: IN
    URB transfer type: URB_INTERRUPT (0x01)
    Packet Data Length: 0
    [Response in: 3191]
    [bInterfaceClass: HID (0x03)]

No.     Time           Source                Destination           Protocol Length Info
   3185 11.714317      host                  1.17.2                USB      91     URB_INTERRUPT out

Frame 3185: Packet, 91 bytes on wire (728 bits), 91 bytes captured (728 bits) on interface \\.\USBPcap1, id 0
    Section number: 1
    Interface id: 0 (\\.\USBPcap1)
    Encapsulation type: USB packets with USBPcap header (152)
    Arrival Time: Mar 31, 2026 22:43:01.500977000 W. Europe Summer Time
    UTC Arrival Time: Mar 31, 2026 20:43:01.500977000 UTC
    Epoch Arrival Time: 1774989781.500977000
    [Time shift for this packet: 0.000000000 seconds]
    [Time delta from previous captured frame: 544.000 microseconds]
    [Time delta from previous displayed frame: 544.000 microseconds]
    [Time since reference or first frame: 11.714317000 seconds]
    Frame Number: 3185
    Frame Length: 91 bytes (728 bits)
    Capture Length: 91 bytes (728 bits)
    [Frame is marked: False]
    [Frame is ignored: False]
    [Protocols in frame: usb:usbhid]
    Character encoding: ASCII (0)
USB URB
    [Source: host]
    [Destination: 1.17.2]
    USBPcap pseudoheader length: 27
    IRP ID: 0xffffa6864b2dd530
    IRP USBD_STATUS: USBD_STATUS_SUCCESS (0x00000000)
    URB Function: URB_FUNCTION_BULK_OR_INTERRUPT_TRANSFER (0x0009)
    IRP information: 0x00, Direction: FDO -> PDO
    URB bus id: 1
    Device address: 17
    Endpoint: 0x02, Direction: OUT
    URB transfer type: URB_INTERRUPT (0x01)
    Packet Data Length: 64
    [Response in: 3186]
    [bInterfaceClass: HID (0x03)]
HID Data: 1002000102291710033c0080a1f30398a1f303b85f050a774d400080a1f303774d400080a1f303c0fdfe041548400080a1f30398a1f303b85f050ad8fdfe04d8

No.     Time           Source                Destination           Protocol Length Info
   3186 11.716119      1.17.2                host                  USB      27     URB_INTERRUPT out

Frame 3186: Packet, 27 bytes on wire (216 bits), 27 bytes captured (216 bits) on interface \\.\USBPcap1, id 0
    Section number: 1
    Interface id: 0 (\\.\USBPcap1)
    Encapsulation type: USB packets with USBPcap header (152)
    Arrival Time: Mar 31, 2026 22:43:01.502779000 W. Europe Summer Time
    UTC Arrival Time: Mar 31, 2026 20:43:01.502779000 UTC
    Epoch Arrival Time: 1774989781.502779000
    [Time shift for this packet: 0.000000000 seconds]
    [Time delta from previous captured frame: 1.802000 milliseconds]
    [Time delta from previous displayed frame: 1.802000 milliseconds]
    [Time since reference or first frame: 11.716119000 seconds]
    Frame Number: 3186
    Frame Length: 27 bytes (216 bits)
    Capture Length: 27 bytes (216 bits)
    [Frame is marked: False]
    [Frame is ignored: False]
    [Protocols in frame: usb]
    Character encoding: ASCII (0)
USB URB
    [Source: 1.17.2]
    [Destination: host]
    USBPcap pseudoheader length: 27
    IRP ID: 0xffffa6864b2dd530
    IRP USBD_STATUS: USBD_STATUS_SUCCESS (0x00000000)
    URB Function: URB_FUNCTION_BULK_OR_INTERRUPT_TRANSFER (0x0009)
    IRP information: 0x01, Direction: PDO -> FDO
    URB bus id: 1
    Device address: 17
    Endpoint: 0x02, Direction: OUT
    URB transfer type: URB_INTERRUPT (0x01)
    Packet Data Length: 0
    [Request in: 3185]
    [Time from request: 1.802000 milliseconds]
    [bInterfaceClass: HID (0x03)]

No.     Time           Source                Destination           Protocol Length Info
   3187 11.723774      1.17.1                host                  USB      91     URB_INTERRUPT in

Frame 3187: Packet, 91 bytes on wire (728 bits), 91 bytes captured (728 bits) on interface \\.\USBPcap1, id 0
    Section number: 1
    Interface id: 0 (\\.\USBPcap1)
    Encapsulation type: USB packets with USBPcap header (152)
    Arrival Time: Mar 31, 2026 22:43:01.510434000 W. Europe Summer Time
    UTC Arrival Time: Mar 31, 2026 20:43:01.510434000 UTC
    Epoch Arrival Time: 1774989781.510434000
    [Time shift for this packet: 0.000000000 seconds]
    [Time delta from previous captured frame: 7.655000 milliseconds]
    [Time delta from previous displayed frame: 7.655000 milliseconds]
    [Time since reference or first frame: 11.723774000 seconds]
    Frame Number: 3187
    Frame Length: 91 bytes (728 bits)
    Capture Length: 91 bytes (728 bits)
    [Frame is marked: False]
    [Frame is ignored: False]
    [Protocols in frame: usb:usbhid]
    Character encoding: ASCII (0)
USB URB
    [Source: 1.17.1]
    [Destination: host]
    USBPcap pseudoheader length: 27
    IRP ID: 0xffffa68649451010
    IRP USBD_STATUS: USBD_STATUS_SUCCESS (0x00000000)
    URB Function: URB_FUNCTION_BULK_OR_INTERRUPT_TRANSFER (0x0009)
    IRP information: 0x01, Direction: PDO -> FDO
    URB bus id: 1
    Device address: 17
    Endpoint: 0x81, Direction: IN
    URB transfer type: URB_INTERRUPT (0x01)
    Packet Data Length: 64
    [Request in: 3180]
    [Time from request: 19.986000 milliseconds]
    [bInterfaceClass: HID (0x03)]
HID Data: 1002010010291744656661756c742050726573657410036000000000000000000000000010033d000000000000000000000000000000000000100331000abc8d

No.     Time           Source                Destination           Protocol Length Info
   3188 11.723791      host                  1.17.1                USB      27     URB_INTERRUPT in

Frame 3188: Packet, 27 bytes on wire (216 bits), 27 bytes captured (216 bits) on interface \\.\USBPcap1, id 0
    Section number: 1
    Interface id: 0 (\\.\USBPcap1)
    Encapsulation type: USB packets with USBPcap header (152)
    Arrival Time: Mar 31, 2026 22:43:01.510451000 W. Europe Summer Time
    UTC Arrival Time: Mar 31, 2026 20:43:01.510451000 UTC
    Epoch Arrival Time: 1774989781.510451000
    [Time shift for this packet: 0.000000000 seconds]
    [Time delta from previous captured frame: 17.000 microseconds]
    [Time delta from previous displayed frame: 17.000 microseconds]
    [Time since reference or first frame: 11.723791000 seconds]
    Frame Number: 3188
    Frame Length: 27 bytes (216 bits)
    Capture Length: 27 bytes (216 bits)
    [Frame is marked: False]
    [Frame is ignored: False]
    [Protocols in frame: usb]
    Character encoding: ASCII (0)
USB URB
    [Source: host]
    [Destination: 1.17.1]
    USBPcap pseudoheader length: 27
    IRP ID: 0xffffa68649451010
    IRP USBD_STATUS: USBD_STATUS_SUCCESS (0x00000000)
    URB Function: URB_FUNCTION_BULK_OR_INTERRUPT_TRANSFER (0x0009)
    IRP information: 0x00, Direction: FDO -> PDO
    URB bus id: 1
    Device address: 17
    Endpoint: 0x81, Direction: IN
    URB transfer type: URB_INTERRUPT (0x01)
    Packet Data Length: 0
    [Response in: 3195]
    [bInterfaceClass: HID (0x03)]

No.     Time           Source                Destination           Protocol Length Info
   3189 11.724721      host                  1.17.2                USB      91     URB_INTERRUPT out

Frame 3189: Packet, 91 bytes on wire (728 bits), 91 bytes captured (728 bits) on interface \\.\USBPcap1, id 0
    Section number: 1
    Interface id: 0 (\\.\USBPcap1)
    Encapsulation type: USB packets with USBPcap header (152)
    Arrival Time: Mar 31, 2026 22:43:01.511381000 W. Europe Summer Time
    UTC Arrival Time: Mar 31, 2026 20:43:01.511381000 UTC
    Epoch Arrival Time: 1774989781.511381000
    [Time shift for this packet: 0.000000000 seconds]
    [Time delta from previous captured frame: 930.000 microseconds]
    [Time delta from previous displayed frame: 930.000 microseconds]
    [Time since reference or first frame: 11.724721000 seconds]
    Frame Number: 3189
    Frame Length: 91 bytes (728 bits)
    Capture Length: 91 bytes (728 bits)
    [Frame is marked: False]
    [Frame is ignored: False]
    [Protocols in frame: usb:usbhid]
    Character encoding: ASCII (0)
USB URB
    [Source: host]
    [Destination: 1.17.2]
    USBPcap pseudoheader length: 27
    IRP ID: 0xffffa6864b2d9530
    IRP USBD_STATUS: USBD_STATUS_SUCCESS (0x00000000)
    URB Function: URB_FUNCTION_BULK_OR_INTERRUPT_TRANSFER (0x0009)
    IRP information: 0x00, Direction: FDO -> PDO
    URB bus id: 1
    Device address: 17
    Endpoint: 0x02, Direction: OUT
    URB transfer type: URB_INTERRUPT (0x01)
    Packet Data Length: 64
    [Response in: 3190]
    [bInterfaceClass: HID (0x03)]
HID Data: 100200010229181003330080a1f30398a1f303b85f050a774d400080a1f303774d400080a1f303c0fdfe041548400080a1f30398a1f303b85f050ad8fdfe04d8

No.     Time           Source                Destination           Protocol Length Info
   3190 11.726123      1.17.2                host                  USB      27     URB_INTERRUPT out

Frame 3190: Packet, 27 bytes on wire (216 bits), 27 bytes captured (216 bits) on interface \\.\USBPcap1, id 0
    Section number: 1
    Interface id: 0 (\\.\USBPcap1)
    Encapsulation type: USB packets with USBPcap header (152)
    Arrival Time: Mar 31, 2026 22:43:01.512783000 W. Europe Summer Time
    UTC Arrival Time: Mar 31, 2026 20:43:01.512783000 UTC
    Epoch Arrival Time: 1774989781.512783000
    [Time shift for this packet: 0.000000000 seconds]
    [Time delta from previous captured frame: 1.402000 milliseconds]
    [Time delta from previous displayed frame: 1.402000 milliseconds]
    [Time since reference or first frame: 11.726123000 seconds]
    Frame Number: 3190
    Frame Length: 27 bytes (216 bits)
    Capture Length: 27 bytes (216 bits)
    [Frame is marked: False]
    [Frame is ignored: False]
    [Protocols in frame: usb]
    Character encoding: ASCII (0)
USB URB
    [Source: 1.17.2]
    [Destination: host]
    USBPcap pseudoheader length: 27
    IRP ID: 0xffffa6864b2d9530
    IRP USBD_STATUS: USBD_STATUS_SUCCESS (0x00000000)
    URB Function: URB_FUNCTION_BULK_OR_INTERRUPT_TRANSFER (0x0009)
    IRP information: 0x01, Direction: PDO -> FDO
    URB bus id: 1
    Device address: 17
    Endpoint: 0x02, Direction: OUT
    URB transfer type: URB_INTERRUPT (0x01)
    Packet Data Length: 0
    [Request in: 3189]
    [Time from request: 1.402000 milliseconds]
    [bInterfaceClass: HID (0x03)]

No.     Time           Source                Destination           Protocol Length Info
   3191 11.733763      1.17.1                host                  USB      91     URB_INTERRUPT in

Frame 3191: Packet, 91 bytes on wire (728 bits), 91 bytes captured (728 bits) on interface \\.\USBPcap1, id 0
    Section number: 1
    Interface id: 0 (\\.\USBPcap1)
    Encapsulation type: USB packets with USBPcap header (152)
    Arrival Time: Mar 31, 2026 22:43:01.520423000 W. Europe Summer Time
    UTC Arrival Time: Mar 31, 2026 20:43:01.520423000 UTC
    Epoch Arrival Time: 1774989781.520423000
    [Time shift for this packet: 0.000000000 seconds]
    [Time delta from previous captured frame: 7.640000 milliseconds]
    [Time delta from previous displayed frame: 7.640000 milliseconds]
    [Time since reference or first frame: 11.733763000 seconds]
    Frame Number: 3191
    Frame Length: 91 bytes (728 bits)
    Capture Length: 91 bytes (728 bits)
    [Frame is marked: False]
    [Frame is ignored: False]
    [Protocols in frame: usb:usbhid]
    Character encoding: ASCII (0)
USB URB
    [Source: 1.17.1]
    [Destination: host]
    USBPcap pseudoheader length: 27
    IRP ID: 0xffffa686494500d0
    IRP USBD_STATUS: USBD_STATUS_SUCCESS (0x00000000)
    URB Function: URB_FUNCTION_BULK_OR_INTERRUPT_TRANSFER (0x0009)
    IRP information: 0x01, Direction: PDO -> FDO
    URB bus id: 1
    Device address: 17
    Endpoint: 0x81, Direction: IN
    URB transfer type: URB_INTERRUPT (0x01)
    Packet Data Length: 64
    [Request in: 3184]
    [Time from request: 19.990000 milliseconds]
    [bInterfaceClass: HID (0x03)]
HID Data: 1002010010291844656661756c742050726573657410036f00000000000000000000000010033d000000000000000000000000000000000000100331000abc8d

No.     Time           Source                Destination           Protocol Length Info
   3192 11.733789      host                  1.17.1                USB      27     URB_INTERRUPT in

Frame 3192: Packet, 27 bytes on wire (216 bits), 27 bytes captured (216 bits) on interface \\.\USBPcap1, id 0
    Section number: 1
    Interface id: 0 (\\.\USBPcap1)
    Encapsulation type: USB packets with USBPcap header (152)
    Arrival Time: Mar 31, 2026 22:43:01.520449000 W. Europe Summer Time
    UTC Arrival Time: Mar 31, 2026 20:43:01.520449000 UTC
    Epoch Arrival Time: 1774989781.520449000
    [Time shift for this packet: 0.000000000 seconds]
    [Time delta from previous captured frame: 26.000 microseconds]
    [Time delta from previous displayed frame: 26.000 microseconds]
    [Time since reference or first frame: 11.733789000 seconds]
    Frame Number: 3192
    Frame Length: 27 bytes (216 bits)
    Capture Length: 27 bytes (216 bits)
    [Frame is marked: False]
    [Frame is ignored: False]
    [Protocols in frame: usb]
    Character encoding: ASCII (0)
USB URB
    [Source: host]
    [Destination: 1.17.1]
    USBPcap pseudoheader length: 27
    IRP ID: 0xffffa686494500d0
    IRP USBD_STATUS: USBD_STATUS_SUCCESS (0x00000000)
    URB Function: URB_FUNCTION_BULK_OR_INTERRUPT_TRANSFER (0x0009)
    IRP information: 0x00, Direction: FDO -> PDO
    URB bus id: 1
    Device address: 17
    Endpoint: 0x81, Direction: IN
    URB transfer type: URB_INTERRUPT (0x01)
    Packet Data Length: 0
    [Response in: 3199]
    [bInterfaceClass: HID (0x03)]

No.     Time           Source                Destination           Protocol Length Info
   3193 11.734483      host                  1.17.2                USB      91     URB_INTERRUPT out

Frame 3193: Packet, 91 bytes on wire (728 bits), 91 bytes captured (728 bits) on interface \\.\USBPcap1, id 0
    Section number: 1
    Interface id: 0 (\\.\USBPcap1)
    Encapsulation type: USB packets with USBPcap header (152)
    Arrival Time: Mar 31, 2026 22:43:01.521143000 W. Europe Summer Time
    UTC Arrival Time: Mar 31, 2026 20:43:01.521143000 UTC
    Epoch Arrival Time: 1774989781.521143000
    [Time shift for this packet: 0.000000000 seconds]
    [Time delta from previous captured frame: 694.000 microseconds]
    [Time delta from previous displayed frame: 694.000 microseconds]
    [Time since reference or first frame: 11.734483000 seconds]
    Frame Number: 3193
    Frame Length: 91 bytes (728 bits)
    Capture Length: 91 bytes (728 bits)
    [Frame is marked: False]
    [Frame is ignored: False]
    [Protocols in frame: usb:usbhid]
    Character encoding: ASCII (0)
USB URB
    [Source: host]
    [Destination: 1.17.2]
    USBPcap pseudoheader length: 27
    IRP ID: 0xffffa6864b1c7530
    IRP USBD_STATUS: USBD_STATUS_SUCCESS (0x00000000)
    URB Function: URB_FUNCTION_BULK_OR_INTERRUPT_TRANSFER (0x0009)
    IRP information: 0x00, Direction: FDO -> PDO
    URB bus id: 1
    Device address: 17
    Endpoint: 0x02, Direction: OUT
    URB transfer type: URB_INTERRUPT (0x01)
    Packet Data Length: 64
    [Response in: 3194]
    [bInterfaceClass: HID (0x03)]
HID Data: 100200010229191003320080a1f30398a1f303b85f050a774d400080a1f303774d400080a1f303c0fdfe041548400080a1f30398a1f303b85f050ad8fdfe04d8

No.     Time           Source                Destination           Protocol Length Info
   3194 11.736125      1.17.2                host                  USB      27     URB_INTERRUPT out

Frame 3194: Packet, 27 bytes on wire (216 bits), 27 bytes captured (216 bits) on interface \\.\USBPcap1, id 0
    Section number: 1
    Interface id: 0 (\\.\USBPcap1)
    Encapsulation type: USB packets with USBPcap header (152)
    Arrival Time: Mar 31, 2026 22:43:01.522785000 W. Europe Summer Time
    UTC Arrival Time: Mar 31, 2026 20:43:01.522785000 UTC
    Epoch Arrival Time: 1774989781.522785000
    [Time shift for this packet: 0.000000000 seconds]
    [Time delta from previous captured frame: 1.642000 milliseconds]
    [Time delta from previous displayed frame: 1.642000 milliseconds]
    [Time since reference or first frame: 11.736125000 seconds]
    Frame Number: 3194
    Frame Length: 27 bytes (216 bits)
    Capture Length: 27 bytes (216 bits)
    [Frame is marked: False]
    [Frame is ignored: False]
    [Protocols in frame: usb]
    Character encoding: ASCII (0)
USB URB
    [Source: 1.17.2]
    [Destination: host]
    USBPcap pseudoheader length: 27
    IRP ID: 0xffffa6864b1c7530
    IRP USBD_STATUS: USBD_STATUS_SUCCESS (0x00000000)
    URB Function: URB_FUNCTION_BULK_OR_INTERRUPT_TRANSFER (0x0009)
    IRP information: 0x01, Direction: PDO -> FDO
    URB bus id: 1
    Device address: 17
    Endpoint: 0x02, Direction: OUT
    URB transfer type: URB_INTERRUPT (0x01)
    Packet Data Length: 0
    [Request in: 3193]
    [Time from request: 1.642000 milliseconds]
    [bInterfaceClass: HID (0x03)]

No.     Time           Source                Destination           Protocol Length Info
   3195 11.743762      1.17.1                host                  USB      91     URB_INTERRUPT in

Frame 3195: Packet, 91 bytes on wire (728 bits), 91 bytes captured (728 bits) on interface \\.\USBPcap1, id 0
    Section number: 1
    Interface id: 0 (\\.\USBPcap1)
    Encapsulation type: USB packets with USBPcap header (152)
    Arrival Time: Mar 31, 2026 22:43:01.530422000 W. Europe Summer Time
    UTC Arrival Time: Mar 31, 2026 20:43:01.530422000 UTC
    Epoch Arrival Time: 1774989781.530422000
    [Time shift for this packet: 0.000000000 seconds]
    [Time delta from previous captured frame: 7.637000 milliseconds]
    [Time delta from previous displayed frame: 7.637000 milliseconds]
    [Time since reference or first frame: 11.743762000 seconds]
    Frame Number: 3195
    Frame Length: 91 bytes (728 bits)
    Capture Length: 91 bytes (728 bits)
    [Frame is marked: False]
    [Frame is ignored: False]
    [Protocols in frame: usb:usbhid]
    Character encoding: ASCII (0)
USB URB
    [Source: 1.17.1]
    [Destination: host]
    USBPcap pseudoheader length: 27
    IRP ID: 0xffffa68649451010
    IRP USBD_STATUS: USBD_STATUS_SUCCESS (0x00000000)
    URB Function: URB_FUNCTION_BULK_OR_INTERRUPT_TRANSFER (0x0009)
    IRP information: 0x01, Direction: PDO -> FDO
    URB bus id: 1
    Device address: 17
    Endpoint: 0x81, Direction: IN
    URB transfer type: URB_INTERRUPT (0x01)
    Packet Data Length: 64
    [Request in: 3188]
    [Time from request: 19.971000 milliseconds]
    [bInterfaceClass: HID (0x03)]
HID Data: 1002010010291944656661756c742050726573657410036e00000000000000000000000010033d000000000000000000000000000000000000100331000abc8d

No.     Time           Source                Destination           Protocol Length Info
   3196 11.743780      host                  1.17.1                USB      27     URB_INTERRUPT in

Frame 3196: Packet, 27 bytes on wire (216 bits), 27 bytes captured (216 bits) on interface \\.\USBPcap1, id 0
    Section number: 1
    Interface id: 0 (\\.\USBPcap1)
    Encapsulation type: USB packets with USBPcap header (152)
    Arrival Time: Mar 31, 2026 22:43:01.530440000 W. Europe Summer Time
    UTC Arrival Time: Mar 31, 2026 20:43:01.530440000 UTC
    Epoch Arrival Time: 1774989781.530440000
    [Time shift for this packet: 0.000000000 seconds]
    [Time delta from previous captured frame: 18.000 microseconds]
    [Time delta from previous displayed frame: 18.000 microseconds]
    [Time since reference or first frame: 11.743780000 seconds]
    Frame Number: 3196
    Frame Length: 27 bytes (216 bits)
    Capture Length: 27 bytes (216 bits)
    [Frame is marked: False]
    [Frame is ignored: False]
    [Protocols in frame: usb]
    Character encoding: ASCII (0)
USB URB
    [Source: host]
    [Destination: 1.17.1]
    USBPcap pseudoheader length: 27
    IRP ID: 0xffffa68649451010
    IRP USBD_STATUS: USBD_STATUS_SUCCESS (0x00000000)
    URB Function: URB_FUNCTION_BULK_OR_INTERRUPT_TRANSFER (0x0009)
    IRP information: 0x00, Direction: FDO -> PDO
    URB bus id: 1
    Device address: 17
    Endpoint: 0x81, Direction: IN
    URB transfer type: URB_INTERRUPT (0x01)
    Packet Data Length: 0
    [Response in: 3203]
    [bInterfaceClass: HID (0x03)]

No.     Time           Source                Destination           Protocol Length Info
   3197 11.744536      host                  1.17.2                USB      91     URB_INTERRUPT out

Frame 3197: Packet, 91 bytes on wire (728 bits), 91 bytes captured (728 bits) on interface \\.\USBPcap1, id 0
    Section number: 1
    Interface id: 0 (\\.\USBPcap1)
    Encapsulation type: USB packets with USBPcap header (152)
    Arrival Time: Mar 31, 2026 22:43:01.531196000 W. Europe Summer Time
    UTC Arrival Time: Mar 31, 2026 20:43:01.531196000 UTC
    Epoch Arrival Time: 1774989781.531196000
    [Time shift for this packet: 0.000000000 seconds]
    [Time delta from previous captured frame: 756.000 microseconds]
    [Time delta from previous displayed frame: 756.000 microseconds]
    [Time since reference or first frame: 11.744536000 seconds]
    Frame Number: 3197
    Frame Length: 91 bytes (728 bits)
    Capture Length: 91 bytes (728 bits)
    [Frame is marked: False]
    [Frame is ignored: False]
    [Protocols in frame: usb:usbhid]
    Character encoding: ASCII (0)
USB URB
    [Source: host]
    [Destination: 1.17.2]
    USBPcap pseudoheader length: 27
    IRP ID: 0xffffa6864b4c9530
    IRP USBD_STATUS: USBD_STATUS_SUCCESS (0x00000000)
    URB Function: URB_FUNCTION_BULK_OR_INTERRUPT_TRANSFER (0x0009)
    IRP information: 0x00, Direction: FDO -> PDO
    URB bus id: 1
    Device address: 17
    Endpoint: 0x02, Direction: OUT
    URB transfer type: URB_INTERRUPT (0x01)
    Packet Data Length: 64
    [Response in: 3198]
    [bInterfaceClass: HID (0x03)]
HID Data: 1002000102291a1003310080a1f30398a1f303b85f050a774d400080a1f303774d400080a1f303c0fdfe041548400080a1f30398a1f303b85f050ad8fdfe04d8

No.     Time           Source                Destination           Protocol Length Info
   3198 11.746118      1.17.2                host                  USB      27     URB_INTERRUPT out

Frame 3198: Packet, 27 bytes on wire (216 bits), 27 bytes captured (216 bits) on interface \\.\USBPcap1, id 0
    Section number: 1
    Interface id: 0 (\\.\USBPcap1)
    Encapsulation type: USB packets with USBPcap header (152)
    Arrival Time: Mar 31, 2026 22:43:01.532778000 W. Europe Summer Time
    UTC Arrival Time: Mar 31, 2026 20:43:01.532778000 UTC
    Epoch Arrival Time: 1774989781.532778000
    [Time shift for this packet: 0.000000000 seconds]
    [Time delta from previous captured frame: 1.582000 milliseconds]
    [Time delta from previous displayed frame: 1.582000 milliseconds]
    [Time since reference or first frame: 11.746118000 seconds]
    Frame Number: 3198
    Frame Length: 27 bytes (216 bits)
    Capture Length: 27 bytes (216 bits)
    [Frame is marked: False]
    [Frame is ignored: False]
    [Protocols in frame: usb]
    Character encoding: ASCII (0)
USB URB
    [Source: 1.17.2]
    [Destination: host]
    USBPcap pseudoheader length: 27
    IRP ID: 0xffffa6864b4c9530
    IRP USBD_STATUS: USBD_STATUS_SUCCESS (0x00000000)
    URB Function: URB_FUNCTION_BULK_OR_INTERRUPT_TRANSFER (0x0009)
    IRP information: 0x01, Direction: PDO -> FDO
    URB bus id: 1
    Device address: 17
    Endpoint: 0x02, Direction: OUT
    URB transfer type: URB_INTERRUPT (0x01)
    Packet Data Length: 0
    [Request in: 3197]
    [Time from request: 1.582000 milliseconds]
    [bInterfaceClass: HID (0x03)]

No.     Time           Source                Destination           Protocol Length Info
   3199 11.753763      1.17.1                host                  USB      91     URB_INTERRUPT in

Frame 3199: Packet, 91 bytes on wire (728 bits), 91 bytes captured (728 bits) on interface \\.\USBPcap1, id 0
    Section number: 1
    Interface id: 0 (\\.\USBPcap1)
    Encapsulation type: USB packets with USBPcap header (152)
    Arrival Time: Mar 31, 2026 22:43:01.540423000 W. Europe Summer Time
    UTC Arrival Time: Mar 31, 2026 20:43:01.540423000 UTC
    Epoch Arrival Time: 1774989781.540423000
    [Time shift for this packet: 0.000000000 seconds]
    [Time delta from previous captured frame: 7.645000 milliseconds]
    [Time delta from previous displayed frame: 7.645000 milliseconds]
    [Time since reference or first frame: 11.753763000 seconds]
    Frame Number: 3199
    Frame Length: 91 bytes (728 bits)
    Capture Length: 91 bytes (728 bits)
    [Frame is marked: False]
    [Frame is ignored: False]
    [Protocols in frame: usb:usbhid]
    Character encoding: ASCII (0)
USB URB
    [Source: 1.17.1]
    [Destination: host]
    USBPcap pseudoheader length: 27
    IRP ID: 0xffffa686494500d0
    IRP USBD_STATUS: USBD_STATUS_SUCCESS (0x00000000)
    URB Function: URB_FUNCTION_BULK_OR_INTERRUPT_TRANSFER (0x0009)
    IRP information: 0x01, Direction: PDO -> FDO
    URB bus id: 1
    Device address: 17
    Endpoint: 0x81, Direction: IN
    URB transfer type: URB_INTERRUPT (0x01)
    Packet Data Length: 64
    [Request in: 3192]
    [Time from request: 19.974000 milliseconds]
    [bInterfaceClass: HID (0x03)]
HID Data: 1002010010291a44656661756c742050726573657410036d00000000000000000000000010033d000000000000000000000000000000000000100331000abc8d

No.     Time           Source                Destination           Protocol Length Info
   3200 11.753788      host                  1.17.1                USB      27     URB_INTERRUPT in

Frame 3200: Packet, 27 bytes on wire (216 bits), 27 bytes captured (216 bits) on interface \\.\USBPcap1, id 0
    Section number: 1
    Interface id: 0 (\\.\USBPcap1)
    Encapsulation type: USB packets with USBPcap header (152)
    Arrival Time: Mar 31, 2026 22:43:01.540448000 W. Europe Summer Time
    UTC Arrival Time: Mar 31, 2026 20:43:01.540448000 UTC
    Epoch Arrival Time: 1774989781.540448000
    [Time shift for this packet: 0.000000000 seconds]
    [Time delta from previous captured frame: 25.000 microseconds]
    [Time delta from previous displayed frame: 25.000 microseconds]
    [Time since reference or first frame: 11.753788000 seconds]
    Frame Number: 3200
    Frame Length: 27 bytes (216 bits)
    Capture Length: 27 bytes (216 bits)
    [Frame is marked: False]
    [Frame is ignored: False]
    [Protocols in frame: usb]
    Character encoding: ASCII (0)
USB URB
    [Source: host]
    [Destination: 1.17.1]
    USBPcap pseudoheader length: 27
    IRP ID: 0xffffa686494500d0
    IRP USBD_STATUS: USBD_STATUS_SUCCESS (0x00000000)
    URB Function: URB_FUNCTION_BULK_OR_INTERRUPT_TRANSFER (0x0009)
    IRP information: 0x00, Direction: FDO -> PDO
    URB bus id: 1
    Device address: 17
    Endpoint: 0x81, Direction: IN
    URB transfer type: URB_INTERRUPT (0x01)
    Packet Data Length: 0
    [Response in: 3207]
    [bInterfaceClass: HID (0x03)]

No.     Time           Source                Destination           Protocol Length Info
   3201 11.754483      host                  1.17.2                USB      91     URB_INTERRUPT out

Frame 3201: Packet, 91 bytes on wire (728 bits), 91 bytes captured (728 bits) on interface \\.\USBPcap1, id 0
    Section number: 1
    Interface id: 0 (\\.\USBPcap1)
    Encapsulation type: USB packets with USBPcap header (152)
    Arrival Time: Mar 31, 2026 22:43:01.541143000 W. Europe Summer Time
    UTC Arrival Time: Mar 31, 2026 20:43:01.541143000 UTC
    Epoch Arrival Time: 1774989781.541143000
    [Time shift for this packet: 0.000000000 seconds]
    [Time delta from previous captured frame: 695.000 microseconds]
    [Time delta from previous displayed frame: 695.000 microseconds]
    [Time since reference or first frame: 11.754483000 seconds]
    Frame Number: 3201
    Frame Length: 91 bytes (728 bits)
    Capture Length: 91 bytes (728 bits)
    [Frame is marked: False]
    [Frame is ignored: False]
    [Protocols in frame: usb:usbhid]
    Character encoding: ASCII (0)
USB URB
    [Source: host]
    [Destination: 1.17.2]
    USBPcap pseudoheader length: 27
    IRP ID: 0xffffa6864b2e3530
    IRP USBD_STATUS: USBD_STATUS_SUCCESS (0x00000000)
    URB Function: URB_FUNCTION_BULK_OR_INTERRUPT_TRANSFER (0x0009)
    IRP information: 0x00, Direction: FDO -> PDO
    URB bus id: 1
    Device address: 17
    Endpoint: 0x02, Direction: OUT
    URB transfer type: URB_INTERRUPT (0x01)
    Packet Data Length: 64
    [Response in: 3202]
    [bInterfaceClass: HID (0x03)]
HID Data: 1002000102291b1003300080a1f30398a1f303b85f050a774d400080a1f303774d400080a1f303c0fdfe041548400080a1f30398a1f303b85f050ad8fdfe04d8

No.     Time           Source                Destination           Protocol Length Info
   3202 11.756123      1.17.2                host                  USB      27     URB_INTERRUPT out

Frame 3202: Packet, 27 bytes on wire (216 bits), 27 bytes captured (216 bits) on interface \\.\USBPcap1, id 0
    Section number: 1
    Interface id: 0 (\\.\USBPcap1)
    Encapsulation type: USB packets with USBPcap header (152)
    Arrival Time: Mar 31, 2026 22:43:01.542783000 W. Europe Summer Time
    UTC Arrival Time: Mar 31, 2026 20:43:01.542783000 UTC
    Epoch Arrival Time: 1774989781.542783000
    [Time shift for this packet: 0.000000000 seconds]
    [Time delta from previous captured frame: 1.640000 milliseconds]
    [Time delta from previous displayed frame: 1.640000 milliseconds]
    [Time since reference or first frame: 11.756123000 seconds]
    Frame Number: 3202
    Frame Length: 27 bytes (216 bits)
    Capture Length: 27 bytes (216 bits)
    [Frame is marked: False]
    [Frame is ignored: False]
    [Protocols in frame: usb]
    Character encoding: ASCII (0)
USB URB
    [Source: 1.17.2]
    [Destination: host]
    USBPcap pseudoheader length: 27
    IRP ID: 0xffffa6864b2e3530
    IRP USBD_STATUS: USBD_STATUS_SUCCESS (0x00000000)
    URB Function: URB_FUNCTION_BULK_OR_INTERRUPT_TRANSFER (0x0009)
    IRP information: 0x01, Direction: PDO -> FDO
    URB bus id: 1
    Device address: 17
    Endpoint: 0x02, Direction: OUT
    URB transfer type: URB_INTERRUPT (0x01)
    Packet Data Length: 0
    [Request in: 3201]
    [Time from request: 1.640000 milliseconds]
    [bInterfaceClass: HID (0x03)]

No.     Time           Source                Destination           Protocol Length Info
   3203 11.763758      1.17.1                host                  USB      91     URB_INTERRUPT in

Frame 3203: Packet, 91 bytes on wire (728 bits), 91 bytes captured (728 bits) on interface \\.\USBPcap1, id 0
    Section number: 1
    Interface id: 0 (\\.\USBPcap1)
    Encapsulation type: USB packets with USBPcap header (152)
    Arrival Time: Mar 31, 2026 22:43:01.550418000 W. Europe Summer Time
    UTC Arrival Time: Mar 31, 2026 20:43:01.550418000 UTC
    Epoch Arrival Time: 1774989781.550418000
    [Time shift for this packet: 0.000000000 seconds]
    [Time delta from previous captured frame: 7.635000 milliseconds]
    [Time delta from previous displayed frame: 7.635000 milliseconds]
    [Time since reference or first frame: 11.763758000 seconds]
    Frame Number: 3203
    Frame Length: 91 bytes (728 bits)
    Capture Length: 91 bytes (728 bits)
    [Frame is marked: False]
    [Frame is ignored: False]
    [Protocols in frame: usb:usbhid]
    Character encoding: ASCII (0)
USB URB
    [Source: 1.17.1]
    [Destination: host]
    USBPcap pseudoheader length: 27
    IRP ID: 0xffffa68649451010
    IRP USBD_STATUS: USBD_STATUS_SUCCESS (0x00000000)
    URB Function: URB_FUNCTION_BULK_OR_INTERRUPT_TRANSFER (0x0009)
    IRP information: 0x01, Direction: PDO -> FDO
    URB bus id: 1
    Device address: 17
    Endpoint: 0x81, Direction: IN
    URB transfer type: URB_INTERRUPT (0x01)
    Packet Data Length: 64
    [Request in: 3196]
    [Time from request: 19.978000 milliseconds]
    [bInterfaceClass: HID (0x03)]
HID Data: 1002010010291b44656661756c742050726573657410036c00000000000000000000000010033d000000000000000000000000000000000000100331000abc8d

No.     Time           Source                Destination           Protocol Length Info
   3204 11.763770      host                  1.17.1                USB      27     URB_INTERRUPT in

Frame 3204: Packet, 27 bytes on wire (216 bits), 27 bytes captured (216 bits) on interface \\.\USBPcap1, id 0
    Section number: 1
    Interface id: 0 (\\.\USBPcap1)
    Encapsulation type: USB packets with USBPcap header (152)
    Arrival Time: Mar 31, 2026 22:43:01.550430000 W. Europe Summer Time
    UTC Arrival Time: Mar 31, 2026 20:43:01.550430000 UTC
    Epoch Arrival Time: 1774989781.550430000
    [Time shift for this packet: 0.000000000 seconds]
    [Time delta from previous captured frame: 12.000 microseconds]
    [Time delta from previous displayed frame: 12.000 microseconds]
    [Time since reference or first frame: 11.763770000 seconds]
    Frame Number: 3204
    Frame Length: 27 bytes (216 bits)
    Capture Length: 27 bytes (216 bits)
    [Frame is marked: False]
    [Frame is ignored: False]
    [Protocols in frame: usb]
    Character encoding: ASCII (0)
USB URB
    [Source: host]
    [Destination: 1.17.1]
    USBPcap pseudoheader length: 27
    IRP ID: 0xffffa68649451010
    IRP USBD_STATUS: USBD_STATUS_SUCCESS (0x00000000)
    URB Function: URB_FUNCTION_BULK_OR_INTERRUPT_TRANSFER (0x0009)
    IRP information: 0x00, Direction: FDO -> PDO
    URB bus id: 1
    Device address: 17
    Endpoint: 0x81, Direction: IN
    URB transfer type: URB_INTERRUPT (0x01)
    Packet Data Length: 0
    [Response in: 3211]
    [bInterfaceClass: HID (0x03)]

No.     Time           Source                Destination           Protocol Length Info
   3205 11.764320      host                  1.17.2                USB      91     URB_INTERRUPT out

Frame 3205: Packet, 91 bytes on wire (728 bits), 91 bytes captured (728 bits) on interface \\.\USBPcap1, id 0
    Section number: 1
    Interface id: 0 (\\.\USBPcap1)
    Encapsulation type: USB packets with USBPcap header (152)
    Arrival Time: Mar 31, 2026 22:43:01.550980000 W. Europe Summer Time
    UTC Arrival Time: Mar 31, 2026 20:43:01.550980000 UTC
    Epoch Arrival Time: 1774989781.550980000
    [Time shift for this packet: 0.000000000 seconds]
    [Time delta from previous captured frame: 550.000 microseconds]
    [Time delta from previous displayed frame: 550.000 microseconds]
    [Time since reference or first frame: 11.764320000 seconds]
    Frame Number: 3205
    Frame Length: 91 bytes (728 bits)
    Capture Length: 91 bytes (728 bits)
    [Frame is marked: False]
    [Frame is ignored: False]
    [Protocols in frame: usb:usbhid]
    Character encoding: ASCII (0)
USB URB
    [Source: host]
    [Destination: 1.17.2]
    USBPcap pseudoheader length: 27
    IRP ID: 0xffffa6864b2c6530
    IRP USBD_STATUS: USBD_STATUS_SUCCESS (0x00000000)
    URB Function: URB_FUNCTION_BULK_OR_INTERRUPT_TRANSFER (0x0009)
    IRP information: 0x00, Direction: FDO -> PDO
    URB bus id: 1
    Device address: 17
    Endpoint: 0x02, Direction: OUT
    URB transfer type: URB_INTERRUPT (0x01)
    Packet Data Length: 64
    [Response in: 3206]
    [bInterfaceClass: HID (0x03)]
HID Data: 1002000102291c1003370080a1f30398a1f303b85f050a774d400080a1f303774d400080a1f303c0fdfe041548400080a1f30398a1f303b85f050ad8fdfe04d8

No.     Time           Source                Destination           Protocol Length Info
   3206 11.766119      1.17.2                host                  USB      27     URB_INTERRUPT out

Frame 3206: Packet, 27 bytes on wire (216 bits), 27 bytes captured (216 bits) on interface \\.\USBPcap1, id 0
    Section number: 1
    Interface id: 0 (\\.\USBPcap1)
    Encapsulation type: USB packets with USBPcap header (152)
    Arrival Time: Mar 31, 2026 22:43:01.552779000 W. Europe Summer Time
    UTC Arrival Time: Mar 31, 2026 20:43:01.552779000 UTC
    Epoch Arrival Time: 1774989781.552779000
    [Time shift for this packet: 0.000000000 seconds]
    [Time delta from previous captured frame: 1.799000 milliseconds]
    [Time delta from previous displayed frame: 1.799000 milliseconds]
    [Time since reference or first frame: 11.766119000 seconds]
    Frame Number: 3206
    Frame Length: 27 bytes (216 bits)
    Capture Length: 27 bytes (216 bits)
    [Frame is marked: False]
    [Frame is ignored: False]
    [Protocols in frame: usb]
    Character encoding: ASCII (0)
USB URB
    [Source: 1.17.2]
    [Destination: host]
    USBPcap pseudoheader length: 27
    IRP ID: 0xffffa6864b2c6530
    IRP USBD_STATUS: USBD_STATUS_SUCCESS (0x00000000)
    URB Function: URB_FUNCTION_BULK_OR_INTERRUPT_TRANSFER (0x0009)
    IRP information: 0x01, Direction: PDO -> FDO
    URB bus id: 1
    Device address: 17
    Endpoint: 0x02, Direction: OUT
    URB transfer type: URB_INTERRUPT (0x01)
    Packet Data Length: 0
    [Request in: 3205]
    [Time from request: 1.799000 milliseconds]
    [bInterfaceClass: HID (0x03)]

No.     Time           Source                Destination           Protocol Length Info
   3207 11.772759      1.17.1                host                  USB      91     URB_INTERRUPT in

Frame 3207: Packet, 91 bytes on wire (728 bits), 91 bytes captured (728 bits) on interface \\.\USBPcap1, id 0
    Section number: 1
    Interface id: 0 (\\.\USBPcap1)
    Encapsulation type: USB packets with USBPcap header (152)
    Arrival Time: Mar 31, 2026 22:43:01.559419000 W. Europe Summer Time
    UTC Arrival Time: Mar 31, 2026 20:43:01.559419000 UTC
    Epoch Arrival Time: 1774989781.559419000
    [Time shift for this packet: 0.000000000 seconds]
    [Time delta from previous captured frame: 6.640000 milliseconds]
    [Time delta from previous displayed frame: 6.640000 milliseconds]
    [Time since reference or first frame: 11.772759000 seconds]
    Frame Number: 3207
    Frame Length: 91 bytes (728 bits)
    Capture Length: 91 bytes (728 bits)
    [Frame is marked: False]
    [Frame is ignored: False]
    [Protocols in frame: usb:usbhid]
    Character encoding: ASCII (0)
USB URB
    [Source: 1.17.1]
    [Destination: host]
    USBPcap pseudoheader length: 27
    IRP ID: 0xffffa686494500d0
    IRP USBD_STATUS: USBD_STATUS_SUCCESS (0x00000000)
    URB Function: URB_FUNCTION_BULK_OR_INTERRUPT_TRANSFER (0x0009)
    IRP information: 0x01, Direction: PDO -> FDO
    URB bus id: 1
    Device address: 17
    Endpoint: 0x81, Direction: IN
    URB transfer type: URB_INTERRUPT (0x01)
    Packet Data Length: 64
    [Request in: 3200]
    [Time from request: 18.971000 milliseconds]
    [bInterfaceClass: HID (0x03)]
HID Data: 1002010010291c44656661756c742050726573657410036b00000000000000000000000010033d000000000000000000000000000000000000100331000abc8d

No.     Time           Source                Destination           Protocol Length Info
   3208 11.772774      host                  1.17.1                USB      27     URB_INTERRUPT in

Frame 3208: Packet, 27 bytes on wire (216 bits), 27 bytes captured (216 bits) on interface \\.\USBPcap1, id 0
    Section number: 1
    Interface id: 0 (\\.\USBPcap1)
    Encapsulation type: USB packets with USBPcap header (152)
    Arrival Time: Mar 31, 2026 22:43:01.559434000 W. Europe Summer Time
    UTC Arrival Time: Mar 31, 2026 20:43:01.559434000 UTC
    Epoch Arrival Time: 1774989781.559434000
    [Time shift for this packet: 0.000000000 seconds]
    [Time delta from previous captured frame: 15.000 microseconds]
    [Time delta from previous displayed frame: 15.000 microseconds]
    [Time since reference or first frame: 11.772774000 seconds]
    Frame Number: 3208
    Frame Length: 27 bytes (216 bits)
    Capture Length: 27 bytes (216 bits)
    [Frame is marked: False]
    [Frame is ignored: False]
    [Protocols in frame: usb]
    Character encoding: ASCII (0)
USB URB
    [Source: host]
    [Destination: 1.17.1]
    USBPcap pseudoheader length: 27
    IRP ID: 0xffffa686494500d0
    IRP USBD_STATUS: USBD_STATUS_SUCCESS (0x00000000)
    URB Function: URB_FUNCTION_BULK_OR_INTERRUPT_TRANSFER (0x0009)
    IRP information: 0x00, Direction: FDO -> PDO
    URB bus id: 1
    Device address: 17
    Endpoint: 0x81, Direction: IN
    URB transfer type: URB_INTERRUPT (0x01)
    Packet Data Length: 0
    [Response in: 3215]
    [bInterfaceClass: HID (0x03)]

No.     Time           Source                Destination           Protocol Length Info
   3209 11.773560      host                  1.17.2                USB      91     URB_INTERRUPT out

Frame 3209: Packet, 91 bytes on wire (728 bits), 91 bytes captured (728 bits) on interface \\.\USBPcap1, id 0
    Section number: 1
    Interface id: 0 (\\.\USBPcap1)
    Encapsulation type: USB packets with USBPcap header (152)
    Arrival Time: Mar 31, 2026 22:43:01.560220000 W. Europe Summer Time
    UTC Arrival Time: Mar 31, 2026 20:43:01.560220000 UTC
    Epoch Arrival Time: 1774989781.560220000
    [Time shift for this packet: 0.000000000 seconds]
    [Time delta from previous captured frame: 786.000 microseconds]
    [Time delta from previous displayed frame: 786.000 microseconds]
    [Time since reference or first frame: 11.773560000 seconds]
    Frame Number: 3209
    Frame Length: 91 bytes (728 bits)
    Capture Length: 91 bytes (728 bits)
    [Frame is marked: False]
    [Frame is ignored: False]
    [Protocols in frame: usb:usbhid]
    Character encoding: ASCII (0)
USB URB
    [Source: host]
    [Destination: 1.17.2]
    USBPcap pseudoheader length: 27
    IRP ID: 0xffffa6864b4d3530
    IRP USBD_STATUS: USBD_STATUS_SUCCESS (0x00000000)
    URB Function: URB_FUNCTION_BULK_OR_INTERRUPT_TRANSFER (0x0009)
    IRP information: 0x00, Direction: FDO -> PDO
    URB bus id: 1
    Device address: 17
    Endpoint: 0x02, Direction: OUT
    URB transfer type: URB_INTERRUPT (0x01)
    Packet Data Length: 64
    [Response in: 3210]
    [bInterfaceClass: HID (0x03)]
HID Data: 1002000102291d1003360080a1f30398a1f303b85f050a774d400080a1f303774d400080a1f303c0fdfe041548400080a1f30398a1f303b85f050ad8fdfe04d8

No.     Time           Source                Destination           Protocol Length Info
   3210 11.775117      1.17.2                host                  USB      27     URB_INTERRUPT out

Frame 3210: Packet, 27 bytes on wire (216 bits), 27 bytes captured (216 bits) on interface \\.\USBPcap1, id 0
    Section number: 1
    Interface id: 0 (\\.\USBPcap1)
    Encapsulation type: USB packets with USBPcap header (152)
    Arrival Time: Mar 31, 2026 22:43:01.561777000 W. Europe Summer Time
    UTC Arrival Time: Mar 31, 2026 20:43:01.561777000 UTC
    Epoch Arrival Time: 1774989781.561777000
    [Time shift for this packet: 0.000000000 seconds]
    [Time delta from previous captured frame: 1.557000 milliseconds]
    [Time delta from previous displayed frame: 1.557000 milliseconds]
    [Time since reference or first frame: 11.775117000 seconds]
    Frame Number: 3210
    Frame Length: 27 bytes (216 bits)
    Capture Length: 27 bytes (216 bits)
    [Frame is marked: False]
    [Frame is ignored: False]
    [Protocols in frame: usb]
    Character encoding: ASCII (0)
USB URB
    [Source: 1.17.2]
    [Destination: host]
    USBPcap pseudoheader length: 27
    IRP ID: 0xffffa6864b4d3530
    IRP USBD_STATUS: USBD_STATUS_SUCCESS (0x00000000)
    URB Function: URB_FUNCTION_BULK_OR_INTERRUPT_TRANSFER (0x0009)
    IRP information: 0x01, Direction: PDO -> FDO
    URB bus id: 1
    Device address: 17
    Endpoint: 0x02, Direction: OUT
    URB transfer type: URB_INTERRUPT (0x01)
    Packet Data Length: 0
    [Request in: 3209]
    [Time from request: 1.557000 milliseconds]
    [bInterfaceClass: HID (0x03)]

No.     Time           Source                Destination           Protocol Length Info
   3211 11.796759      1.17.1                host                  USB      91     URB_INTERRUPT in

Frame 3211: Packet, 91 bytes on wire (728 bits), 91 bytes captured (728 bits) on interface \\.\USBPcap1, id 0
    Section number: 1
    Interface id: 0 (\\.\USBPcap1)
    Encapsulation type: USB packets with USBPcap header (152)
    Arrival Time: Mar 31, 2026 22:43:01.583419000 W. Europe Summer Time
    UTC Arrival Time: Mar 31, 2026 20:43:01.583419000 UTC
    Epoch Arrival Time: 1774989781.583419000
    [Time shift for this packet: 0.000000000 seconds]
    [Time delta from previous captured frame: 21.642000 milliseconds]
    [Time delta from previous displayed frame: 21.642000 milliseconds]
    [Time since reference or first frame: 11.796759000 seconds]
    Frame Number: 3211
    Frame Length: 91 bytes (728 bits)
    Capture Length: 91 bytes (728 bits)
    [Frame is marked: False]
    [Frame is ignored: False]
    [Protocols in frame: usb:usbhid]
    Character encoding: ASCII (0)
USB URB
    [Source: 1.17.1]
    [Destination: host]
    USBPcap pseudoheader length: 27
    IRP ID: 0xffffa68649451010
    IRP USBD_STATUS: USBD_STATUS_SUCCESS (0x00000000)
    URB Function: URB_FUNCTION_BULK_OR_INTERRUPT_TRANSFER (0x0009)
    IRP information: 0x01, Direction: PDO -> FDO
    URB bus id: 1
    Device address: 17
    Endpoint: 0x81, Direction: IN
    URB transfer type: URB_INTERRUPT (0x01)
    Packet Data Length: 64
    [Request in: 3204]
    [Time from request: 32.989000 milliseconds]
    [bInterfaceClass: HID (0x03)]
HID Data: 1002010010291d44656661756c742050726573657410036a00000000000000000000000010033d000000000000000000000000000000000000100331000abc8d

No.     Time           Source                Destination           Protocol Length Info
   3212 11.796773      host                  1.17.1                USB      27     URB_INTERRUPT in

Frame 3212: Packet, 27 bytes on wire (216 bits), 27 bytes captured (216 bits) on interface \\.\USBPcap1, id 0
    Section number: 1
    Interface id: 0 (\\.\USBPcap1)
    Encapsulation type: USB packets with USBPcap header (152)
    Arrival Time: Mar 31, 2026 22:43:01.583433000 W. Europe Summer Time
    UTC Arrival Time: Mar 31, 2026 20:43:01.583433000 UTC
    Epoch Arrival Time: 1774989781.583433000
    [Time shift for this packet: 0.000000000 seconds]
    [Time delta from previous captured frame: 14.000 microseconds]
    [Time delta from previous displayed frame: 14.000 microseconds]
    [Time since reference or first frame: 11.796773000 seconds]
    Frame Number: 3212
    Frame Length: 27 bytes (216 bits)
    Capture Length: 27 bytes (216 bits)
    [Frame is marked: False]
    [Frame is ignored: False]
    [Protocols in frame: usb]
    Character encoding: ASCII (0)
USB URB
    [Source: host]
    [Destination: 1.17.1]
    USBPcap pseudoheader length: 27
    IRP ID: 0xffffa68649451010
    IRP USBD_STATUS: USBD_STATUS_SUCCESS (0x00000000)
    URB Function: URB_FUNCTION_BULK_OR_INTERRUPT_TRANSFER (0x0009)
    IRP information: 0x00, Direction: FDO -> PDO
    URB bus id: 1
    Device address: 17
    Endpoint: 0x81, Direction: IN
    URB transfer type: URB_INTERRUPT (0x01)
    Packet Data Length: 0
    [Response in: 3219]
    [bInterfaceClass: HID (0x03)]

No.     Time           Source                Destination           Protocol Length Info
   3213 11.797443      host                  1.17.2                USB      91     URB_INTERRUPT out

Frame 3213: Packet, 91 bytes on wire (728 bits), 91 bytes captured (728 bits) on interface \\.\USBPcap1, id 0
    Section number: 1
    Interface id: 0 (\\.\USBPcap1)
    Encapsulation type: USB packets with USBPcap header (152)
    Arrival Time: Mar 31, 2026 22:43:01.584103000 W. Europe Summer Time
    UTC Arrival Time: Mar 31, 2026 20:43:01.584103000 UTC
    Epoch Arrival Time: 1774989781.584103000
    [Time shift for this packet: 0.000000000 seconds]
    [Time delta from previous captured frame: 670.000 microseconds]
    [Time delta from previous displayed frame: 670.000 microseconds]
    [Time since reference or first frame: 11.797443000 seconds]
    Frame Number: 3213
    Frame Length: 91 bytes (728 bits)
    Capture Length: 91 bytes (728 bits)
    [Frame is marked: False]
    [Frame is ignored: False]
    [Protocols in frame: usb:usbhid]
    Character encoding: ASCII (0)
USB URB
    [Source: host]
    [Destination: 1.17.2]
    USBPcap pseudoheader length: 27
    IRP ID: 0xffffa68648ede010
    IRP USBD_STATUS: USBD_STATUS_SUCCESS (0x00000000)
    URB Function: URB_FUNCTION_BULK_OR_INTERRUPT_TRANSFER (0x0009)
    IRP information: 0x00, Direction: FDO -> PDO
    URB bus id: 1
    Device address: 17
    Endpoint: 0x02, Direction: OUT
    URB transfer type: URB_INTERRUPT (0x01)
    Packet Data Length: 64
    [Response in: 3214]
    [bInterfaceClass: HID (0x03)]
HID Data: 100200010227001003250080a1f30398a1f303b85f050a774d400080a1f303774d400080a1f303c0fdfe041548400080a1f30398a1f303b85f050ad8fdfe04d8

No.     Time           Source                Destination           Protocol Length Info
   3214 11.799123      1.17.2                host                  USB      27     URB_INTERRUPT out

Frame 3214: Packet, 27 bytes on wire (216 bits), 27 bytes captured (216 bits) on interface \\.\USBPcap1, id 0
    Section number: 1
    Interface id: 0 (\\.\USBPcap1)
    Encapsulation type: USB packets with USBPcap header (152)
    Arrival Time: Mar 31, 2026 22:43:01.585783000 W. Europe Summer Time
    UTC Arrival Time: Mar 31, 2026 20:43:01.585783000 UTC
    Epoch Arrival Time: 1774989781.585783000
    [Time shift for this packet: 0.000000000 seconds]
    [Time delta from previous captured frame: 1.680000 milliseconds]
    [Time delta from previous displayed frame: 1.680000 milliseconds]
    [Time since reference or first frame: 11.799123000 seconds]
    Frame Number: 3214
    Frame Length: 27 bytes (216 bits)
    Capture Length: 27 bytes (216 bits)
    [Frame is marked: False]
    [Frame is ignored: False]
    [Protocols in frame: usb]
    Character encoding: ASCII (0)
USB URB
    [Source: 1.17.2]
    [Destination: host]
    USBPcap pseudoheader length: 27
    IRP ID: 0xffffa68648ede010
    IRP USBD_STATUS: USBD_STATUS_SUCCESS (0x00000000)
    URB Function: URB_FUNCTION_BULK_OR_INTERRUPT_TRANSFER (0x0009)
    IRP information: 0x01, Direction: PDO -> FDO
    URB bus id: 1
    Device address: 17
    Endpoint: 0x02, Direction: OUT
    URB transfer type: URB_INTERRUPT (0x01)
    Packet Data Length: 0
    [Request in: 3213]
    [Time from request: 1.680000 milliseconds]
    [bInterfaceClass: HID (0x03)]

No.     Time           Source                Destination           Protocol Length Info
   3215 11.801756      1.17.1                host                  USB      91     URB_INTERRUPT in

Frame 3215: Packet, 91 bytes on wire (728 bits), 91 bytes captured (728 bits) on interface \\.\USBPcap1, id 0
    Section number: 1
    Interface id: 0 (\\.\USBPcap1)
    Encapsulation type: USB packets with USBPcap header (152)
    Arrival Time: Mar 31, 2026 22:43:01.588416000 W. Europe Summer Time
    UTC Arrival Time: Mar 31, 2026 20:43:01.588416000 UTC
    Epoch Arrival Time: 1774989781.588416000
    [Time shift for this packet: 0.000000000 seconds]
    [Time delta from previous captured frame: 2.633000 milliseconds]
    [Time delta from previous displayed frame: 2.633000 milliseconds]
    [Time since reference or first frame: 11.801756000 seconds]
    Frame Number: 3215
    Frame Length: 91 bytes (728 bits)
    Capture Length: 91 bytes (728 bits)
    [Frame is marked: False]
    [Frame is ignored: False]
    [Protocols in frame: usb:usbhid]
    Character encoding: ASCII (0)
USB URB
    [Source: 1.17.1]
    [Destination: host]
    USBPcap pseudoheader length: 27
    IRP ID: 0xffffa686494500d0
    IRP USBD_STATUS: USBD_STATUS_SUCCESS (0x00000000)
    URB Function: URB_FUNCTION_BULK_OR_INTERRUPT_TRANSFER (0x0009)
    IRP information: 0x01, Direction: PDO -> FDO
    URB bus id: 1
    Device address: 17
    Endpoint: 0x81, Direction: IN
    URB transfer type: URB_INTERRUPT (0x01)
    Packet Data Length: 64
    [Request in: 3208]
    [Time from request: 28.982000 milliseconds]
    [bInterfaceClass: HID (0x03)]
HID Data: 10020100342400ffff444959204d6f6e206f6666736574496e41000000000000003100f30163000000180100000300496e42000000000000001003bc000abc8d

No.     Time           Source                Destination           Protocol Length Info
   3216 11.801769      host                  1.17.1                USB      27     URB_INTERRUPT in

Frame 3216: Packet, 27 bytes on wire (216 bits), 27 bytes captured (216 bits) on interface \\.\USBPcap1, id 0
    Section number: 1
    Interface id: 0 (\\.\USBPcap1)
    Encapsulation type: USB packets with USBPcap header (152)
    Arrival Time: Mar 31, 2026 22:43:01.588429000 W. Europe Summer Time
    UTC Arrival Time: Mar 31, 2026 20:43:01.588429000 UTC
    Epoch Arrival Time: 1774989781.588429000
    [Time shift for this packet: 0.000000000 seconds]
    [Time delta from previous captured frame: 13.000 microseconds]
    [Time delta from previous displayed frame: 13.000 microseconds]
    [Time since reference or first frame: 11.801769000 seconds]
    Frame Number: 3216
    Frame Length: 27 bytes (216 bits)
    Capture Length: 27 bytes (216 bits)
    [Frame is marked: False]
    [Frame is ignored: False]
    [Protocols in frame: usb]
    Character encoding: ASCII (0)
USB URB
    [Source: host]
    [Destination: 1.17.1]
    USBPcap pseudoheader length: 27
    IRP ID: 0xffffa686494500d0
    IRP USBD_STATUS: USBD_STATUS_SUCCESS (0x00000000)
    URB Function: URB_FUNCTION_BULK_OR_INTERRUPT_TRANSFER (0x0009)
    IRP information: 0x00, Direction: FDO -> PDO
    URB bus id: 1
    Device address: 17
    Endpoint: 0x81, Direction: IN
    URB transfer type: URB_INTERRUPT (0x01)
    Packet Data Length: 0
    [Response in: 3223]
    [bInterfaceClass: HID (0x03)]

No.     Time           Source                Destination           Protocol Length Info
   3217 11.803018      host                  1.17.2                USB      91     URB_INTERRUPT out

Frame 3217: Packet, 91 bytes on wire (728 bits), 91 bytes captured (728 bits) on interface \\.\USBPcap1, id 0
    Section number: 1
    Interface id: 0 (\\.\USBPcap1)
    Encapsulation type: USB packets with USBPcap header (152)
    Arrival Time: Mar 31, 2026 22:43:01.589678000 W. Europe Summer Time
    UTC Arrival Time: Mar 31, 2026 20:43:01.589678000 UTC
    Epoch Arrival Time: 1774989781.589678000
    [Time shift for this packet: 0.000000000 seconds]
    [Time delta from previous captured frame: 1.249000 milliseconds]
    [Time delta from previous displayed frame: 1.249000 milliseconds]
    [Time since reference or first frame: 11.803018000 seconds]
    Frame Number: 3217
    Frame Length: 91 bytes (728 bits)
    Capture Length: 91 bytes (728 bits)
    [Frame is marked: False]
    [Frame is ignored: False]
    [Protocols in frame: usb:usbhid]
    Character encoding: ASCII (0)
USB URB
    [Source: host]
    [Destination: 1.17.2]
    USBPcap pseudoheader length: 27
    IRP ID: 0xffffa68649cd92a0
    IRP USBD_STATUS: USBD_STATUS_SUCCESS (0x00000000)
    URB Function: URB_FUNCTION_BULK_OR_INTERRUPT_TRANSFER (0x0009)
    IRP information: 0x00, Direction: FDO -> PDO
    URB bus id: 1
    Device address: 17
    Endpoint: 0x02, Direction: OUT
    URB transfer type: URB_INTERRUPT (0x01)
    Packet Data Length: 64
    [Response in: 3218]
    [bInterfaceClass: HID (0x03)]
HID Data: 1002000102270110032400f0eb7f092cec7f09b85f050a774d4000f0eb7f09774d4000f0eb7f09c0fdfe0415484000f0eb7f092cec7f09b85f050ad8fdfe04d8

No.     Time           Source                Destination           Protocol Length Info
   3218 11.804115      1.17.2                host                  USB      27     URB_INTERRUPT out

Frame 3218: Packet, 27 bytes on wire (216 bits), 27 bytes captured (216 bits) on interface \\.\USBPcap1, id 0
    Section number: 1
    Interface id: 0 (\\.\USBPcap1)
    Encapsulation type: USB packets with USBPcap header (152)
    Arrival Time: Mar 31, 2026 22:43:01.590775000 W. Europe Summer Time
    UTC Arrival Time: Mar 31, 2026 20:43:01.590775000 UTC
    Epoch Arrival Time: 1774989781.590775000
    [Time shift for this packet: 0.000000000 seconds]
    [Time delta from previous captured frame: 1.097000 milliseconds]
    [Time delta from previous displayed frame: 1.097000 milliseconds]
    [Time since reference or first frame: 11.804115000 seconds]
    Frame Number: 3218
    Frame Length: 27 bytes (216 bits)
    Capture Length: 27 bytes (216 bits)
    [Frame is marked: False]
    [Frame is ignored: False]
    [Protocols in frame: usb]
    Character encoding: ASCII (0)
USB URB
    [Source: 1.17.2]
    [Destination: host]
    USBPcap pseudoheader length: 27
    IRP ID: 0xffffa68649cd92a0
    IRP USBD_STATUS: USBD_STATUS_SUCCESS (0x00000000)
    URB Function: URB_FUNCTION_BULK_OR_INTERRUPT_TRANSFER (0x0009)
    IRP information: 0x01, Direction: PDO -> FDO
    URB bus id: 1
    Device address: 17
    Endpoint: 0x02, Direction: OUT
    URB transfer type: URB_INTERRUPT (0x01)
    Packet Data Length: 0
    [Request in: 3217]
    [Time from request: 1.097000 milliseconds]
    [bInterfaceClass: HID (0x03)]

No.     Time           Source                Destination           Protocol Length Info
   3219 11.811754      1.17.1                host                  USB      91     URB_INTERRUPT in

Frame 3219: Packet, 91 bytes on wire (728 bits), 91 bytes captured (728 bits) on interface \\.\USBPcap1, id 0
    Section number: 1
    Interface id: 0 (\\.\USBPcap1)
    Encapsulation type: USB packets with USBPcap header (152)
    Arrival Time: Mar 31, 2026 22:43:01.598414000 W. Europe Summer Time
    UTC Arrival Time: Mar 31, 2026 20:43:01.598414000 UTC
    Epoch Arrival Time: 1774989781.598414000
    [Time shift for this packet: 0.000000000 seconds]
    [Time delta from previous captured frame: 7.639000 milliseconds]
    [Time delta from previous displayed frame: 7.639000 milliseconds]
    [Time since reference or first frame: 11.811754000 seconds]
    Frame Number: 3219
    Frame Length: 91 bytes (728 bits)
    Capture Length: 91 bytes (728 bits)
    [Frame is marked: False]
    [Frame is ignored: False]
    [Protocols in frame: usb:usbhid]
    Character encoding: ASCII (0)
USB URB
    [Source: 1.17.1]
    [Destination: host]
    USBPcap pseudoheader length: 27
    IRP ID: 0xffffa68649451010
    IRP USBD_STATUS: USBD_STATUS_SUCCESS (0x00000000)
    URB Function: URB_FUNCTION_BULK_OR_INTERRUPT_TRANSFER (0x0009)
    IRP information: 0x01, Direction: PDO -> FDO
    URB bus id: 1
    Device address: 17
    Endpoint: 0x81, Direction: IN
    URB transfer type: URB_INTERRUPT (0x01)
    Packet Data Length: 64
    [Request in: 3212]
    [Time from request: 14.981000 milliseconds]
    [bInterfaceClass: HID (0x03)]
HID Data: 100201003424013100f30163000000180100000000496e43000000000000003100f30163000000180100000400496e44000000000000000000100312000abc8d

No.     Time           Source                Destination           Protocol Length Info
   3220 11.811766      host                  1.17.1                USB      27     URB_INTERRUPT in

Frame 3220: Packet, 27 bytes on wire (216 bits), 27 bytes captured (216 bits) on interface \\.\USBPcap1, id 0
    Section number: 1
    Interface id: 0 (\\.\USBPcap1)
    Encapsulation type: USB packets with USBPcap header (152)
    Arrival Time: Mar 31, 2026 22:43:01.598426000 W. Europe Summer Time
    UTC Arrival Time: Mar 31, 2026 20:43:01.598426000 UTC
    Epoch Arrival Time: 1774989781.598426000
    [Time shift for this packet: 0.000000000 seconds]
    [Time delta from previous captured frame: 12.000 microseconds]
    [Time delta from previous displayed frame: 12.000 microseconds]
    [Time since reference or first frame: 11.811766000 seconds]
    Frame Number: 3220
    Frame Length: 27 bytes (216 bits)
    Capture Length: 27 bytes (216 bits)
    [Frame is marked: False]
    [Frame is ignored: False]
    [Protocols in frame: usb]
    Character encoding: ASCII (0)
USB URB
    [Source: host]
    [Destination: 1.17.1]
    USBPcap pseudoheader length: 27
    IRP ID: 0xffffa68649451010
    IRP USBD_STATUS: USBD_STATUS_SUCCESS (0x00000000)
    URB Function: URB_FUNCTION_BULK_OR_INTERRUPT_TRANSFER (0x0009)
    IRP information: 0x00, Direction: FDO -> PDO
    URB bus id: 1
    Device address: 17
    Endpoint: 0x81, Direction: IN
    URB transfer type: URB_INTERRUPT (0x01)
    Packet Data Length: 0
    [Response in: 3227]
    [bInterfaceClass: HID (0x03)]

No.     Time           Source                Destination           Protocol Length Info
   3221 11.813495      host                  1.17.2                USB      91     URB_INTERRUPT out

Frame 3221: Packet, 91 bytes on wire (728 bits), 91 bytes captured (728 bits) on interface \\.\USBPcap1, id 0
    Section number: 1
    Interface id: 0 (\\.\USBPcap1)
    Encapsulation type: USB packets with USBPcap header (152)
    Arrival Time: Mar 31, 2026 22:43:01.600155000 W. Europe Summer Time
    UTC Arrival Time: Mar 31, 2026 20:43:01.600155000 UTC
    Epoch Arrival Time: 1774989781.600155000
    [Time shift for this packet: 0.000000000 seconds]
    [Time delta from previous captured frame: 1.729000 milliseconds]
    [Time delta from previous displayed frame: 1.729000 milliseconds]
    [Time since reference or first frame: 11.813495000 seconds]
    Frame Number: 3221
    Frame Length: 91 bytes (728 bits)
    Capture Length: 91 bytes (728 bits)
    [Frame is marked: False]
    [Frame is ignored: False]
    [Protocols in frame: usb:usbhid]
    Character encoding: ASCII (0)
USB URB
    [Source: host]
    [Destination: 1.17.2]
    USBPcap pseudoheader length: 27
    IRP ID: 0xffffa6864903d250
    IRP USBD_STATUS: USBD_STATUS_SUCCESS (0x00000000)
    URB Function: URB_FUNCTION_BULK_OR_INTERRUPT_TRANSFER (0x0009)
    IRP information: 0x00, Direction: FDO -> PDO
    URB bus id: 1
    Device address: 17
    Endpoint: 0x02, Direction: OUT
    URB transfer type: URB_INTERRUPT (0x01)
    Packet Data Length: 64
    [Response in: 3222]
    [bInterfaceClass: HID (0x03)]
HID Data: 1002000102270210032700f0eb7f092cec7f09b85f050a774d4000f0eb7f09774d4000f0eb7f09c0fdfe0415484000f0eb7f092cec7f09b85f050ad8fdfe04d8

No.     Time           Source                Destination           Protocol Length Info
   3222 11.815116      1.17.2                host                  USB      27     URB_INTERRUPT out

Frame 3222: Packet, 27 bytes on wire (216 bits), 27 bytes captured (216 bits) on interface \\.\USBPcap1, id 0
    Section number: 1
    Interface id: 0 (\\.\USBPcap1)
    Encapsulation type: USB packets with USBPcap header (152)
    Arrival Time: Mar 31, 2026 22:43:01.601776000 W. Europe Summer Time
    UTC Arrival Time: Mar 31, 2026 20:43:01.601776000 UTC
    Epoch Arrival Time: 1774989781.601776000
    [Time shift for this packet: 0.000000000 seconds]
    [Time delta from previous captured frame: 1.621000 milliseconds]
    [Time delta from previous displayed frame: 1.621000 milliseconds]
    [Time since reference or first frame: 11.815116000 seconds]
    Frame Number: 3222
    Frame Length: 27 bytes (216 bits)
    Capture Length: 27 bytes (216 bits)
    [Frame is marked: False]
    [Frame is ignored: False]
    [Protocols in frame: usb]
    Character encoding: ASCII (0)
USB URB
    [Source: 1.17.2]
    [Destination: host]
    USBPcap pseudoheader length: 27
    IRP ID: 0xffffa6864903d250
    IRP USBD_STATUS: USBD_STATUS_SUCCESS (0x00000000)
    URB Function: URB_FUNCTION_BULK_OR_INTERRUPT_TRANSFER (0x0009)
    IRP information: 0x01, Direction: PDO -> FDO
    URB bus id: 1
    Device address: 17
    Endpoint: 0x02, Direction: OUT
    URB transfer type: URB_INTERRUPT (0x01)
    Packet Data Length: 0
    [Request in: 3221]
    [Time from request: 1.621000 milliseconds]
    [bInterfaceClass: HID (0x03)]

No.     Time           Source                Destination           Protocol Length Info
   3223 11.821758      1.17.1                host                  USB      91     URB_INTERRUPT in

Frame 3223: Packet, 91 bytes on wire (728 bits), 91 bytes captured (728 bits) on interface \\.\USBPcap1, id 0
    Section number: 1
    Interface id: 0 (\\.\USBPcap1)
    Encapsulation type: USB packets with USBPcap header (152)
    Arrival Time: Mar 31, 2026 22:43:01.608418000 W. Europe Summer Time
    UTC Arrival Time: Mar 31, 2026 20:43:01.608418000 UTC
    Epoch Arrival Time: 1774989781.608418000
    [Time shift for this packet: 0.000000000 seconds]
    [Time delta from previous captured frame: 6.642000 milliseconds]
    [Time delta from previous displayed frame: 6.642000 milliseconds]
    [Time since reference or first frame: 11.821758000 seconds]
    Frame Number: 3223
    Frame Length: 91 bytes (728 bits)
    Capture Length: 91 bytes (728 bits)
    [Frame is marked: False]
    [Frame is ignored: False]
    [Protocols in frame: usb:usbhid]
    Character encoding: ASCII (0)
USB URB
    [Source: 1.17.1]
    [Destination: host]
    USBPcap pseudoheader length: 27
    IRP ID: 0xffffa686494500d0
    IRP USBD_STATUS: USBD_STATUS_SUCCESS (0x00000000)
    URB Function: URB_FUNCTION_BULK_OR_INTERRUPT_TRANSFER (0x0009)
    IRP information: 0x01, Direction: PDO -> FDO
    URB bus id: 1
    Device address: 17
    Endpoint: 0x81, Direction: IN
    URB transfer type: URB_INTERRUPT (0x01)
    Packet Data Length: 64
    [Request in: 3216]
    [Time from request: 19.989000 milliseconds]
    [bInterfaceClass: HID (0x03)]
HID Data: 10020100342402990209008c001801000008004f75743100000000010014002c010a00cb00590010017800470019007800760019007800a10010033b000abc8d

No.     Time           Source                Destination           Protocol Length Info
   3224 11.821779      host                  1.17.1                USB      27     URB_INTERRUPT in

Frame 3224: Packet, 27 bytes on wire (216 bits), 27 bytes captured (216 bits) on interface \\.\USBPcap1, id 0
    Section number: 1
    Interface id: 0 (\\.\USBPcap1)
    Encapsulation type: USB packets with USBPcap header (152)
    Arrival Time: Mar 31, 2026 22:43:01.608439000 W. Europe Summer Time
    UTC Arrival Time: Mar 31, 2026 20:43:01.608439000 UTC
    Epoch Arrival Time: 1774989781.608439000
    [Time shift for this packet: 0.000000000 seconds]
    [Time delta from previous captured frame: 21.000 microseconds]
    [Time delta from previous displayed frame: 21.000 microseconds]
    [Time since reference or first frame: 11.821779000 seconds]
    Frame Number: 3224
    Frame Length: 27 bytes (216 bits)
    Capture Length: 27 bytes (216 bits)
    [Frame is marked: False]
    [Frame is ignored: False]
    [Protocols in frame: usb]
    Character encoding: ASCII (0)
USB URB
    [Source: host]
    [Destination: 1.17.1]
    USBPcap pseudoheader length: 27
    IRP ID: 0xffffa686494500d0
    IRP USBD_STATUS: USBD_STATUS_SUCCESS (0x00000000)
    URB Function: URB_FUNCTION_BULK_OR_INTERRUPT_TRANSFER (0x0009)
    IRP information: 0x00, Direction: FDO -> PDO
    URB bus id: 1
    Device address: 17
    Endpoint: 0x81, Direction: IN
    URB transfer type: URB_INTERRUPT (0x01)
    Packet Data Length: 0
    [Response in: 3231]
    [bInterfaceClass: HID (0x03)]

No.     Time           Source                Destination           Protocol Length Info
   3225 11.823976      host                  1.17.2                USB      91     URB_INTERRUPT out

Frame 3225: Packet, 91 bytes on wire (728 bits), 91 bytes captured (728 bits) on interface \\.\USBPcap1, id 0
    Section number: 1
    Interface id: 0 (\\.\USBPcap1)
    Encapsulation type: USB packets with USBPcap header (152)
    Arrival Time: Mar 31, 2026 22:43:01.610636000 W. Europe Summer Time
    UTC Arrival Time: Mar 31, 2026 20:43:01.610636000 UTC
    Epoch Arrival Time: 1774989781.610636000
    [Time shift for this packet: 0.000000000 seconds]
    [Time delta from previous captured frame: 2.197000 milliseconds]
    [Time delta from previous displayed frame: 2.197000 milliseconds]
    [Time since reference or first frame: 11.823976000 seconds]
    Frame Number: 3225
    Frame Length: 91 bytes (728 bits)
    Capture Length: 91 bytes (728 bits)
    [Frame is marked: False]
    [Frame is ignored: False]
    [Protocols in frame: usb:usbhid]
    Character encoding: ASCII (0)
USB URB
    [Source: host]
    [Destination: 1.17.2]
    USBPcap pseudoheader length: 27
    IRP ID: 0xffffa6864b0ce2a0
    IRP USBD_STATUS: USBD_STATUS_SUCCESS (0x00000000)
    URB Function: URB_FUNCTION_BULK_OR_INTERRUPT_TRANSFER (0x0009)
    IRP information: 0x00, Direction: FDO -> PDO
    URB bus id: 1
    Device address: 17
    Endpoint: 0x02, Direction: OUT
    URB transfer type: URB_INTERRUPT (0x01)
    Packet Data Length: 64
    [Response in: 3226]
    [bInterfaceClass: HID (0x03)]
HID Data: 1002000102270310032600f0eb7f092cec7f09b85f050a774d4000f0eb7f09774d4000f0eb7f09c0fdfe0415484000f0eb7f092cec7f09b85f050ad8fdfe04d8

No.     Time           Source                Destination           Protocol Length Info
   3226 11.825115      1.17.2                host                  USB      27     URB_INTERRUPT out

Frame 3226: Packet, 27 bytes on wire (216 bits), 27 bytes captured (216 bits) on interface \\.\USBPcap1, id 0
    Section number: 1
    Interface id: 0 (\\.\USBPcap1)
    Encapsulation type: USB packets with USBPcap header (152)
    Arrival Time: Mar 31, 2026 22:43:01.611775000 W. Europe Summer Time
    UTC Arrival Time: Mar 31, 2026 20:43:01.611775000 UTC
    Epoch Arrival Time: 1774989781.611775000
    [Time shift for this packet: 0.000000000 seconds]
    [Time delta from previous captured frame: 1.139000 milliseconds]
    [Time delta from previous displayed frame: 1.139000 milliseconds]
    [Time since reference or first frame: 11.825115000 seconds]
    Frame Number: 3226
    Frame Length: 27 bytes (216 bits)
    Capture Length: 27 bytes (216 bits)
    [Frame is marked: False]
    [Frame is ignored: False]
    [Protocols in frame: usb]
    Character encoding: ASCII (0)
USB URB
    [Source: 1.17.2]
    [Destination: host]
    USBPcap pseudoheader length: 27
    IRP ID: 0xffffa6864b0ce2a0
    IRP USBD_STATUS: USBD_STATUS_SUCCESS (0x00000000)
    URB Function: URB_FUNCTION_BULK_OR_INTERRUPT_TRANSFER (0x0009)
    IRP information: 0x01, Direction: PDO -> FDO
    URB bus id: 1
    Device address: 17
    Endpoint: 0x02, Direction: OUT
    URB transfer type: URB_INTERRUPT (0x01)
    Packet Data Length: 0
    [Request in: 3225]
    [Time from request: 1.139000 milliseconds]
    [bInterfaceClass: HID (0x03)]

No.     Time           Source                Destination           Protocol Length Info
   3227 11.831758      1.17.1                host                  USB      91     URB_INTERRUPT in

Frame 3227: Packet, 91 bytes on wire (728 bits), 91 bytes captured (728 bits) on interface \\.\USBPcap1, id 0
    Section number: 1
    Interface id: 0 (\\.\USBPcap1)
    Encapsulation type: USB packets with USBPcap header (152)
    Arrival Time: Mar 31, 2026 22:43:01.618418000 W. Europe Summer Time
    UTC Arrival Time: Mar 31, 2026 20:43:01.618418000 UTC
    Epoch Arrival Time: 1774989781.618418000
    [Time shift for this packet: 0.000000000 seconds]
    [Time delta from previous captured frame: 6.643000 milliseconds]
    [Time delta from previous displayed frame: 6.643000 milliseconds]
    [Time since reference or first frame: 11.831758000 seconds]
    Frame Number: 3227
    Frame Length: 91 bytes (728 bits)
    Capture Length: 91 bytes (728 bits)
    [Frame is marked: False]
    [Frame is ignored: False]
    [Protocols in frame: usb:usbhid]
    Character encoding: ASCII (0)
USB URB
    [Source: 1.17.1]
    [Destination: host]
    USBPcap pseudoheader length: 27
    IRP ID: 0xffffa68649451010
    IRP USBD_STATUS: USBD_STATUS_SUCCESS (0x00000000)
    URB Function: URB_FUNCTION_BULK_OR_INTERRUPT_TRANSFER (0x0009)
    IRP information: 0x01, Direction: PDO -> FDO
    URB bus id: 1
    Device address: 17
    Endpoint: 0x81, Direction: IN
    URB transfer type: URB_INTERRUPT (0x01)
    Packet Data Length: 64
    [Request in: 3220]
    [Time from request: 19.992000 milliseconds]
    [bInterfaceClass: HID (0x03)]
HID Data: 1002010034240319007800c80019007800f000190078000e01190000003100f301dc00ff000000280001004f75743200000000020014002c011003d2000abc8d

No.     Time           Source                Destination           Protocol Length Info
   3228 11.831773      host                  1.17.1                USB      27     URB_INTERRUPT in

Frame 3228: Packet, 27 bytes on wire (216 bits), 27 bytes captured (216 bits) on interface \\.\USBPcap1, id 0
    Section number: 1
    Interface id: 0 (\\.\USBPcap1)
    Encapsulation type: USB packets with USBPcap header (152)
    Arrival Time: Mar 31, 2026 22:43:01.618433000 W. Europe Summer Time
    UTC Arrival Time: Mar 31, 2026 20:43:01.618433000 UTC
    Epoch Arrival Time: 1774989781.618433000
    [Time shift for this packet: 0.000000000 seconds]
    [Time delta from previous captured frame: 15.000 microseconds]
    [Time delta from previous displayed frame: 15.000 microseconds]
    [Time since reference or first frame: 11.831773000 seconds]
    Frame Number: 3228
    Frame Length: 27 bytes (216 bits)
    Capture Length: 27 bytes (216 bits)
    [Frame is marked: False]
    [Frame is ignored: False]
    [Protocols in frame: usb]
    Character encoding: ASCII (0)
USB URB
    [Source: host]
    [Destination: 1.17.1]
    USBPcap pseudoheader length: 27
    IRP ID: 0xffffa68649451010
    IRP USBD_STATUS: USBD_STATUS_SUCCESS (0x00000000)
    URB Function: URB_FUNCTION_BULK_OR_INTERRUPT_TRANSFER (0x0009)
    IRP information: 0x00, Direction: FDO -> PDO
    URB bus id: 1
    Device address: 17
    Endpoint: 0x81, Direction: IN
    URB transfer type: URB_INTERRUPT (0x01)
    Packet Data Length: 0
    [Response in: 3235]
    [bInterfaceClass: HID (0x03)]

No.     Time           Source                Destination           Protocol Length Info
   3229 11.834080      host                  1.17.2                USB      91     URB_INTERRUPT out

Frame 3229: Packet, 91 bytes on wire (728 bits), 91 bytes captured (728 bits) on interface \\.\USBPcap1, id 0
    Section number: 1
    Interface id: 0 (\\.\USBPcap1)
    Encapsulation type: USB packets with USBPcap header (152)
    Arrival Time: Mar 31, 2026 22:43:01.620740000 W. Europe Summer Time
    UTC Arrival Time: Mar 31, 2026 20:43:01.620740000 UTC
    Epoch Arrival Time: 1774989781.620740000
    [Time shift for this packet: 0.000000000 seconds]
    [Time delta from previous captured frame: 2.307000 milliseconds]
    [Time delta from previous displayed frame: 2.307000 milliseconds]
    [Time since reference or first frame: 11.834080000 seconds]
    Frame Number: 3229
    Frame Length: 91 bytes (728 bits)
    Capture Length: 91 bytes (728 bits)
    [Frame is marked: False]
    [Frame is ignored: False]
    [Protocols in frame: usb:usbhid]
    Character encoding: ASCII (0)
USB URB
    [Source: host]
    [Destination: 1.17.2]
    USBPcap pseudoheader length: 27
    IRP ID: 0xffffa6864b1d8010
    IRP USBD_STATUS: USBD_STATUS_SUCCESS (0x00000000)
    URB Function: URB_FUNCTION_BULK_OR_INTERRUPT_TRANSFER (0x0009)
    IRP information: 0x00, Direction: FDO -> PDO
    URB bus id: 1
    Device address: 17
    Endpoint: 0x02, Direction: OUT
    URB transfer type: URB_INTERRUPT (0x01)
    Packet Data Length: 64
    [Response in: 3230]
    [bInterfaceClass: HID (0x03)]
HID Data: 1002000102270410032100f0eb7f092cec7f09b85f050a774d4000f0eb7f09774d4000f0eb7f09c0fdfe0415484000f0eb7f092cec7f09b85f050ad8fdfe04d8

No.     Time           Source                Destination           Protocol Length Info
   3230 11.835114      1.17.2                host                  USB      27     URB_INTERRUPT out

Frame 3230: Packet, 27 bytes on wire (216 bits), 27 bytes captured (216 bits) on interface \\.\USBPcap1, id 0
    Section number: 1
    Interface id: 0 (\\.\USBPcap1)
    Encapsulation type: USB packets with USBPcap header (152)
    Arrival Time: Mar 31, 2026 22:43:01.621774000 W. Europe Summer Time
    UTC Arrival Time: Mar 31, 2026 20:43:01.621774000 UTC
    Epoch Arrival Time: 1774989781.621774000
    [Time shift for this packet: 0.000000000 seconds]
    [Time delta from previous captured frame: 1.034000 milliseconds]
    [Time delta from previous displayed frame: 1.034000 milliseconds]
    [Time since reference or first frame: 11.835114000 seconds]
    Frame Number: 3230
    Frame Length: 27 bytes (216 bits)
    Capture Length: 27 bytes (216 bits)
    [Frame is marked: False]
    [Frame is ignored: False]
    [Protocols in frame: usb]
    Character encoding: ASCII (0)
USB URB
    [Source: 1.17.2]
    [Destination: host]
    USBPcap pseudoheader length: 27
    IRP ID: 0xffffa6864b1d8010
    IRP USBD_STATUS: USBD_STATUS_SUCCESS (0x00000000)
    URB Function: URB_FUNCTION_BULK_OR_INTERRUPT_TRANSFER (0x0009)
    IRP information: 0x01, Direction: PDO -> FDO
    URB bus id: 1
    Device address: 17
    Endpoint: 0x02, Direction: OUT
    URB transfer type: URB_INTERRUPT (0x01)
    Packet Data Length: 0
    [Request in: 3229]
    [Time from request: 1.034000 milliseconds]
    [bInterfaceClass: HID (0x03)]

No.     Time           Source                Destination           Protocol Length Info
   3231 11.841758      1.17.1                host                  USB      91     URB_INTERRUPT in

Frame 3231: Packet, 91 bytes on wire (728 bits), 91 bytes captured (728 bits) on interface \\.\USBPcap1, id 0
    Section number: 1
    Interface id: 0 (\\.\USBPcap1)
    Encapsulation type: USB packets with USBPcap header (152)
    Arrival Time: Mar 31, 2026 22:43:01.628418000 W. Europe Summer Time
    UTC Arrival Time: Mar 31, 2026 20:43:01.628418000 UTC
    Epoch Arrival Time: 1774989781.628418000
    [Time shift for this packet: 0.000000000 seconds]
    [Time delta from previous captured frame: 6.644000 milliseconds]
    [Time delta from previous displayed frame: 6.644000 milliseconds]
    [Time since reference or first frame: 11.841758000 seconds]
    Frame Number: 3231
    Frame Length: 91 bytes (728 bits)
    Capture Length: 91 bytes (728 bits)
    [Frame is marked: False]
    [Frame is ignored: False]
    [Protocols in frame: usb:usbhid]
    Character encoding: ASCII (0)
USB URB
    [Source: 1.17.1]
    [Destination: host]
    USBPcap pseudoheader length: 27
    IRP ID: 0xffffa686494500d0
    IRP USBD_STATUS: USBD_STATUS_SUCCESS (0x00000000)
    URB Function: URB_FUNCTION_BULK_OR_INTERRUPT_TRANSFER (0x0009)
    IRP information: 0x01, Direction: PDO -> FDO
    URB bus id: 1
    Device address: 17
    Endpoint: 0x81, Direction: IN
    URB transfer type: URB_INTERRUPT (0x01)
    Packet Data Length: 64
    [Request in: 3224]
    [Time from request: 19.979000 milliseconds]
    [bInterfaceClass: HID (0x03)]
HID Data: 100201003424040a00cb00590010017800470019007800760019007800a10019007800c80019007800f000190078000e01190000003100f3011003f9000abc8d

No.     Time           Source                Destination           Protocol Length Info
   3232 11.841781      host                  1.17.1                USB      27     URB_INTERRUPT in

Frame 3232: Packet, 27 bytes on wire (216 bits), 27 bytes captured (216 bits) on interface \\.\USBPcap1, id 0
    Section number: 1
    Interface id: 0 (\\.\USBPcap1)
    Encapsulation type: USB packets with USBPcap header (152)
    Arrival Time: Mar 31, 2026 22:43:01.628441000 W. Europe Summer Time
    UTC Arrival Time: Mar 31, 2026 20:43:01.628441000 UTC
    Epoch Arrival Time: 1774989781.628441000
    [Time shift for this packet: 0.000000000 seconds]
    [Time delta from previous captured frame: 23.000 microseconds]
    [Time delta from previous displayed frame: 23.000 microseconds]
    [Time since reference or first frame: 11.841781000 seconds]
    Frame Number: 3232
    Frame Length: 27 bytes (216 bits)
    Capture Length: 27 bytes (216 bits)
    [Frame is marked: False]
    [Frame is ignored: False]
    [Protocols in frame: usb]
    Character encoding: ASCII (0)
USB URB
    [Source: host]
    [Destination: 1.17.1]
    USBPcap pseudoheader length: 27
    IRP ID: 0xffffa686494500d0
    IRP USBD_STATUS: USBD_STATUS_SUCCESS (0x00000000)
    URB Function: URB_FUNCTION_BULK_OR_INTERRUPT_TRANSFER (0x0009)
    IRP information: 0x00, Direction: FDO -> PDO
    URB bus id: 1
    Device address: 17
    Endpoint: 0x81, Direction: IN
    URB transfer type: URB_INTERRUPT (0x01)
    Packet Data Length: 0
    [Response in: 3239]
    [bInterfaceClass: HID (0x03)]

No.     Time           Source                Destination           Protocol Length Info
   3233 11.844834      host                  1.17.2                USB      91     URB_INTERRUPT out

Frame 3233: Packet, 91 bytes on wire (728 bits), 91 bytes captured (728 bits) on interface \\.\USBPcap1, id 0
    Section number: 1
    Interface id: 0 (\\.\USBPcap1)
    Encapsulation type: USB packets with USBPcap header (152)
    Arrival Time: Mar 31, 2026 22:43:01.631494000 W. Europe Summer Time
    UTC Arrival Time: Mar 31, 2026 20:43:01.631494000 UTC
    Epoch Arrival Time: 1774989781.631494000
    [Time shift for this packet: 0.000000000 seconds]
    [Time delta from previous captured frame: 3.053000 milliseconds]
    [Time delta from previous displayed frame: 3.053000 milliseconds]
    [Time since reference or first frame: 11.844834000 seconds]
    Frame Number: 3233
    Frame Length: 91 bytes (728 bits)
    Capture Length: 91 bytes (728 bits)
    [Frame is marked: False]
    [Frame is ignored: False]
    [Protocols in frame: usb:usbhid]
    Character encoding: ASCII (0)
USB URB
    [Source: host]
    [Destination: 1.17.2]
    USBPcap pseudoheader length: 27
    IRP ID: 0xffffa686087ee010
    IRP USBD_STATUS: USBD_STATUS_SUCCESS (0x00000000)
    URB Function: URB_FUNCTION_BULK_OR_INTERRUPT_TRANSFER (0x0009)
    IRP information: 0x00, Direction: FDO -> PDO
    URB bus id: 1
    Device address: 17
    Endpoint: 0x02, Direction: OUT
    URB transfer type: URB_INTERRUPT (0x01)
    Packet Data Length: 64
    [Response in: 3234]
    [bInterfaceClass: HID (0x03)]
HID Data: 1002000102270510032000f0eb7f092cec7f09b85f050a774d4000f0eb7f09774d4000f0eb7f09c0fdfe0415484000f0eb7f092cec7f09b85f050ad8fdfe04d8

No.     Time           Source                Destination           Protocol Length Info
   3234 11.846120      1.17.2                host                  USB      27     URB_INTERRUPT out

Frame 3234: Packet, 27 bytes on wire (216 bits), 27 bytes captured (216 bits) on interface \\.\USBPcap1, id 0
    Section number: 1
    Interface id: 0 (\\.\USBPcap1)
    Encapsulation type: USB packets with USBPcap header (152)
    Arrival Time: Mar 31, 2026 22:43:01.632780000 W. Europe Summer Time
    UTC Arrival Time: Mar 31, 2026 20:43:01.632780000 UTC
    Epoch Arrival Time: 1774989781.632780000
    [Time shift for this packet: 0.000000000 seconds]
    [Time delta from previous captured frame: 1.286000 milliseconds]
    [Time delta from previous displayed frame: 1.286000 milliseconds]
    [Time since reference or first frame: 11.846120000 seconds]
    Frame Number: 3234
    Frame Length: 27 bytes (216 bits)
    Capture Length: 27 bytes (216 bits)
    [Frame is marked: False]
    [Frame is ignored: False]
    [Protocols in frame: usb]
    Character encoding: ASCII (0)
USB URB
    [Source: 1.17.2]
    [Destination: host]
    USBPcap pseudoheader length: 27
    IRP ID: 0xffffa686087ee010
    IRP USBD_STATUS: USBD_STATUS_SUCCESS (0x00000000)
    URB Function: URB_FUNCTION_BULK_OR_INTERRUPT_TRANSFER (0x0009)
    IRP information: 0x01, Direction: PDO -> FDO
    URB bus id: 1
    Device address: 17
    Endpoint: 0x02, Direction: OUT
    URB transfer type: URB_INTERRUPT (0x01)
    Packet Data Length: 0
    [Request in: 3233]
    [Time from request: 1.286000 milliseconds]
    [bInterfaceClass: HID (0x03)]

No.     Time           Source                Destination           Protocol Length Info
   3235 11.851753      1.17.1                host                  USB      91     URB_INTERRUPT in

Frame 3235: Packet, 91 bytes on wire (728 bits), 91 bytes captured (728 bits) on interface \\.\USBPcap1, id 0
    Section number: 1
    Interface id: 0 (\\.\USBPcap1)
    Encapsulation type: USB packets with USBPcap header (152)
    Arrival Time: Mar 31, 2026 22:43:01.638413000 W. Europe Summer Time
    UTC Arrival Time: Mar 31, 2026 20:43:01.638413000 UTC
    Epoch Arrival Time: 1774989781.638413000
    [Time shift for this packet: 0.000000000 seconds]
    [Time delta from previous captured frame: 5.633000 milliseconds]
    [Time delta from previous displayed frame: 5.633000 milliseconds]
    [Time since reference or first frame: 11.851753000 seconds]
    Frame Number: 3235
    Frame Length: 91 bytes (728 bits)
    Capture Length: 91 bytes (728 bits)
    [Frame is marked: False]
    [Frame is ignored: False]
    [Protocols in frame: usb:usbhid]
    Character encoding: ASCII (0)
USB URB
    [Source: 1.17.1]
    [Destination: host]
    USBPcap pseudoheader length: 27
    IRP ID: 0xffffa68649451010
    IRP USBD_STATUS: USBD_STATUS_SUCCESS (0x00000000)
    URB Function: URB_FUNCTION_BULK_OR_INTERRUPT_TRANSFER (0x0009)
    IRP information: 0x01, Direction: PDO -> FDO
    URB bus id: 1
    Device address: 17
    Endpoint: 0x81, Direction: IN
    URB transfer type: URB_INTERRUPT (0x01)
    Packet Data Length: 64
    [Request in: 3228]
    [Time from request: 19.980000 milliseconds]
    [bInterfaceClass: HID (0x03)]
HID Data: 10020100342405dc001e010000000002004f75743300000000040000002c01000078001f0019007800470019007800760019007800a100190010030f000abc8d

No.     Time           Source                Destination           Protocol Length Info
   3236 11.851768      host                  1.17.1                USB      27     URB_INTERRUPT in

Frame 3236: Packet, 27 bytes on wire (216 bits), 27 bytes captured (216 bits) on interface \\.\USBPcap1, id 0
    Section number: 1
    Interface id: 0 (\\.\USBPcap1)
    Encapsulation type: USB packets with USBPcap header (152)
    Arrival Time: Mar 31, 2026 22:43:01.638428000 W. Europe Summer Time
    UTC Arrival Time: Mar 31, 2026 20:43:01.638428000 UTC
    Epoch Arrival Time: 1774989781.638428000
    [Time shift for this packet: 0.000000000 seconds]
    [Time delta from previous captured frame: 15.000 microseconds]
    [Time delta from previous displayed frame: 15.000 microseconds]
    [Time since reference or first frame: 11.851768000 seconds]
    Frame Number: 3236
    Frame Length: 27 bytes (216 bits)
    Capture Length: 27 bytes (216 bits)
    [Frame is marked: False]
    [Frame is ignored: False]
    [Protocols in frame: usb]
    Character encoding: ASCII (0)
USB URB
    [Source: host]
    [Destination: 1.17.1]
    USBPcap pseudoheader length: 27
    IRP ID: 0xffffa68649451010
    IRP USBD_STATUS: USBD_STATUS_SUCCESS (0x00000000)
    URB Function: URB_FUNCTION_BULK_OR_INTERRUPT_TRANSFER (0x0009)
    IRP information: 0x00, Direction: FDO -> PDO
    URB bus id: 1
    Device address: 17
    Endpoint: 0x81, Direction: IN
    URB transfer type: URB_INTERRUPT (0x01)
    Packet Data Length: 0
    [Response in: 3243]
    [bInterfaceClass: HID (0x03)]

No.     Time           Source                Destination           Protocol Length Info
   3237 11.855070      host                  1.17.2                USB      91     URB_INTERRUPT out

Frame 3237: Packet, 91 bytes on wire (728 bits), 91 bytes captured (728 bits) on interface \\.\USBPcap1, id 0
    Section number: 1
    Interface id: 0 (\\.\USBPcap1)
    Encapsulation type: USB packets with USBPcap header (152)
    Arrival Time: Mar 31, 2026 22:43:01.641730000 W. Europe Summer Time
    UTC Arrival Time: Mar 31, 2026 20:43:01.641730000 UTC
    Epoch Arrival Time: 1774989781.641730000
    [Time shift for this packet: 0.000000000 seconds]
    [Time delta from previous captured frame: 3.302000 milliseconds]
    [Time delta from previous displayed frame: 3.302000 milliseconds]
    [Time since reference or first frame: 11.855070000 seconds]
    Frame Number: 3237
    Frame Length: 91 bytes (728 bits)
    Capture Length: 91 bytes (728 bits)
    [Frame is marked: False]
    [Frame is ignored: False]
    [Protocols in frame: usb:usbhid]
    Character encoding: ASCII (0)
USB URB
    [Source: host]
    [Destination: 1.17.2]
    USBPcap pseudoheader length: 27
    IRP ID: 0xffffa686080d32a0
    IRP USBD_STATUS: USBD_STATUS_SUCCESS (0x00000000)
    URB Function: URB_FUNCTION_BULK_OR_INTERRUPT_TRANSFER (0x0009)
    IRP information: 0x00, Direction: FDO -> PDO
    URB bus id: 1
    Device address: 17
    Endpoint: 0x02, Direction: OUT
    URB transfer type: URB_INTERRUPT (0x01)
    Packet Data Length: 64
    [Response in: 3238]
    [bInterfaceClass: HID (0x03)]
HID Data: 1002000102270610032300f0eb7f092cec7f09b85f050a774d4000f0eb7f09774d4000f0eb7f09c0fdfe0415484000f0eb7f092cec7f09b85f050ad8fdfe04d8

No.     Time           Source                Destination           Protocol Length Info
   3238 11.856119      1.17.2                host                  USB      27     URB_INTERRUPT out

Frame 3238: Packet, 27 bytes on wire (216 bits), 27 bytes captured (216 bits) on interface \\.\USBPcap1, id 0
    Section number: 1
    Interface id: 0 (\\.\USBPcap1)
    Encapsulation type: USB packets with USBPcap header (152)
    Arrival Time: Mar 31, 2026 22:43:01.642779000 W. Europe Summer Time
    UTC Arrival Time: Mar 31, 2026 20:43:01.642779000 UTC
    Epoch Arrival Time: 1774989781.642779000
    [Time shift for this packet: 0.000000000 seconds]
    [Time delta from previous captured frame: 1.049000 milliseconds]
    [Time delta from previous displayed frame: 1.049000 milliseconds]
    [Time since reference or first frame: 11.856119000 seconds]
    Frame Number: 3238
    Frame Length: 27 bytes (216 bits)
    Capture Length: 27 bytes (216 bits)
    [Frame is marked: False]
    [Frame is ignored: False]
    [Protocols in frame: usb]
    Character encoding: ASCII (0)
USB URB
    [Source: 1.17.2]
    [Destination: host]
    USBPcap pseudoheader length: 27
    IRP ID: 0xffffa686080d32a0
    IRP USBD_STATUS: USBD_STATUS_SUCCESS (0x00000000)
    URB Function: URB_FUNCTION_BULK_OR_INTERRUPT_TRANSFER (0x0009)
    IRP information: 0x01, Direction: PDO -> FDO
    URB bus id: 1
    Device address: 17
    Endpoint: 0x02, Direction: OUT
    URB transfer type: URB_INTERRUPT (0x01)
    Packet Data Length: 0
    [Request in: 3237]
    [Time from request: 1.049000 milliseconds]
    [bInterfaceClass: HID (0x03)]

No.     Time           Source                Destination           Protocol Length Info
   3239 11.861758      1.17.1                host                  USB      91     URB_INTERRUPT in

Frame 3239: Packet, 91 bytes on wire (728 bits), 91 bytes captured (728 bits) on interface \\.\USBPcap1, id 0
    Section number: 1
    Interface id: 0 (\\.\USBPcap1)
    Encapsulation type: USB packets with USBPcap header (152)
    Arrival Time: Mar 31, 2026 22:43:01.648418000 W. Europe Summer Time
    UTC Arrival Time: Mar 31, 2026 20:43:01.648418000 UTC
    Epoch Arrival Time: 1774989781.648418000
    [Time shift for this packet: 0.000000000 seconds]
    [Time delta from previous captured frame: 5.639000 milliseconds]
    [Time delta from previous displayed frame: 5.639000 milliseconds]
    [Time since reference or first frame: 11.861758000 seconds]
    Frame Number: 3239
    Frame Length: 91 bytes (728 bits)
    Capture Length: 91 bytes (728 bits)
    [Frame is marked: False]
    [Frame is ignored: False]
    [Protocols in frame: usb:usbhid]
    Character encoding: ASCII (0)
USB URB
    [Source: 1.17.1]
    [Destination: host]
    USBPcap pseudoheader length: 27
    IRP ID: 0xffffa686494500d0
    IRP USBD_STATUS: USBD_STATUS_SUCCESS (0x00000000)
    URB Function: URB_FUNCTION_BULK_OR_INTERRUPT_TRANSFER (0x0009)
    IRP information: 0x01, Direction: PDO -> FDO
    URB bus id: 1
    Device address: 17
    Endpoint: 0x81, Direction: IN
    URB transfer type: URB_INTERRUPT (0x01)
    Packet Data Length: 64
    [Request in: 3232]
    [Time from request: 19.977000 milliseconds]
    [bInterfaceClass: HID (0x03)]
HID Data: 100201003424067800c80019007800f000190078000e01190000003100f301dc0018010000000004004f7574340000000008004f002c01080010035a000abc8d

No.     Time           Source                Destination           Protocol Length Info
   3240 11.861773      host                  1.17.1                USB      27     URB_INTERRUPT in

Frame 3240: Packet, 27 bytes on wire (216 bits), 27 bytes captured (216 bits) on interface \\.\USBPcap1, id 0
    Section number: 1
    Interface id: 0 (\\.\USBPcap1)
    Encapsulation type: USB packets with USBPcap header (152)
    Arrival Time: Mar 31, 2026 22:43:01.648433000 W. Europe Summer Time
    UTC Arrival Time: Mar 31, 2026 20:43:01.648433000 UTC
    Epoch Arrival Time: 1774989781.648433000
    [Time shift for this packet: 0.000000000 seconds]
    [Time delta from previous captured frame: 15.000 microseconds]
    [Time delta from previous displayed frame: 15.000 microseconds]
    [Time since reference or first frame: 11.861773000 seconds]
    Frame Number: 3240
    Frame Length: 27 bytes (216 bits)
    Capture Length: 27 bytes (216 bits)
    [Frame is marked: False]
    [Frame is ignored: False]
    [Protocols in frame: usb]
    Character encoding: ASCII (0)
USB URB
    [Source: host]
    [Destination: 1.17.1]
    USBPcap pseudoheader length: 27
    IRP ID: 0xffffa686494500d0
    IRP USBD_STATUS: USBD_STATUS_SUCCESS (0x00000000)
    URB Function: URB_FUNCTION_BULK_OR_INTERRUPT_TRANSFER (0x0009)
    IRP information: 0x00, Direction: FDO -> PDO
    URB bus id: 1
    Device address: 17
    Endpoint: 0x81, Direction: IN
    URB transfer type: URB_INTERRUPT (0x01)
    Packet Data Length: 0
    [Response in: 3247]
    [bInterfaceClass: HID (0x03)]

No.     Time           Source                Destination           Protocol Length Info
   3241 11.865568      host                  1.17.2                USB      91     URB_INTERRUPT out

Frame 3241: Packet, 91 bytes on wire (728 bits), 91 bytes captured (728 bits) on interface \\.\USBPcap1, id 0
    Section number: 1
    Interface id: 0 (\\.\USBPcap1)
    Encapsulation type: USB packets with USBPcap header (152)
    Arrival Time: Mar 31, 2026 22:43:01.652228000 W. Europe Summer Time
    UTC Arrival Time: Mar 31, 2026 20:43:01.652228000 UTC
    Epoch Arrival Time: 1774989781.652228000
    [Time shift for this packet: 0.000000000 seconds]
    [Time delta from previous captured frame: 3.795000 milliseconds]
    [Time delta from previous displayed frame: 3.795000 milliseconds]
    [Time since reference or first frame: 11.865568000 seconds]
    Frame Number: 3241
    Frame Length: 91 bytes (728 bits)
    Capture Length: 91 bytes (728 bits)
    [Frame is marked: False]
    [Frame is ignored: False]
    [Protocols in frame: usb:usbhid]
    Character encoding: ASCII (0)
USB URB
    [Source: host]
    [Destination: 1.17.2]
    USBPcap pseudoheader length: 27
    IRP ID: 0xffffa68649cd92a0
    IRP USBD_STATUS: USBD_STATUS_SUCCESS (0x00000000)
    URB Function: URB_FUNCTION_BULK_OR_INTERRUPT_TRANSFER (0x0009)
    IRP information: 0x00, Direction: FDO -> PDO
    URB bus id: 1
    Device address: 17
    Endpoint: 0x02, Direction: OUT
    URB transfer type: URB_INTERRUPT (0x01)
    Packet Data Length: 64
    [Response in: 3242]
    [bInterfaceClass: HID (0x03)]
HID Data: 1002000102270710032200f0eb7f092cec7f09b85f050a774d4000f0eb7f09774d4000f0eb7f09c0fdfe0415484000f0eb7f092cec7f09b85f050ad8fdfe04d8

No.     Time           Source                Destination           Protocol Length Info
   3242 11.867111      1.17.2                host                  USB      27     URB_INTERRUPT out

Frame 3242: Packet, 27 bytes on wire (216 bits), 27 bytes captured (216 bits) on interface \\.\USBPcap1, id 0
    Section number: 1
    Interface id: 0 (\\.\USBPcap1)
    Encapsulation type: USB packets with USBPcap header (152)
    Arrival Time: Mar 31, 2026 22:43:01.653771000 W. Europe Summer Time
    UTC Arrival Time: Mar 31, 2026 20:43:01.653771000 UTC
    Epoch Arrival Time: 1774989781.653771000
    [Time shift for this packet: 0.000000000 seconds]
    [Time delta from previous captured frame: 1.543000 milliseconds]
    [Time delta from previous displayed frame: 1.543000 milliseconds]
    [Time since reference or first frame: 11.867111000 seconds]
    Frame Number: 3242
    Frame Length: 27 bytes (216 bits)
    Capture Length: 27 bytes (216 bits)
    [Frame is marked: False]
    [Frame is ignored: False]
    [Protocols in frame: usb]
    Character encoding: ASCII (0)
USB URB
    [Source: 1.17.2]
    [Destination: host]
    USBPcap pseudoheader length: 27
    IRP ID: 0xffffa68649cd92a0
    IRP USBD_STATUS: USBD_STATUS_SUCCESS (0x00000000)
    URB Function: URB_FUNCTION_BULK_OR_INTERRUPT_TRANSFER (0x0009)
    IRP information: 0x01, Direction: PDO -> FDO
    URB bus id: 1
    Device address: 17
    Endpoint: 0x02, Direction: OUT
    URB transfer type: URB_INTERRUPT (0x01)
    Packet Data Length: 0
    [Request in: 3241]
    [Time from request: 1.543000 milliseconds]
    [bInterfaceClass: HID (0x03)]

No.     Time           Source                Destination           Protocol Length Info
   3243 11.870765      1.17.1                host                  USB      91     URB_INTERRUPT in

Frame 3243: Packet, 91 bytes on wire (728 bits), 91 bytes captured (728 bits) on interface \\.\USBPcap1, id 0
    Section number: 1
    Interface id: 0 (\\.\USBPcap1)
    Encapsulation type: USB packets with USBPcap header (152)
    Arrival Time: Mar 31, 2026 22:43:01.657425000 W. Europe Summer Time
    UTC Arrival Time: Mar 31, 2026 20:43:01.657425000 UTC
    Epoch Arrival Time: 1774989781.657425000
    [Time shift for this packet: 0.000000000 seconds]
    [Time delta from previous captured frame: 3.654000 milliseconds]
    [Time delta from previous displayed frame: 3.654000 milliseconds]
    [Time since reference or first frame: 11.870765000 seconds]
    Frame Number: 3243
    Frame Length: 91 bytes (728 bits)
    Capture Length: 91 bytes (728 bits)
    [Frame is marked: False]
    [Frame is ignored: False]
    [Protocols in frame: usb:usbhid]
    Character encoding: ASCII (0)
USB URB
    [Source: 1.17.1]
    [Destination: host]
    USBPcap pseudoheader length: 27
    IRP ID: 0xffffa68649451010
    IRP USBD_STATUS: USBD_STATUS_SUCCESS (0x00000000)
    URB Function: URB_FUNCTION_BULK_OR_INTERRUPT_TRANSFER (0x0009)
    IRP information: 0x01, Direction: PDO -> FDO
    URB bus id: 1
    Device address: 17
    Endpoint: 0x81, Direction: IN
    URB transfer type: URB_INTERRUPT (0x01)
    Packet Data Length: 64
    [Request in: 3236]
    [Time from request: 18.997000 milliseconds]
    [bInterfaceClass: HID (0x03)]
HID Data: 1002010034240778001f0019007800470019007800760019007800a10019007800c80019007800f000190078000e01190009030900f301ba00100385000abc8d

No.     Time           Source                Destination           Protocol Length Info
   3244 11.870796      host                  1.17.1                USB      27     URB_INTERRUPT in

Frame 3244: Packet, 27 bytes on wire (216 bits), 27 bytes captured (216 bits) on interface \\.\USBPcap1, id 0
    Section number: 1
    Interface id: 0 (\\.\USBPcap1)
    Encapsulation type: USB packets with USBPcap header (152)
    Arrival Time: Mar 31, 2026 22:43:01.657456000 W. Europe Summer Time
    UTC Arrival Time: Mar 31, 2026 20:43:01.657456000 UTC
    Epoch Arrival Time: 1774989781.657456000
    [Time shift for this packet: 0.000000000 seconds]
    [Time delta from previous captured frame: 31.000 microseconds]
    [Time delta from previous displayed frame: 31.000 microseconds]
    [Time since reference or first frame: 11.870796000 seconds]
    Frame Number: 3244
    Frame Length: 27 bytes (216 bits)
    Capture Length: 27 bytes (216 bits)
    [Frame is marked: False]
    [Frame is ignored: False]
    [Protocols in frame: usb]
    Character encoding: ASCII (0)
USB URB
    [Source: host]
    [Destination: 1.17.1]
    USBPcap pseudoheader length: 27
    IRP ID: 0xffffa68649451010
    IRP USBD_STATUS: USBD_STATUS_SUCCESS (0x00000000)
    URB Function: URB_FUNCTION_BULK_OR_INTERRUPT_TRANSFER (0x0009)
    IRP information: 0x00, Direction: FDO -> PDO
    URB bus id: 1
    Device address: 17
    Endpoint: 0x81, Direction: IN
    URB transfer type: URB_INTERRUPT (0x01)
    Packet Data Length: 0
    [Response in: 3251]
    [bInterfaceClass: HID (0x03)]

No.     Time           Source                Destination           Protocol Length Info
   3245 11.875017      host                  1.17.2                USB      91     URB_INTERRUPT out

Frame 3245: Packet, 91 bytes on wire (728 bits), 91 bytes captured (728 bits) on interface \\.\USBPcap1, id 0
    Section number: 1
    Interface id: 0 (\\.\USBPcap1)
    Encapsulation type: USB packets with USBPcap header (152)
    Arrival Time: Mar 31, 2026 22:43:01.661677000 W. Europe Summer Time
    UTC Arrival Time: Mar 31, 2026 20:43:01.661677000 UTC
    Epoch Arrival Time: 1774989781.661677000
    [Time shift for this packet: 0.000000000 seconds]
    [Time delta from previous captured frame: 4.221000 milliseconds]
    [Time delta from previous displayed frame: 4.221000 milliseconds]
    [Time since reference or first frame: 11.875017000 seconds]
    Frame Number: 3245
    Frame Length: 91 bytes (728 bits)
    Capture Length: 91 bytes (728 bits)
    [Frame is marked: False]
    [Frame is ignored: False]
    [Protocols in frame: usb:usbhid]
    Character encoding: ASCII (0)
USB URB
    [Source: host]
    [Destination: 1.17.2]
    USBPcap pseudoheader length: 27
    IRP ID: 0xffffa6864b1d2530
    IRP USBD_STATUS: USBD_STATUS_SUCCESS (0x00000000)
    URB Function: URB_FUNCTION_BULK_OR_INTERRUPT_TRANSFER (0x0009)
    IRP information: 0x00, Direction: FDO -> PDO
    URB bus id: 1
    Device address: 17
    Endpoint: 0x02, Direction: OUT
    URB transfer type: URB_INTERRUPT (0x01)
    Packet Data Length: 64
    [Response in: 3246]
    [bInterfaceClass: HID (0x03)]
HID Data: 1002000102270810032d00f0eb7f092cec7f09b85f050a774d4000f0eb7f09774d4000f0eb7f09c0fdfe0415484000f0eb7f092cec7f09b85f050ad8fdfe04d8

No.     Time           Source                Destination           Protocol Length Info
   3246 11.876112      1.17.2                host                  USB      27     URB_INTERRUPT out

Frame 3246: Packet, 27 bytes on wire (216 bits), 27 bytes captured (216 bits) on interface \\.\USBPcap1, id 0
    Section number: 1
    Interface id: 0 (\\.\USBPcap1)
    Encapsulation type: USB packets with USBPcap header (152)
    Arrival Time: Mar 31, 2026 22:43:01.662772000 W. Europe Summer Time
    UTC Arrival Time: Mar 31, 2026 20:43:01.662772000 UTC
    Epoch Arrival Time: 1774989781.662772000
    [Time shift for this packet: 0.000000000 seconds]
    [Time delta from previous captured frame: 1.095000 milliseconds]
    [Time delta from previous displayed frame: 1.095000 milliseconds]
    [Time since reference or first frame: 11.876112000 seconds]
    Frame Number: 3246
    Frame Length: 27 bytes (216 bits)
    Capture Length: 27 bytes (216 bits)
    [Frame is marked: False]
    [Frame is ignored: False]
    [Protocols in frame: usb]
    Character encoding: ASCII (0)
USB URB
    [Source: 1.17.2]
    [Destination: host]
    USBPcap pseudoheader length: 27
    IRP ID: 0xffffa6864b1d2530
    IRP USBD_STATUS: USBD_STATUS_SUCCESS (0x00000000)
    URB Function: URB_FUNCTION_BULK_OR_INTERRUPT_TRANSFER (0x0009)
    IRP information: 0x01, Direction: PDO -> FDO
    URB bus id: 1
    Device address: 17
    Endpoint: 0x02, Direction: OUT
    URB transfer type: URB_INTERRUPT (0x01)
    Packet Data Length: 0
    [Request in: 3245]
    [Time from request: 1.095000 milliseconds]
    [bInterfaceClass: HID (0x03)]

No.     Time           Source                Destination           Protocol Length Info
   3247 11.895753      1.17.1                host                  USB      91     URB_INTERRUPT in

Frame 3247: Packet, 91 bytes on wire (728 bits), 91 bytes captured (728 bits) on interface \\.\USBPcap1, id 0
    Section number: 1
    Interface id: 0 (\\.\USBPcap1)
    Encapsulation type: USB packets with USBPcap header (152)
    Arrival Time: Mar 31, 2026 22:43:01.682413000 W. Europe Summer Time
    UTC Arrival Time: Mar 31, 2026 20:43:01.682413000 UTC
    Epoch Arrival Time: 1774989781.682413000
    [Time shift for this packet: 0.000000000 seconds]
    [Time delta from previous captured frame: 19.641000 milliseconds]
    [Time delta from previous displayed frame: 19.641000 milliseconds]
    [Time since reference or first frame: 11.895753000 seconds]
    Frame Number: 3247
    Frame Length: 91 bytes (728 bits)
    Capture Length: 91 bytes (728 bits)
    [Frame is marked: False]
    [Frame is ignored: False]
    [Protocols in frame: usb:usbhid]
    Character encoding: ASCII (0)
USB URB
    [Source: 1.17.1]
    [Destination: host]
    USBPcap pseudoheader length: 27
    IRP ID: 0xffffa686494500d0
    IRP USBD_STATUS: USBD_STATUS_SUCCESS (0x00000000)
    URB Function: URB_FUNCTION_BULK_OR_INTERRUPT_TRANSFER (0x0009)
    IRP information: 0x01, Direction: PDO -> FDO
    URB bus id: 1
    Device address: 17
    Endpoint: 0x81, Direction: IN
    URB transfer type: URB_INTERRUPT (0x01)
    Packet Data Length: 64
    [Request in: 3240]
    [Time from request: 33.980000 milliseconds]
    [bInterfaceClass: HID (0x03)]
HID Data: 100201003424082c0100000000080000000000000000000000000000000000000000000000000000000000000000000000000000000000000010033d000abc8d

No.     Time           Source                Destination           Protocol Length Info
   3248 11.895768      host                  1.17.1                USB      27     URB_INTERRUPT in

Frame 3248: Packet, 27 bytes on wire (216 bits), 27 bytes captured (216 bits) on interface \\.\USBPcap1, id 0
    Section number: 1
    Interface id: 0 (\\.\USBPcap1)
    Encapsulation type: USB packets with USBPcap header (152)
    Arrival Time: Mar 31, 2026 22:43:01.682428000 W. Europe Summer Time
    UTC Arrival Time: Mar 31, 2026 20:43:01.682428000 UTC
    Epoch Arrival Time: 1774989781.682428000
    [Time shift for this packet: 0.000000000 seconds]
    [Time delta from previous captured frame: 15.000 microseconds]
    [Time delta from previous displayed frame: 15.000 microseconds]
    [Time since reference or first frame: 11.895768000 seconds]
    Frame Number: 3248
    Frame Length: 27 bytes (216 bits)
    Capture Length: 27 bytes (216 bits)
    [Frame is marked: False]
    [Frame is ignored: False]
    [Protocols in frame: usb]
    Character encoding: ASCII (0)
USB URB
    [Source: host]
    [Destination: 1.17.1]
    USBPcap pseudoheader length: 27
    IRP ID: 0xffffa686494500d0
    IRP USBD_STATUS: USBD_STATUS_SUCCESS (0x00000000)
    URB Function: URB_FUNCTION_BULK_OR_INTERRUPT_TRANSFER (0x0009)
    IRP information: 0x00, Direction: FDO -> PDO
    URB bus id: 1
    Device address: 17
    Endpoint: 0x81, Direction: IN
    URB transfer type: URB_INTERRUPT (0x01)
    Packet Data Length: 0
    [Response in: 3255]
    [bInterfaceClass: HID (0x03)]

No.     Time           Source                Destination           Protocol Length Info
   3249 12.421297      host                  1.17.2                USB      91     URB_INTERRUPT out

Frame 3249: Packet, 91 bytes on wire (728 bits), 91 bytes captured (728 bits) on interface \\.\USBPcap1, id 0
    Section number: 1
    Interface id: 0 (\\.\USBPcap1)
    Encapsulation type: USB packets with USBPcap header (152)
    Arrival Time: Mar 31, 2026 22:43:02.207957000 W. Europe Summer Time
    UTC Arrival Time: Mar 31, 2026 20:43:02.207957000 UTC
    Epoch Arrival Time: 1774989782.207957000
    [Time shift for this packet: 0.000000000 seconds]
    [Time delta from previous captured frame: 525.529000 milliseconds]
    [Time delta from previous displayed frame: 525.529000 milliseconds]
    [Time since reference or first frame: 12.421297000 seconds]
    Frame Number: 3249
    Frame Length: 91 bytes (728 bits)
    Capture Length: 91 bytes (728 bits)
    [Frame is marked: False]
    [Frame is ignored: False]
    [Protocols in frame: usb:usbhid]
    Character encoding: ASCII (0)
USB URB
    [Source: host]
    [Destination: 1.17.2]
    USBPcap pseudoheader length: 27
    IRP ID: 0xffffa6864b1d2530
    IRP USBD_STATUS: USBD_STATUS_SUCCESS (0x00000000)
    URB Function: URB_FUNCTION_BULK_OR_INTERRUPT_TRANSFER (0x0009)
    IRP information: 0x00, Direction: FDO -> PDO
    URB bus id: 1
    Device address: 17
    Endpoint: 0x02, Direction: OUT
    URB transfer type: URB_INTERRUPT (0x01)
    Packet Data Length: 64
    [Response in: 3250]
    [bInterfaceClass: HID (0x03)]
HID Data: 1002000101121003134000f0eb7f092cec7f09b85f050a774d4000f0eb7f09774d4000f0eb7f09c0fdfe0415484000f0eb7f092cec7f09b85f050ad8fdfe04d8

No.     Time           Source                Destination           Protocol Length Info
   3250 12.423099      1.17.2                host                  USB      27     URB_INTERRUPT out

Frame 3250: Packet, 27 bytes on wire (216 bits), 27 bytes captured (216 bits) on interface \\.\USBPcap1, id 0
    Section number: 1
    Interface id: 0 (\\.\USBPcap1)
    Encapsulation type: USB packets with USBPcap header (152)
    Arrival Time: Mar 31, 2026 22:43:02.209759000 W. Europe Summer Time
    UTC Arrival Time: Mar 31, 2026 20:43:02.209759000 UTC
    Epoch Arrival Time: 1774989782.209759000
    [Time shift for this packet: 0.000000000 seconds]
    [Time delta from previous captured frame: 1.802000 milliseconds]
    [Time delta from previous displayed frame: 1.802000 milliseconds]
    [Time since reference or first frame: 12.423099000 seconds]
    Frame Number: 3250
    Frame Length: 27 bytes (216 bits)
    Capture Length: 27 bytes (216 bits)
    [Frame is marked: False]
    [Frame is ignored: False]
    [Protocols in frame: usb]
    Character encoding: ASCII (0)
USB URB
    [Source: 1.17.2]
    [Destination: host]
    USBPcap pseudoheader length: 27
    IRP ID: 0xffffa6864b1d2530
    IRP USBD_STATUS: USBD_STATUS_SUCCESS (0x00000000)
    URB Function: URB_FUNCTION_BULK_OR_INTERRUPT_TRANSFER (0x0009)
    IRP information: 0x01, Direction: PDO -> FDO
    URB bus id: 1
    Device address: 17
    Endpoint: 0x02, Direction: OUT
    URB transfer type: URB_INTERRUPT (0x01)
    Packet Data Length: 0
    [Request in: 3249]
    [Time from request: 1.802000 milliseconds]
    [bInterfaceClass: HID (0x03)]

No.     Time           Source                Destination           Protocol Length Info
   3251 12.433731      1.17.1                host                  USB      91     URB_INTERRUPT in

Frame 3251: Packet, 91 bytes on wire (728 bits), 91 bytes captured (728 bits) on interface \\.\USBPcap1, id 0
    Section number: 1
    Interface id: 0 (\\.\USBPcap1)
    Encapsulation type: USB packets with USBPcap header (152)
    Arrival Time: Mar 31, 2026 22:43:02.220391000 W. Europe Summer Time
    UTC Arrival Time: Mar 31, 2026 20:43:02.220391000 UTC
    Epoch Arrival Time: 1774989782.220391000
    [Time shift for this packet: 0.000000000 seconds]
    [Time delta from previous captured frame: 10.632000 milliseconds]
    [Time delta from previous displayed frame: 10.632000 milliseconds]
    [Time since reference or first frame: 12.433731000 seconds]
    Frame Number: 3251
    Frame Length: 91 bytes (728 bits)
    Capture Length: 91 bytes (728 bits)
    [Frame is marked: False]
    [Frame is ignored: False]
    [Protocols in frame: usb:usbhid]
    Character encoding: ASCII (0)
USB URB
    [Source: 1.17.1]
    [Destination: host]
    USBPcap pseudoheader length: 27
    IRP ID: 0xffffa68649451010
    IRP USBD_STATUS: USBD_STATUS_SUCCESS (0x00000000)
    URB Function: URB_FUNCTION_BULK_OR_INTERRUPT_TRANSFER (0x0009)
    IRP information: 0x01, Direction: PDO -> FDO
    URB bus id: 1
    Device address: 17
    Endpoint: 0x81, Direction: IN
    URB transfer type: URB_INTERRUPT (0x01)
    Packet Data Length: 64
    [Request in: 3244]
    [Time from request: 562.935000 milliseconds]
    [bInterfaceClass: HID (0x03)]
HID Data: 10020100010110030000000000080000000000000000000000000000000000000000000000000000000000000000000000000000000000000010033d000abc8d

No.     Time           Source                Destination           Protocol Length Info
   3252 12.433758      host                  1.17.1                USB      27     URB_INTERRUPT in

Frame 3252: Packet, 27 bytes on wire (216 bits), 27 bytes captured (216 bits) on interface \\.\USBPcap1, id 0
    Section number: 1
    Interface id: 0 (\\.\USBPcap1)
    Encapsulation type: USB packets with USBPcap header (152)
    Arrival Time: Mar 31, 2026 22:43:02.220418000 W. Europe Summer Time
    UTC Arrival Time: Mar 31, 2026 20:43:02.220418000 UTC
    Epoch Arrival Time: 1774989782.220418000
    [Time shift for this packet: 0.000000000 seconds]
    [Time delta from previous captured frame: 27.000 microseconds]
    [Time delta from previous displayed frame: 27.000 microseconds]
    [Time since reference or first frame: 12.433758000 seconds]
    Frame Number: 3252
    Frame Length: 27 bytes (216 bits)
    Capture Length: 27 bytes (216 bits)
    [Frame is marked: False]
    [Frame is ignored: False]
    [Protocols in frame: usb]
    Character encoding: ASCII (0)
USB URB
    [Source: host]
    [Destination: 1.17.1]
    USBPcap pseudoheader length: 27
    IRP ID: 0xffffa68649451010
    IRP USBD_STATUS: USBD_STATUS_SUCCESS (0x00000000)
    URB Function: URB_FUNCTION_BULK_OR_INTERRUPT_TRANSFER (0x0009)
    IRP information: 0x00, Direction: FDO -> PDO
    URB bus id: 1
    Device address: 17
    Endpoint: 0x81, Direction: IN
    URB transfer type: URB_INTERRUPT (0x01)
    Packet Data Length: 0
    [Response in: 3259]
    [bInterfaceClass: HID (0x03)]

No.     Time           Source                Destination           Protocol Length Info
   3253 12.737418      host                  1.17.2                USB      91     URB_INTERRUPT out

Frame 3253: Packet, 91 bytes on wire (728 bits), 91 bytes captured (728 bits) on interface \\.\USBPcap1, id 0
    Section number: 1
    Interface id: 0 (\\.\USBPcap1)
    Encapsulation type: USB packets with USBPcap header (152)
    Arrival Time: Mar 31, 2026 22:43:02.524078000 W. Europe Summer Time
    UTC Arrival Time: Mar 31, 2026 20:43:02.524078000 UTC
    Epoch Arrival Time: 1774989782.524078000
    [Time shift for this packet: 0.000000000 seconds]
    [Time delta from previous captured frame: 303.660000 milliseconds]
    [Time delta from previous displayed frame: 303.660000 milliseconds]
    [Time since reference or first frame: 12.737418000 seconds]
    Frame Number: 3253
    Frame Length: 91 bytes (728 bits)
    Capture Length: 91 bytes (728 bits)
    [Frame is marked: False]
    [Frame is ignored: False]
    [Protocols in frame: usb:usbhid]
    Character encoding: ASCII (0)
USB URB
    [Source: host]
    [Destination: 1.17.2]
    USBPcap pseudoheader length: 27
    IRP ID: 0xffffa6864b1d2530
    IRP USBD_STATUS: USBD_STATUS_SUCCESS (0x00000000)
    URB Function: URB_FUNCTION_BULK_OR_INTERRUPT_TRANSFER (0x0009)
    IRP information: 0x00, Direction: FDO -> PDO
    URB bus id: 1
    Device address: 17
    Endpoint: 0x02, Direction: OUT
    URB transfer type: URB_INTERRUPT (0x01)
    Packet Data Length: 64
    [Response in: 3254]
    [bInterfaceClass: HID (0x03)]
HID Data: 1002000101401003414000f0eb7f09f9eb7f09b85f050a774d4000f0eb7f09774d4000f0eb7f09c0fdfe0415484000f0eb7f09f9eb7f09b85f050ad8fdfe04d8

No.     Time           Source                Destination           Protocol Length Info
   3254 12.739085      1.17.2                host                  USB      27     URB_INTERRUPT out

Frame 3254: Packet, 27 bytes on wire (216 bits), 27 bytes captured (216 bits) on interface \\.\USBPcap1, id 0
    Section number: 1
    Interface id: 0 (\\.\USBPcap1)
    Encapsulation type: USB packets with USBPcap header (152)
    Arrival Time: Mar 31, 2026 22:43:02.525745000 W. Europe Summer Time
    UTC Arrival Time: Mar 31, 2026 20:43:02.525745000 UTC
    Epoch Arrival Time: 1774989782.525745000
    [Time shift for this packet: 0.000000000 seconds]
    [Time delta from previous captured frame: 1.667000 milliseconds]
    [Time delta from previous displayed frame: 1.667000 milliseconds]
    [Time since reference or first frame: 12.739085000 seconds]
    Frame Number: 3254
    Frame Length: 27 bytes (216 bits)
    Capture Length: 27 bytes (216 bits)
    [Frame is marked: False]
    [Frame is ignored: False]
    [Protocols in frame: usb]
    Character encoding: ASCII (0)
USB URB
    [Source: 1.17.2]
    [Destination: host]
    USBPcap pseudoheader length: 27
    IRP ID: 0xffffa6864b1d2530
    IRP USBD_STATUS: USBD_STATUS_SUCCESS (0x00000000)
    URB Function: URB_FUNCTION_BULK_OR_INTERRUPT_TRANSFER (0x0009)
    IRP information: 0x01, Direction: PDO -> FDO
    URB bus id: 1
    Device address: 17
    Endpoint: 0x02, Direction: OUT
    URB transfer type: URB_INTERRUPT (0x01)
    Packet Data Length: 0
    [Request in: 3253]
    [Time from request: 1.667000 milliseconds]
    [bInterfaceClass: HID (0x03)]

No.     Time           Source                Destination           Protocol Length Info
   3255 12.748724      1.17.1                host                  USB      91     URB_INTERRUPT in

Frame 3255: Packet, 91 bytes on wire (728 bits), 91 bytes captured (728 bits) on interface \\.\USBPcap1, id 0
    Section number: 1
    Interface id: 0 (\\.\USBPcap1)
    Encapsulation type: USB packets with USBPcap header (152)
    Arrival Time: Mar 31, 2026 22:43:02.535384000 W. Europe Summer Time
    UTC Arrival Time: Mar 31, 2026 20:43:02.535384000 UTC
    Epoch Arrival Time: 1774989782.535384000
    [Time shift for this packet: 0.000000000 seconds]
    [Time delta from previous captured frame: 9.639000 milliseconds]
    [Time delta from previous displayed frame: 9.639000 milliseconds]
    [Time since reference or first frame: 12.748724000 seconds]
    Frame Number: 3255
    Frame Length: 91 bytes (728 bits)
    Capture Length: 91 bytes (728 bits)
    [Frame is marked: False]
    [Frame is ignored: False]
    [Protocols in frame: usb:usbhid]
    Character encoding: ASCII (0)
USB URB
    [Source: 1.17.1]
    [Destination: host]
    USBPcap pseudoheader length: 27
    IRP ID: 0xffffa686494500d0
    IRP USBD_STATUS: USBD_STATUS_SUCCESS (0x00000000)
    URB Function: URB_FUNCTION_BULK_OR_INTERRUPT_TRANSFER (0x0009)
    IRP information: 0x01, Direction: PDO -> FDO
    URB bus id: 1
    Device address: 17
    Endpoint: 0x81, Direction: IN
    URB transfer type: URB_INTERRUPT (0x01)
    Packet Data Length: 64
    [Request in: 3248]
    [Time from request: 852.956000 milliseconds]
    [bInterfaceClass: HID (0x03)]
HID Data: 100201001c4000000900000900000500000000001700001400001400000a00000010034400000000000000000000000000000000000000000010033d000abc8d

No.     Time           Source                Destination           Protocol Length Info
   3256 12.748753      host                  1.17.1                USB      27     URB_INTERRUPT in

Frame 3256: Packet, 27 bytes on wire (216 bits), 27 bytes captured (216 bits) on interface \\.\USBPcap1, id 0
    Section number: 1
    Interface id: 0 (\\.\USBPcap1)
    Encapsulation type: USB packets with USBPcap header (152)
    Arrival Time: Mar 31, 2026 22:43:02.535413000 W. Europe Summer Time
    UTC Arrival Time: Mar 31, 2026 20:43:02.535413000 UTC
    Epoch Arrival Time: 1774989782.535413000
    [Time shift for this packet: 0.000000000 seconds]
    [Time delta from previous captured frame: 29.000 microseconds]
    [Time delta from previous displayed frame: 29.000 microseconds]
    [Time since reference or first frame: 12.748753000 seconds]
    Frame Number: 3256
    Frame Length: 27 bytes (216 bits)
    Capture Length: 27 bytes (216 bits)
    [Frame is marked: False]
    [Frame is ignored: False]
    [Protocols in frame: usb]
    Character encoding: ASCII (0)
USB URB
    [Source: host]
    [Destination: 1.17.1]
    USBPcap pseudoheader length: 27
    IRP ID: 0xffffa686494500d0
    IRP USBD_STATUS: USBD_STATUS_SUCCESS (0x00000000)
    URB Function: URB_FUNCTION_BULK_OR_INTERRUPT_TRANSFER (0x0009)
    IRP information: 0x00, Direction: FDO -> PDO
    URB bus id: 1
    Device address: 17
    Endpoint: 0x81, Direction: IN
    URB transfer type: URB_INTERRUPT (0x01)
    Packet Data Length: 0
    [Response in: 3396]
    [bInterfaceClass: HID (0x03)]

No.     Time           Source                Destination           Protocol Length Info
   3257 13.061077      host                  1.17.2                USB      91     URB_INTERRUPT out

Frame 3257: Packet, 91 bytes on wire (728 bits), 91 bytes captured (728 bits) on interface \\.\USBPcap1, id 0
    Section number: 1
    Interface id: 0 (\\.\USBPcap1)
    Encapsulation type: USB packets with USBPcap header (152)
    Arrival Time: Mar 31, 2026 22:43:02.847737000 W. Europe Summer Time
    UTC Arrival Time: Mar 31, 2026 20:43:02.847737000 UTC
    Epoch Arrival Time: 1774989782.847737000
    [Time shift for this packet: 0.000000000 seconds]
    [Time delta from previous captured frame: 312.324000 milliseconds]
    [Time delta from previous displayed frame: 312.324000 milliseconds]
    [Time since reference or first frame: 13.061077000 seconds]
    Frame Number: 3257
    Frame Length: 91 bytes (728 bits)
    Capture Length: 91 bytes (728 bits)
    [Frame is marked: False]
    [Frame is ignored: False]
    [Protocols in frame: usb:usbhid]
    Character encoding: ASCII (0)
USB URB
    [Source: host]
    [Destination: 1.17.2]
    USBPcap pseudoheader length: 27
    IRP ID: 0xffffa6864b1d2530
    IRP USBD_STATUS: USBD_STATUS_SUCCESS (0x00000000)
    URB Function: URB_FUNCTION_BULK_OR_INTERRUPT_TRANSFER (0x0009)
    IRP information: 0x00, Direction: FDO -> PDO
    URB bus id: 1
    Device address: 17
    Endpoint: 0x02, Direction: OUT
    URB transfer type: URB_INTERRUPT (0x01)
    Packet Data Length: 64
    [Response in: 3258]
    [bInterfaceClass: HID (0x03)]
HID Data: 1002000101401003414000f0eb7f0914ec7f09b85f050a774d4000f0eb7f09774d4000f0eb7f09c0fdfe0415484000f0eb7f0914ec7f09b85f050ad8fdfe04d8

No.     Time           Source                Destination           Protocol Length Info
   3258 13.063069      1.17.2                host                  USB      27     URB_INTERRUPT out

Frame 3258: Packet, 27 bytes on wire (216 bits), 27 bytes captured (216 bits) on interface \\.\USBPcap1, id 0
    Section number: 1
    Interface id: 0 (\\.\USBPcap1)
    Encapsulation type: USB packets with USBPcap header (152)
    Arrival Time: Mar 31, 2026 22:43:02.849729000 W. Europe Summer Time
    UTC Arrival Time: Mar 31, 2026 20:43:02.849729000 UTC
    Epoch Arrival Time: 1774989782.849729000
    [Time shift for this packet: 0.000000000 seconds]
    [Time delta from previous captured frame: 1.992000 milliseconds]
    [Time delta from previous displayed frame: 1.992000 milliseconds]
    [Time since reference or first frame: 13.063069000 seconds]
    Frame Number: 3258
    Frame Length: 27 bytes (216 bits)
    Capture Length: 27 bytes (216 bits)
    [Frame is marked: False]
    [Frame is ignored: False]
    [Protocols in frame: usb]
    Character encoding: ASCII (0)
USB URB
    [Source: 1.17.2]
    [Destination: host]
    USBPcap pseudoheader length: 27
    IRP ID: 0xffffa6864b1d2530
    IRP USBD_STATUS: USBD_STATUS_SUCCESS (0x00000000)
    URB Function: URB_FUNCTION_BULK_OR_INTERRUPT_TRANSFER (0x0009)
    IRP information: 0x01, Direction: PDO -> FDO
    URB bus id: 1
    Device address: 17
    Endpoint: 0x02, Direction: OUT
    URB transfer type: URB_INTERRUPT (0x01)
    Packet Data Length: 0
    [Request in: 3257]
    [Time from request: 1.992000 milliseconds]
    [bInterfaceClass: HID (0x03)]

No.     Time           Source                Destination           Protocol Length Info
   3259 13.064708      1.17.1                host                  USB      91     URB_INTERRUPT in

Frame 3259: Packet, 91 bytes on wire (728 bits), 91 bytes captured (728 bits) on interface \\.\USBPcap1, id 0
    Section number: 1
    Interface id: 0 (\\.\USBPcap1)
    Encapsulation type: USB packets with USBPcap header (152)
    Arrival Time: Mar 31, 2026 22:43:02.851368000 W. Europe Summer Time
    UTC Arrival Time: Mar 31, 2026 20:43:02.851368000 UTC
    Epoch Arrival Time: 1774989782.851368000
    [Time shift for this packet: 0.000000000 seconds]
    [Time delta from previous captured frame: 1.639000 milliseconds]
    [Time delta from previous displayed frame: 1.639000 milliseconds]
    [Time since reference or first frame: 13.064708000 seconds]
    Frame Number: 3259
    Frame Length: 91 bytes (728 bits)
    Capture Length: 91 bytes (728 bits)
    [Frame is marked: False]
    [Frame is ignored: False]
    [Protocols in frame: usb:usbhid]
    Character encoding: ASCII (0)
USB URB
    [Source: 1.17.1]
    [Destination: host]
    USBPcap pseudoheader length: 27
    IRP ID: 0xffffa68649451010
    IRP USBD_STATUS: USBD_STATUS_SUCCESS (0x00000000)
    URB Function: URB_FUNCTION_BULK_OR_INTERRUPT_TRANSFER (0x0009)
    IRP information: 0x01, Direction: PDO -> FDO
    URB bus id: 1
    Device address: 17
    Endpoint: 0x81, Direction: IN
    URB transfer type: URB_INTERRUPT (0x01)
    Packet Data Length: 64
    [Request in: 3252]
    [Time from request: 630.950000 milliseconds]
    [bInterfaceClass: HID (0x03)]
HID Data: 100201001c4000000300000400000400000000001400001c00001c00000a00000010034100000000000000000000000000000000000000000010033d000abc8d

No.     Time           Source                Destination           Protocol Length Info
   3260 13.064737      host                  1.17.1                USB      27     URB_INTERRUPT in

Frame 3260: Packet, 27 bytes on wire (216 bits), 27 bytes captured (216 bits) on interface \\.\USBPcap1, id 0
    Section number: 1
    Interface id: 0 (\\.\USBPcap1)
    Encapsulation type: USB packets with USBPcap header (152)
    Arrival Time: Mar 31, 2026 22:43:02.851397000 W. Europe Summer Time
    UTC Arrival Time: Mar 31, 2026 20:43:02.851397000 UTC
    Epoch Arrival Time: 1774989782.851397000
    [Time shift for this packet: 0.000000000 seconds]
    [Time delta from previous captured frame: 29.000 microseconds]
    [Time delta from previous displayed frame: 29.000 microseconds]
    [Time since reference or first frame: 13.064737000 seconds]
    Frame Number: 3260
    Frame Length: 27 bytes (216 bits)
    Capture Length: 27 bytes (216 bits)
    [Frame is marked: False]
    [Frame is ignored: False]
    [Protocols in frame: usb]
    Character encoding: ASCII (0)
USB URB
    [Source: host]
    [Destination: 1.17.1]
    USBPcap pseudoheader length: 27
    IRP ID: 0xffffa68649451010
    IRP USBD_STATUS: USBD_STATUS_SUCCESS (0x00000000)
    URB Function: URB_FUNCTION_BULK_OR_INTERRUPT_TRANSFER (0x0009)
    IRP information: 0x00, Direction: FDO -> PDO
    URB bus id: 1
    Device address: 17
    Endpoint: 0x81, Direction: IN
    URB transfer type: URB_INTERRUPT (0x01)
    Packet Data Length: 0
    [Response in: 3994]
    [bInterfaceClass: HID (0x03)]

No.     Time           Source                Destination           Protocol Length Info
   3359 13.373264      host                  1.17.2                USB      91     URB_INTERRUPT out

Frame 3359: Packet, 91 bytes on wire (728 bits), 91 bytes captured (728 bits) on interface \\.\USBPcap1, id 0
    Section number: 1
    Interface id: 0 (\\.\USBPcap1)
    Encapsulation type: USB packets with USBPcap header (152)
    Arrival Time: Mar 31, 2026 22:43:03.159924000 W. Europe Summer Time
    UTC Arrival Time: Mar 31, 2026 20:43:03.159924000 UTC
    Epoch Arrival Time: 1774989783.159924000
    [Time shift for this packet: 0.000000000 seconds]
    [Time delta from previous captured frame: 582.000 microseconds]
    [Time delta from previous displayed frame: 308.527000 milliseconds]
    [Time since reference or first frame: 13.373264000 seconds]
    Frame Number: 3359
    Frame Length: 91 bytes (728 bits)
    Capture Length: 91 bytes (728 bits)
    [Frame is marked: False]
    [Frame is ignored: False]
    [Protocols in frame: usb:usbhid]
    Character encoding: ASCII (0)
USB URB
    [Source: host]
    [Destination: 1.17.2]
    USBPcap pseudoheader length: 27
    IRP ID: 0xffffa6864b1d2530
    IRP USBD_STATUS: USBD_STATUS_SUCCESS (0x00000000)
    URB Function: URB_FUNCTION_BULK_OR_INTERRUPT_TRANSFER (0x0009)
    IRP information: 0x00, Direction: FDO -> PDO
    URB bus id: 1
    Device address: 17
    Endpoint: 0x02, Direction: OUT
    URB transfer type: URB_INTERRUPT (0x01)
    Packet Data Length: 64
    [Response in: 3364]
    [bInterfaceClass: HID (0x03)]
HID Data: 1002000101401003414000f0eb7f0914ec7f09b85f050a774d4000f0eb7f09774d4000f0eb7f09c0fdfe0415484000f0eb7f0914ec7f09b85f050ad8fdfe04d8

No.     Time           Source                Destination           Protocol Length Info
   3364 13.375032      1.17.2                host                  USB      27     URB_INTERRUPT out

Frame 3364: Packet, 27 bytes on wire (216 bits), 27 bytes captured (216 bits) on interface \\.\USBPcap1, id 0
    Section number: 1
    Interface id: 0 (\\.\USBPcap1)
    Encapsulation type: USB packets with USBPcap header (152)
    Arrival Time: Mar 31, 2026 22:43:03.161692000 W. Europe Summer Time
    UTC Arrival Time: Mar 31, 2026 20:43:03.161692000 UTC
    Epoch Arrival Time: 1774989783.161692000
    [Time shift for this packet: 0.000000000 seconds]
    [Time delta from previous captured frame: 341.000 microseconds]
    [Time delta from previous displayed frame: 1.768000 milliseconds]
    [Time since reference or first frame: 13.375032000 seconds]
    Frame Number: 3364
    Frame Length: 27 bytes (216 bits)
    Capture Length: 27 bytes (216 bits)
    [Frame is marked: False]
    [Frame is ignored: False]
    [Protocols in frame: usb]
    Character encoding: ASCII (0)
USB URB
    [Source: 1.17.2]
    [Destination: host]
    USBPcap pseudoheader length: 27
    IRP ID: 0xffffa6864b1d2530
    IRP USBD_STATUS: USBD_STATUS_SUCCESS (0x00000000)
    URB Function: URB_FUNCTION_BULK_OR_INTERRUPT_TRANSFER (0x0009)
    IRP information: 0x01, Direction: PDO -> FDO
    URB bus id: 1
    Device address: 17
    Endpoint: 0x02, Direction: OUT
    URB transfer type: URB_INTERRUPT (0x01)
    Packet Data Length: 0
    [Request in: 3359]
    [Time from request: 1.768000 milliseconds]
    [bInterfaceClass: HID (0x03)]

No.     Time           Source                Destination           Protocol Length Info
   3396 13.391695      1.17.1                host                  USB      91     URB_INTERRUPT in

Frame 3396: Packet, 91 bytes on wire (728 bits), 91 bytes captured (728 bits) on interface \\.\USBPcap1, id 0
    Section number: 1
    Interface id: 0 (\\.\USBPcap1)
    Encapsulation type: USB packets with USBPcap header (152)
    Arrival Time: Mar 31, 2026 22:43:03.178355000 W. Europe Summer Time
    UTC Arrival Time: Mar 31, 2026 20:43:03.178355000 UTC
    Epoch Arrival Time: 1774989783.178355000
    [Time shift for this packet: 0.000000000 seconds]
    [Time delta from previous captured frame: 27.000 microseconds]
    [Time delta from previous displayed frame: 16.663000 milliseconds]
    [Time since reference or first frame: 13.391695000 seconds]
    Frame Number: 3396
    Frame Length: 91 bytes (728 bits)
    Capture Length: 91 bytes (728 bits)
    [Frame is marked: False]
    [Frame is ignored: False]
    [Protocols in frame: usb:usbhid]
    Character encoding: ASCII (0)
USB URB
    [Source: 1.17.1]
    [Destination: host]
    USBPcap pseudoheader length: 27
    IRP ID: 0xffffa686494500d0
    IRP USBD_STATUS: USBD_STATUS_SUCCESS (0x00000000)
    URB Function: URB_FUNCTION_BULK_OR_INTERRUPT_TRANSFER (0x0009)
    IRP information: 0x01, Direction: PDO -> FDO
    URB bus id: 1
    Device address: 17
    Endpoint: 0x81, Direction: IN
    URB transfer type: URB_INTERRUPT (0x01)
    Packet Data Length: 64
    [Request in: 3256]
    [Time from request: 642.942000 milliseconds]
    [bInterfaceClass: HID (0x03)]
HID Data: 100201001c4000000500000700000400000000001000001b00001300000a00000010034800000000000000000000000000000000000000000010033d000abc8d

No.     Time           Source                Destination           Protocol Length Info
   3397 13.391701      host                  1.17.1                USB      27     URB_INTERRUPT in

Frame 3397: Packet, 27 bytes on wire (216 bits), 27 bytes captured (216 bits) on interface \\.\USBPcap1, id 0
    Section number: 1
    Interface id: 0 (\\.\USBPcap1)
    Encapsulation type: USB packets with USBPcap header (152)
    Arrival Time: Mar 31, 2026 22:43:03.178361000 W. Europe Summer Time
    UTC Arrival Time: Mar 31, 2026 20:43:03.178361000 UTC
    Epoch Arrival Time: 1774989783.178361000
    [Time shift for this packet: 0.000000000 seconds]
    [Time delta from previous captured frame: 6.000 microseconds]
    [Time delta from previous displayed frame: 6.000 microseconds]
    [Time since reference or first frame: 13.391701000 seconds]
    Frame Number: 3397
    Frame Length: 27 bytes (216 bits)
    Capture Length: 27 bytes (216 bits)
    [Frame is marked: False]
    [Frame is ignored: False]
    [Protocols in frame: usb]
    Character encoding: ASCII (0)
USB URB
    [Source: host]
    [Destination: 1.17.1]
    USBPcap pseudoheader length: 27
    IRP ID: 0xffffa686494500d0
    IRP USBD_STATUS: USBD_STATUS_SUCCESS (0x00000000)
    URB Function: URB_FUNCTION_BULK_OR_INTERRUPT_TRANSFER (0x0009)
    IRP information: 0x00, Direction: FDO -> PDO
    URB bus id: 1
    Device address: 17
    Endpoint: 0x81, Direction: IN
    URB transfer type: URB_INTERRUPT (0x01)
    Packet Data Length: 0
    [Response in: 4508]
    [bInterfaceClass: HID (0x03)]

No.     Time           Source                Destination           Protocol Length Info
   3961 13.674361      host                  1.17.2                USB      91     URB_INTERRUPT out

Frame 3961: Packet, 91 bytes on wire (728 bits), 91 bytes captured (728 bits) on interface \\.\USBPcap1, id 0
    Section number: 1
    Interface id: 0 (\\.\USBPcap1)
    Encapsulation type: USB packets with USBPcap header (152)
    Arrival Time: Mar 31, 2026 22:43:03.461021000 W. Europe Summer Time
    UTC Arrival Time: Mar 31, 2026 20:43:03.461021000 UTC
    Epoch Arrival Time: 1774989783.461021000
    [Time shift for this packet: 0.000000000 seconds]
    [Time delta from previous captured frame: 705.000 microseconds]
    [Time delta from previous displayed frame: 282.660000 milliseconds]
    [Time since reference or first frame: 13.674361000 seconds]
    Frame Number: 3961
    Frame Length: 91 bytes (728 bits)
    Capture Length: 91 bytes (728 bits)
    [Frame is marked: False]
    [Frame is ignored: False]
    [Protocols in frame: usb:usbhid]
    Character encoding: ASCII (0)
USB URB
    [Source: host]
    [Destination: 1.17.2]
    USBPcap pseudoheader length: 27
    IRP ID: 0xffffa6864b1d2530
    IRP USBD_STATUS: USBD_STATUS_SUCCESS (0x00000000)
    URB Function: URB_FUNCTION_BULK_OR_INTERRUPT_TRANSFER (0x0009)
    IRP information: 0x00, Direction: FDO -> PDO
    URB bus id: 1
    Device address: 17
    Endpoint: 0x02, Direction: OUT
    URB transfer type: URB_INTERRUPT (0x01)
    Packet Data Length: 64
    [Response in: 3966]
    [bInterfaceClass: HID (0x03)]
HID Data: 1002000101401003414000f0eb7f0914ec7f09b85f050a774d4000f0eb7f09774d4000f0eb7f09c0fdfe0415484000f0eb7f0914ec7f09b85f050ad8fdfe04d8

No.     Time           Source                Destination           Protocol Length Info
   3966 13.676018      1.17.2                host                  USB      27     URB_INTERRUPT out

Frame 3966: Packet, 27 bytes on wire (216 bits), 27 bytes captured (216 bits) on interface \\.\USBPcap1, id 0
    Section number: 1
    Interface id: 0 (\\.\USBPcap1)
    Encapsulation type: USB packets with USBPcap header (152)
    Arrival Time: Mar 31, 2026 22:43:03.462678000 W. Europe Summer Time
    UTC Arrival Time: Mar 31, 2026 20:43:03.462678000 UTC
    Epoch Arrival Time: 1774989783.462678000
    [Time shift for this packet: 0.000000000 seconds]
    [Time delta from previous captured frame: 362.000 microseconds]
    [Time delta from previous displayed frame: 1.657000 milliseconds]
    [Time since reference or first frame: 13.676018000 seconds]
    Frame Number: 3966
    Frame Length: 27 bytes (216 bits)
    Capture Length: 27 bytes (216 bits)
    [Frame is marked: False]
    [Frame is ignored: False]
    [Protocols in frame: usb]
    Character encoding: ASCII (0)
USB URB
    [Source: 1.17.2]
    [Destination: host]
    USBPcap pseudoheader length: 27
    IRP ID: 0xffffa6864b1d2530
    IRP USBD_STATUS: USBD_STATUS_SUCCESS (0x00000000)
    URB Function: URB_FUNCTION_BULK_OR_INTERRUPT_TRANSFER (0x0009)
    IRP information: 0x01, Direction: PDO -> FDO
    URB bus id: 1
    Device address: 17
    Endpoint: 0x02, Direction: OUT
    URB transfer type: URB_INTERRUPT (0x01)
    Packet Data Length: 0
    [Request in: 3961]
    [Time from request: 1.657000 milliseconds]
    [bInterfaceClass: HID (0x03)]

No.     Time           Source                Destination           Protocol Length Info
   3994 13.689668      1.17.1                host                  USB      91     URB_INTERRUPT in

Frame 3994: Packet, 91 bytes on wire (728 bits), 91 bytes captured (728 bits) on interface \\.\USBPcap1, id 0
    Section number: 1
    Interface id: 0 (\\.\USBPcap1)
    Encapsulation type: USB packets with USBPcap header (152)
    Arrival Time: Mar 31, 2026 22:43:03.476328000 W. Europe Summer Time
    UTC Arrival Time: Mar 31, 2026 20:43:03.476328000 UTC
    Epoch Arrival Time: 1774989783.476328000
    [Time shift for this packet: 0.000000000 seconds]
    [Time delta from previous captured frame: 18.000 microseconds]
    [Time delta from previous displayed frame: 13.650000 milliseconds]
    [Time since reference or first frame: 13.689668000 seconds]
    Frame Number: 3994
    Frame Length: 91 bytes (728 bits)
    Capture Length: 91 bytes (728 bits)
    [Frame is marked: False]
    [Frame is ignored: False]
    [Protocols in frame: usb:usbhid]
    Character encoding: ASCII (0)
USB URB
    [Source: 1.17.1]
    [Destination: host]
    USBPcap pseudoheader length: 27
    IRP ID: 0xffffa68649451010
    IRP USBD_STATUS: USBD_STATUS_SUCCESS (0x00000000)
    URB Function: URB_FUNCTION_BULK_OR_INTERRUPT_TRANSFER (0x0009)
    IRP information: 0x01, Direction: PDO -> FDO
    URB bus id: 1
    Device address: 17
    Endpoint: 0x81, Direction: IN
    URB transfer type: URB_INTERRUPT (0x01)
    Packet Data Length: 64
    [Request in: 3260]
    [Time from request: 624.931000 milliseconds]
    [bInterfaceClass: HID (0x03)]
HID Data: 100201001c4000000700000900000400000000000c00001600001700000a00000010035100000000000000000000000000000000000000000010033d000abc8d

No.     Time           Source                Destination           Protocol Length Info
   3995 13.689673      host                  1.17.1                USB      27     URB_INTERRUPT in

Frame 3995: Packet, 27 bytes on wire (216 bits), 27 bytes captured (216 bits) on interface \\.\USBPcap1, id 0
    Section number: 1
    Interface id: 0 (\\.\USBPcap1)
    Encapsulation type: USB packets with USBPcap header (152)
    Arrival Time: Mar 31, 2026 22:43:03.476333000 W. Europe Summer Time
    UTC Arrival Time: Mar 31, 2026 20:43:03.476333000 UTC
    Epoch Arrival Time: 1774989783.476333000
    [Time shift for this packet: 0.000000000 seconds]
    [Time delta from previous captured frame: 5.000 microseconds]
    [Time delta from previous displayed frame: 5.000 microseconds]
    [Time since reference or first frame: 13.689673000 seconds]
    Frame Number: 3995
    Frame Length: 27 bytes (216 bits)
    Capture Length: 27 bytes (216 bits)
    [Frame is marked: False]
    [Frame is ignored: False]
    [Protocols in frame: usb]
    Character encoding: ASCII (0)
USB URB
    [Source: host]
    [Destination: 1.17.1]
    USBPcap pseudoheader length: 27
    IRP ID: 0xffffa68649451010
    IRP USBD_STATUS: USBD_STATUS_SUCCESS (0x00000000)
    URB Function: URB_FUNCTION_BULK_OR_INTERRUPT_TRANSFER (0x0009)
    IRP information: 0x00, Direction: FDO -> PDO
    URB bus id: 1
    Device address: 17
    Endpoint: 0x81, Direction: IN
    URB transfer type: URB_INTERRUPT (0x01)
    Packet Data Length: 0
    [Response in: 4750]
    [bInterfaceClass: HID (0x03)]

No.     Time           Source                Destination           Protocol Length Info
   4497 13.984796      host                  1.17.2                USB      91     URB_INTERRUPT out

Frame 4497: Packet, 91 bytes on wire (728 bits), 91 bytes captured (728 bits) on interface \\.\USBPcap1, id 0
    Section number: 1
    Interface id: 0 (\\.\USBPcap1)
    Encapsulation type: USB packets with USBPcap header (152)
    Arrival Time: Mar 31, 2026 22:43:03.771456000 W. Europe Summer Time
    UTC Arrival Time: Mar 31, 2026 20:43:03.771456000 UTC
    Epoch Arrival Time: 1774989783.771456000
    [Time shift for this packet: 0.000000000 seconds]
    [Time delta from previous captured frame: 136.000 microseconds]
    [Time delta from previous displayed frame: 295.123000 milliseconds]
    [Time since reference or first frame: 13.984796000 seconds]
    Frame Number: 4497
    Frame Length: 91 bytes (728 bits)
    Capture Length: 91 bytes (728 bits)
    [Frame is marked: False]
    [Frame is ignored: False]
    [Protocols in frame: usb:usbhid]
    Character encoding: ASCII (0)
USB URB
    [Source: host]
    [Destination: 1.17.2]
    USBPcap pseudoheader length: 27
    IRP ID: 0xffffa6864b1d2530
    IRP USBD_STATUS: USBD_STATUS_SUCCESS (0x00000000)
    URB Function: URB_FUNCTION_BULK_OR_INTERRUPT_TRANSFER (0x0009)
    IRP information: 0x00, Direction: FDO -> PDO
    URB bus id: 1
    Device address: 17
    Endpoint: 0x02, Direction: OUT
    URB transfer type: URB_INTERRUPT (0x01)
    Packet Data Length: 64
    [Response in: 4500]
    [bInterfaceClass: HID (0x03)]
HID Data: 1002000101401003414000f0eb7f0914ec7f09b85f050a774d4000f0eb7f09774d4000f0eb7f09c0fdfe0415484000f0eb7f0914ec7f09b85f050ad8fdfe04d8

No.     Time           Source                Destination           Protocol Length Info
   4500 13.986007      1.17.2                host                  USB      27     URB_INTERRUPT out

Frame 4500: Packet, 27 bytes on wire (216 bits), 27 bytes captured (216 bits) on interface \\.\USBPcap1, id 0
    Section number: 1
    Interface id: 0 (\\.\USBPcap1)
    Encapsulation type: USB packets with USBPcap header (152)
    Arrival Time: Mar 31, 2026 22:43:03.772667000 W. Europe Summer Time
    UTC Arrival Time: Mar 31, 2026 20:43:03.772667000 UTC
    Epoch Arrival Time: 1774989783.772667000
    [Time shift for this packet: 0.000000000 seconds]
    [Time delta from previous captured frame: 349.000 microseconds]
    [Time delta from previous displayed frame: 1.211000 milliseconds]
    [Time since reference or first frame: 13.986007000 seconds]
    Frame Number: 4500
    Frame Length: 27 bytes (216 bits)
    Capture Length: 27 bytes (216 bits)
    [Frame is marked: False]
    [Frame is ignored: False]
    [Protocols in frame: usb]
    Character encoding: ASCII (0)
USB URB
    [Source: 1.17.2]
    [Destination: host]
    USBPcap pseudoheader length: 27
    IRP ID: 0xffffa6864b1d2530
    IRP USBD_STATUS: USBD_STATUS_SUCCESS (0x00000000)
    URB Function: URB_FUNCTION_BULK_OR_INTERRUPT_TRANSFER (0x0009)
    IRP information: 0x01, Direction: PDO -> FDO
    URB bus id: 1
    Device address: 17
    Endpoint: 0x02, Direction: OUT
    URB transfer type: URB_INTERRUPT (0x01)
    Packet Data Length: 0
    [Request in: 4497]
    [Time from request: 1.211000 milliseconds]
    [bInterfaceClass: HID (0x03)]

No.     Time           Source                Destination           Protocol Length Info
   4508 13.989654      1.17.1                host                  USB      91     URB_INTERRUPT in

Frame 4508: Packet, 91 bytes on wire (728 bits), 91 bytes captured (728 bits) on interface \\.\USBPcap1, id 0
    Section number: 1
    Interface id: 0 (\\.\USBPcap1)
    Encapsulation type: USB packets with USBPcap header (152)
    Arrival Time: Mar 31, 2026 22:43:03.776314000 W. Europe Summer Time
    UTC Arrival Time: Mar 31, 2026 20:43:03.776314000 UTC
    Epoch Arrival Time: 1774989783.776314000
    [Time shift for this packet: 0.000000000 seconds]
    [Time delta from previous captured frame: 18.000 microseconds]
    [Time delta from previous displayed frame: 3.647000 milliseconds]
    [Time since reference or first frame: 13.989654000 seconds]
    Frame Number: 4508
    Frame Length: 91 bytes (728 bits)
    Capture Length: 91 bytes (728 bits)
    [Frame is marked: False]
    [Frame is ignored: False]
    [Protocols in frame: usb:usbhid]
    Character encoding: ASCII (0)
USB URB
    [Source: 1.17.1]
    [Destination: host]
    USBPcap pseudoheader length: 27
    IRP ID: 0xffffa686494500d0
    IRP USBD_STATUS: USBD_STATUS_SUCCESS (0x00000000)
    URB Function: URB_FUNCTION_BULK_OR_INTERRUPT_TRANSFER (0x0009)
    IRP information: 0x01, Direction: PDO -> FDO
    URB bus id: 1
    Device address: 17
    Endpoint: 0x81, Direction: IN
    URB transfer type: URB_INTERRUPT (0x01)
    Packet Data Length: 64
    [Request in: 3397]
    [Time from request: 597.953000 milliseconds]
    [bInterfaceClass: HID (0x03)]
HID Data: 100201001c4000000800000600000600000000001800001900001400000a00000010034b00000000000000000000000000000000000000000010033d000abc8d

No.     Time           Source                Destination           Protocol Length Info
   4509 13.989660      host                  1.17.1                USB      27     URB_INTERRUPT in

Frame 4509: Packet, 27 bytes on wire (216 bits), 27 bytes captured (216 bits) on interface \\.\USBPcap1, id 0
    Section number: 1
    Interface id: 0 (\\.\USBPcap1)
    Encapsulation type: USB packets with USBPcap header (152)
    Arrival Time: Mar 31, 2026 22:43:03.776320000 W. Europe Summer Time
    UTC Arrival Time: Mar 31, 2026 20:43:03.776320000 UTC
    Epoch Arrival Time: 1774989783.776320000
    [Time shift for this packet: 0.000000000 seconds]
    [Time delta from previous captured frame: 6.000 microseconds]
    [Time delta from previous displayed frame: 6.000 microseconds]
    [Time since reference or first frame: 13.989660000 seconds]
    Frame Number: 4509
    Frame Length: 27 bytes (216 bits)
    Capture Length: 27 bytes (216 bits)
    [Frame is marked: False]
    [Frame is ignored: False]
    [Protocols in frame: usb]
    Character encoding: ASCII (0)
USB URB
    [Source: host]
    [Destination: 1.17.1]
    USBPcap pseudoheader length: 27
    IRP ID: 0xffffa686494500d0
    IRP USBD_STATUS: USBD_STATUS_SUCCESS (0x00000000)
    URB Function: URB_FUNCTION_BULK_OR_INTERRUPT_TRANSFER (0x0009)
    IRP information: 0x00, Direction: FDO -> PDO
    URB bus id: 1
    Device address: 17
    Endpoint: 0x81, Direction: IN
    URB transfer type: URB_INTERRUPT (0x01)
    Packet Data Length: 0
    [Response in: 5535]
    [bInterfaceClass: HID (0x03)]

No.     Time           Source                Destination           Protocol Length Info
   4747 14.304910      host                  1.17.2                USB      91     URB_INTERRUPT out

Frame 4747: Packet, 91 bytes on wire (728 bits), 91 bytes captured (728 bits) on interface \\.\USBPcap1, id 0
    Section number: 1
    Interface id: 0 (\\.\USBPcap1)
    Encapsulation type: USB packets with USBPcap header (152)
    Arrival Time: Mar 31, 2026 22:43:04.091570000 W. Europe Summer Time
    UTC Arrival Time: Mar 31, 2026 20:43:04.091570000 UTC
    Epoch Arrival Time: 1774989784.091570000
    [Time shift for this packet: 0.000000000 seconds]
    [Time delta from previous captured frame: 5.252000 milliseconds]
    [Time delta from previous displayed frame: 315.250000 milliseconds]
    [Time since reference or first frame: 14.304910000 seconds]
    Frame Number: 4747
    Frame Length: 91 bytes (728 bits)
    Capture Length: 91 bytes (728 bits)
    [Frame is marked: False]
    [Frame is ignored: False]
    [Protocols in frame: usb:usbhid]
    Character encoding: ASCII (0)
USB URB
    [Source: host]
    [Destination: 1.17.2]
    USBPcap pseudoheader length: 27
    IRP ID: 0xffffa6864b1d2530
    IRP USBD_STATUS: USBD_STATUS_SUCCESS (0x00000000)
    URB Function: URB_FUNCTION_BULK_OR_INTERRUPT_TRANSFER (0x0009)
    IRP information: 0x00, Direction: FDO -> PDO
    URB bus id: 1
    Device address: 17
    Endpoint: 0x02, Direction: OUT
    URB transfer type: URB_INTERRUPT (0x01)
    Packet Data Length: 64
    [Response in: 4748]
    [bInterfaceClass: HID (0x03)]
HID Data: 1002000101401003414000f0eb7f0914ec7f09b85f050a774d4000f0eb7f09774d4000f0eb7f09c0fdfe0415484000f0eb7f0914ec7f09b85f050ad8fdfe04d8

No.     Time           Source                Destination           Protocol Length Info
   4748 14.305988      1.17.2                host                  USB      27     URB_INTERRUPT out

Frame 4748: Packet, 27 bytes on wire (216 bits), 27 bytes captured (216 bits) on interface \\.\USBPcap1, id 0
    Section number: 1
    Interface id: 0 (\\.\USBPcap1)
    Encapsulation type: USB packets with USBPcap header (152)
    Arrival Time: Mar 31, 2026 22:43:04.092648000 W. Europe Summer Time
    UTC Arrival Time: Mar 31, 2026 20:43:04.092648000 UTC
    Epoch Arrival Time: 1774989784.092648000
    [Time shift for this packet: 0.000000000 seconds]
    [Time delta from previous captured frame: 1.078000 milliseconds]
    [Time delta from previous displayed frame: 1.078000 milliseconds]
    [Time since reference or first frame: 14.305988000 seconds]
    Frame Number: 4748
    Frame Length: 27 bytes (216 bits)
    Capture Length: 27 bytes (216 bits)
    [Frame is marked: False]
    [Frame is ignored: False]
    [Protocols in frame: usb]
    Character encoding: ASCII (0)
USB URB
    [Source: 1.17.2]
    [Destination: host]
    USBPcap pseudoheader length: 27
    IRP ID: 0xffffa6864b1d2530
    IRP USBD_STATUS: USBD_STATUS_SUCCESS (0x00000000)
    URB Function: URB_FUNCTION_BULK_OR_INTERRUPT_TRANSFER (0x0009)
    IRP information: 0x01, Direction: PDO -> FDO
    URB bus id: 1
    Device address: 17
    Endpoint: 0x02, Direction: OUT
    URB transfer type: URB_INTERRUPT (0x01)
    Packet Data Length: 0
    [Request in: 4747]
    [Time from request: 1.078000 milliseconds]
    [bInterfaceClass: HID (0x03)]

No.     Time           Source                Destination           Protocol Length Info
   4750 14.306641      1.17.1                host                  USB      91     URB_INTERRUPT in

Frame 4750: Packet, 91 bytes on wire (728 bits), 91 bytes captured (728 bits) on interface \\.\USBPcap1, id 0
    Section number: 1
    Interface id: 0 (\\.\USBPcap1)
    Encapsulation type: USB packets with USBPcap header (152)
    Arrival Time: Mar 31, 2026 22:43:04.093301000 W. Europe Summer Time
    UTC Arrival Time: Mar 31, 2026 20:43:04.093301000 UTC
    Epoch Arrival Time: 1774989784.093301000
    [Time shift for this packet: 0.000000000 seconds]
    [Time delta from previous captured frame: 23.000 microseconds]
    [Time delta from previous displayed frame: 653.000 microseconds]
    [Time since reference or first frame: 14.306641000 seconds]
    Frame Number: 4750
    Frame Length: 91 bytes (728 bits)
    Capture Length: 91 bytes (728 bits)
    [Frame is marked: False]
    [Frame is ignored: False]
    [Protocols in frame: usb:usbhid]
    Character encoding: ASCII (0)
USB URB
    [Source: 1.17.1]
    [Destination: host]
    USBPcap pseudoheader length: 27
    IRP ID: 0xffffa68649451010
    IRP USBD_STATUS: USBD_STATUS_SUCCESS (0x00000000)
    URB Function: URB_FUNCTION_BULK_OR_INTERRUPT_TRANSFER (0x0009)
    IRP information: 0x01, Direction: PDO -> FDO
    URB bus id: 1
    Device address: 17
    Endpoint: 0x81, Direction: IN
    URB transfer type: URB_INTERRUPT (0x01)
    Packet Data Length: 64
    [Request in: 3995]
    [Time from request: 616.968000 milliseconds]
    [bInterfaceClass: HID (0x03)]
HID Data: 100201001c4000000400000600000300000000001600001700001900000a00000010034f00000000000000000000000000000000000000000010033d000abc8d

No.     Time           Source                Destination           Protocol Length Info
   4751 14.306646      host                  1.17.1                USB      27     URB_INTERRUPT in

Frame 4751: Packet, 27 bytes on wire (216 bits), 27 bytes captured (216 bits) on interface \\.\USBPcap1, id 0
    Section number: 1
    Interface id: 0 (\\.\USBPcap1)
    Encapsulation type: USB packets with USBPcap header (152)
    Arrival Time: Mar 31, 2026 22:43:04.093306000 W. Europe Summer Time
    UTC Arrival Time: Mar 31, 2026 20:43:04.093306000 UTC
    Epoch Arrival Time: 1774989784.093306000
    [Time shift for this packet: 0.000000000 seconds]
    [Time delta from previous captured frame: 5.000 microseconds]
    [Time delta from previous displayed frame: 5.000 microseconds]
    [Time since reference or first frame: 14.306646000 seconds]
    Frame Number: 4751
    Frame Length: 27 bytes (216 bits)
    Capture Length: 27 bytes (216 bits)
    [Frame is marked: False]
    [Frame is ignored: False]
    [Protocols in frame: usb]
    Character encoding: ASCII (0)
USB URB
    [Source: host]
    [Destination: 1.17.1]
    USBPcap pseudoheader length: 27
    IRP ID: 0xffffa68649451010
    IRP USBD_STATUS: USBD_STATUS_SUCCESS (0x00000000)
    URB Function: URB_FUNCTION_BULK_OR_INTERRUPT_TRANSFER (0x0009)
    IRP information: 0x00, Direction: FDO -> PDO
    URB bus id: 1
    Device address: 17
    Endpoint: 0x81, Direction: IN
    URB transfer type: URB_INTERRUPT (0x01)
    Packet Data Length: 0
    [Response in: 5589]
    [bInterfaceClass: HID (0x03)]

No.     Time           Source                Destination           Protocol Length Info
   5523 14.889548      host                  1.17.2                USB      91     URB_INTERRUPT out

Frame 5523: Packet, 91 bytes on wire (728 bits), 91 bytes captured (728 bits) on interface \\.\USBPcap1, id 0
    Section number: 1
    Interface id: 0 (\\.\USBPcap1)
    Encapsulation type: USB packets with USBPcap header (152)
    Arrival Time: Mar 31, 2026 22:43:04.676208000 W. Europe Summer Time
    UTC Arrival Time: Mar 31, 2026 20:43:04.676208000 UTC
    Epoch Arrival Time: 1774989784.676208000
    [Time shift for this packet: 0.000000000 seconds]
    [Time delta from previous captured frame: 2.936000 milliseconds]
    [Time delta from previous displayed frame: 582.902000 milliseconds]
    [Time since reference or first frame: 14.889548000 seconds]
    Frame Number: 5523
    Frame Length: 91 bytes (728 bits)
    Capture Length: 91 bytes (728 bits)
    [Frame is marked: False]
    [Frame is ignored: False]
    [Protocols in frame: usb:usbhid]
    Character encoding: ASCII (0)
USB URB
    [Source: host]
    [Destination: 1.17.2]
    USBPcap pseudoheader length: 27
    IRP ID: 0xffffa6864b1d2530
    IRP USBD_STATUS: USBD_STATUS_SUCCESS (0x00000000)
    URB Function: URB_FUNCTION_BULK_OR_INTERRUPT_TRANSFER (0x0009)
    IRP information: 0x00, Direction: FDO -> PDO
    URB bus id: 1
    Device address: 17
    Endpoint: 0x02, Direction: OUT
    URB transfer type: URB_INTERRUPT (0x01)
    Packet Data Length: 64
    [Response in: 5526]
    [bInterfaceClass: HID (0x03)]
HID Data: 1002000101401003414000f0eb7f0914ec7f09b85f050a774d4000f0eb7f09774d4000f0eb7f09c0fdfe0415484000f0eb7f0914ec7f09b85f050ad8fdfe04d8

No.     Time           Source                Destination           Protocol Length Info
   5526 14.890959      1.17.2                host                  USB      27     URB_INTERRUPT out

Frame 5526: Packet, 27 bytes on wire (216 bits), 27 bytes captured (216 bits) on interface \\.\USBPcap1, id 0
    Section number: 1
    Interface id: 0 (\\.\USBPcap1)
    Encapsulation type: USB packets with USBPcap header (152)
    Arrival Time: Mar 31, 2026 22:43:04.677619000 W. Europe Summer Time
    UTC Arrival Time: Mar 31, 2026 20:43:04.677619000 UTC
    Epoch Arrival Time: 1774989784.677619000
    [Time shift for this packet: 0.000000000 seconds]
    [Time delta from previous captured frame: 1.361000 milliseconds]
    [Time delta from previous displayed frame: 1.411000 milliseconds]
    [Time since reference or first frame: 14.890959000 seconds]
    Frame Number: 5526
    Frame Length: 27 bytes (216 bits)
    Capture Length: 27 bytes (216 bits)
    [Frame is marked: False]
    [Frame is ignored: False]
    [Protocols in frame: usb]
    Character encoding: ASCII (0)
USB URB
    [Source: 1.17.2]
    [Destination: host]
    USBPcap pseudoheader length: 27
    IRP ID: 0xffffa6864b1d2530
    IRP USBD_STATUS: USBD_STATUS_SUCCESS (0x00000000)
    URB Function: URB_FUNCTION_BULK_OR_INTERRUPT_TRANSFER (0x0009)
    IRP information: 0x01, Direction: PDO -> FDO
    URB bus id: 1
    Device address: 17
    Endpoint: 0x02, Direction: OUT
    URB transfer type: URB_INTERRUPT (0x01)
    Packet Data Length: 0
    [Request in: 5523]
    [Time from request: 1.411000 milliseconds]
    [bInterfaceClass: HID (0x03)]

No.     Time           Source                Destination           Protocol Length Info
   5535 14.898600      1.17.1                host                  USB      91     URB_INTERRUPT in

Frame 5535: Packet, 91 bytes on wire (728 bits), 91 bytes captured (728 bits) on interface \\.\USBPcap1, id 0
    Section number: 1
    Interface id: 0 (\\.\USBPcap1)
    Encapsulation type: USB packets with USBPcap header (152)
    Arrival Time: Mar 31, 2026 22:43:04.685260000 W. Europe Summer Time
    UTC Arrival Time: Mar 31, 2026 20:43:04.685260000 UTC
    Epoch Arrival Time: 1774989784.685260000
    [Time shift for this packet: 0.000000000 seconds]
    [Time delta from previous captured frame: 1.986000 milliseconds]
    [Time delta from previous displayed frame: 7.641000 milliseconds]
    [Time since reference or first frame: 14.898600000 seconds]
    Frame Number: 5535
    Frame Length: 91 bytes (728 bits)
    Capture Length: 91 bytes (728 bits)
    [Frame is marked: False]
    [Frame is ignored: False]
    [Protocols in frame: usb:usbhid]
    Character encoding: ASCII (0)
USB URB
    [Source: 1.17.1]
    [Destination: host]
    USBPcap pseudoheader length: 27
    IRP ID: 0xffffa686494500d0
    IRP USBD_STATUS: USBD_STATUS_SUCCESS (0x00000000)
    URB Function: URB_FUNCTION_BULK_OR_INTERRUPT_TRANSFER (0x0009)
    IRP information: 0x01, Direction: PDO -> FDO
    URB bus id: 1
    Device address: 17
    Endpoint: 0x81, Direction: IN
    URB transfer type: URB_INTERRUPT (0x01)
    Packet Data Length: 64
    [Request in: 4509]
    [Time from request: 908.940000 milliseconds]
    [bInterfaceClass: HID (0x03)]
HID Data: 100201001c4000000300000300000100000000000d00001d00001500001c00000010034400000000000000000000000000000000000000000010033d000abc8d

No.     Time           Source                Destination           Protocol Length Info
   5536 14.898614      host                  1.17.1                USB      27     URB_INTERRUPT in

Frame 5536: Packet, 27 bytes on wire (216 bits), 27 bytes captured (216 bits) on interface \\.\USBPcap1, id 0
    Section number: 1
    Interface id: 0 (\\.\USBPcap1)
    Encapsulation type: USB packets with USBPcap header (152)
    Arrival Time: Mar 31, 2026 22:43:04.685274000 W. Europe Summer Time
    UTC Arrival Time: Mar 31, 2026 20:43:04.685274000 UTC
    Epoch Arrival Time: 1774989784.685274000
    [Time shift for this packet: 0.000000000 seconds]
    [Time delta from previous captured frame: 14.000 microseconds]
    [Time delta from previous displayed frame: 14.000 microseconds]
    [Time since reference or first frame: 14.898614000 seconds]
    Frame Number: 5536
    Frame Length: 27 bytes (216 bits)
    Capture Length: 27 bytes (216 bits)
    [Frame is marked: False]
    [Frame is ignored: False]
    [Protocols in frame: usb]
    Character encoding: ASCII (0)
USB URB
    [Source: host]
    [Destination: 1.17.1]
    USBPcap pseudoheader length: 27
    IRP ID: 0xffffa686494500d0
    IRP USBD_STATUS: USBD_STATUS_SUCCESS (0x00000000)
    URB Function: URB_FUNCTION_BULK_OR_INTERRUPT_TRANSFER (0x0009)
    IRP information: 0x00, Direction: FDO -> PDO
    URB bus id: 1
    Device address: 17
    Endpoint: 0x81, Direction: IN
    URB transfer type: URB_INTERRUPT (0x01)
    Packet Data Length: 0
    [Response in: 5941]
    [bInterfaceClass: HID (0x03)]

No.     Time           Source                Destination           Protocol Length Info
   5571 14.927247      host                  1.17.2                USB      91     URB_INTERRUPT out

Frame 5571: Packet, 91 bytes on wire (728 bits), 91 bytes captured (728 bits) on interface \\.\USBPcap1, id 0
    Section number: 1
    Interface id: 0 (\\.\USBPcap1)
    Encapsulation type: USB packets with USBPcap header (152)
    Arrival Time: Mar 31, 2026 22:43:04.713907000 W. Europe Summer Time
    UTC Arrival Time: Mar 31, 2026 20:43:04.713907000 UTC
    Epoch Arrival Time: 1774989784.713907000
    [Time shift for this packet: 0.000000000 seconds]
    [Time delta from previous captured frame: 640.000 microseconds]
    [Time delta from previous displayed frame: 28.633000 milliseconds]
    [Time since reference or first frame: 14.927247000 seconds]
    Frame Number: 5571
    Frame Length: 91 bytes (728 bits)
    Capture Length: 91 bytes (728 bits)
    [Frame is marked: False]
    [Frame is ignored: False]
    [Protocols in frame: usb:usbhid]
    Character encoding: ASCII (0)
USB URB
    [Source: host]
    [Destination: 1.17.2]
    USBPcap pseudoheader length: 27
    IRP ID: 0xffffa6864b1d2530
    IRP USBD_STATUS: USBD_STATUS_SUCCESS (0x00000000)
    URB Function: URB_FUNCTION_BULK_OR_INTERRUPT_TRANSFER (0x0009)
    IRP information: 0x00, Direction: FDO -> PDO
    URB bus id: 1
    Device address: 17
    Endpoint: 0x02, Direction: OUT
    URB transfer type: URB_INTERRUPT (0x01)
    Packet Data Length: 64
    [Response in: 5576]
    [bInterfaceClass: HID (0x03)]
HID Data: 1002000101401003414000f0eb7f0914ec7f09b85f050a774d4000f0eb7f09774d4000f0eb7f09c0fdfe0415484000f0eb7f0914ec7f09b85f050ad8fdfe04d8

No.     Time           Source                Destination           Protocol Length Info
   5576 14.928953      1.17.2                host                  USB      27     URB_INTERRUPT out

Frame 5576: Packet, 27 bytes on wire (216 bits), 27 bytes captured (216 bits) on interface \\.\USBPcap1, id 0
    Section number: 1
    Interface id: 0 (\\.\USBPcap1)
    Encapsulation type: USB packets with USBPcap header (152)
    Arrival Time: Mar 31, 2026 22:43:04.715613000 W. Europe Summer Time
    UTC Arrival Time: Mar 31, 2026 20:43:04.715613000 UTC
    Epoch Arrival Time: 1774989784.715613000
    [Time shift for this packet: 0.000000000 seconds]
    [Time delta from previous captured frame: 344.000 microseconds]
    [Time delta from previous displayed frame: 1.706000 milliseconds]
    [Time since reference or first frame: 14.928953000 seconds]
    Frame Number: 5576
    Frame Length: 27 bytes (216 bits)
    Capture Length: 27 bytes (216 bits)
    [Frame is marked: False]
    [Frame is ignored: False]
    [Protocols in frame: usb]
    Character encoding: ASCII (0)
USB URB
    [Source: 1.17.2]
    [Destination: host]
    USBPcap pseudoheader length: 27
    IRP ID: 0xffffa6864b1d2530
    IRP USBD_STATUS: USBD_STATUS_SUCCESS (0x00000000)
    URB Function: URB_FUNCTION_BULK_OR_INTERRUPT_TRANSFER (0x0009)
    IRP information: 0x01, Direction: PDO -> FDO
    URB bus id: 1
    Device address: 17
    Endpoint: 0x02, Direction: OUT
    URB transfer type: URB_INTERRUPT (0x01)
    Packet Data Length: 0
    [Request in: 5571]
    [Time from request: 1.706000 milliseconds]
    [bInterfaceClass: HID (0x03)]

No.     Time           Source                Destination           Protocol Length Info
   5589 14.937598      1.17.1                host                  USB      91     URB_INTERRUPT in

Frame 5589: Packet, 91 bytes on wire (728 bits), 91 bytes captured (728 bits) on interface \\.\USBPcap1, id 0
    Section number: 1
    Interface id: 0 (\\.\USBPcap1)
    Encapsulation type: USB packets with USBPcap header (152)
    Arrival Time: Mar 31, 2026 22:43:04.724258000 W. Europe Summer Time
    UTC Arrival Time: Mar 31, 2026 20:43:04.724258000 UTC
    Epoch Arrival Time: 1774989784.724258000
    [Time shift for this packet: 0.000000000 seconds]
    [Time delta from previous captured frame: 988.000 microseconds]
    [Time delta from previous displayed frame: 8.645000 milliseconds]
    [Time since reference or first frame: 14.937598000 seconds]
    Frame Number: 5589
    Frame Length: 91 bytes (728 bits)
    Capture Length: 91 bytes (728 bits)
    [Frame is marked: False]
    [Frame is ignored: False]
    [Protocols in frame: usb:usbhid]
    Character encoding: ASCII (0)
USB URB
    [Source: 1.17.1]
    [Destination: host]
    USBPcap pseudoheader length: 27
    IRP ID: 0xffffa68649451010
    IRP USBD_STATUS: USBD_STATUS_SUCCESS (0x00000000)
    URB Function: URB_FUNCTION_BULK_OR_INTERRUPT_TRANSFER (0x0009)
    IRP information: 0x01, Direction: PDO -> FDO
    URB bus id: 1
    Device address: 17
    Endpoint: 0x81, Direction: IN
    URB transfer type: URB_INTERRUPT (0x01)
    Packet Data Length: 64
    [Request in: 4751]
    [Time from request: 630.952000 milliseconds]
    [bInterfaceClass: HID (0x03)]
HID Data: 100201001c4000000300000300000100000000000d00001d00001500001c00000010034400000000000000000000000000000000000000000010033d000abc8d

No.     Time           Source                Destination           Protocol Length Info
   5590 14.937611      host                  1.17.1                USB      27     URB_INTERRUPT in

Frame 5590: Packet, 27 bytes on wire (216 bits), 27 bytes captured (216 bits) on interface \\.\USBPcap1, id 0
    Section number: 1
    Interface id: 0 (\\.\USBPcap1)
    Encapsulation type: USB packets with USBPcap header (152)
    Arrival Time: Mar 31, 2026 22:43:04.724271000 W. Europe Summer Time
    UTC Arrival Time: Mar 31, 2026 20:43:04.724271000 UTC
    Epoch Arrival Time: 1774989784.724271000
    [Time shift for this packet: 0.000000000 seconds]
    [Time delta from previous captured frame: 13.000 microseconds]
    [Time delta from previous displayed frame: 13.000 microseconds]
    [Time since reference or first frame: 14.937611000 seconds]
    Frame Number: 5590
    Frame Length: 27 bytes (216 bits)
    Capture Length: 27 bytes (216 bits)
    [Frame is marked: False]
    [Frame is ignored: False]
    [Protocols in frame: usb]
    Character encoding: ASCII (0)
USB URB
    [Source: host]
    [Destination: 1.17.1]
    USBPcap pseudoheader length: 27
    IRP ID: 0xffffa68649451010
    IRP USBD_STATUS: USBD_STATUS_SUCCESS (0x00000000)
    URB Function: URB_FUNCTION_BULK_OR_INTERRUPT_TRANSFER (0x0009)
    IRP information: 0x00, Direction: FDO -> PDO
    URB bus id: 1
    Device address: 17
    Endpoint: 0x81, Direction: IN
    URB transfer type: URB_INTERRUPT (0x01)
    Packet Data Length: 0
    [Response in: 6061]
    [bInterfaceClass: HID (0x03)]

No.     Time           Source                Destination           Protocol Length Info
   5939 15.244862      host                  1.17.2                USB      91     URB_INTERRUPT out

Frame 5939: Packet, 91 bytes on wire (728 bits), 91 bytes captured (728 bits) on interface \\.\USBPcap1, id 0
    Section number: 1
    Interface id: 0 (\\.\USBPcap1)
    Encapsulation type: USB packets with USBPcap header (152)
    Arrival Time: Mar 31, 2026 22:43:05.031522000 W. Europe Summer Time
    UTC Arrival Time: Mar 31, 2026 20:43:05.031522000 UTC
    Epoch Arrival Time: 1774989785.031522000
    [Time shift for this packet: 0.000000000 seconds]
    [Time delta from previous captured frame: 95.249000 milliseconds]
    [Time delta from previous displayed frame: 307.251000 milliseconds]
    [Time since reference or first frame: 15.244862000 seconds]
    Frame Number: 5939
    Frame Length: 91 bytes (728 bits)
    Capture Length: 91 bytes (728 bits)
    [Frame is marked: False]
    [Frame is ignored: False]
    [Protocols in frame: usb:usbhid]
    Character encoding: ASCII (0)
USB URB
    [Source: host]
    [Destination: 1.17.2]
    USBPcap pseudoheader length: 27
    IRP ID: 0xffffa6864b1d2530
    IRP USBD_STATUS: USBD_STATUS_SUCCESS (0x00000000)
    URB Function: URB_FUNCTION_BULK_OR_INTERRUPT_TRANSFER (0x0009)
    IRP information: 0x00, Direction: FDO -> PDO
    URB bus id: 1
    Device address: 17
    Endpoint: 0x02, Direction: OUT
    URB transfer type: URB_INTERRUPT (0x01)
    Packet Data Length: 64
    [Response in: 5940]
    [bInterfaceClass: HID (0x03)]
HID Data: 1002000101401003414000f0eb7f0914ec7f09b85f050a774d4000f0eb7f09774d4000f0eb7f09c0fdfe0415484000f0eb7f0914ec7f09b85f050ad8fdfe04d8

No.     Time           Source                Destination           Protocol Length Info
   5940 15.245945      1.17.2                host                  USB      27     URB_INTERRUPT out

Frame 5940: Packet, 27 bytes on wire (216 bits), 27 bytes captured (216 bits) on interface \\.\USBPcap1, id 0
    Section number: 1
    Interface id: 0 (\\.\USBPcap1)
    Encapsulation type: USB packets with USBPcap header (152)
    Arrival Time: Mar 31, 2026 22:43:05.032605000 W. Europe Summer Time
    UTC Arrival Time: Mar 31, 2026 20:43:05.032605000 UTC
    Epoch Arrival Time: 1774989785.032605000
    [Time shift for this packet: 0.000000000 seconds]
    [Time delta from previous captured frame: 1.083000 milliseconds]
    [Time delta from previous displayed frame: 1.083000 milliseconds]
    [Time since reference or first frame: 15.245945000 seconds]
    Frame Number: 5940
    Frame Length: 27 bytes (216 bits)
    Capture Length: 27 bytes (216 bits)
    [Frame is marked: False]
    [Frame is ignored: False]
    [Protocols in frame: usb]
    Character encoding: ASCII (0)
USB URB
    [Source: 1.17.2]
    [Destination: host]
    USBPcap pseudoheader length: 27
    IRP ID: 0xffffa6864b1d2530
    IRP USBD_STATUS: USBD_STATUS_SUCCESS (0x00000000)
    URB Function: URB_FUNCTION_BULK_OR_INTERRUPT_TRANSFER (0x0009)
    IRP information: 0x01, Direction: PDO -> FDO
    URB bus id: 1
    Device address: 17
    Endpoint: 0x02, Direction: OUT
    URB transfer type: URB_INTERRUPT (0x01)
    Packet Data Length: 0
    [Request in: 5939]
    [Time from request: 1.083000 milliseconds]
    [bInterfaceClass: HID (0x03)]

No.     Time           Source                Destination           Protocol Length Info
   5941 15.253597      1.17.1                host                  USB      91     URB_INTERRUPT in

Frame 5941: Packet, 91 bytes on wire (728 bits), 91 bytes captured (728 bits) on interface \\.\USBPcap1, id 0
    Section number: 1
    Interface id: 0 (\\.\USBPcap1)
    Encapsulation type: USB packets with USBPcap header (152)
    Arrival Time: Mar 31, 2026 22:43:05.040257000 W. Europe Summer Time
    UTC Arrival Time: Mar 31, 2026 20:43:05.040257000 UTC
    Epoch Arrival Time: 1774989785.040257000
    [Time shift for this packet: 0.000000000 seconds]
    [Time delta from previous captured frame: 7.652000 milliseconds]
    [Time delta from previous displayed frame: 7.652000 milliseconds]
    [Time since reference or first frame: 15.253597000 seconds]
    Frame Number: 5941
    Frame Length: 91 bytes (728 bits)
    Capture Length: 91 bytes (728 bits)
    [Frame is marked: False]
    [Frame is ignored: False]
    [Protocols in frame: usb:usbhid]
    Character encoding: ASCII (0)
USB URB
    [Source: 1.17.1]
    [Destination: host]
    USBPcap pseudoheader length: 27
    IRP ID: 0xffffa686494500d0
    IRP USBD_STATUS: USBD_STATUS_SUCCESS (0x00000000)
    URB Function: URB_FUNCTION_BULK_OR_INTERRUPT_TRANSFER (0x0009)
    IRP information: 0x01, Direction: PDO -> FDO
    URB bus id: 1
    Device address: 17
    Endpoint: 0x81, Direction: IN
    URB transfer type: URB_INTERRUPT (0x01)
    Packet Data Length: 64
    [Request in: 5536]
    [Time from request: 354.983000 milliseconds]
    [bInterfaceClass: HID (0x03)]
HID Data: 100201001c4000000700000500000200000000000c00001500001700001c00000010034e00000000000000000000000000000000000000000010033d000abc8d

No.     Time           Source                Destination           Protocol Length Info
   5942 15.253624      host                  1.17.1                USB      27     URB_INTERRUPT in

Frame 5942: Packet, 27 bytes on wire (216 bits), 27 bytes captured (216 bits) on interface \\.\USBPcap1, id 0
    Section number: 1
    Interface id: 0 (\\.\USBPcap1)
    Encapsulation type: USB packets with USBPcap header (152)
    Arrival Time: Mar 31, 2026 22:43:05.040284000 W. Europe Summer Time
    UTC Arrival Time: Mar 31, 2026 20:43:05.040284000 UTC
    Epoch Arrival Time: 1774989785.040284000
    [Time shift for this packet: 0.000000000 seconds]
    [Time delta from previous captured frame: 27.000 microseconds]
    [Time delta from previous displayed frame: 27.000 microseconds]
    [Time since reference or first frame: 15.253624000 seconds]
    Frame Number: 5942
    Frame Length: 27 bytes (216 bits)
    Capture Length: 27 bytes (216 bits)
    [Frame is marked: False]
    [Frame is ignored: False]
    [Protocols in frame: usb]
    Character encoding: ASCII (0)
USB URB
    [Source: host]
    [Destination: 1.17.1]
    USBPcap pseudoheader length: 27
    IRP ID: 0xffffa686494500d0
    IRP USBD_STATUS: USBD_STATUS_SUCCESS (0x00000000)
    URB Function: URB_FUNCTION_BULK_OR_INTERRUPT_TRANSFER (0x0009)
    IRP information: 0x00, Direction: FDO -> PDO
    URB bus id: 1
    Device address: 17
    Endpoint: 0x81, Direction: IN
    URB transfer type: URB_INTERRUPT (0x01)
    Packet Data Length: 0
    [Response in: 6489]
    [bInterfaceClass: HID (0x03)]

No.     Time           Source                Destination           Protocol Length Info
   6045 15.552916      host                  1.17.2                USB      91     URB_INTERRUPT out

Frame 6045: Packet, 91 bytes on wire (728 bits), 91 bytes captured (728 bits) on interface \\.\USBPcap1, id 0
    Section number: 1
    Interface id: 0 (\\.\USBPcap1)
    Encapsulation type: USB packets with USBPcap header (152)
    Arrival Time: Mar 31, 2026 22:43:05.339576000 W. Europe Summer Time
    UTC Arrival Time: Mar 31, 2026 20:43:05.339576000 UTC
    Epoch Arrival Time: 1774989785.339576000
    [Time shift for this packet: 0.000000000 seconds]
    [Time delta from previous captured frame: 341.000 microseconds]
    [Time delta from previous displayed frame: 299.292000 milliseconds]
    [Time since reference or first frame: 15.552916000 seconds]
    Frame Number: 6045
    Frame Length: 91 bytes (728 bits)
    Capture Length: 91 bytes (728 bits)
    [Frame is marked: False]
    [Frame is ignored: False]
    [Protocols in frame: usb:usbhid]
    Character encoding: ASCII (0)
USB URB
    [Source: host]
    [Destination: 1.17.2]
    USBPcap pseudoheader length: 27
    IRP ID: 0xffffa6864b1d2530
    IRP USBD_STATUS: USBD_STATUS_SUCCESS (0x00000000)
    URB Function: URB_FUNCTION_BULK_OR_INTERRUPT_TRANSFER (0x0009)
    IRP information: 0x00, Direction: FDO -> PDO
    URB bus id: 1
    Device address: 17
    Endpoint: 0x02, Direction: OUT
    URB transfer type: URB_INTERRUPT (0x01)
    Packet Data Length: 64
    [Response in: 6050]
    [bInterfaceClass: HID (0x03)]
HID Data: 1002000101401003414000f0eb7f0914ec7f09b85f050a774d4000f0eb7f09774d4000f0eb7f09c0fdfe0415484000f0eb7f0914ec7f09b85f050ad8fdfe04d8

No.     Time           Source                Destination           Protocol Length Info
   6050 15.554919      1.17.2                host                  USB      27     URB_INTERRUPT out

Frame 6050: Packet, 27 bytes on wire (216 bits), 27 bytes captured (216 bits) on interface \\.\USBPcap1, id 0
    Section number: 1
    Interface id: 0 (\\.\USBPcap1)
    Encapsulation type: USB packets with USBPcap header (152)
    Arrival Time: Mar 31, 2026 22:43:05.341579000 W. Europe Summer Time
    UTC Arrival Time: Mar 31, 2026 20:43:05.341579000 UTC
    Epoch Arrival Time: 1774989785.341579000
    [Time shift for this packet: 0.000000000 seconds]
    [Time delta from previous captured frame: 350.000 microseconds]
    [Time delta from previous displayed frame: 2.003000 milliseconds]
    [Time since reference or first frame: 15.554919000 seconds]
    Frame Number: 6050
    Frame Length: 27 bytes (216 bits)
    Capture Length: 27 bytes (216 bits)
    [Frame is marked: False]
    [Frame is ignored: False]
    [Protocols in frame: usb]
    Character encoding: ASCII (0)
USB URB
    [Source: 1.17.2]
    [Destination: host]
    USBPcap pseudoheader length: 27
    IRP ID: 0xffffa6864b1d2530
    IRP USBD_STATUS: USBD_STATUS_SUCCESS (0x00000000)
    URB Function: URB_FUNCTION_BULK_OR_INTERRUPT_TRANSFER (0x0009)
    IRP information: 0x01, Direction: PDO -> FDO
    URB bus id: 1
    Device address: 17
    Endpoint: 0x02, Direction: OUT
    URB transfer type: URB_INTERRUPT (0x01)
    Packet Data Length: 0
    [Request in: 6045]
    [Time from request: 2.003000 milliseconds]
    [bInterfaceClass: HID (0x03)]

No.     Time           Source                Destination           Protocol Length Info
   6061 15.559565      1.17.1                host                  USB      91     URB_INTERRUPT in

Frame 6061: Packet, 91 bytes on wire (728 bits), 91 bytes captured (728 bits) on interface \\.\USBPcap1, id 0
    Section number: 1
    Interface id: 0 (\\.\USBPcap1)
    Encapsulation type: USB packets with USBPcap header (152)
    Arrival Time: Mar 31, 2026 22:43:05.346225000 W. Europe Summer Time
    UTC Arrival Time: Mar 31, 2026 20:43:05.346225000 UTC
    Epoch Arrival Time: 1774989785.346225000
    [Time shift for this packet: 0.000000000 seconds]
    [Time delta from previous captured frame: 6.000 microseconds]
    [Time delta from previous displayed frame: 4.646000 milliseconds]
    [Time since reference or first frame: 15.559565000 seconds]
    Frame Number: 6061
    Frame Length: 91 bytes (728 bits)
    Capture Length: 91 bytes (728 bits)
    [Frame is marked: False]
    [Frame is ignored: False]
    [Protocols in frame: usb:usbhid]
    Character encoding: ASCII (0)
USB URB
    [Source: 1.17.1]
    [Destination: host]
    USBPcap pseudoheader length: 27
    IRP ID: 0xffffa68649451010
    IRP USBD_STATUS: USBD_STATUS_SUCCESS (0x00000000)
    URB Function: URB_FUNCTION_BULK_OR_INTERRUPT_TRANSFER (0x0009)
    IRP information: 0x01, Direction: PDO -> FDO
    URB bus id: 1
    Device address: 17
    Endpoint: 0x81, Direction: IN
    URB transfer type: URB_INTERRUPT (0x01)
    Packet Data Length: 64
    [Request in: 5590]
    [Time from request: 621.954000 milliseconds]
    [bInterfaceClass: HID (0x03)]
HID Data: 100201001c4000000600000700000400000000000f00001600001600000a00000010035c00000000000000000000000000000000000000000010033d000abc8d

No.     Time           Source                Destination           Protocol Length Info
   6062 15.559570      host                  1.17.1                USB      27     URB_INTERRUPT in

Frame 6062: Packet, 27 bytes on wire (216 bits), 27 bytes captured (216 bits) on interface \\.\USBPcap1, id 0
    Section number: 1
    Interface id: 0 (\\.\USBPcap1)
    Encapsulation type: USB packets with USBPcap header (152)
    Arrival Time: Mar 31, 2026 22:43:05.346230000 W. Europe Summer Time
    UTC Arrival Time: Mar 31, 2026 20:43:05.346230000 UTC
    Epoch Arrival Time: 1774989785.346230000
    [Time shift for this packet: 0.000000000 seconds]
    [Time delta from previous captured frame: 5.000 microseconds]
    [Time delta from previous displayed frame: 5.000 microseconds]
    [Time since reference or first frame: 15.559570000 seconds]
    Frame Number: 6062
    Frame Length: 27 bytes (216 bits)
    Capture Length: 27 bytes (216 bits)
    [Frame is marked: False]
    [Frame is ignored: False]
    [Protocols in frame: usb]
    Character encoding: ASCII (0)
USB URB
    [Source: host]
    [Destination: 1.17.1]
    USBPcap pseudoheader length: 27
    IRP ID: 0xffffa68649451010
    IRP USBD_STATUS: USBD_STATUS_SUCCESS (0x00000000)
    URB Function: URB_FUNCTION_BULK_OR_INTERRUPT_TRANSFER (0x0009)
    IRP information: 0x00, Direction: FDO -> PDO
    URB bus id: 1
    Device address: 17
    Endpoint: 0x81, Direction: IN
    URB transfer type: URB_INTERRUPT (0x01)
    Packet Data Length: 0
    [Response in: 6673]
    [bInterfaceClass: HID (0x03)]

No.     Time           Source                Destination           Protocol Length Info
   6487 15.862568      host                  1.17.2                USB      91     URB_INTERRUPT out

Frame 6487: Packet, 91 bytes on wire (728 bits), 91 bytes captured (728 bits) on interface \\.\USBPcap1, id 0
    Section number: 1
    Interface id: 0 (\\.\USBPcap1)
    Encapsulation type: USB packets with USBPcap header (152)
    Arrival Time: Mar 31, 2026 22:43:05.649228000 W. Europe Summer Time
    UTC Arrival Time: Mar 31, 2026 20:43:05.649228000 UTC
    Epoch Arrival Time: 1774989785.649228000
    [Time shift for this packet: 0.000000000 seconds]
    [Time delta from previous captured frame: 1.000 microseconds]
    [Time delta from previous displayed frame: 302.998000 milliseconds]
    [Time since reference or first frame: 15.862568000 seconds]
    Frame Number: 6487
    Frame Length: 91 bytes (728 bits)
    Capture Length: 91 bytes (728 bits)
    [Frame is marked: False]
    [Frame is ignored: False]
    [Protocols in frame: usb:usbhid]
    Character encoding: ASCII (0)
USB URB
    [Source: host]
    [Destination: 1.17.2]
    USBPcap pseudoheader length: 27
    IRP ID: 0xffffa6864b1d2530
    IRP USBD_STATUS: USBD_STATUS_SUCCESS (0x00000000)
    URB Function: URB_FUNCTION_BULK_OR_INTERRUPT_TRANSFER (0x0009)
    IRP information: 0x00, Direction: FDO -> PDO
    URB bus id: 1
    Device address: 17
    Endpoint: 0x02, Direction: OUT
    URB transfer type: URB_INTERRUPT (0x01)
    Packet Data Length: 64
    [Response in: 6488]
    [bInterfaceClass: HID (0x03)]
HID Data: 1002000101401003414000f0eb7f0914ec7f09b85f050a774d4000f0eb7f09774d4000f0eb7f09c0fdfe0415484000f0eb7f0914ec7f09b85f050ad8fdfe04d8

No.     Time           Source                Destination           Protocol Length Info
   6488 15.863907      1.17.2                host                  USB      27     URB_INTERRUPT out

Frame 6488: Packet, 27 bytes on wire (216 bits), 27 bytes captured (216 bits) on interface \\.\USBPcap1, id 0
    Section number: 1
    Interface id: 0 (\\.\USBPcap1)
    Encapsulation type: USB packets with USBPcap header (152)
    Arrival Time: Mar 31, 2026 22:43:05.650567000 W. Europe Summer Time
    UTC Arrival Time: Mar 31, 2026 20:43:05.650567000 UTC
    Epoch Arrival Time: 1774989785.650567000
    [Time shift for this packet: 0.000000000 seconds]
    [Time delta from previous captured frame: 1.339000 milliseconds]
    [Time delta from previous displayed frame: 1.339000 milliseconds]
    [Time since reference or first frame: 15.863907000 seconds]
    Frame Number: 6488
    Frame Length: 27 bytes (216 bits)
    Capture Length: 27 bytes (216 bits)
    [Frame is marked: False]
    [Frame is ignored: False]
    [Protocols in frame: usb]
    Character encoding: ASCII (0)
USB URB
    [Source: 1.17.2]
    [Destination: host]
    USBPcap pseudoheader length: 27
    IRP ID: 0xffffa6864b1d2530
    IRP USBD_STATUS: USBD_STATUS_SUCCESS (0x00000000)
    URB Function: URB_FUNCTION_BULK_OR_INTERRUPT_TRANSFER (0x0009)
    IRP information: 0x01, Direction: PDO -> FDO
    URB bus id: 1
    Device address: 17
    Endpoint: 0x02, Direction: OUT
    URB transfer type: URB_INTERRUPT (0x01)
    Packet Data Length: 0
    [Request in: 6487]
    [Time from request: 1.339000 milliseconds]
    [bInterfaceClass: HID (0x03)]

No.     Time           Source                Destination           Protocol Length Info
   6489 15.864551      1.17.1                host                  USB      91     URB_INTERRUPT in

Frame 6489: Packet, 91 bytes on wire (728 bits), 91 bytes captured (728 bits) on interface \\.\USBPcap1, id 0
    Section number: 1
    Interface id: 0 (\\.\USBPcap1)
    Encapsulation type: USB packets with USBPcap header (152)
    Arrival Time: Mar 31, 2026 22:43:05.651211000 W. Europe Summer Time
    UTC Arrival Time: Mar 31, 2026 20:43:05.651211000 UTC
    Epoch Arrival Time: 1774989785.651211000
    [Time shift for this packet: 0.000000000 seconds]
    [Time delta from previous captured frame: 644.000 microseconds]
    [Time delta from previous displayed frame: 644.000 microseconds]
    [Time since reference or first frame: 15.864551000 seconds]
    Frame Number: 6489
    Frame Length: 91 bytes (728 bits)
    Capture Length: 91 bytes (728 bits)
    [Frame is marked: False]
    [Frame is ignored: False]
    [Protocols in frame: usb:usbhid]
    Character encoding: ASCII (0)
USB URB
    [Source: 1.17.1]
    [Destination: host]
    USBPcap pseudoheader length: 27
    IRP ID: 0xffffa686494500d0
    IRP USBD_STATUS: USBD_STATUS_SUCCESS (0x00000000)
    URB Function: URB_FUNCTION_BULK_OR_INTERRUPT_TRANSFER (0x0009)
    IRP information: 0x01, Direction: PDO -> FDO
    URB bus id: 1
    Device address: 17
    Endpoint: 0x81, Direction: IN
    URB transfer type: URB_INTERRUPT (0x01)
    Packet Data Length: 64
    [Request in: 5942]
    [Time from request: 610.927000 milliseconds]
    [bInterfaceClass: HID (0x03)]
HID Data: 100201001c4000000300000400000400000000000e00000a00001800000a00000010034900000000000000000000000000000000000000000010033d000abc8d

No.     Time           Source                Destination           Protocol Length Info
   6490 15.864574      host                  1.17.1                USB      27     URB_INTERRUPT in

Frame 6490: Packet, 27 bytes on wire (216 bits), 27 bytes captured (216 bits) on interface \\.\USBPcap1, id 0
    Section number: 1
    Interface id: 0 (\\.\USBPcap1)
    Encapsulation type: USB packets with USBPcap header (152)
    Arrival Time: Mar 31, 2026 22:43:05.651234000 W. Europe Summer Time
    UTC Arrival Time: Mar 31, 2026 20:43:05.651234000 UTC
    Epoch Arrival Time: 1774989785.651234000
    [Time shift for this packet: 0.000000000 seconds]
    [Time delta from previous captured frame: 23.000 microseconds]
    [Time delta from previous displayed frame: 23.000 microseconds]
    [Time since reference or first frame: 15.864574000 seconds]
    Frame Number: 6490
    Frame Length: 27 bytes (216 bits)
    Capture Length: 27 bytes (216 bits)
    [Frame is marked: False]
    [Frame is ignored: False]
    [Protocols in frame: usb]
    Character encoding: ASCII (0)
USB URB
    [Source: host]
    [Destination: 1.17.1]
    USBPcap pseudoheader length: 27
    IRP ID: 0xffffa686494500d0
    IRP USBD_STATUS: USBD_STATUS_SUCCESS (0x00000000)
    URB Function: URB_FUNCTION_BULK_OR_INTERRUPT_TRANSFER (0x0009)
    IRP information: 0x00, Direction: FDO -> PDO
    URB bus id: 1
    Device address: 17
    Endpoint: 0x81, Direction: IN
    URB transfer type: URB_INTERRUPT (0x01)
    Packet Data Length: 0
    [Response in: 6715]
    [bInterfaceClass: HID (0x03)]

No.     Time           Source                Destination           Protocol Length Info
   6671 16.186610      host                  1.17.2                USB      91     URB_INTERRUPT out

Frame 6671: Packet, 91 bytes on wire (728 bits), 91 bytes captured (728 bits) on interface \\.\USBPcap1, id 0
    Section number: 1
    Interface id: 0 (\\.\USBPcap1)
    Encapsulation type: USB packets with USBPcap header (152)
    Arrival Time: Mar 31, 2026 22:43:05.973270000 W. Europe Summer Time
    UTC Arrival Time: Mar 31, 2026 20:43:05.973270000 UTC
    Epoch Arrival Time: 1774989785.973270000
    [Time shift for this packet: 0.000000000 seconds]
    [Time delta from previous captured frame: 56.015000 milliseconds]
    [Time delta from previous displayed frame: 322.036000 milliseconds]
    [Time since reference or first frame: 16.186610000 seconds]
    Frame Number: 6671
    Frame Length: 91 bytes (728 bits)
    Capture Length: 91 bytes (728 bits)
    [Frame is marked: False]
    [Frame is ignored: False]
    [Protocols in frame: usb:usbhid]
    Character encoding: ASCII (0)
USB URB
    [Source: host]
    [Destination: 1.17.2]
    USBPcap pseudoheader length: 27
    IRP ID: 0xffffa6864b1d2530
    IRP USBD_STATUS: USBD_STATUS_SUCCESS (0x00000000)
    URB Function: URB_FUNCTION_BULK_OR_INTERRUPT_TRANSFER (0x0009)
    IRP information: 0x00, Direction: FDO -> PDO
    URB bus id: 1
    Device address: 17
    Endpoint: 0x02, Direction: OUT
    URB transfer type: URB_INTERRUPT (0x01)
    Packet Data Length: 64
    [Response in: 6672]
    [bInterfaceClass: HID (0x03)]
HID Data: 1002000101401003414000f0eb7f0914ec7f09b85f050a774d4000f0eb7f09774d4000f0eb7f09c0fdfe0415484000f0eb7f0914ec7f09b85f050ad8fdfe04d8

No.     Time           Source                Destination           Protocol Length Info
   6672 16.187911      1.17.2                host                  USB      27     URB_INTERRUPT out

Frame 6672: Packet, 27 bytes on wire (216 bits), 27 bytes captured (216 bits) on interface \\.\USBPcap1, id 0
    Section number: 1
    Interface id: 0 (\\.\USBPcap1)
    Encapsulation type: USB packets with USBPcap header (152)
    Arrival Time: Mar 31, 2026 22:43:05.974571000 W. Europe Summer Time
    UTC Arrival Time: Mar 31, 2026 20:43:05.974571000 UTC
    Epoch Arrival Time: 1774989785.974571000
    [Time shift for this packet: 0.000000000 seconds]
    [Time delta from previous captured frame: 1.301000 milliseconds]
    [Time delta from previous displayed frame: 1.301000 milliseconds]
    [Time since reference or first frame: 16.187911000 seconds]
    Frame Number: 6672
    Frame Length: 27 bytes (216 bits)
    Capture Length: 27 bytes (216 bits)
    [Frame is marked: False]
    [Frame is ignored: False]
    [Protocols in frame: usb]
    Character encoding: ASCII (0)
USB URB
    [Source: 1.17.2]
    [Destination: host]
    USBPcap pseudoheader length: 27
    IRP ID: 0xffffa6864b1d2530
    IRP USBD_STATUS: USBD_STATUS_SUCCESS (0x00000000)
    URB Function: URB_FUNCTION_BULK_OR_INTERRUPT_TRANSFER (0x0009)
    IRP information: 0x01, Direction: PDO -> FDO
    URB bus id: 1
    Device address: 17
    Endpoint: 0x02, Direction: OUT
    URB transfer type: URB_INTERRUPT (0x01)
    Packet Data Length: 0
    [Request in: 6671]
    [Time from request: 1.301000 milliseconds]
    [bInterfaceClass: HID (0x03)]

No.     Time           Source                Destination           Protocol Length Info
   6673 16.190548      1.17.1                host                  USB      91     URB_INTERRUPT in

Frame 6673: Packet, 91 bytes on wire (728 bits), 91 bytes captured (728 bits) on interface \\.\USBPcap1, id 0
    Section number: 1
    Interface id: 0 (\\.\USBPcap1)
    Encapsulation type: USB packets with USBPcap header (152)
    Arrival Time: Mar 31, 2026 22:43:05.977208000 W. Europe Summer Time
    UTC Arrival Time: Mar 31, 2026 20:43:05.977208000 UTC
    Epoch Arrival Time: 1774989785.977208000
    [Time shift for this packet: 0.000000000 seconds]
    [Time delta from previous captured frame: 2.637000 milliseconds]
    [Time delta from previous displayed frame: 2.637000 milliseconds]
    [Time since reference or first frame: 16.190548000 seconds]
    Frame Number: 6673
    Frame Length: 91 bytes (728 bits)
    Capture Length: 91 bytes (728 bits)
    [Frame is marked: False]
    [Frame is ignored: False]
    [Protocols in frame: usb:usbhid]
    Character encoding: ASCII (0)
USB URB
    [Source: 1.17.1]
    [Destination: host]
    USBPcap pseudoheader length: 27
    IRP ID: 0xffffa68649451010
    IRP USBD_STATUS: USBD_STATUS_SUCCESS (0x00000000)
    URB Function: URB_FUNCTION_BULK_OR_INTERRUPT_TRANSFER (0x0009)
    IRP information: 0x01, Direction: PDO -> FDO
    URB bus id: 1
    Device address: 17
    Endpoint: 0x81, Direction: IN
    URB transfer type: URB_INTERRUPT (0x01)
    Packet Data Length: 64
    [Request in: 6062]
    [Time from request: 630.978000 milliseconds]
    [bInterfaceClass: HID (0x03)]
HID Data: 100201001c4000000600000500000300000000000f00001700001b00000a00000010035500000000000000000000000000000000000000000010033d000abc8d

No.     Time           Source                Destination           Protocol Length Info
   6674 16.190577      host                  1.17.1                USB      27     URB_INTERRUPT in

Frame 6674: Packet, 27 bytes on wire (216 bits), 27 bytes captured (216 bits) on interface \\.\USBPcap1, id 0
    Section number: 1
    Interface id: 0 (\\.\USBPcap1)
    Encapsulation type: USB packets with USBPcap header (152)
    Arrival Time: Mar 31, 2026 22:43:05.977237000 W. Europe Summer Time
    UTC Arrival Time: Mar 31, 2026 20:43:05.977237000 UTC
    Epoch Arrival Time: 1774989785.977237000
    [Time shift for this packet: 0.000000000 seconds]
    [Time delta from previous captured frame: 29.000 microseconds]
    [Time delta from previous displayed frame: 29.000 microseconds]
    [Time since reference or first frame: 16.190577000 seconds]
    Frame Number: 6674
    Frame Length: 27 bytes (216 bits)
    Capture Length: 27 bytes (216 bits)
    [Frame is marked: False]
    [Frame is ignored: False]
    [Protocols in frame: usb]
    Character encoding: ASCII (0)
USB URB
    [Source: host]
    [Destination: 1.17.1]
    USBPcap pseudoheader length: 27
    IRP ID: 0xffffa68649451010
    IRP USBD_STATUS: USBD_STATUS_SUCCESS (0x00000000)
    URB Function: URB_FUNCTION_BULK_OR_INTERRUPT_TRANSFER (0x0009)
    IRP information: 0x00, Direction: FDO -> PDO
    URB bus id: 1
    Device address: 17
    Endpoint: 0x81, Direction: IN
    URB transfer type: URB_INTERRUPT (0x01)
    Packet Data Length: 0
    [Response in: 6729]
    [bInterfaceClass: HID (0x03)]

No.     Time           Source                Destination           Protocol Length Info
   6711 16.504589      host                  1.17.2                USB      91     URB_INTERRUPT out

Frame 6711: Packet, 91 bytes on wire (728 bits), 91 bytes captured (728 bits) on interface \\.\USBPcap1, id 0
    Section number: 1
    Interface id: 0 (\\.\USBPcap1)
    Encapsulation type: USB packets with USBPcap header (152)
    Arrival Time: Mar 31, 2026 22:43:06.291249000 W. Europe Summer Time
    UTC Arrival Time: Mar 31, 2026 20:43:06.291249000 UTC
    Epoch Arrival Time: 1774989786.291249000
    [Time shift for this packet: 0.000000000 seconds]
    [Time delta from previous captured frame: 1.032000 milliseconds]
    [Time delta from previous displayed frame: 314.012000 milliseconds]
    [Time since reference or first frame: 16.504589000 seconds]
    Frame Number: 6711
    Frame Length: 91 bytes (728 bits)
    Capture Length: 91 bytes (728 bits)
    [Frame is marked: False]
    [Frame is ignored: False]
    [Protocols in frame: usb:usbhid]
    Character encoding: ASCII (0)
USB URB
    [Source: host]
    [Destination: 1.17.2]
    USBPcap pseudoheader length: 27
    IRP ID: 0xffffa6864b1d2530
    IRP USBD_STATUS: USBD_STATUS_SUCCESS (0x00000000)
    URB Function: URB_FUNCTION_BULK_OR_INTERRUPT_TRANSFER (0x0009)
    IRP information: 0x00, Direction: FDO -> PDO
    URB bus id: 1
    Device address: 17
    Endpoint: 0x02, Direction: OUT
    URB transfer type: URB_INTERRUPT (0x01)
    Packet Data Length: 64
    [Response in: 6712]
    [bInterfaceClass: HID (0x03)]
HID Data: 1002000101401003414000f0eb7f0914ec7f09b85f050a774d4000f0eb7f09774d4000f0eb7f09c0fdfe0415484000f0eb7f0914ec7f09b85f050ad8fdfe04d8

No.     Time           Source                Destination           Protocol Length Info
   6712 16.505876      1.17.2                host                  USB      27     URB_INTERRUPT out

Frame 6712: Packet, 27 bytes on wire (216 bits), 27 bytes captured (216 bits) on interface \\.\USBPcap1, id 0
    Section number: 1
    Interface id: 0 (\\.\USBPcap1)
    Encapsulation type: USB packets with USBPcap header (152)
    Arrival Time: Mar 31, 2026 22:43:06.292536000 W. Europe Summer Time
    UTC Arrival Time: Mar 31, 2026 20:43:06.292536000 UTC
    Epoch Arrival Time: 1774989786.292536000
    [Time shift for this packet: 0.000000000 seconds]
    [Time delta from previous captured frame: 1.287000 milliseconds]
    [Time delta from previous displayed frame: 1.287000 milliseconds]
    [Time since reference or first frame: 16.505876000 seconds]
    Frame Number: 6712
    Frame Length: 27 bytes (216 bits)
    Capture Length: 27 bytes (216 bits)
    [Frame is marked: False]
    [Frame is ignored: False]
    [Protocols in frame: usb]
    Character encoding: ASCII (0)
USB URB
    [Source: 1.17.2]
    [Destination: host]
    USBPcap pseudoheader length: 27
    IRP ID: 0xffffa6864b1d2530
    IRP USBD_STATUS: USBD_STATUS_SUCCESS (0x00000000)
    URB Function: URB_FUNCTION_BULK_OR_INTERRUPT_TRANSFER (0x0009)
    IRP information: 0x01, Direction: PDO -> FDO
    URB bus id: 1
    Device address: 17
    Endpoint: 0x02, Direction: OUT
    URB transfer type: URB_INTERRUPT (0x01)
    Packet Data Length: 0
    [Request in: 6711]
    [Time from request: 1.287000 milliseconds]
    [bInterfaceClass: HID (0x03)]

No.     Time           Source                Destination           Protocol Length Info
   6715 16.515530      1.17.1                host                  USB      91     URB_INTERRUPT in

Frame 6715: Packet, 91 bytes on wire (728 bits), 91 bytes captured (728 bits) on interface \\.\USBPcap1, id 0
    Section number: 1
    Interface id: 0 (\\.\USBPcap1)
    Encapsulation type: USB packets with USBPcap header (152)
    Arrival Time: Mar 31, 2026 22:43:06.302190000 W. Europe Summer Time
    UTC Arrival Time: Mar 31, 2026 20:43:06.302190000 UTC
    Epoch Arrival Time: 1774989786.302190000
    [Time shift for this packet: 0.000000000 seconds]
    [Time delta from previous captured frame: 3.998000 milliseconds]
    [Time delta from previous displayed frame: 9.654000 milliseconds]
    [Time since reference or first frame: 16.515530000 seconds]
    Frame Number: 6715
    Frame Length: 91 bytes (728 bits)
    Capture Length: 91 bytes (728 bits)
    [Frame is marked: False]
    [Frame is ignored: False]
    [Protocols in frame: usb:usbhid]
    Character encoding: ASCII (0)
USB URB
    [Source: 1.17.1]
    [Destination: host]
    USBPcap pseudoheader length: 27
    IRP ID: 0xffffa686494500d0
    IRP USBD_STATUS: USBD_STATUS_SUCCESS (0x00000000)
    URB Function: URB_FUNCTION_BULK_OR_INTERRUPT_TRANSFER (0x0009)
    IRP information: 0x01, Direction: PDO -> FDO
    URB bus id: 1
    Device address: 17
    Endpoint: 0x81, Direction: IN
    URB transfer type: URB_INTERRUPT (0x01)
    Packet Data Length: 64
    [Request in: 6490]
    [Time from request: 650.956000 milliseconds]
    [bInterfaceClass: HID (0x03)]
HID Data: 100201001c4000000500000400000300000000000f00001400001800000a00000010035700000000000000000000000000000000000000000010033d000abc8d

No.     Time           Source                Destination           Protocol Length Info
   6716 16.515564      host                  1.17.1                USB      27     URB_INTERRUPT in

Frame 6716: Packet, 27 bytes on wire (216 bits), 27 bytes captured (216 bits) on interface \\.\USBPcap1, id 0
    Section number: 1
    Interface id: 0 (\\.\USBPcap1)
    Encapsulation type: USB packets with USBPcap header (152)
    Arrival Time: Mar 31, 2026 22:43:06.302224000 W. Europe Summer Time
    UTC Arrival Time: Mar 31, 2026 20:43:06.302224000 UTC
    Epoch Arrival Time: 1774989786.302224000
    [Time shift for this packet: 0.000000000 seconds]
    [Time delta from previous captured frame: 34.000 microseconds]
    [Time delta from previous displayed frame: 34.000 microseconds]
    [Time since reference or first frame: 16.515564000 seconds]
    Frame Number: 6716
    Frame Length: 27 bytes (216 bits)
    Capture Length: 27 bytes (216 bits)
    [Frame is marked: False]
    [Frame is ignored: False]
    [Protocols in frame: usb]
    Character encoding: ASCII (0)
USB URB
    [Source: host]
    [Destination: 1.17.1]
    USBPcap pseudoheader length: 27
    IRP ID: 0xffffa686494500d0
    IRP USBD_STATUS: USBD_STATUS_SUCCESS (0x00000000)
    URB Function: URB_FUNCTION_BULK_OR_INTERRUPT_TRANSFER (0x0009)
    IRP information: 0x00, Direction: FDO -> PDO
    URB bus id: 1
    Device address: 17
    Endpoint: 0x81, Direction: IN
    URB transfer type: URB_INTERRUPT (0x01)
    Packet Data Length: 0
    [Response in: 6737]
    [bInterfaceClass: HID (0x03)]

No.     Time           Source                Destination           Protocol Length Info
   6727 16.822110      host                  1.17.2                USB      91     URB_INTERRUPT out

Frame 6727: Packet, 91 bytes on wire (728 bits), 91 bytes captured (728 bits) on interface \\.\USBPcap1, id 0
    Section number: 1
    Interface id: 0 (\\.\USBPcap1)
    Encapsulation type: USB packets with USBPcap header (152)
    Arrival Time: Mar 31, 2026 22:43:06.608770000 W. Europe Summer Time
    UTC Arrival Time: Mar 31, 2026 20:43:06.608770000 UTC
    Epoch Arrival Time: 1774989786.608770000
    [Time shift for this packet: 0.000000000 seconds]
    [Time delta from previous captured frame: 215.541000 milliseconds]
    [Time delta from previous displayed frame: 306.546000 milliseconds]
    [Time since reference or first frame: 16.822110000 seconds]
    Frame Number: 6727
    Frame Length: 91 bytes (728 bits)
    Capture Length: 91 bytes (728 bits)
    [Frame is marked: False]
    [Frame is ignored: False]
    [Protocols in frame: usb:usbhid]
    Character encoding: ASCII (0)
USB URB
    [Source: host]
    [Destination: 1.17.2]
    USBPcap pseudoheader length: 27
    IRP ID: 0xffffa6864b1d2530
    IRP USBD_STATUS: USBD_STATUS_SUCCESS (0x00000000)
    URB Function: URB_FUNCTION_BULK_OR_INTERRUPT_TRANSFER (0x0009)
    IRP information: 0x00, Direction: FDO -> PDO
    URB bus id: 1
    Device address: 17
    Endpoint: 0x02, Direction: OUT
    URB transfer type: URB_INTERRUPT (0x01)
    Packet Data Length: 64
    [Response in: 6728]
    [bInterfaceClass: HID (0x03)]
HID Data: 1002000101401003414000f0eb7f0914ec7f09b85f050a774d4000f0eb7f09774d4000f0eb7f09c0fdfe0415484000f0eb7f0914ec7f09b85f050ad8fdfe04d8

No.     Time           Source                Destination           Protocol Length Info
   6728 16.823877      1.17.2                host                  USB      27     URB_INTERRUPT out

Frame 6728: Packet, 27 bytes on wire (216 bits), 27 bytes captured (216 bits) on interface \\.\USBPcap1, id 0
    Section number: 1
    Interface id: 0 (\\.\USBPcap1)
    Encapsulation type: USB packets with USBPcap header (152)
    Arrival Time: Mar 31, 2026 22:43:06.610537000 W. Europe Summer Time
    UTC Arrival Time: Mar 31, 2026 20:43:06.610537000 UTC
    Epoch Arrival Time: 1774989786.610537000
    [Time shift for this packet: 0.000000000 seconds]
    [Time delta from previous captured frame: 1.767000 milliseconds]
    [Time delta from previous displayed frame: 1.767000 milliseconds]
    [Time since reference or first frame: 16.823877000 seconds]
    Frame Number: 6728
    Frame Length: 27 bytes (216 bits)
    Capture Length: 27 bytes (216 bits)
    [Frame is marked: False]
    [Frame is ignored: False]
    [Protocols in frame: usb]
    Character encoding: ASCII (0)
USB URB
    [Source: 1.17.2]
    [Destination: host]
    USBPcap pseudoheader length: 27
    IRP ID: 0xffffa6864b1d2530
    IRP USBD_STATUS: USBD_STATUS_SUCCESS (0x00000000)
    URB Function: URB_FUNCTION_BULK_OR_INTERRUPT_TRANSFER (0x0009)
    IRP information: 0x01, Direction: PDO -> FDO
    URB bus id: 1
    Device address: 17
    Endpoint: 0x02, Direction: OUT
    URB transfer type: URB_INTERRUPT (0x01)
    Packet Data Length: 0
    [Request in: 6727]
    [Time from request: 1.767000 milliseconds]
    [bInterfaceClass: HID (0x03)]

No.     Time           Source                Destination           Protocol Length Info
   6729 16.831515      1.17.1                host                  USB      91     URB_INTERRUPT in

Frame 6729: Packet, 91 bytes on wire (728 bits), 91 bytes captured (728 bits) on interface \\.\USBPcap1, id 0
    Section number: 1
    Interface id: 0 (\\.\USBPcap1)
    Encapsulation type: USB packets with USBPcap header (152)
    Arrival Time: Mar 31, 2026 22:43:06.618175000 W. Europe Summer Time
    UTC Arrival Time: Mar 31, 2026 20:43:06.618175000 UTC
    Epoch Arrival Time: 1774989786.618175000
    [Time shift for this packet: 0.000000000 seconds]
    [Time delta from previous captured frame: 7.638000 milliseconds]
    [Time delta from previous displayed frame: 7.638000 milliseconds]
    [Time since reference or first frame: 16.831515000 seconds]
    Frame Number: 6729
    Frame Length: 91 bytes (728 bits)
    Capture Length: 91 bytes (728 bits)
    [Frame is marked: False]
    [Frame is ignored: False]
    [Protocols in frame: usb:usbhid]
    Character encoding: ASCII (0)
USB URB
    [Source: 1.17.1]
    [Destination: host]
    USBPcap pseudoheader length: 27
    IRP ID: 0xffffa68649451010
    IRP USBD_STATUS: USBD_STATUS_SUCCESS (0x00000000)
    URB Function: URB_FUNCTION_BULK_OR_INTERRUPT_TRANSFER (0x0009)
    IRP information: 0x01, Direction: PDO -> FDO
    URB bus id: 1
    Device address: 17
    Endpoint: 0x81, Direction: IN
    URB transfer type: URB_INTERRUPT (0x01)
    Packet Data Length: 64
    [Request in: 6674]
    [Time from request: 640.938000 milliseconds]
    [bInterfaceClass: HID (0x03)]
HID Data: 100201001c4000000800000700000400000000001900001c00001300000a00000010034b00000000000000000000000000000000000000000010033d000abc8d

No.     Time           Source                Destination           Protocol Length Info
   6730 16.831543      host                  1.17.1                USB      27     URB_INTERRUPT in

Frame 6730: Packet, 27 bytes on wire (216 bits), 27 bytes captured (216 bits) on interface \\.\USBPcap1, id 0
    Section number: 1
    Interface id: 0 (\\.\USBPcap1)
    Encapsulation type: USB packets with USBPcap header (152)
    Arrival Time: Mar 31, 2026 22:43:06.618203000 W. Europe Summer Time
    UTC Arrival Time: Mar 31, 2026 20:43:06.618203000 UTC
    Epoch Arrival Time: 1774989786.618203000
    [Time shift for this packet: 0.000000000 seconds]
    [Time delta from previous captured frame: 28.000 microseconds]
    [Time delta from previous displayed frame: 28.000 microseconds]
    [Time since reference or first frame: 16.831543000 seconds]
    Frame Number: 6730
    Frame Length: 27 bytes (216 bits)
    Capture Length: 27 bytes (216 bits)
    [Frame is marked: False]
    [Frame is ignored: False]
    [Protocols in frame: usb]
    Character encoding: ASCII (0)
USB URB
    [Source: host]
    [Destination: 1.17.1]
    USBPcap pseudoheader length: 27
    IRP ID: 0xffffa68649451010
    IRP USBD_STATUS: USBD_STATUS_SUCCESS (0x00000000)
    URB Function: URB_FUNCTION_BULK_OR_INTERRUPT_TRANSFER (0x0009)
    IRP information: 0x00, Direction: FDO -> PDO
    URB bus id: 1
    Device address: 17
    Endpoint: 0x81, Direction: IN
    URB transfer type: URB_INTERRUPT (0x01)
    Packet Data Length: 0
    [Response in: 6741]
    [bInterfaceClass: HID (0x03)]

No.     Time           Source                Destination           Protocol Length Info
   6735 17.132579      host                  1.17.2                USB      91     URB_INTERRUPT out

Frame 6735: Packet, 91 bytes on wire (728 bits), 91 bytes captured (728 bits) on interface \\.\USBPcap1, id 0
    Section number: 1
    Interface id: 0 (\\.\USBPcap1)
    Encapsulation type: USB packets with USBPcap header (152)
    Arrival Time: Mar 31, 2026 22:43:06.919239000 W. Europe Summer Time
    UTC Arrival Time: Mar 31, 2026 20:43:06.919239000 UTC
    Epoch Arrival Time: 1774989786.919239000
    [Time shift for this packet: 0.000000000 seconds]
    [Time delta from previous captured frame: 138.032000 milliseconds]
    [Time delta from previous displayed frame: 301.036000 milliseconds]
    [Time since reference or first frame: 17.132579000 seconds]
    Frame Number: 6735
    Frame Length: 91 bytes (728 bits)
    Capture Length: 91 bytes (728 bits)
    [Frame is marked: False]
    [Frame is ignored: False]
    [Protocols in frame: usb:usbhid]
    Character encoding: ASCII (0)
USB URB
    [Source: host]
    [Destination: 1.17.2]
    USBPcap pseudoheader length: 27
    IRP ID: 0xffffa6864b1d2530
    IRP USBD_STATUS: USBD_STATUS_SUCCESS (0x00000000)
    URB Function: URB_FUNCTION_BULK_OR_INTERRUPT_TRANSFER (0x0009)
    IRP information: 0x00, Direction: FDO -> PDO
    URB bus id: 1
    Device address: 17
    Endpoint: 0x02, Direction: OUT
    URB transfer type: URB_INTERRUPT (0x01)
    Packet Data Length: 64
    [Response in: 6736]
    [bInterfaceClass: HID (0x03)]
HID Data: 1002000101401003414000f0eb7f0914ec7f09b85f050a774d4000f0eb7f09774d4000f0eb7f09c0fdfe0415484000f0eb7f0914ec7f09b85f050ad8fdfe04d8

No.     Time           Source                Destination           Protocol Length Info
   6736 17.133844      1.17.2                host                  USB      27     URB_INTERRUPT out

Frame 6736: Packet, 27 bytes on wire (216 bits), 27 bytes captured (216 bits) on interface \\.\USBPcap1, id 0
    Section number: 1
    Interface id: 0 (\\.\USBPcap1)
    Encapsulation type: USB packets with USBPcap header (152)
    Arrival Time: Mar 31, 2026 22:43:06.920504000 W. Europe Summer Time
    UTC Arrival Time: Mar 31, 2026 20:43:06.920504000 UTC
    Epoch Arrival Time: 1774989786.920504000
    [Time shift for this packet: 0.000000000 seconds]
    [Time delta from previous captured frame: 1.265000 milliseconds]
    [Time delta from previous displayed frame: 1.265000 milliseconds]
    [Time since reference or first frame: 17.133844000 seconds]
    Frame Number: 6736
    Frame Length: 27 bytes (216 bits)
    Capture Length: 27 bytes (216 bits)
    [Frame is marked: False]
    [Frame is ignored: False]
    [Protocols in frame: usb]
    Character encoding: ASCII (0)
USB URB
    [Source: 1.17.2]
    [Destination: host]
    USBPcap pseudoheader length: 27
    IRP ID: 0xffffa6864b1d2530
    IRP USBD_STATUS: USBD_STATUS_SUCCESS (0x00000000)
    URB Function: URB_FUNCTION_BULK_OR_INTERRUPT_TRANSFER (0x0009)
    IRP information: 0x01, Direction: PDO -> FDO
    URB bus id: 1
    Device address: 17
    Endpoint: 0x02, Direction: OUT
    URB transfer type: URB_INTERRUPT (0x01)
    Packet Data Length: 0
    [Request in: 6735]
    [Time from request: 1.265000 milliseconds]
    [bInterfaceClass: HID (0x03)]

No.     Time           Source                Destination           Protocol Length Info
   6737 17.136486      1.17.1                host                  USB      91     URB_INTERRUPT in

Frame 6737: Packet, 91 bytes on wire (728 bits), 91 bytes captured (728 bits) on interface \\.\USBPcap1, id 0
    Section number: 1
    Interface id: 0 (\\.\USBPcap1)
    Encapsulation type: USB packets with USBPcap header (152)
    Arrival Time: Mar 31, 2026 22:43:06.923146000 W. Europe Summer Time
    UTC Arrival Time: Mar 31, 2026 20:43:06.923146000 UTC
    Epoch Arrival Time: 1774989786.923146000
    [Time shift for this packet: 0.000000000 seconds]
    [Time delta from previous captured frame: 2.642000 milliseconds]
    [Time delta from previous displayed frame: 2.642000 milliseconds]
    [Time since reference or first frame: 17.136486000 seconds]
    Frame Number: 6737
    Frame Length: 91 bytes (728 bits)
    Capture Length: 91 bytes (728 bits)
    [Frame is marked: False]
    [Frame is ignored: False]
    [Protocols in frame: usb:usbhid]
    Character encoding: ASCII (0)
USB URB
    [Source: 1.17.1]
    [Destination: host]
    USBPcap pseudoheader length: 27
    IRP ID: 0xffffa686494500d0
    IRP USBD_STATUS: USBD_STATUS_SUCCESS (0x00000000)
    URB Function: URB_FUNCTION_BULK_OR_INTERRUPT_TRANSFER (0x0009)
    IRP information: 0x01, Direction: PDO -> FDO
    URB bus id: 1
    Device address: 17
    Endpoint: 0x81, Direction: IN
    URB transfer type: URB_INTERRUPT (0x01)
    Packet Data Length: 64
    [Request in: 6716]
    [Time from request: 620.922000 milliseconds]
    [bInterfaceClass: HID (0x03)]
HID Data: 100201001c4000000300000700000100000000001000001400001900000a00000010034e00000000000000000000000000000000000000000010033d000abc8d

No.     Time           Source                Destination           Protocol Length Info
   6738 17.136512      host                  1.17.1                USB      27     URB_INTERRUPT in

Frame 6738: Packet, 27 bytes on wire (216 bits), 27 bytes captured (216 bits) on interface \\.\USBPcap1, id 0
    Section number: 1
    Interface id: 0 (\\.\USBPcap1)
    Encapsulation type: USB packets with USBPcap header (152)
    Arrival Time: Mar 31, 2026 22:43:06.923172000 W. Europe Summer Time
    UTC Arrival Time: Mar 31, 2026 20:43:06.923172000 UTC
    Epoch Arrival Time: 1774989786.923172000
    [Time shift for this packet: 0.000000000 seconds]
    [Time delta from previous captured frame: 26.000 microseconds]
    [Time delta from previous displayed frame: 26.000 microseconds]
    [Time since reference or first frame: 17.136512000 seconds]
    Frame Number: 6738
    Frame Length: 27 bytes (216 bits)
    Capture Length: 27 bytes (216 bits)
    [Frame is marked: False]
    [Frame is ignored: False]
    [Protocols in frame: usb]
    Character encoding: ASCII (0)
USB URB
    [Source: host]
    [Destination: 1.17.1]
    USBPcap pseudoheader length: 27
    IRP ID: 0xffffa686494500d0
    IRP USBD_STATUS: USBD_STATUS_SUCCESS (0x00000000)
    URB Function: URB_FUNCTION_BULK_OR_INTERRUPT_TRANSFER (0x0009)
    IRP information: 0x00, Direction: FDO -> PDO
    URB bus id: 1
    Device address: 17
    Endpoint: 0x81, Direction: IN
    URB transfer type: URB_INTERRUPT (0x01)
    Packet Data Length: 0
    [Response in: 7081]
    [bInterfaceClass: HID (0x03)]

No.     Time           Source                Destination           Protocol Length Info
   6739 17.441209      host                  1.17.2                USB      91     URB_INTERRUPT out

Frame 6739: Packet, 91 bytes on wire (728 bits), 91 bytes captured (728 bits) on interface \\.\USBPcap1, id 0
    Section number: 1
    Interface id: 0 (\\.\USBPcap1)
    Encapsulation type: USB packets with USBPcap header (152)
    Arrival Time: Mar 31, 2026 22:43:07.227869000 W. Europe Summer Time
    UTC Arrival Time: Mar 31, 2026 20:43:07.227869000 UTC
    Epoch Arrival Time: 1774989787.227869000
    [Time shift for this packet: 0.000000000 seconds]
    [Time delta from previous captured frame: 304.697000 milliseconds]
    [Time delta from previous displayed frame: 304.697000 milliseconds]
    [Time since reference or first frame: 17.441209000 seconds]
    Frame Number: 6739
    Frame Length: 91 bytes (728 bits)
    Capture Length: 91 bytes (728 bits)
    [Frame is marked: False]
    [Frame is ignored: False]
    [Protocols in frame: usb:usbhid]
    Character encoding: ASCII (0)
USB URB
    [Source: host]
    [Destination: 1.17.2]
    USBPcap pseudoheader length: 27
    IRP ID: 0xffffa6864b1d2530
    IRP USBD_STATUS: USBD_STATUS_SUCCESS (0x00000000)
    URB Function: URB_FUNCTION_BULK_OR_INTERRUPT_TRANSFER (0x0009)
    IRP information: 0x00, Direction: FDO -> PDO
    URB bus id: 1
    Device address: 17
    Endpoint: 0x02, Direction: OUT
    URB transfer type: URB_INTERRUPT (0x01)
    Packet Data Length: 64
    [Response in: 6740]
    [bInterfaceClass: HID (0x03)]
HID Data: 1002000101401003414000f0eb7f0914ec7f09b85f050a774d4000f0eb7f09774d4000f0eb7f09c0fdfe0415484000f0eb7f0914ec7f09b85f050ad8fdfe04d8

No.     Time           Source                Destination           Protocol Length Info
   6740 17.442844      1.17.2                host                  USB      27     URB_INTERRUPT out

Frame 6740: Packet, 27 bytes on wire (216 bits), 27 bytes captured (216 bits) on interface \\.\USBPcap1, id 0
    Section number: 1
    Interface id: 0 (\\.\USBPcap1)
    Encapsulation type: USB packets with USBPcap header (152)
    Arrival Time: Mar 31, 2026 22:43:07.229504000 W. Europe Summer Time
    UTC Arrival Time: Mar 31, 2026 20:43:07.229504000 UTC
    Epoch Arrival Time: 1774989787.229504000
    [Time shift for this packet: 0.000000000 seconds]
    [Time delta from previous captured frame: 1.635000 milliseconds]
    [Time delta from previous displayed frame: 1.635000 milliseconds]
    [Time since reference or first frame: 17.442844000 seconds]
    Frame Number: 6740
    Frame Length: 27 bytes (216 bits)
    Capture Length: 27 bytes (216 bits)
    [Frame is marked: False]
    [Frame is ignored: False]
    [Protocols in frame: usb]
    Character encoding: ASCII (0)
USB URB
    [Source: 1.17.2]
    [Destination: host]
    USBPcap pseudoheader length: 27
    IRP ID: 0xffffa6864b1d2530
    IRP USBD_STATUS: USBD_STATUS_SUCCESS (0x00000000)
    URB Function: URB_FUNCTION_BULK_OR_INTERRUPT_TRANSFER (0x0009)
    IRP information: 0x01, Direction: PDO -> FDO
    URB bus id: 1
    Device address: 17
    Endpoint: 0x02, Direction: OUT
    URB transfer type: URB_INTERRUPT (0x01)
    Packet Data Length: 0
    [Request in: 6739]
    [Time from request: 1.635000 milliseconds]
    [bInterfaceClass: HID (0x03)]

No.     Time           Source                Destination           Protocol Length Info
   6741 17.452478      1.17.1                host                  USB      91     URB_INTERRUPT in

Frame 6741: Packet, 91 bytes on wire (728 bits), 91 bytes captured (728 bits) on interface \\.\USBPcap1, id 0
    Section number: 1
    Interface id: 0 (\\.\USBPcap1)
    Encapsulation type: USB packets with USBPcap header (152)
    Arrival Time: Mar 31, 2026 22:43:07.239138000 W. Europe Summer Time
    UTC Arrival Time: Mar 31, 2026 20:43:07.239138000 UTC
    Epoch Arrival Time: 1774989787.239138000
    [Time shift for this packet: 0.000000000 seconds]
    [Time delta from previous captured frame: 9.634000 milliseconds]
    [Time delta from previous displayed frame: 9.634000 milliseconds]
    [Time since reference or first frame: 17.452478000 seconds]
    Frame Number: 6741
    Frame Length: 91 bytes (728 bits)
    Capture Length: 91 bytes (728 bits)
    [Frame is marked: False]
    [Frame is ignored: False]
    [Protocols in frame: usb:usbhid]
    Character encoding: ASCII (0)
USB URB
    [Source: 1.17.1]
    [Destination: host]
    USBPcap pseudoheader length: 27
    IRP ID: 0xffffa68649451010
    IRP USBD_STATUS: USBD_STATUS_SUCCESS (0x00000000)
    URB Function: URB_FUNCTION_BULK_OR_INTERRUPT_TRANSFER (0x0009)
    IRP information: 0x01, Direction: PDO -> FDO
    URB bus id: 1
    Device address: 17
    Endpoint: 0x81, Direction: IN
    URB transfer type: URB_INTERRUPT (0x01)
    Packet Data Length: 64
    [Request in: 6730]
    [Time from request: 620.935000 milliseconds]
    [bInterfaceClass: HID (0x03)]
HID Data: 100201001c4000000200000500000400000000001e00001000001900000a00000010034200000000000000000000000000000000000000000010033d000abc8d

No.     Time           Source                Destination           Protocol Length Info
   6742 17.452498      host                  1.17.1                USB      27     URB_INTERRUPT in

Frame 6742: Packet, 27 bytes on wire (216 bits), 27 bytes captured (216 bits) on interface \\.\USBPcap1, id 0
    Section number: 1
    Interface id: 0 (\\.\USBPcap1)
    Encapsulation type: USB packets with USBPcap header (152)
    Arrival Time: Mar 31, 2026 22:43:07.239158000 W. Europe Summer Time
    UTC Arrival Time: Mar 31, 2026 20:43:07.239158000 UTC
    Epoch Arrival Time: 1774989787.239158000
    [Time shift for this packet: 0.000000000 seconds]
    [Time delta from previous captured frame: 20.000 microseconds]
    [Time delta from previous displayed frame: 20.000 microseconds]
    [Time since reference or first frame: 17.452498000 seconds]
    Frame Number: 6742
    Frame Length: 27 bytes (216 bits)
    Capture Length: 27 bytes (216 bits)
    [Frame is marked: False]
    [Frame is ignored: False]
    [Protocols in frame: usb]
    Character encoding: ASCII (0)
USB URB
    [Source: host]
    [Destination: 1.17.1]
    USBPcap pseudoheader length: 27
    IRP ID: 0xffffa68649451010
    IRP USBD_STATUS: USBD_STATUS_SUCCESS (0x00000000)
    URB Function: URB_FUNCTION_BULK_OR_INTERRUPT_TRANSFER (0x0009)
    IRP information: 0x00, Direction: FDO -> PDO
    URB bus id: 1
    Device address: 17
    Endpoint: 0x81, Direction: IN
    URB transfer type: URB_INTERRUPT (0x01)
    Packet Data Length: 0
    [Response in: 7193]
    [bInterfaceClass: HID (0x03)]

No.     Time           Source                Destination           Protocol Length Info
   7071 17.764602      host                  1.17.2                USB      91     URB_INTERRUPT out

Frame 7071: Packet, 91 bytes on wire (728 bits), 91 bytes captured (728 bits) on interface \\.\USBPcap1, id 0
    Section number: 1
    Interface id: 0 (\\.\USBPcap1)
    Encapsulation type: USB packets with USBPcap header (152)
    Arrival Time: Mar 31, 2026 22:43:07.551262000 W. Europe Summer Time
    UTC Arrival Time: Mar 31, 2026 20:43:07.551262000 UTC
    Epoch Arrival Time: 1774989787.551262000
    [Time shift for this packet: 0.000000000 seconds]
    [Time delta from previous captured frame: 4.105000 milliseconds]
    [Time delta from previous displayed frame: 312.104000 milliseconds]
    [Time since reference or first frame: 17.764602000 seconds]
    Frame Number: 7071
    Frame Length: 91 bytes (728 bits)
    Capture Length: 91 bytes (728 bits)
    [Frame is marked: False]
    [Frame is ignored: False]
    [Protocols in frame: usb:usbhid]
    Character encoding: ASCII (0)
USB URB
    [Source: host]
    [Destination: 1.17.2]
    USBPcap pseudoheader length: 27
    IRP ID: 0xffffa6864b1d2530
    IRP USBD_STATUS: USBD_STATUS_SUCCESS (0x00000000)
    URB Function: URB_FUNCTION_BULK_OR_INTERRUPT_TRANSFER (0x0009)
    IRP information: 0x00, Direction: FDO -> PDO
    URB bus id: 1
    Device address: 17
    Endpoint: 0x02, Direction: OUT
    URB transfer type: URB_INTERRUPT (0x01)
    Packet Data Length: 64
    [Response in: 7074]
    [bInterfaceClass: HID (0x03)]
HID Data: 1002000101401003414000f0eb7f0914ec7f09b85f050a774d4000f0eb7f09774d4000f0eb7f09c0fdfe0415484000f0eb7f0914ec7f09b85f050ad8fdfe04d8

No.     Time           Source                Destination           Protocol Length Info
   7074 17.765810      1.17.2                host                  USB      27     URB_INTERRUPT out

Frame 7074: Packet, 27 bytes on wire (216 bits), 27 bytes captured (216 bits) on interface \\.\USBPcap1, id 0
    Section number: 1
    Interface id: 0 (\\.\USBPcap1)
    Encapsulation type: USB packets with USBPcap header (152)
    Arrival Time: Mar 31, 2026 22:43:07.552470000 W. Europe Summer Time
    UTC Arrival Time: Mar 31, 2026 20:43:07.552470000 UTC
    Epoch Arrival Time: 1774989787.552470000
    [Time shift for this packet: 0.000000000 seconds]
    [Time delta from previous captured frame: 341.000 microseconds]
    [Time delta from previous displayed frame: 1.208000 milliseconds]
    [Time since reference or first frame: 17.765810000 seconds]
    Frame Number: 7074
    Frame Length: 27 bytes (216 bits)
    Capture Length: 27 bytes (216 bits)
    [Frame is marked: False]
    [Frame is ignored: False]
    [Protocols in frame: usb]
    Character encoding: ASCII (0)
USB URB
    [Source: 1.17.2]
    [Destination: host]
    USBPcap pseudoheader length: 27
    IRP ID: 0xffffa6864b1d2530
    IRP USBD_STATUS: USBD_STATUS_SUCCESS (0x00000000)
    URB Function: URB_FUNCTION_BULK_OR_INTERRUPT_TRANSFER (0x0009)
    IRP information: 0x01, Direction: PDO -> FDO
    URB bus id: 1
    Device address: 17
    Endpoint: 0x02, Direction: OUT
    URB transfer type: URB_INTERRUPT (0x01)
    Packet Data Length: 0
    [Request in: 7071]
    [Time from request: 1.208000 milliseconds]
    [bInterfaceClass: HID (0x03)]

No.     Time           Source                Destination           Protocol Length Info
   7081 17.776453      1.17.1                host                  USB      91     URB_INTERRUPT in

Frame 7081: Packet, 91 bytes on wire (728 bits), 91 bytes captured (728 bits) on interface \\.\USBPcap1, id 0
    Section number: 1
    Interface id: 0 (\\.\USBPcap1)
    Encapsulation type: USB packets with USBPcap header (152)
    Arrival Time: Mar 31, 2026 22:43:07.563113000 W. Europe Summer Time
    UTC Arrival Time: Mar 31, 2026 20:43:07.563113000 UTC
    Epoch Arrival Time: 1774989787.563113000
    [Time shift for this packet: 0.000000000 seconds]
    [Time delta from previous captured frame: 958.000 microseconds]
    [Time delta from previous displayed frame: 10.643000 milliseconds]
    [Time since reference or first frame: 17.776453000 seconds]
    Frame Number: 7081
    Frame Length: 91 bytes (728 bits)
    Capture Length: 91 bytes (728 bits)
    [Frame is marked: False]
    [Frame is ignored: False]
    [Protocols in frame: usb:usbhid]
    Character encoding: ASCII (0)
USB URB
    [Source: 1.17.1]
    [Destination: host]
    USBPcap pseudoheader length: 27
    IRP ID: 0xffffa686494500d0
    IRP USBD_STATUS: USBD_STATUS_SUCCESS (0x00000000)
    URB Function: URB_FUNCTION_BULK_OR_INTERRUPT_TRANSFER (0x0009)
    IRP information: 0x01, Direction: PDO -> FDO
    URB bus id: 1
    Device address: 17
    Endpoint: 0x81, Direction: IN
    URB transfer type: URB_INTERRUPT (0x01)
    Packet Data Length: 64
    [Request in: 6738]
    [Time from request: 639.941000 milliseconds]
    [bInterfaceClass: HID (0x03)]
HID Data: 100201001c4000000600000700000400000000001600001900001400000a00000010034800000000000000000000000000000000000000000010033d000abc8d

No.     Time           Source                Destination           Protocol Length Info
   7082 17.776470      host                  1.17.1                USB      27     URB_INTERRUPT in

Frame 7082: Packet, 27 bytes on wire (216 bits), 27 bytes captured (216 bits) on interface \\.\USBPcap1, id 0
    Section number: 1
    Interface id: 0 (\\.\USBPcap1)
    Encapsulation type: USB packets with USBPcap header (152)
    Arrival Time: Mar 31, 2026 22:43:07.563130000 W. Europe Summer Time
    UTC Arrival Time: Mar 31, 2026 20:43:07.563130000 UTC
    Epoch Arrival Time: 1774989787.563130000
    [Time shift for this packet: 0.000000000 seconds]
    [Time delta from previous captured frame: 17.000 microseconds]
    [Time delta from previous displayed frame: 17.000 microseconds]
    [Time since reference or first frame: 17.776470000 seconds]
    Frame Number: 7082
    Frame Length: 27 bytes (216 bits)
    Capture Length: 27 bytes (216 bits)
    [Frame is marked: False]
    [Frame is ignored: False]
    [Protocols in frame: usb]
    Character encoding: ASCII (0)
USB URB
    [Source: host]
    [Destination: 1.17.1]
    USBPcap pseudoheader length: 27
    IRP ID: 0xffffa686494500d0
    IRP USBD_STATUS: USBD_STATUS_SUCCESS (0x00000000)
    URB Function: URB_FUNCTION_BULK_OR_INTERRUPT_TRANSFER (0x0009)
    IRP information: 0x00, Direction: FDO -> PDO
    URB bus id: 1
    Device address: 17
    Endpoint: 0x81, Direction: IN
    URB transfer type: URB_INTERRUPT (0x01)
    Packet Data Length: 0
    [bInterfaceClass: HID (0x03)]

No.     Time           Source                Destination           Protocol Length Info
   7191 18.086341      host                  1.17.2                USB      91     URB_INTERRUPT out

Frame 7191: Packet, 91 bytes on wire (728 bits), 91 bytes captured (728 bits) on interface \\.\USBPcap1, id 0
    Section number: 1
    Interface id: 0 (\\.\USBPcap1)
    Encapsulation type: USB packets with USBPcap header (152)
    Arrival Time: Mar 31, 2026 22:43:07.873001000 W. Europe Summer Time
    UTC Arrival Time: Mar 31, 2026 20:43:07.873001000 UTC
    Epoch Arrival Time: 1774989787.873001000
    [Time shift for this packet: 0.000000000 seconds]
    [Time delta from previous captured frame: 25.842000 milliseconds]
    [Time delta from previous displayed frame: 309.871000 milliseconds]
    [Time since reference or first frame: 18.086341000 seconds]
    Frame Number: 7191
    Frame Length: 91 bytes (728 bits)
    Capture Length: 91 bytes (728 bits)
    [Frame is marked: False]
    [Frame is ignored: False]
    [Protocols in frame: usb:usbhid]
    Character encoding: ASCII (0)
USB URB
    [Source: host]
    [Destination: 1.17.2]
    USBPcap pseudoheader length: 27
    IRP ID: 0xffffa6864b1d2530
    IRP USBD_STATUS: USBD_STATUS_SUCCESS (0x00000000)
    URB Function: URB_FUNCTION_BULK_OR_INTERRUPT_TRANSFER (0x0009)
    IRP information: 0x00, Direction: FDO -> PDO
    URB bus id: 1
    Device address: 17
    Endpoint: 0x02, Direction: OUT
    URB transfer type: URB_INTERRUPT (0x01)
    Packet Data Length: 64
    [Response in: 7192]
    [bInterfaceClass: HID (0x03)]
HID Data: 1002000101401003414000f0eb7f0914ec7f09b85f050a774d4000f0eb7f09774d4000f0eb7f09c0fdfe0415484000f0eb7f0914ec7f09b85f050ad8fdfe04d8

No.     Time           Source                Destination           Protocol Length Info
   7192 18.087814      1.17.2                host                  USB      27     URB_INTERRUPT out

Frame 7192: Packet, 27 bytes on wire (216 bits), 27 bytes captured (216 bits) on interface \\.\USBPcap1, id 0
    Section number: 1
    Interface id: 0 (\\.\USBPcap1)
    Encapsulation type: USB packets with USBPcap header (152)
    Arrival Time: Mar 31, 2026 22:43:07.874474000 W. Europe Summer Time
    UTC Arrival Time: Mar 31, 2026 20:43:07.874474000 UTC
    Epoch Arrival Time: 1774989787.874474000
    [Time shift for this packet: 0.000000000 seconds]
    [Time delta from previous captured frame: 1.473000 milliseconds]
    [Time delta from previous displayed frame: 1.473000 milliseconds]
    [Time since reference or first frame: 18.087814000 seconds]
    Frame Number: 7192
    Frame Length: 27 bytes (216 bits)
    Capture Length: 27 bytes (216 bits)
    [Frame is marked: False]
    [Frame is ignored: False]
    [Protocols in frame: usb]
    Character encoding: ASCII (0)
USB URB
    [Source: 1.17.2]
    [Destination: host]
    USBPcap pseudoheader length: 27
    IRP ID: 0xffffa6864b1d2530
    IRP USBD_STATUS: USBD_STATUS_SUCCESS (0x00000000)
    URB Function: URB_FUNCTION_BULK_OR_INTERRUPT_TRANSFER (0x0009)
    IRP information: 0x01, Direction: PDO -> FDO
    URB bus id: 1
    Device address: 17
    Endpoint: 0x02, Direction: OUT
    URB transfer type: URB_INTERRUPT (0x01)
    Packet Data Length: 0
    [Request in: 7191]
    [Time from request: 1.473000 milliseconds]
    [bInterfaceClass: HID (0x03)]

No.     Time           Source                Destination           Protocol Length Info
   7193 18.093448      1.17.1                host                  USB      91     URB_INTERRUPT in

Frame 7193: Packet, 91 bytes on wire (728 bits), 91 bytes captured (728 bits) on interface \\.\USBPcap1, id 0
    Section number: 1
    Interface id: 0 (\\.\USBPcap1)
    Encapsulation type: USB packets with USBPcap header (152)
    Arrival Time: Mar 31, 2026 22:43:07.880108000 W. Europe Summer Time
    UTC Arrival Time: Mar 31, 2026 20:43:07.880108000 UTC
    Epoch Arrival Time: 1774989787.880108000
    [Time shift for this packet: 0.000000000 seconds]
    [Time delta from previous captured frame: 5.634000 milliseconds]
    [Time delta from previous displayed frame: 5.634000 milliseconds]
    [Time since reference or first frame: 18.093448000 seconds]
    Frame Number: 7193
    Frame Length: 91 bytes (728 bits)
    Capture Length: 91 bytes (728 bits)
    [Frame is marked: False]
    [Frame is ignored: False]
    [Protocols in frame: usb:usbhid]
    Character encoding: ASCII (0)
USB URB
    [Source: 1.17.1]
    [Destination: host]
    USBPcap pseudoheader length: 27
    IRP ID: 0xffffa68649451010
    IRP USBD_STATUS: USBD_STATUS_SUCCESS (0x00000000)
    URB Function: URB_FUNCTION_BULK_OR_INTERRUPT_TRANSFER (0x0009)
    IRP information: 0x01, Direction: PDO -> FDO
    URB bus id: 1
    Device address: 17
    Endpoint: 0x81, Direction: IN
    URB transfer type: URB_INTERRUPT (0x01)
    Packet Data Length: 64
    [Request in: 6742]
    [Time from request: 640.950000 milliseconds]
    [bInterfaceClass: HID (0x03)]
HID Data: 100201001c4000000700000800000600000000001000001f00001200001100000010035900000000000000000000000000000000000000000010033d000abc8d

No.     Time           Source                Destination           Protocol Length Info
   7194 18.093468      host                  1.17.1                USB      27     URB_INTERRUPT in

Frame 7194: Packet, 27 bytes on wire (216 bits), 27 bytes captured (216 bits) on interface \\.\USBPcap1, id 0
    Section number: 1
    Interface id: 0 (\\.\USBPcap1)
    Encapsulation type: USB packets with USBPcap header (152)
    Arrival Time: Mar 31, 2026 22:43:07.880128000 W. Europe Summer Time
    UTC Arrival Time: Mar 31, 2026 20:43:07.880128000 UTC
    Epoch Arrival Time: 1774989787.880128000
    [Time shift for this packet: 0.000000000 seconds]
    [Time delta from previous captured frame: 20.000 microseconds]
    [Time delta from previous displayed frame: 20.000 microseconds]
    [Time since reference or first frame: 18.093468000 seconds]
    Frame Number: 7194
    Frame Length: 27 bytes (216 bits)
    Capture Length: 27 bytes (216 bits)
    [Frame is marked: False]
    [Frame is ignored: False]
    [Protocols in frame: usb]
    Character encoding: ASCII (0)
USB URB
    [Source: host]
    [Destination: 1.17.1]
    USBPcap pseudoheader length: 27
    IRP ID: 0xffffa68649451010
    IRP USBD_STATUS: USBD_STATUS_SUCCESS (0x00000000)
    URB Function: URB_FUNCTION_BULK_OR_INTERRUPT_TRANSFER (0x0009)
    IRP information: 0x00, Direction: FDO -> PDO
    URB bus id: 1
    Device address: 17
    Endpoint: 0x81, Direction: IN
    URB transfer type: URB_INTERRUPT (0x01)
    Packet Data Length: 0
    [bInterfaceClass: HID (0x03)]
