+++++++++++++++++ Device Information ++++++++++++++++++
Device Description       : HID-compliant device
Device Path              : \\?\HID#VID_0168&PID_0821#b&32b6afdb&0&0000#{4d1e55b2-f16f-11cf-88cb-001111000030} (GUID_DEVINTERFACE_HID)
Kernel Name              : \Device\000000fa
Device ID                : HID\VID_0168&PID_0821\B&32B6AFDB&0&0000
Hardware IDs             : HID\VID_0168&PID_0821&REV_0000 HID\VID_0168&PID_0821 HID\VID_0168&UP:0001_U:0000 HID_DEVICE_UP:0001_U:0000 HID_DEVICE
Driver KeyName           : {745a17a0-74d3-11d0-b6fe-00a0c90f57da}\0188 (GUID_DEVCLASS_HIDCLASS)
Driver Inf               : C:\WINDOWS\inf\input.inf
Legacy BusType           : PNPBus
Class                    : HIDClass
Class GUID               : {745a17a0-74d3-11d0-b6fe-00a0c90f57da} (GUID_DEVCLASS_HIDCLASS)
Enumerator               : HID
Location Info            : -
Address                  : 1
Manufacturer Info        : (Standard system devices)
Capabilities             : 0xE0 (SilentInstall, RawDeviceOK, SurpriseRemovalOK)
Status                   : 0x0180200A (DN_DRIVER_LOADED, DN_STARTED, DN_DISABLEABLE, DN_NT_ENUMERATOR, DN_NT_DRIVER)
First Install Date       : 2025-10-24 20:04:16
Last Arrival Date        : 2026-03-31 21:27:33
EnhancedPowerMgmtEnabled : 0
Power State              : D0 (supported: D0, D2, D3, wake from D0, wake from D2)

             ++++++++++++++ HID Information +++++++++++++++
Manufacturer             : Musicrown
Product                  : Dsp Process
UsagePage                : 0x01 (Generic Desktop Controls)
Usage                    : 0x00 (Undefined)



and furthermore:


=========================== USB Port3 ===========================

Connection Status        : 0x01 (Device is connected)
Port Chain               : 2-9-1-3
Properties               : 0x01
 IsUserConnectable       : yes
 PortIsDebugCapable      : no
 PortHasMultiCompanions  : no
 PortConnectorIsTypeC    : no
ConnectionIndex          : 0x03 (Port 3)
CompanionIndex           : 0
 CompanionHubSymLnk      : USB#VID_2109&PID_0817#9&26cd0486&0&1#{f18a0e88-c30c-11d0-8815-00a0c906bed8}
 CompanionPortNumber     : 0x03 (Port 3)
 -> CompanionPortChain   : 2-4-1-3

      ========================== Summary =========================
Vendor ID                : 0x0168 (Unknown Vendor)
Product ID               : 0x0821
Manufacturer String      : "Musicrown"
Product String           : "Dsp Process"
Serial                   : ---
USB Version              : 1.1 (12 Mbit/s FullSpeed)
Port maximum Speed       : High-Speed (Companion Port 2-4-1-3 is doing the SuperSpeed)
Device maximum Speed     : Full-Speed
Device Connection Speed  : Full-Speed
Self powered             : no
Demanded Current         : 100 mA
Used Endpoints           : 3

      ======================== USB Device ========================

        +++++++++++++++++ Device Information ++++++++++++++++++
Device Description       : USB Input Device
Device Path              : \\?\USB#VID_0168&PID_0821#a&fafae93&0&3#{a5dcbf10-6530-11d2-901f-00c04fb951ed} (GUID_DEVINTERFACE_USB_DEVICE)
Kernel Name              : \Device\USBPDO-14
Device ID                : USB\VID_0168&PID_0821\A&FAFAE93&0&3
Hardware IDs             : USB\VID_0168&PID_0821&REV_0000 USB\VID_0168&PID_0821
Driver KeyName           : {745a17a0-74d3-11d0-b6fe-00a0c90f57da}\0187 (GUID_DEVCLASS_HIDCLASS)
Driver                   : \SystemRoot\System32\drivers\hidusb.sys (Version: 10.0.26100.7920  Date: 2026-03-10  Company: Microsoft Corporation)
Driver Inf               : C:\WINDOWS\inf\input.inf
Legacy BusType           : PNPBus
Class                    : HIDClass
Class GUID               : {745a17a0-74d3-11d0-b6fe-00a0c90f57da} (GUID_DEVCLASS_HIDCLASS)
Service                  : HidUsb
Enumerator               : USB
Location Info            : Port_#0003.Hub_#0008
Address                  : 3
Location IDs             : PCIROOT(0)#PCI(0201)#PCI(0000)#PCI(0C00)#PCI(0000)#USBROOT(0)#USB(9)#USB(1)#USB(3), ACPI(_SB_)#ACPI(PCI0)#ACPI(GPP7)#ACPI(UP00)#ACPI(DP60)#ACPI(XH00)#ACPI(RHUB)#ACPI(POTB)#ACPI(PRT1)#USB(3)
Container ID             : {d6d19c92-b103-11f0-9ac6-806e6f6e6963}
Manufacturer Info        : (Standard system devices)
Capabilities             : 0x84 (Removable, SurpriseRemovalOK)
Status                   : 0x0180600A (DN_DRIVER_LOADED, DN_STARTED, DN_DISABLEABLE, DN_REMOVABLE, DN_NT_ENUMERATOR, DN_NT_DRIVER)
First Install Date       : 2025-10-24 20:04:16
Last Arrival Date        : 2026-03-31 21:27:33
Bus Relations            : HID\VID_0168&PID_0821\b&32b6afdb&0&0000
SelectiveSuspendEnabled  : 0
EnhancedPowerMgmtEnabled : 1
Power State              : D0 (supported: D0, D2, D3, wake from D0, wake from D2)

        ---------------- Connection Information ---------------
Connection Index         : 0x03 (Port 3)
Connection Status        : 0x01 (DeviceConnected)
Current Config Value     : 0x01 (Configuration 1)
Device Address           : 0x11 (17)
Is Hub                   : 0x00 (no)
Device Bus Speed         : 0x01 (Full-Speed)
Number of open Pipes     : 0x02 (2 pipes to data endpoints)
Pipe[0]                  : EndpointID=1  Direction=IN   ScheduleOffset=0  Type=Interrupt  wMaxPacketSize=0x40    bInterval=1   -> 718 Bits/ms = 89750 Bytes/s
Pipe[1]                  : EndpointID=2  Direction=OUT  ScheduleOffset=0  Type=Interrupt  wMaxPacketSize=0x40    bInterval=1   -> 718 Bits/ms = 89750 Bytes/s
Data (HexDump)           : 03 00 00 00 12 01 10 01 00 00 00 08 68 01 21 08   ............h.!.
                           00 00 01 02 00 01 01 01 00 11 00 02 00 00 00 01   ................
                           00 00 00 07 05 81 03 40 00 01 00 00 00 00 07 05   .......@........
                           02 03 40 00 01 00 00 00 00                        ..@......

        --------------- Connection Information V2 -------------
Connection Index         : 0x03 (3)
Length                   : 0x10 (16 bytes)
SupportedUsbProtocols    : 0x03
 Usb110                  : 1 (yes, port supports USB 1.1)
 Usb200                  : 1 (yes, port supports USB 2.0)
 Usb300                  : 0 (no, port not supports USB 3.0) -> but Companion Port 2-4-1-3 does
 ReservedMBZ             : 0x00
Flags                    : 0x00
 DevIsOpAtSsOrHigher     : 0 (Device is not operating at SuperSpeed or higher)
 DevIsSsCapOrHigher      : 0 (Device is not SuperSpeed capable or higher)
 DevIsOpAtSsPlusOrHigher : 0 (Device is not operating at SuperSpeedPlus or higher)
 DevIsSsPlusCapOrHigher  : 0 (Device is not SuperSpeedPlus capable or higher)
 ReservedMBZ             : 0x00
Data (HexDump)           : 03 00 00 00 10 00 00 00 03 00 00 00 00 00 00 00   ................

    ---------------------- Device Descriptor ----------------------
bLength                  : 0x12 (18 bytes)
bDescriptorType          : 0x01 (Device Descriptor)
bcdUSB                   : 0x110 (USB Version 1.1)
bDeviceClass             : 0x00 (defined by the interface descriptors)
bDeviceSubClass          : 0x00
bDeviceProtocol          : 0x00
bMaxPacketSize0          : 0x08 (8 bytes)
idVendor                 : 0x0168 (Unknown Vendor)
idProduct                : 0x0821
bcdDevice                : 0x0000
iManufacturer            : 0x01 (String Descriptor 1)
 Language 0x0409         : "Musicrown"
iProduct                 : 0x02 (String Descriptor 2)
 Language 0x0409         : "Dsp Process"
iSerialNumber            : 0x00 (No String Descriptor)
bNumConfigurations       : 0x01 (1 Configuration)
Data (HexDump)           : 12 01 10 01 00 00 00 08 68 01 21 08 00 00 01 02   ........h.!.....
                           00 01                                             ..

    ------------------ Configuration Descriptor -------------------
bLength                  : 0x09 (9 bytes)
bDescriptorType          : 0x02 (Configuration Descriptor)
wTotalLength             : 0x0029 (41 bytes)
bNumInterfaces           : 0x01 (1 Interface)
bConfigurationValue      : 0x01 (Configuration 1)
iConfiguration           : 0x00 (No String Descriptor)
bmAttributes             : 0x80
 D7: Reserved, set 1     : 0x01
 D6: Self Powered        : 0x00 (no)
 D5: Remote Wakeup       : 0x00 (no)
 D4..0: Reserved, set 0  : 0x00
MaxPower                 : 0x32 (100 mA)
Data (HexDump)           : 09 02 29 00 01 01 00 80 32 09 04 00 00 02 03 00   ..).....2.......
                           00 00 09 21 10 01 00 01 22 1B 00 07 05 81 03 40   ...!...."......@
                           00 01 07 05 02 03 40 00 01                        ......@..

        ---------------- Interface Descriptor -----------------
bLength                  : 0x09 (9 bytes)
bDescriptorType          : 0x04 (Interface Descriptor)
bInterfaceNumber         : 0x00 (Interface 0)
bAlternateSetting        : 0x00
bNumEndpoints            : 0x02 (2 Endpoints)
bInterfaceClass          : 0x03 (HID - Human Interface Device)
bInterfaceSubClass       : 0x00 (None)
bInterfaceProtocol       : 0x00 (None)
iInterface               : 0x00 (No String Descriptor)
Data (HexDump)           : 09 04 00 00 02 03 00 00 00                        .........

        ------------------- HID Descriptor --------------------
bLength                  : 0x09 (9 bytes)
bDescriptorType          : 0x21 (HID Descriptor)
bcdHID                   : 0x0110 (HID Version 1.10)
bCountryCode             : 0x00 (00 = not localized)
bNumDescriptors          : 0x01
Data (HexDump)           : 09 21 10 01 00 01 22 1B 00                        .!...."..
Descriptor 1:
bDescriptorType          : 0x22 (Class=Report)
wDescriptorLength        : 0x001B (27 bytes)
  05 01             Usage Page (Generic Desktop Controls)
  09 00             Usage (Undefined)
  A1 01             Collection (Application)
  15 00               Logical Minimum (0)
  25 FF               Logical Maximum (-1)
  19 01               Usage Minimum (1)
  29 08               Usage Maximum (8)
  95 40               Report Count (64)
  75 08               Report Size (8)
  81 02               Input (Var)
  19 01               Usage Minimum (1)
  29 08               Usage Maximum (8)
  91 02               Output (Var)
  C0                End Collection
Data (HexDump)           : 05 01 09 00 A1 01 15 00 25 FF 19 01 29 08 95 40   ........%...)..@
                           75 08 81 02 19 01 29 08 91 02 C0                  u.....)....

        ----------------- Endpoint Descriptor -----------------
bLength                  : 0x07 (7 bytes)
bDescriptorType          : 0x05 (Endpoint Descriptor)
bEndpointAddress         : 0x81 (Direction=IN EndpointID=1)
bmAttributes             : 0x03 (TransferType=Interrupt)
wMaxPacketSize           : 0x0040 (64 bytes)
bInterval                : 0x01 (1 ms)
Data (HexDump)           : 07 05 81 03 40 00 01                              ....@..

        ----------------- Endpoint Descriptor -----------------
bLength                  : 0x07 (7 bytes)
bDescriptorType          : 0x05 (Endpoint Descriptor)
bEndpointAddress         : 0x02 (Direction=OUT EndpointID=2)
bmAttributes             : 0x03 (TransferType=Interrupt)
wMaxPacketSize           : 0x0040 (64 bytes)
bInterval                : 0x01 (1 ms)
Data (HexDump)           : 07 05 02 03 40 00 01                              ....@..

      -------------------- String Descriptors -------------------
             ------ String Descriptor 0 ------
bLength                  : 0x04 (4 bytes)
bDescriptorType          : 0x03 (String Descriptor)
Language ID[0]           : 0x0409 (English - United States)
Data (HexDump)           : 04 03 09 04                                       ....
             ------ String Descriptor 1 ------
bLength                  : 0x14 (20 bytes)
bDescriptorType          : 0x03 (String Descriptor)
Language 0x0409          : "Musicrown"
Data (HexDump)           : 14 03 4D 00 75 00 73 00 69 00 63 00 72 00 6F 00   ..M.u.s.i.c.r.o.
                           77 00 6E 00                                       w.n.
             ------ String Descriptor 2 ------
bLength                  : 0x18 (24 bytes)
bDescriptorType          : 0x03 (String Descriptor)
Language 0x0409          : "Dsp Process"
Data (HexDump)           : 18 03 44 00 73 00 70 00 20 00 50 00 72 00 6F 00   ..D.s.p. .P.r.o.
                           63 00 65 00 73 00 73 00                           c.e.s.s.